;processo;sentenca;similar_file;similar_processo
0;2016.021.057357-4;"6048    PROJETO DE SENTENÇA\n\nAinda que dispensado o ...
Name: ANDPROCCLOB__TXT_DESCR, dtype: object";0004F3E14485394AFAB5ABAD765DD1398D9EC5051528310E;['2016.001.125651-9']
1;2016.021.057357-4;"Homologo, por sentença, para que surta seus efeitos legais, o projeto de sentença elaborado pelo juiz leigo, na forma do artigo 40 da Lei nº 9.099/95. 

Em caso de depósito judicial referente à condenação, expeça-se mandado de pagamento, independentemente de nova conclusão. 

Caso haja valor remanescente a ser recebido, manifeste-se o credor em 7 dias, sob pena de arquivamento dos autos. Após o trânsito em julgado, tratando-se de sentença de improcedência ou de extinção do feito sem resolução do mérito, dê-se baixa e arquivem-se imediatamente. 

Tratando-se de sentença de procedência, após o trânsito em julgado e o decurso do prazo de 15 dias para pagamento espontâneo do valor da condenação previsto no art. 523 do NCPC c/c o entendimento consolidado no enunciado nº 13.9.1 do Aviso nº 23/2008 do TJERJ, aguarde-se por mais 7 dias a manifestação das partes e, em seguida, caso permaneçam em silêncio, proceda-se a baixa e ao arquivamento. 

FICAM AS PARTES CIENTES DE QUE A NOVA SISTEMÁTICA DE CONTAGEM DE PRAZO ESTABELECIDO NO ART. 219 DO NCPC/2015 NÃO SE APLICA AOS JUIZADOS ESPECIAIS CÍVEIS, CONSOANTE NOTA TÉCNICA 01/2016 DO FONAJE DE 04/03/2016 C/C A PRIMEIRA PARTE DO ENUNCIADO 86 TAMBÉM DO FONAJE, COMPUTANDO-SE OS PRAZOS EM DIAS CORRIDOS, ASSIM PROCEDENDO COM A FINALIDADE PRECÍPUA DE SE ALCANÇAR A BOA GESTÃO CARTORÁRIA COM FUNDAMENTO NO PRINCÍPIO DA CELERIDADE QUE REGE A LEI 9.099/95.";0004F3E14485394AFAB5ABAD765DD1398D9EC5051528310E;['2016.001.125651-9']
2;2016.021.057357-4;"Cuida-se de ação sob o rito sumaríssimo por meio da qual busca a parte demandante a condenação da ré ao cumprimento de obrigação de fazer, consistente na regularização do valor cobrado pelo plano VELOX contratado. Pede, ainda pagamento de indenização por danos materiais consistente na devolução em dobro dos valores pagos a maior, bem como indenização por danos morais.
Como causa de pedir, alega o demandante, em resumo, que já era cliente da empresa ré com a qual mantinha linha de telefone fixo, que decidiu contratar um plano velox em 29 de julho de 2015 no valor de R$65,75. Alega que desde o primeiro mes a fatura passou a cobrar valor maior que o efetivamente contratado pelo autor, não sendo resolvido o problema administrativamente. 
Em contestação, a ré afirma que a autora não faz prova mínima das alegações, uma vez que não apresenta sequer um número de protocolo que demonstre a tentativa de solucionar qualquer problema administrativamente. Sustenta, ainda, não haver danos morais a serem indenizados.
Embora dispensado pela norma do artigo 38 da Lei 9.099/95, é o breve relatório. Decido.
A relação estabelecida entre as partes é de consumo, porquanto presentes os requisitos subjetivos (arts. 2º, caput, e 3º, caput, da Lei nº 8.078/90) e objetivo (art. 3º, § 2º, da Lei n.º 8.078/90) que a caracterizam. Aplicável, portanto, o regime jurídico especial da Lei n.º 8.078/90, que assegura ao consumidor como, medida protetiva, a inversão do ônus da prova (artigo 6º, VIII, do CDC). Defiro, assim, a inversão do ônus da prova.
		A esse respeito, deve ser dito que, apesar da inversão do ônus da prova deferida, cabe ao autor produzir ao menos início de prova que aponte não apenas para a existência do dano, mas, também, para o nexo de causalidade que liga ele (o dano) a uma conduta da ré. 
		Isto é, o autor alega ter sido cobrado por valores indevidos, contudo não demonstra a cada mês os valores devidos, nem tampouco a diferença que pretende ter restituição em dobro. Desse modo faz pedido incerto e indeterminado. Além disso, as faturas acostadas não comprovam o efetivo pagamento, sendo inviabilizando a restituição dos valores. Cabe destacar, ainda, que observei nos documentos juntados pelo autor (fls. 11 e ss) que o valor referente a VELOX nas faturas estão menores que o valor contratado e não maiores, o que está passando do valor apontado pelo autor é o valor da VELOX já somada com OI FIXO.
 		Longe de se presumir, aqui, a má-fé do autor, é necessário observar que a instrução da causa não aponta, de forma conclusiva, para uma falha na prestação do serviço capaz, eventualmente, de produzir no autor os danos descritos na inicial, e, assim, reconhecer o dever da ré de indenizá-lo.
		Assim, diante da deficiência instrutória, não há como se concluir pela existência de nexo entre os danos descritos no feito e uma conduta da ré, razão pela qual, a despeito da inversão do ônus da prova, reconheço a improcedência dos pedidos formulados.
Pelo exposto, JULGO IMPROCEDENTES OS PEDIDOS veiculados na inicial.
		Sem custas e honorários, por força do disposto no artigo 55 da Lei Especial.
 		
Rio de Janeiro, 9 de maio de 2016

JULIANA CORREIA GOMES
JUÍZA LEIGA



 		Submeto o projeto  de sentença à homologação do Dra. Juíza de Direito, na forma do art. 40 da Lei 9.099/95.";00049E652555A1E030AD0043DF5F9F097323C5045D42174A;['2016.001.011778-0']
3;2016.021.057357-4;"Homologo, por sentença, para que surta seus efeitos legais, o projeto de sentença elaborado pelo juiz leigo, na forma do artigo 40 da Lei nº 9.099/95.  

Em caso de depósito judicial referente à condenação, expeça-se mandado de pagamento, independentemente de nova conclusão.  

Caso haja valor remanescente a ser recebido, manifeste-se o credor em 7 dias, sob pena de arquivamento dos autos. Após o trânsito em julgado, tratando-se de sentença de improcedência ou de extinção do feito sem resolução do mérito, dê-se baixa e arquivem-se imediatamente.  

Tratando-se de sentença de procedência, após o trânsito em julgado e o decurso do prazo de 15 dias para pagamento espontâneo do valor da condenação previsto no art. 523 do NCPC c/c o entendimento consolidado no enunciado nº 13.9.1 do Aviso nº 23/2008 do TJERJ, aguarde-se por mais 7 dias a manifestação das partes e, em seguida, caso permaneçam em silêncio, proceda-se a baixa e ao arquivamento.  

FICAM AS PARTES CIENTES DE QUE A NOVA SISTEMÁTICA DE CONTAGEM DE PRAZO ESTABELECIDO NO ART. 219 DO NCPC/2015 NÃO SE APLICA AOS JUIZADOS ESPECIAIS CÍVEIS, CONSOANTE NOTA TÉCNICA 01/2016 DO FONAJE DE 04/03/2016, COMPUTANDO-SE OS PRAZOS EM DIAS CORRIDOS, ASSIM PROCEDENDO COM A FINALIDADE PRECÍPUA DE SE ALCANÇAR A BOA GESTÃO CARTORÁRIA COM FUNDAMENTO NO PRINCÍPIO DA CELERIDADE QUE REGE A LEI 9.099/95.   

Cumpridas as formalidades legais, dê-se baixa e arquivem-se os autos.";00049E652555A1E030AD0043DF5F9F097323C5045D42174A;['2016.001.011778-0']
4;2016.021.057357-4;"Homologo o acordo celebrado entre as partes para que surta seus jurídicos e legais efeitos, e julgo o feito extinto, com resolução do mérito, nos termos do art. 487, inc. III, b, do novo Código de Processo Civil ( Lei nº 13.105/ 2015). 
Se for o caso, comprovado o depósito, expeça-se mandado de pagamento em favor da parte autora, independentemente de nova conclusão.  
Decorrido o prazo do cumprimento o acordo, aguarde-se por cinco dias a manifestação das partes; não havendo manifestação,  dê-se baixa e arquive-se. 
FICAM AS PARTES CIENTES DE QUE A NOVA SISTEMÁTICA DE CONTAGEM DE PRAZO ESTABELECIDO NO ART. 219 DO NCPC/2015 NÃO SE APLICA AOS JUIZADOS ESPECIAIS CÍVEIS, CONSOANTE NOTA TÉCNICA 01/2016 DO FONAJE DE 04/03/2016 C/C A PRIMEIRA PARTE DO ENUNCIADO 86 TAMBÉM DO FONAJE, COMPUTANDO-SE OS PRAZOS EM DIAS CORRIDOS, ASSIM PROCEDENDO COM A FINALIDADE PRECÍPUA DE SE ALCANÇAR A BOA GESTÃO CARTORÁRIA COM FUNDAMENTO NO PRINCÍPIO DA CELERIDADE QUE REGE A LEI 9.099/95.";000423C5203BDA5838D533DAD1DD3C6468D5C5045E321923;['2016.001.041617-5']
5;2016.021.057357-4;"

Relatório dispensado nos termos do artigo 38, da Lei nº 9.099/95. 
Incontroverso que a relação jurídica existente entre as partes configura-se como de consumo, eis que presentes seus requisitos subjetivos (artigos 2º e 3º da Lei nº 8.078/90 - Código de Defesa do Consumidor) e objetivos (parágrafos 1º e 2º, do artigo 3º da mesma lei), fazendo jus à parte autora a inversão do ônus da prova, que ora determino por força da lei.
A ré em nenhum momento provou que as alegações autorais são inverídicas. Mais ainda: não juntou aos autos qualquer documento explicando o motivo da fatura de janeiro de 2016, ter vindo em um valor tão superior aos cobrados nos meses anteriores 
Por sua vez, a parte autora juntou os protocolos de atendimento no Serviço de Atendimento ao Cliente que comprovam o seu empenho em resolver o problema administrativamente (fls. 05).
Neste diapasão, caberia à ré demonstrar o seu empenho em resolver a situação de forma eficaz. O que não foi feito. 
Tal atitude de absoluta inércia e descortesia para com o seu cliente deve ser totalmente rechaçada pelo Poder Judiciário, razão pela qual entendo ser cabível a condenação da ré em danos morais.
Contudo, há que se levar em conta o princípio da razoabilidade na aplicação dos mesmos, sendo o valor pleiteado pela parte autora excessivo, especialmente se for levado em conta que este juízo concedeu os efeitos da tutela antecipada requerida (fls. 21).
Isto posto,  JULGO PROCEDENTE EM PARTE, os pedidos para:
a)	Tornar definitivos os efeitos da tutela concedida antecipadamente;
b)	Tornar sem efeito a cobrança do mês de janeiro de 2016;
c)	Condenar a ré no pagamento de R$ 2.000 (dois mil reais), a títulos de danos morais, corrigidos monetariamente a partir da data de intimação da presente sentença e com juros de mora de 1% ao mês a contar da data da citação.

Sem ônus sucumbenciais, na forma do artigo 55 da Lei nº 9099/95. Publique-se e intimem-se. Após certificado o trânsito em julgado, dê-se baixa e arquivem-se.";0004561D5A142F5596CEC8209A888ECF1F12C50460042537;['2016.001.040608-0']
6;2016.021.057357-4;Fls. 75: Indefiro, até porque houve a intimação prévia quanto à antecipação do ato, conforme o próprio autor admite, devendo arcar com o ônus de sua inadvertência, ainda mais se tratando de processo eletrônico. Homologo, por sentença, para que surta seus efeitos legais, o projeto de sentença elaborado pelo juiz leigo, na forma do artigo 40 da Lei nº 9.099/95. Com o trânsito em julgado, dê-se baixa e arquivem-se.;000436894009AF0BE920272E70086C3B0BBDC505033E3242;['2016.001.009150-0']
7;2016.021.057357-4;"335    Processo nº: 0050712-30.2016.8.19.0001\nAutor:...
Name: ANDPROCCLOB__TXT_DESCR, dtype: object";0004A19E9176BF1300E55986B417D97F23E1C5045E1B1938;['2016.001.042109-2']
8;2016.021.057357-4;"Homologo, por sentença, para que surta seus efeitos legais, o projeto de sentença elaborado pelo juiz leigo, na forma do artigo 40 da Lei nº 9.099/95. 

Em caso de depósito judicial referente à condenação, expeça-se mandado de pagamento, independentemente de nova conclusão. 

Caso haja valor remanescente a ser recebido, manifeste-se o credor em 7 dias, sob pena de arquivamento dos autos. Após o trânsito em julgado, tratando-se de sentença de improcedência ou de extinção do feito sem resolução do mérito, dê-se baixa e arquivem-se imediatamente. 

Tratando-se de sentença de procedência, após o trânsito em julgado e o decurso do prazo de 15 dias para pagamento espontâneo do valor da condenação previsto no art. 523 do NCPC c/c o entendimento consolidado no enunciado nº 13.9.1 do Aviso nº 23/2008 do TJERJ, aguarde-se por mais 7 dias a manifestação das partes e, em seguida, caso permaneçam em silêncio, proceda-se a baixa e ao arquivamento. 

FICAM AS PARTES CIENTES DE QUE A NOVA SISTEMÁTICA DE CONTAGEM DE PRAZO ESTABELECIDO NO ART. 219 DO NCPC/2015 NÃO SE APLICA AOS JUIZADOS ESPECIAIS CÍVEIS, CONSOANTE NOTA TÉCNICA 01/2016 DO FONAJE DE 04/03/2016 C/C A PRIMEIRA PARTE DO ENUNCIADO 86 TAMBÉM DO FONAJE, COMPUTANDO-SE OS PRAZOS EM DIAS CORRIDOS, ASSIM PROCEDENDO COM A FINALIDADE PRECÍPUA DE SE ALCANÇAR A BOA GESTÃO CARTORÁRIA COM FUNDAMENTO NO PRINCÍPIO DA CELERIDADE QUE REGE A LEI 9.099/95.";0004A19E9176BF1300E55986B417D97F23E1C5045E1B1938;['2016.001.042109-2']
9;2016.021.057357-4;"Dispensado o relatório na forma do artigo 38, da Lei 9099/95.

Tendo em vista que a empresa Ré encontra-se em processo de recuperação judicial, em trâmite na 7ª Vara Empresarial da Comarca do Rio de Janeiro (Autos: 0203711-65.2016.8.19.0001)  e considerando que este Juízo deve atender, neste caso, às determinações previstas no artigo 6º da Lei 11.101 de 09 de fevereiro de 2005.

Considerando, ainda, o princípio da celeridade que rege os Juizados Especiais Cíveis, não podendo o presente processo ficar aguardando o término do processo de Recuperação Judicial, JULGO EXTINTA a execução, nos termos do art. 53 §4º da lei 9099/95.  

Assim, expeça-se certidão de crédito em favor da parte autora, no que se refere ao crédito existente nestes autos, podendo o Autor se habilitar como credor nos autos do processo acima mencionado.

Sem custas na forma do art. 55 da Lei 9099/95.

Após o trânsito em julgado, dê-se baixa e arquive-se.";0004A19E9176BF1300E55986B417D97F23E1C5045E1B1938;['2016.001.042109-2']
10;2016.021.057357-4;"Homologo, por sentença, para que surta seus efeitos legais, o projeto de sentença elaborado pelo juiz leigo, na forma do artigo 40 da Lei nº 9.099/95. 

Em caso de depósito judicial referente à condenação, expeça-se mandado de pagamento, independentemente de nova conclusão. 

Caso haja valor remanescente a ser recebido, manifeste-se o credor em 7 dias, sob pena de arquivamento dos autos. Após o trânsito em julgado, tratando-se de sentença de improcedência ou de extinção do feito sem resolução do mérito, dê-se baixa e arquivem-se imediatamente. 

Tratando-se de sentença de procedência, após o trânsito em julgado e o decurso do prazo de 15 dias para pagamento espontâneo do valor da condenação previsto no art. 523 do NCPC c/c o entendimento consolidado no enunciado nº 13.9.1 do Aviso nº 23/2008 do TJERJ, aguarde-se por mais 7 dias a manifestação das partes e, em seguida, caso permaneçam em silêncio, proceda-se a baixa e ao arquivamento. 

FICAM AS PARTES CIENTES DE QUE A NOVA SISTEMÁTICA DE CONTAGEM DE PRAZO ESTABELECIDO NO ART. 219 DO NCPC/2015 NÃO SE APLICA AOS JUIZADOS ESPECIAIS CÍVEIS, CONSOANTE NOTA TÉCNICA 01/2016 DO FONAJE DE 04/03/2016 C/C A PRIMEIRA PARTE DO ENUNCIADO 86 TAMBÉM DO FONAJE, COMPUTANDO-SE OS PRAZOS EM DIAS CORRIDOS, ASSIM PROCEDENDO COM A FINALIDADE PRECÍPUA DE SE ALCANÇAR A BOA GESTÃO CARTORÁRIA COM FUNDAMENTO NO PRINCÍPIO DA CELERIDADE QUE REGE A LEI 9.099/95.";00044136406C23D25FE74C7CDDD8547A0E8BC505152E0B61;['2016.001.126648-3']
11;2016.021.057357-4;"3597    PROJETO DE SENTENÇA\n\nAinda que dispensado o ...
Name: ANDPROCCLOB__TXT_DESCR, dtype: object";00044136406C23D25FE74C7CDDD8547A0E8BC505152E0B61;['2016.001.126648-3']
12;2016.021.057357-4;"Homologo, por sentença, para que surta seus efeitos legais, o projeto de sentença elaborado pelo juiz leigo, na forma do artigo 40 da Lei nº 9.099/95. 

Em caso de depósito judicial referente à condenação, expeça-se mandado de pagamento, independentemente de nova conclusão. 

Caso haja valor remanescente a ser recebido, manifeste-se o credor em 7 dias, sob pena de arquivamento dos autos. Após o trânsito em julgado, tratando-se de sentença de improcedência ou de extinção do feito sem resolução do mérito, dê-se baixa e arquivem-se imediatamente. 

Tratando-se de sentença de procedência, após o trânsito em julgado e o decurso do prazo de 15 dias para pagamento espontâneo do valor da condenação previsto no art. 523 do NCPC c/c o entendimento consolidado no enunciado nº 13.9.1 do Aviso nº 23/2008 do TJERJ, aguarde-se por mais 7 dias a manifestação das partes e, em seguida, caso permaneçam em silêncio, proceda-se a baixa e ao arquivamento. 

FICAM AS PARTES CIENTES DE QUE A NOVA SISTEMÁTICA DE CONTAGEM DE PRAZO ESTABELECIDO NO ART. 219 DO NCPC/2015 NÃO SE APLICA AOS JUIZADOS ESPECIAIS CÍVEIS, CONSOANTE NOTA TÉCNICA 01/2016 DO FONAJE DE 04/03/2016 C/C A PRIMEIRA PARTE DO ENUNCIADO 86 TAMBÉM DO FONAJE, COMPUTANDO-SE OS PRAZOS EM DIAS CORRIDOS, ASSIM PROCEDENDO COM A FINALIDADE PRECÍPUA DE SE ALCANÇAR A BOA GESTÃO CARTORÁRIA COM FUNDAMENTO NO PRINCÍPIO DA CELERIDADE QUE REGE A LEI 9.099/95.";0004A89041B58D4AABC8F7352E869C1F2438C5050B5B1E4F;['2016.001.038573-7']
13;2016.021.057357-4;"Processo n°:  0046766-50.2016.8.19.0001
Autor: RAFAEL DE NORO~ES CARVALHO
Réu: OI MO´VEL S/A e TIM CELULAR S/A

PROJETO DE SENTENÇA

Dispensado o relatório na forma do art. 38 da Lei 9.099/95.

Trata-se de ação em que o autor alega ter solicitado junto a 2° ré, no dia 26.08.15, a portabilidade de sua linha telefônica, entretanto, no dia 31.08.15, solicitou o cancelamento da referida portabilidade, devido a uma oferta da primeira reclamada. Narra o demandante que, apesar dos diversos contatos junto as reclamadas para solucionar o problema, as mesmas não se desincumbiram de prestar o serviço de forma adequada, acarretando lhe relevantes transtornos.

Pelo que, objetiva: a compensação por danos morais, em valor arbitrado pelo juízo.

As partes rés foram citadas e ofereceram defesas sob a forma escrita, onde suscitaram a preliminar incompetência do juízo, além de pugnar pela improcedência dos pedidos, ao argumento de que não ocorreu falha na prestação do serviço.

Rejeito a preliminar de incompetência do juízo, suscitada pela 1° ré,  uma vez que, a matéria pode ser provada por outros meios, não sendo necessária a realização de perícia, nos termos do artigo 32, da Lei 9.099/95.

Assim, presentes as condições para o regular exercício do direito de ação, bem como, os demais pressupostos da ação, passo a enfrentar o mérito.

A relação jurídica entre as partes é de consumo, já que estão presentes os requisitos subjetivos (consumidor e fornecedor, art. 2o c/c art. 17 e art. 3o da Lei 8.078/90) e objetivos (produto e serviço, §§ 1o e 2o do artigo 3o da mesma lei) de tal relação, impondo-se à demanda sob exame os preceitos do Código de Defesa do Consumidor.

No entanto, tal fato, não exime a parte Autora de produzir o mínimo de prova a fim de comprovar o fato constitutivo de seu direito, a teor da regra contida no artigo 373, inciso I do Código de Processo Civil.
Contudo, verifica-se que a parte autora não logrou êxito em comprovar os fatos constitutivos de seu direito, ônus que lhe cabia, a teor do art. 373, I do CPC, eis que, não há prova nos autos de que tenha havido falha na prestação dos serviços sob exame, por parte das rés, visto que o requerente sequer juntou documento comprovando que possuía uma linha telefônica fixa com a primeira ré, tampouco, mencionou o número da referida linha em sua inicial.

Cumpre dizer, que o instituto da inversão do ônus da prova, previsto no art. 6º, VIII do Código de Defesa do Consumidor, não isenta a parte autora de comprovar os elementos básicos de sua postulação.

Portanto, tendo em vista a ausência de prova relativa aos fatos constitutivos do direito do autor, os pedidos elencados na exordial, merecem improcedência, eis que, não há prova nos autos de que as rés tenham adotado conduta ilícita em relação a parte autora.
Assim é que, levando-se em conta a não comprovação da responsabilidade do réu sobre o alegado dano, as alegações deduzidas na exordial não merecem prosperar. 
Pelo exposto, JULGO IMPROCEDENTES OS PEDIDOS e dou pela extinção do processo com resolução do mérito, na forma do artigo 487, I, do Código de Processo Civil.
Sem ônus de sucumbência em razão do disposto no artigo 55 da Lei nº 9.099/95.

Projeto de sentença sujeito à homologação pela MM. Juíza de Direito, com base no art. 40 da Lei nº 9099/95.

Rio de Janeiro, 11 de julho de 2016.


ANDRÉA LUCIA DUARTE DOS SANTOS
JUÍZA LEIGA";0004A89041B58D4AABC8F7352E869C1F2438C5050B5B1E4F;['2016.001.038573-7']
14;2016.021.057357-4;"215    \t\tDispensado o relatório na forma do artigo ...
Name: ANDPROCCLOB__TXT_DESCR, dtype: object";00042663AE38A6C5C167B026EB5BDF0756E9C5045F62630D;['2016.001.021114-0']
15;2016.021.057357-4;"Homologo, por sentença, para que surta seus efeitos legais, o projeto de sentença elaborado pelo juiz leigo, na forma do artigo 40 da Lei nº 9.099/95.  

Em caso de depósito judicial referente à condenação, expeça-se mandado de pagamento, independentemente de nova conclusão.  

Caso haja valor remanescente a ser recebido, manifeste-se o credor em 7 dias, sob pena de arquivamento dos autos. Após o trânsito em julgado, tratando-se de sentença de improcedência ou de extinção do feito sem resolução do mérito, dê-se baixa e arquivem-se imediatamente.  

Tratando-se de sentença de procedência, após o trânsito em julgado e o decurso do prazo de 15 dias para pagamento espontâneo do valor da condenação previsto no art. 523 do NCPC c/c o entendimento consolidado no enunciado nº 13.9.1 do Aviso nº 23/2008 do TJERJ, aguarde-se por mais 7 dias a manifestação das partes e, em seguida, caso permaneçam em silêncio, proceda-se a baixa e ao arquivamento.  

FICAM AS PARTES CIENTES DE QUE A NOVA SISTEMÁTICA DE CONTAGEM DE PRAZO ESTABELECIDO NO ART. 219 DO NCPC/2015 NÃO SE APLICA AOS JUIZADOS ESPECIAIS CÍVEIS, CONSOANTE NOTA TÉCNICA 01/2016 DO FONAJE DE 04/03/2016, COMPUTANDO-SE OS PRAZOS EM DIAS CORRIDOS, ASSIM PROCEDENDO COM A FINALIDADE PRECÍPUA DE SE ALCANÇAR A BOA GESTÃO CARTORÁRIA COM FUNDAMENTO NO PRINCÍPIO DA CELERIDADE QUE REGE A LEI 9.099/95.   

Cumpridas as formalidades legais, dê-se baixa e arquivem-se os autos.";00042663AE38A6C5C167B026EB5BDF0756E9C5045F62630D;['2016.001.021114-0']
16;2016.021.057357-4;"HOMOLOGO, por sentença, o acordo celebrado entre as partes, para que produza seus jurídicos e legais efeitos. Assim sendo, JULGO EXTINTO O PROCESSO, com resolução de mérito, com fundamento no artigo 487, inciso III, alínea b, do CPC. 

Sem custas. 

REGISTRE-SE. 

Após, dê-se baixa e arquive-se.";00040360F3A5EE61AB424F5932E09DA5476EC5045F631362;['2016.001.021266-1']
