;processo;sentenca;similar_file;similar_processo
54;2016.001.278424-6;"Homologo, por sentença, para que surta seus efeitos legais, o projeto de sentença elaborado pelo juiz leigo, na forma do artigo 40 da Lei nº 9.099/95. 

Em caso de depósito judicial referente à condenação, expeça-se mandado de pagamento, independentemente de nova conclusão. 

Caso haja valor remanescente a ser recebido, manifeste-se o credor em 7 dias, sob pena de arquivamento dos autos. Após o trânsito em julgado, tratando-se de sentença de improcedência ou de extinção do feito sem resolução do mérito, dê-se baixa e arquivem-se imediatamente. 

Tratando-se de sentença de procedência, após o trânsito em julgado e o decurso do prazo de 15 dias para pagamento espontâneo do valor da condenação previsto no art. 523 do NCPC c/c o entendimento consolidado no enunciado nº 13.9.1 do Aviso nº 23/2008 do TJERJ, aguarde-se por mais 7 dias a manifestação das partes e, em seguida, caso permaneçam em silêncio, proceda-se a baixa e ao arquivamento. 

FICAM AS PARTES CIENTES DE QUE A NOVA SISTEMÁTICA DE CONTAGEM DE PRAZO ESTABELECIDO NO ART. 219 DO NCPC/2015 NÃO SE APLICA AOS JUIZADOS ESPECIAIS CÍVEIS, CONSOANTE NOTA TÉCNICA 01/2016 DO FONAJE DE 04/03/2016 C/C A PRIMEIRA PARTE DO ENUNCIADO 86 TAMBÉM DO FONAJE, COMPUTANDO-SE OS PRAZOS EM DIAS CORRIDOS, ASSIM PROCEDENDO COM A FINALIDADE PRECÍPUA DE SE ALCANÇAR A BOA GESTÃO CARTORÁRIA COM FUNDAMENTO NO PRINCÍPIO DA CELERIDADE QUE REGE A LEI 9.099/95.";0004B1EBB081C4994F0A3463C2A801938E82C505290B0C3A;2016.001.178298-9
55;2016.001.278424-6;"4517    PODER JUDICIÁRIO DO ESTADO DO RIO DE JANEIRO\n...
Name: ANDPROCCLOB__TXT_DESCR, dtype: object";00049B673F656DA66B5759F3D6A35A334A87C50511241C29;2016.021.010535-9
56;2016.001.278424-6;Vistos etc. HOMOLOGO o PROJETO DE SENTENÇA proferido pelo DD. Juiz Leigo que me foi submetido, para que a mesma produza os seus jurídicos e legais efeitos, nos termos do artigo 4º, inciso III, da Resolução nº 08/2005, do Órgão Especial do TJ/RJ.  Sem custas judiciais, na forma da Lei nº 9.099/95. P.R.I. Certificado o trânsito em julgado, aguarde-se pronunciamento por 30 dias. Na inércia, dê-se baixa e arquive-se.;00049B673F656DA66B5759F3D6A35A334A87C50511241C29;2016.021.010535-9
57;2016.001.278424-6;A parte autora não compareceu à audiência, apesar de devidamente intimada. Isto posto, JULGO EXTINTO O PROCESSO, sem resolução do mérito, na forma do art. 51, I, da Lei 9.099/95. P.I. Condeno a parte autora ao pagamento das custas processuais, na forma do art. 51, § 2°, da Lei 9.099/95. Defiro (para processos físicos) o desentranhamento de documentos, mediante a substituição por cópias. Após o trânsito em julgado, estando o autor representado por advogado, intime-se por D.O para pagamento as custas, no prazo de  10 dias, nos moldes do Aviso 42/2010. No caso de inércia,  emita-se Certidão ao DEGAR e arquivem-se sem baixa.;0004B7BDD88FEAFA4D2E148E06B86B4A5828C505254B263F;2016.208.012081-9
58;2016.001.278424-6;"5458    ESTADO DO RIO DE JANEIRO\nPODER JUDICIÁRIO\nVI...
Name: ANDPROCCLOB__TXT_DESCR, dtype: object";0004AAB6C9D7127F2500F51DBE5865ED3142C50523063C33;2016.001.134888-8
59;2016.001.278424-6;"Homologo, por sentença, para que surta seus efeitos legais, o projeto de sentença elaborado pelo juiz leigo, na forma do artigo 40 da Lei nº 9.099/95.  

Em caso de depósito judicial referente à condenação, expeça-se mandado de pagamento, independentemente de nova conclusão.  

Caso haja valor remanescente a ser recebido, manifeste-se o credor em 7 dias, sob pena de arquivamento dos autos. Após o trânsito em julgado, tratando-se de sentença de improcedência ou de extinção do feito sem resolução do mérito, dê-se baixa e arquivem-se imediatamente.  

Tratando-se de sentença de procedência, após o trânsito em julgado e o decurso do prazo de 15 dias para pagamento espontâneo do valor da condenação previsto no art. 523 do NCPC c/c o entendimento consolidado no enunciado nº 13.9.1 do Aviso nº 23/2008 do TJERJ, aguarde-se por mais 7 dias a manifestação das partes e, em seguida, caso permaneçam em silêncio, proceda-se a baixa e ao arquivamento.  

FICAM AS PARTES CIENTES DE QUE A NOVA SISTEMÁTICA DE CONTAGEM DE PRAZO ESTABELECIDO NO ART. 219 DO NCPC/2015 NÃO SE APLICA AOS JUIZADOS ESPECIAIS CÍVEIS, CONSOANTE NOTA TÉCNICA 01/2016 DO FONAJE DE 04/03/2016, COMPUTANDO-SE OS PRAZOS EM DIAS CORRIDOS, ASSIM PROCEDENDO COM A FINALIDADE PRECÍPUA DE SE ALCANÇAR A BOA GESTÃO CARTORÁRIA COM FUNDAMENTO NO PRINCÍPIO DA CELERIDADE QUE REGE A LEI 9.099/95.   

Cumpridas as formalidades legais, dê-se baixa e arquivem-se os autos.";0004AAB6C9D7127F2500F51DBE5865ED3142C50523063C33;2016.001.134888-8
60;2016.001.278424-6;"Homologo o acordo celebrado entre as partes para que surta seus jurídicos e legais efeitos, e julgo o feito extinto, com resolução do mérito, nos termos do art. 487, inc. III, b, do novo Código de Processo Civil ( Lei nº 13.105/ 2015). 

Se for o caso, comprovado o depósito, expeça-se mandado de pagamento em favor da parte autora, independentemente de nova conclusão.   Após, nada mais sendo requerido, dê-se baixa e arquivem-se. 


Decorrido o prazo do cumprimento o acordo, aguarde-se por cinco dias a manifestação das partes; não havendo manifestação,  dê-se baixa e arquive-se.";00046147C920E8F723EBEF3708558E344303C5051F071228;2016.001.153671-1
61;2016.001.278424-6;"Processo :0005662-51.2016.8.19.0204

Autor: ALMIR PAVÃO

Réu: CLARO S.A

			
			PROJETO DE SENTENÇA

Dispensado o relatório nos termos do art. 38 da Lei 9.099/95.

A parte autora alega, em síntese, que solicitou cancelamento de sua linha telefônica em 12 de junho de 2015 mas que em setembro recebeu informação de conta não paga além de ter seu nome negativado indevidamente.Requer cancelamento de débitos, retirada de seu nome dos cadastros restritivos de crédito e indenização por danos morais.

Em contestação a ré suscita que não houve irregularidades no serviço prestado e impugna os pedidos.

Inicialmente, cabe ressaltar que a situação dos autos se consubstancia em efetiva relação de consumo, presente a relação entre consumidor e fornecedor, nos moldes dos arts. 2º e 3º do Código de Defesa do Consumidor. Assim sendo, inteiramente aplicáveis são as normas protetivas dispostas na Lei 8.078/90.

Em que pese, entretanto, a natureza da relação jurídica aqui evidenciada e, assim, o regramento legal incidente, entendo que o pedido autoral não merece acolhimento neste caso. Isto porque, embora haja faturas de cobrança após o protocolo de cancelamento, não há nos autos provas de que a parte autora estava adimplente junto à ré até o dia do pedido de cancelamento da linha, não havendo ainda, comprovante de que teve seu nome inscrito nos cadastros restritivos de crédito.
Deste modo, em que pese o ordenamento jurídico aplicável às relações de consumo preveja a inversão do ônus da prova, é encargo da parte autora constituir a prova mínima do fato constitutivo do seu direito, nos moldes do artigo 373, inciso I, do NCPC e súmula 330, TJ-RJ, o que não se verificou na hipótese. Limitou-se a explanar, genericamente, episódio danoso, sem qualquer alicerce, não demonstrando o dano moral sofrido ou os valores materiais perquiridos.
Ante o exposto, JULGO IMPROCEDENTES OS PEDIDOS da parte autora e julgo extinto o processo com julgamento de mérito, nos termos do artigo 487,I, CPC.
Sem custas e honorários de sucumbência, nos termos do art. 55 da Lei 9.0099/95.
Submeto a apreciação do MM. Juiz de Direito conforme artigo 40 da Lei 9.099/ 95. Rio de Janeiro, 26 de abril de 2016. Juliana de Mattos Braga ¿ juíza leiga";0004A143F1C8FB8F62B546EC5B6480E133B5C5045E4E3216;2016.204.005647-0
62;2016.001.278424-6;Dispensado o relatório na forma do art. 38 da Lei 9099/95. HOMOLOGO o projeto de sentença proferido pelo Juiz Leigo, para que produza seus jurídicos e legais efeitos, na forma do art. 40 da Lei 9.099/95.  FICAM AS PARTES CIENTES DE QUE, NOS TERMOS DO AVISO 02/2016 DA COJES (D.O. 31/03/2016) OS PRAZOS PROCESSUAIS EM SEDE DE JEC CONTINUARÃO A SER CONTADOS EM DIAS CORRIDOS, INAPLICÁVEL O ARTIGO 219 DO NCPC.Fica a parte ré ciente de que caso não pague a quantia certa a que foi condenada em 15 dias, contados do trânsito em julgado da sentença, o valor da condenação será acrescido de multa de 10%, por aplicação do artigo 523,§1º do CPC, sendo certo, ainda, que a comprovação do depósito deverá vir aos autos no prazo de 5 dias, após a efetivação. Comprovado o depósito nos autos, e a quitação por parte do credor, expeça-se mandado de pagamento. Após, dê-se baixa e arquive-se. Caso negativo, após o decurso do prazo de trinta dias do trânsito em julgado, dê-se baixa e arquive-se.;0004A143F1C8FB8F62B546EC5B6480E133B5C5045E4E3216;2016.204.005647-0
63;2016.001.278424-6;"5250    ESTADO DO RIO DE JANEIRO\nPODER JUDICIÁRIO\nVI...
Name: ANDPROCCLOB__TXT_DESCR, dtype: object";0004CD2BD04DB3C589D0FBD94F49B3C81702C5051C152055;2016.001.137584-3
64;2016.001.278424-6;"Homologo, por sentença, para que surta seus efeitos legais, o projeto de sentença elaborado pelo juiz leigo, na forma do artigo 40 da Lei nº 9.099/95.  

Em caso de depósito judicial referente à condenação, expeça-se mandado de pagamento, independente de nova conclusão, cumprindo à parte ré, quando do pagamento, apresentar planilha discriminada do valor da condenação.  

Caso haja valor remanescente a ser recebido, manifeste-se o credor em 7 dias, sob pena de arquivamento dos autos. Após o trânsito em julgado, tratando-se de sentença de improcedência ou de extinção do feito sem resolução do mérito, dê-se baixa e arquivem-se imediatamente.  

Tratando-se de sentença de procedência, após o trânsito em julgado e o decurso do prazo de 15 dias para pagamento espontâneo do valor da condenação previsto no art. 523 do NCPC c/c o entendimento consolidado no enunciado nº 13.9.1 do Aviso nº 23/2008 do TJERJ, aguarde-se por mais 7 dias a manifestação das partes e, em seguida, caso permaneçam em silêncio, proceda-se a baixa e ao arquivamento.  

FICAM AS PARTES CIENTES DE QUE A NOVA SISTEMÁTICA DE CONTAGEM DE PRAZO ESTABELECIDO NO ART. 219 DO NCPC/2015 NÃO SE APLICA AOS JUIZADOS ESPECIAIS CÍVEIS, CONSOANTE NOTA TÉCNICA 01/2016 DO FONAJE DE 04/03/2016, COMPUTANDO-SE OS PRAZOS EM DIAS CORRIDOS, ASSIM PROCEDENDO COM A FINALIDADE PRECÍPUA DE SE ALCANÇAR A BOA GESTÃO CARTORÁRIA COM FUNDAMENTO NO PRINCÍPIO DA CELERIDADE QUE REGE A LEI 9.099/95.   

Cumpridas as formalidades legais, dê-se baixa e arquivem-se os autos.";0004CD2BD04DB3C589D0FBD94F49B3C81702C5051C152055;2016.001.137584-3
65;2016.001.278424-6;Diante da ausência da parte autora na Audiência de Conciliação, Instrução e Julgamento, JULGO EXTINTO O PROCESSO SEM EXAME DE MÉRITO, nos termos do artigo 51, I, da Lei 9099/95. Defiro, desde já, o desentranhamento de documentos, mediante substituição por cópias. Custas pela parte autora. Após o trânsito em julgado, dê-se baixa e arquive-se.  P.R.I.;0004D886200BBD664F06A29BC6603293A65AC50463044F54;2016.204.005744-8
66;2016.001.278424-6;"1403    A autora reclama por ter sofrido apontamento i...
Name: ANDPROCCLOB__TXT_DESCR, dtype: object";0004532FA5013652D264E0332D5C051BA229C505025B6430;2016.001.049453-8
67;2016.001.278424-6;"Homologo, por sentença, para que surta seus efeitos legais, o projeto de sentença elaborado pelo juiz leigo, na forma do artigo 40 da Lei nº 9.099/95.  

Em caso de depósito judicial referente à condenação, expeça-se mandado de pagamento, independentemente de nova conclusão.  

Caso haja valor remanescente a ser recebido, manifeste-se o credor em 7 dias, sob pena de arquivamento dos autos. Após o trânsito em julgado, tratando-se de sentença de improcedência ou de extinção do feito sem resolução do mérito, dê-se baixa e arquivem-se imediatamente.  

Tratando-se de sentença de procedência, após o trânsito em julgado e o decurso do prazo de 15 dias para pagamento espontâneo do valor da condenação previsto no art. 523 do NCPC c/c o entendimento consolidado no enunciado nº 13.9.1 do Aviso nº 23/2008 do TJERJ, aguarde-se por mais 7 dias a manifestação das partes e, em seguida, caso permaneçam em silêncio, proceda-se a baixa e ao arquivamento.  

FICAM AS PARTES CIENTES DE QUE A NOVA SISTEMÁTICA DE CONTAGEM DE PRAZO ESTABELECIDO NO ART. 219 DO NCPC/2015 NÃO SE APLICA AOS JUIZADOS ESPECIAIS CÍVEIS, CONSOANTE NOTA TÉCNICA 01/2016 DO FONAJE DE 04/03/2016, COMPUTANDO-SE OS PRAZOS EM DIAS CORRIDOS, ASSIM PROCEDENDO COM A FINALIDADE PRECÍPUA DE SE ALCANÇAR A BOA GESTÃO CARTORÁRIA COM FUNDAMENTO NO PRINCÍPIO DA CELERIDADE QUE REGE A LEI 9.099/95.   

Cumpridas as formalidades legais, dê-se baixa e arquivem-se os autos.";0004532FA5013652D264E0332D5C051BA229C505025B6430;2016.001.049453-8
68;2016.001.278424-6;"HOMOLOGO, por sentença, para que produza seus efeitos legais, o ACORDO ajustado pelas partes e, em consequência, JULGO EXTINTO O PROCESSO com resolução do mérito, nos termos do art. 487, inciso III, alínea b, do Código de Processo Civil. Sem Custas. Registre-se. Dê-se baixa e arquivem-se os autos.
Defiro desde já, se for o caso, independente de nova conclusão e havendo quitação da parte Autora, a expedição de mandado de pagamento. 
Cientes as partes de que, decorridos 90 dias da data do arquivamento definitivo, os autos processuais (físicos) serão eliminados, nos termos do artigo 1°, do Ato Normativo Conjunto n° 01/2005. PRI.";0004EA420EE044735188219309147230A9FCC505111E5A2D;2016.208.011057-7
69;2016.001.278424-6;"578    Processo: 0007197-79.2016.8.19.0021\nAutor: NE...
Name: ANDPROCCLOB__TXT_DESCR, dtype: object";000456ED20BDCBEE9C8AF1EB8B26BDC9D5F5C50464523D60;2016.021.006947-1
70;2016.001.278424-6;Vistos etc. HOMOLOGO o PROJETO DE SENTENÇA proferido pelo DD. Juiz Leigo que me foi submetido, para que a mesma produza os seus jurídicos e legais efeitos, nos termos do artigo 4º, inciso III, da Resolução nº 08/2005, do Órgão Especial do TJ/RJ.  Sem custas judiciais, na forma da Lei nº 9.099/95. P.R.I. Certificado o trânsito em julgado, aguarde-se pronunciamento por 30 dias. Na inércia, dê-se baixa e arquive-se.;000456ED20BDCBEE9C8AF1EB8B26BDC9D5F5C50464523D60;2016.021.006947-1
71;2016.001.278424-6;"4726    Dispensado o relatório na forma do artigo 38 d...
Name: ANDPROCCLOB__TXT_DESCR, dtype: object";000456BCFD9F78F3A9E3C4A8467752D4FD35C50515225A1B;2016.063.003316-3
72;2016.001.278424-6;"Dispensado o relatório, na forma do art. 38, da Lei 9.099/95. Decido.   
HOMOLOGO o projeto de sentença elaborado pelo Juiz Leigo, que passa  a valer como fundamentação deste, com fulcro, na Lei Estadual nº 4578/05 e na Resolução nº 08/05 do E. Órgão Especial do TJRJ, e RESOLVE-SE o mérito, com base no art. 487, I, do NCPC. Sem custas e honorários.   
Publique-se. Aguarde-se a data designada para a leitura de sentença. 
Após, certificado o trânsito em julgado e comprovado o depósito, no prazo devido, expeça-se mandado de pagamento, independente de nova conclusão.   
Nada mais havendo, dê-se baixa e arquive-se. 
Ficam as partes cientes de que os prazos perante o JEC continuam sendo contados em dias corridos, nos termos da nota técnica 01/2016 do FONAJE e do entendimento da Corregedora Nacional de Justiça, Ministra Nancy Andrighi.";000456BCFD9F78F3A9E3C4A8467752D4FD35C50515225A1B;2016.063.003316-3
73;2016.001.278424-6;"335    Processo nº: 0050712-30.2016.8.19.0001\nAutor:...
Name: ANDPROCCLOB__TXT_DESCR, dtype: object";0004A19E9176BF1300E55986B417D97F23E1C5045E1B1938;2016.001.042109-2
74;2016.001.278424-6;"Homologo, por sentença, para que surta seus efeitos legais, o projeto de sentença elaborado pelo juiz leigo, na forma do artigo 40 da Lei nº 9.099/95. 

Em caso de depósito judicial referente à condenação, expeça-se mandado de pagamento, independentemente de nova conclusão. 

Caso haja valor remanescente a ser recebido, manifeste-se o credor em 7 dias, sob pena de arquivamento dos autos. Após o trânsito em julgado, tratando-se de sentença de improcedência ou de extinção do feito sem resolução do mérito, dê-se baixa e arquivem-se imediatamente. 

Tratando-se de sentença de procedência, após o trânsito em julgado e o decurso do prazo de 15 dias para pagamento espontâneo do valor da condenação previsto no art. 523 do NCPC c/c o entendimento consolidado no enunciado nº 13.9.1 do Aviso nº 23/2008 do TJERJ, aguarde-se por mais 7 dias a manifestação das partes e, em seguida, caso permaneçam em silêncio, proceda-se a baixa e ao arquivamento. 

FICAM AS PARTES CIENTES DE QUE A NOVA SISTEMÁTICA DE CONTAGEM DE PRAZO ESTABELECIDO NO ART. 219 DO NCPC/2015 NÃO SE APLICA AOS JUIZADOS ESPECIAIS CÍVEIS, CONSOANTE NOTA TÉCNICA 01/2016 DO FONAJE DE 04/03/2016 C/C A PRIMEIRA PARTE DO ENUNCIADO 86 TAMBÉM DO FONAJE, COMPUTANDO-SE OS PRAZOS EM DIAS CORRIDOS, ASSIM PROCEDENDO COM A FINALIDADE PRECÍPUA DE SE ALCANÇAR A BOA GESTÃO CARTORÁRIA COM FUNDAMENTO NO PRINCÍPIO DA CELERIDADE QUE REGE A LEI 9.099/95.";0004A19E9176BF1300E55986B417D97F23E1C5045E1B1938;2016.001.042109-2
75;2016.001.278424-6;"Dispensado o relatório na forma do artigo 38, da Lei 9099/95.

Tendo em vista que a empresa Ré encontra-se em processo de recuperação judicial, em trâmite na 7ª Vara Empresarial da Comarca do Rio de Janeiro (Autos: 0203711-65.2016.8.19.0001)  e considerando que este Juízo deve atender, neste caso, às determinações previstas no artigo 6º da Lei 11.101 de 09 de fevereiro de 2005.

Considerando, ainda, o princípio da celeridade que rege os Juizados Especiais Cíveis, não podendo o presente processo ficar aguardando o término do processo de Recuperação Judicial, JULGO EXTINTA a execução, nos termos do art. 53 §4º da lei 9099/95.  

Assim, expeça-se certidão de crédito em favor da parte autora, no que se refere ao crédito existente nestes autos, podendo o Autor se habilitar como credor nos autos do processo acima mencionado.

Sem custas na forma do art. 55 da Lei 9099/95.

Após o trânsito em julgado, dê-se baixa e arquive-se.";0004A19E9176BF1300E55986B417D97F23E1C5045E1B1938;2016.001.042109-2
76;2016.001.278424-6;"Em  03  de  maio  de  2016,  às    11h41min  na  Sala  de  Audiências  deste  Juizado,  onde 
presente se encontrava a Drº. MARCELO MENAGED, abriu-se a Audiência de Conciliação, Instrução e 
Julgamento  designada  nestes  autos.  Ao  pregão  compareceram  as  partes  acompanhadas  dos  seus 
ilustres patronos. Renovada a proposta de conciliação a mesma restou aceita nos seguintes termos da 
Proposta do Juizo: 
I-  A  ré  se  compromete  a  pagar  a  parte  autora  o  valor  de  R$  1.600,00  (hum  mil    e  seiscentos  reais), 
através de depósito em conta corrente do patrono do autor Ananias de Carvalho Arrais, Banco do Brasil 
conta  corrente  nº  110494-2,  agência  0329-8,  portador  do  CPF  sob  o  nº  422.632.393-91,nascido  dia 
05.02.1972  no  prazo  de  20  dias  úteis,  sob  pena  de  multa  de  30%  (trinta)  por  cento,  pelo 
descumprimento. FICA DEFERIDO O LEVANTAMENTO DA IMPORTANCIA ATRAVES DE MANDADO 
DE PAGAMENTO, APÓS COMPROVADO O DEPOSITO, INDEPENDENTEMENTE DE CONCLUSÃO.     
 
II a ré se compromete a cancelar o contrato vinculado a conta de nº 201486466, bem como os débitos a 
ela vinculados e a baixa dos cadastros restritivos, cajo haja, pelo memo prazo acima mencionado. 
Pelo exposto, HOMOLOGO O ACORDO firmado pelas partes e julgo extinto o processo com resolução do mérito. P.R.I.C 
";00049E47C539F86A40126F0A19607DBA122DC50505031234;2016.021.001854-2
77;2016.001.278424-6;"Dispensado o relatório, na forma do art. 38, da Lei 9.099/95. Decido. 
HOMOLOGO o projeto de sentença elaborado pelo Juiz Leigo, que passa a valer como fundamentação deste, com fulcro, na Lei Estadual nº 4578/05 e na Resolução nº 08/05 do E. Órgão Especial do TJRJ, e RESOLVE-SE o mérito, com base no art. 487, I, do NCPC. Sem custas e honorários. 
Publique-se. Aguarde-se a data designada para a leitura de sentença.
Após, certificado o trânsito dê-se baixa e arquive-se.	
Ficam as partes cientes de que os prazos perante o JEC continuam sendo contados em dias corridos, nos termos da nota técnica 01/2016 do FONAJE e do entendimento da Corregedora Nacional de Justiça, Ministra Nancy Andrighi.";0004E88F238FF9275B266B516AFA91771440C5045E08594B;2016.063.000050-9
78;2016.001.278424-6;"Dispensado o relatório na forma do artigo 38 da Lei 9.099/95, decido.
	Trata-se de ação indenizatória, pelo rito sumaríssimo, por meio da qual a parte autora requer o réu condenado a compensar os danos morais experimentados em razão de falha na prestação do serviço do réu em Levy Gasparian. Em contestação, a ré afirma que não há danos indenizáveis, uma vez que o serviço está sendo regularmente prestado ao autor, pelo que requer a improcedência dos pedidos.
Estando presentes as condições da ação e os pressupostos de constituição e desenvolvimento regular do processo, passo a decidir o mérito.  
Inicialmente, reconheço, de oficio, a incompetência do Juízo para julgamento do pedido relacionado à disponibilidade do serviço, por entender ser necessária a produção de prova pericial para o deslinde da presente questão, pois somente com a realização de prova pericial é que este juízo teria como avaliar o que leva a falta de sinal. 
Conforme se verifica da contestação apresentada a ré argui a improcedência do pedido alegando que não houve falha na prestação do serviço. 
Trata-se de relação de consumo, sendo, portanto aplicável à espécie o Código de Defesa do Consumidor. Este, em seu art. 6, VIII, permite a inversão do ônus da prova quando o consumidor for hipossuficiente, ou as regras da experiência indicarem a verossimilhança da alegação.  
No entanto, no presente caso as alegações autorais não são verossímeis, pelo que deixo de decretar a inversão do ônus da prova, pois a autora, na inicial, não indica nem sequer quando o serviço teria ficado indisponível, impedindo, assim, qualquer prova em sentido contrário por parte da ré. 
A parte autora se limita a afirmar a titularidade do serviço para pleitear o dano moral, não apontando qualquer dano concreto ao seu direito da personalidade. No tocante ao dano moral, para que haja sua caracterização é necessário a existência de lesão a bem integrante da personalidade, tal como a honra, a liberdade, a integridade psicológica, causando dor, sofrimento, tristeza, vexame e humilhação à vítima. Vem daí a conhecida definição de dano moral ministrada por Savatier: ""qualquer sofrimento que não é causado por uma perda pecuniária"", o que não ocorreu na hipótese dos autos. 
Diante do exposto JULGO IMPROCEDENTE o pedido formulado pelaparte autora e JULGO EXTINTO O FEITO SEM EXAME DO MÉRITO, nos termos do artigo 51, inciso II, da Lei 9.099/95 em relação ao pedido de obrigação de fazer. 
Sem custas e honorários, na forma do art. 55 da Lei nº. 9.099/95.
Retifique-se o polo passivo caso requerido.
Submeto o presente projeto à homologação pela MM. Juíza de Direito.

Três Rios, 20 de junho de 2016.



Mariana de Quadros Krygier
Juíza Leiga
	";0004E88F238FF9275B266B516AFA91771440C5045E08594B;2016.063.000050-9
79;2016.001.278424-6;"Dispensado o relatório nos termos do art. 38, da Lei 9.099/95.
HOMOLOGO, para que produza seus jurídicos e legais efeitos, o acordo estabelecido pelas partes. Por conseguinte JULGO EXTINTO o presente processo, com julgamento do mérito, na forma do art. 487, III, ""b"" do NCPC.
Sem custas ou honorários. 
Em havendo depósito do valor acordado expeça-se mandado de pagamento.
Após o trânsito em julgado, cumpridas todas as formalidades legais, dê-se baixa e arquivem-se. 
P.I.";000421EEC0B3D8233D7CD47C7CAB91A70CBEC50509580312;2016.063.002019-3
