;processo;sentenca;similar_file;similar_processo
0;2016.001.278424-6;"Processo n°:  0424840-45.2016.8.19.0001
Autor:  RUBEM GRANADO
Réu:  TELEMAR NORTE LESTE S/A (EM RECUPERAÇÃO JUDICIAL) e  CLARO S/A 


PROJETO DE SENTENÇA


Dispensado o relatório na forma do art. 38 da Lei 9.099/95.

Trata-se de ação em que o autor alega ter contratado os serviços junto as reclamadas, que, por sua vez, não se desincumbiram de prestar o serviço de forma adequada, tendo cobrado valores diversos do contratado. Afirma o requerente ainda, ter entrado em contato com as rés por diversas vezes, não tendo logrado êxito em solucionar o problema.

Pelo que, objetiva: pela a primeira ré - disponibilize o serviço contratado no dia 09/09/2016, pelo preço pactuado de R$ 96,80, sendo R$ 31,90 pelo serviço de telefonia e R$ 64,90 pelo serviço de internet, acrescido das parcelas avençadas referentes as taxas de habilitação dos serviços de adesão ao fixo e a velox, no valor total de R$ 15,98; que cesse as cobranças indevidas; pela segunda ré ¿ o cancelamento de qualquer contrato, que porventura, entenda existir com o autor; a suspensão das cobranças de tais serviços; a devolução, em dobro, da quantia de R$ 459,02, cobrado indevidamente; bem como, pelas rés, a compensação por danos morais, em valor arbitrado pelo juizo.

O presente feito deve ser extinto sem resolução do mérito por incompetência territorial.

A parte autora tem domicilio em Teresópolis, conforme fls. 11, 13 e 17, e as reclamadas, foram regularmente citadas no Centro e em Botafogo (fls. 86 e 88)
O presente juízo, no entanto, não é competente territorialmente para conhecer e processar a presente demanda. Isto porque, nenhuma das partes possui endereço localizado na abrangência da competência deste Juizado Especial, não havendo razão jurídica para processar a demanda neste juízo, em obediência ao enunciado 2.2.4, Aviso 33/2008, TJ/RJ. 
O art. 4º, & ú, I da Lei 9.099/95 estabelece que é competente para processo e julgamento de causas de menor complexidade o juízo do foro do domicílio do autor, ou, a critério deste, do local onde o réu exerça atividades profissionais ou econômicas ou mantenha estabelecimento, filial, agência, sucursal ou escritório.
Em consequência aplica-se o Enunciado n° 2.2.5 dos Juizados Especiais Estaduais, publicado no Aviso n° 23/2008, o qual transcreve-se: 


¿2.2.5- Salvo nos locais onde haja órgão distribuidor para Juizados com a mesma competência, o juiz deverá, com base na violação do princípio do juiz natural, reconhecer de ofício a incompetência nos casos em que a ação for proposta no juizado de localização de um dos estabelecimentos de parte com multiplicidade de endereços, sem que se trate da sede ou sem que haja relação do estabelecimento: (i) com o domicílio residencial do autor; (ii) com o local onde a obrigação deva ser cumprida; ou (iii) com o lugar do ato ou fato lesivo ou serviço prestado.¿ (grifamos).

Por isso, a incompetência territorial importa em extinção do feito, conforme regra legal expressa neste sentido. Fica, portanto, inviabilizada a apreciação e o julgamento da presente causa.

Diante de todo exposto, JULGO EXTINTO O FEITO SEM RESOLUÇÃO DE MÉRITO, com fulcro no art. 51, III da Lei n. 9.099/95. 
Sem ônus de sucumbência em razão do disposto no artigo 55 da Lei nº 9.099/95.

Projeto de sentença sujeito à homologação pela MM. Juíza de Direito, com base no art. 40 da Lei nº 9099/95.


Rio de Janeiro, 08 de março de 2017.


ANDRÉA LUCIA DUARTE DOS SANTOS
JUIZA LEIGA";0004A98E9ADC7FF30F144DE283D03AEF0563C505612E521D;2016.001.369788-6
1;2016.001.278424-6;"Homologo, por sentença, para que surta seus efeitos legais, o projeto de sentença elaborado pelo juiz leigo, na forma do artigo 40 da Lei nº 9.099/95. 

Em caso de depósito judicial referente à condenação, expeça-se mandado de pagamento, independentemente de nova conclusão. 

Caso haja valor remanescente a ser recebido, manifeste-se o credor em 7 dias, sob pena de arquivamento dos autos. Após o trânsito em julgado, tratando-se de sentença de improcedência ou de extinção do feito sem resolução do mérito, dê-se baixa e arquivem-se imediatamente. 


Tratando-se de sentença de procedência, após o trânsito em julgado e o decurso do prazo de 15 dias para pagamento espontâneo do valor da condenação previsto no art. 523 do NCPC c/c o entendimento consolidado no enunciado nº 13.9.1 do Aviso nº 23/2008 do TJERJ, aguarde-se por mais 7 dias a manifestação das partes e, em seguida, caso permaneçam em silêncio, proceda-se a baixa e ao arquivamento. 

FICAM AS PARTES CIENTES DE QUE A NOVA SISTEMÁTICA DE CONTAGEM DE PRAZO ESTABELECIDO NO ART. 219 DO NCPC/2015 NÃO SE APLICA AOS JUIZADOS ESPECIAIS CÍVEIS, CONSOANTE NOTA TÉCNICA 01/2016 DO FONAJE DE 04/03/2016 C/C A PRIMEIRA PARTE DO ENUNCIADO 86 TAMBÉM DO FONAJE, COMPUTANDO-SE OS PRAZOS EM DIAS CORRIDOS, ASSIM PROCEDENDO COM A FINALIDADE PRECÍPUA DE SE ALCANÇAR A BOA GESTÃO CARTORÁRIA COM FUNDAMENTO NO PRINCÍPIO DA CELERIDADE QUE REGE A LEI 9.099/95.";0004A98E9ADC7FF30F144DE283D03AEF0563C505612E521D;2016.001.369788-6
2;2016.001.278424-6;"14181    \nESTADO DO RIO DE JANEIRO\nPODER JUDICIÁRIO\n...
Name: ANDPROCCLOB__TXT_DESCR, dtype: object";0004A226E9E84B9479C89719D3C4C260CE94C5056041042D;2016.001.359967-0
3;2016.001.278424-6;"Homologo, por sentença, para que surta seus efeitos legais, o projeto de sentença elaborado pelo juiz leigo, na forma do artigo 40 da Lei nº 9.099/95. 

Em caso de depósito judicial referente à condenação, expeça-se mandado de pagamento, independentemente de nova conclusão. 

Caso haja valor remanescente a ser recebido, manifeste-se o credor em 7 dias, sob pena de arquivamento dos autos. Após o trânsito em julgado, tratando-se de sentença de improcedência ou de extinção do feito sem resolução do mérito, dê-se baixa e arquivem-se imediatamente. 


Tratando-se de sentença de procedência, após o trânsito em julgado e o decurso do prazo de 15 dias para pagamento espontâneo do valor da condenação previsto no art. 523 do NCPC c/c o entendimento consolidado no enunciado nº 13.9.1 do Aviso nº 23/2008 do TJERJ, aguarde-se por mais 7 dias a manifestação das partes e, em seguida, caso permaneçam em silêncio, proceda-se a baixa e ao arquivamento. 

FICAM AS PARTES CIENTES DE QUE A NOVA SISTEMÁTICA DE CONTAGEM DE PRAZO ESTABELECIDO NO ART. 219 DO NCPC/2015 NÃO SE APLICA AOS JUIZADOS ESPECIAIS CÍVEIS, CONSOANTE NOTA TÉCNICA 01/2016 DO FONAJE DE 04/03/2016 C/C A PRIMEIRA PARTE DO ENUNCIADO 86 TAMBÉM DO FONAJE, COMPUTANDO-SE OS PRAZOS EM DIAS CORRIDOS, ASSIM PROCEDENDO COM A FINALIDADE PRECÍPUA DE SE ALCANÇAR A BOA GESTÃO CARTORÁRIA COM FUNDAMENTO NO PRINCÍPIO DA CELERIDADE QUE REGE A LEI 9.099/95.";0004A226E9E84B9479C89719D3C4C260CE94C5056041042D;2016.001.359967-0
4;2016.001.278424-6;"HOMOLOGO, por sentença, o acordo celebrado entre as partes, para que produza seus jurídicos e legais efeitos. Assim sendo, JULGO EXTINTO O PROCESSO, com resolução de mérito, com fundamento no artigo 487, inciso III, alínea b, do CPC. Sem custas. 

Cumprido o acordo, dê-se baixa e arquive-se, independente de conclusão.";00041836C3E6766742FB820D3843EBF1AFBAC50604135E03;2016.001.367573-8
5;2016.001.278424-6;"Homologo o acordo celebrado entre a parte autora  e o segundo e terceiro réus,C &a e BRADESCARD, para que surta seus jurídicos e legais efeitos, e julgo o feito extinto, com resolução do mérito, nos termos do art. 487, inc. III, b, do novo Código de Processo Civil ( Lei nº 13.105/ 2015). 
Decorrido o prazo do cumprimento o acordo, aguarde-se por cinco dias a manifestação das partes; não havendo manifestação,  dê-se baixa e arquive-se.

Homologo o pedido de desistência da parte autora  quanto ao primeiro réu TELEMAR e JULGO EXTINTO o processo, sem resolução do mérito, na forma do art. 485, inciso VIII, do Novo Código de Processo Civil (Lei nº 13.105, de 16/03/2015). Retirei de pauta a audiência designada.Sem custas na forma do artigo 55, da Lei nº 9099/95.Transitado em julgado, dê-se baixa e arquive-se.";0004E6E4A04174F260773BE043106DA098CDC5055E3B3262;2016.001.353993-4
6;2016.001.278424-6;"Processo: 0382290-35.2016.8.19.0001
AUTOR: ABRAHAN OBADIA
RÉU: OI S/A


Em 05 de dezembro de 2016, na sala de audiências deste juízo, perante a MMª. Drª. Juíza de Direito, MARCIA MACIEL QUARESMA, compareceu a parte autora, acompanhada de seu advogado, bem como o preposto e advogado do réu. Proposta a conciliação a mesma foi aceita nos seguintes termos: 1- A parte ré se compromete a inserir o serviço de OI TV no Combo contratado pela parte autora no Plano OI Total Fixo + Pós 100 + Banda Larga + TV 2, Oi Mix HD, no prazo de até 30 dias, sob pena de multa a ser fixada em execução; 2 ¿ A parte ré se compromete a inserir R$ 2.800,00, em créditos no referido plano, a saber, OI Total de titularidade do autor, vinculado a linha de nº (21) 988638735, no prazo de até 60 dias corridos, sob pena de multa a ser fixada em execução, ficando o autor ciente que não poderá alterar o plano para plano controle. Pela MMª Juíza foi proferida a seguinte sentença: ¿VISTOS. ETC... HOMOLOGO o presente acordo para que surta seus jurídicos e legais efeitos, e, em consequência, JULGO EXTINTO o presente feito nos termos do art. 487, III do CPC. Sem ônus sucumbenciais. Publicada em audiência. Intimados os presentes. Registre-se. Após o trânsito em julgado, dê-se baixa e arquive-se¿. Nada mais havendo, determinou a MMª Juíza o encerramento da presente. Eu Simone Iack Pinheiro, Secretária, o digitei.



MARCIA MACIEL QUARESMA 
JUIZ DE DIREITO  


Parte autora:
Advogado:

Parte ré:
Advogado:";00048C510551EA1EF23C50C8067BCFA576A9C50554534215;2016.001.333705-5
7;2016.001.278424-6;"7260    \t\tDispensado o relatório na forma do artigo ...
Name: ANDPROCCLOB__TXT_DESCR, dtype: object";0004B77ABA0364984556DB4CC775C8C9474FC5052E1F0D03;2016.001.176306-5
8;2016.001.278424-6;"Homologo, por sentença, para que surta seus efeitos legais, o projeto de sentença elaborado pelo juiz leigo, na forma do artigo 40 da Lei nº 9.099/95.  

Em caso de depósito judicial referente à condenação, expeça-se mandado de pagamento, independente de nova conclusão, cumprindo à parte ré, quando do pagamento, apresentar planilha discriminada do valor da condenação.  

Caso haja valor remanescente a ser recebido, manifeste-se o credor em 7 dias, sob pena de arquivamento dos autos. Após o trânsito em julgado, tratando-se de sentença de improcedência ou de extinção do feito sem resolução do mérito, dê-se baixa e arquivem-se imediatamente.  

Tratando-se de sentença de procedência, após o trânsito em julgado e o decurso do prazo de 15 dias para pagamento espontâneo do valor da condenação previsto no art. 523 do NCPC c/c o entendimento consolidado no enunciado nº 13.9.1 do Aviso nº 23/2008 do TJERJ, aguarde-se por mais 7 dias a manifestação das partes e, em seguida, caso permaneçam em silêncio, proceda-se a baixa e ao arquivamento.  

FICAM AS PARTES CIENTES DE QUE A NOVA SISTEMÁTICA DE CONTAGEM DE PRAZO ESTABELECIDO NO ART. 219 DO NCPC/2015 NÃO SE APLICA AOS JUIZADOS ESPECIAIS CÍVEIS, CONSOANTE NOTA TÉCNICA 01/2016 DO FONAJE DE 04/03/2016, COMPUTANDO-SE OS PRAZOS EM DIAS CORRIDOS, ASSIM PROCEDENDO COM A FINALIDADE PRECÍPUA DE SE ALCANÇAR A BOA GESTÃO CARTORÁRIA COM FUNDAMENTO NO PRINCÍPIO DA CELERIDADE QUE REGE A LEI 9.099/95.   

Cumpridas as formalidades legais, dê-se baixa e arquivem-se os autos.";0004B77ABA0364984556DB4CC775C8C9474FC5052E1F0D03;2016.001.176306-5
9;2016.001.278424-6;"Processo nº: 0027616-44.2016.8.19.0208 
Parte Autora: Carlos Alberto Oliveira Xavier
Parte Ré: Oi Móvel



Projeto de Sentença


Dispensado o relatório nos termos do art. 38 da Lei n° 9.099/95, passo a decidir.

Inexiste preliminar a dirimir, razão pela qual, reconhecendo a existência dos pressupostos processuais e das condições de regular desenvolvimento acionário, passo ao exame do mérito.

A relação jurídica entre as partes é de consumo, já que estão presentes os requisitos subjetivos (consumidor e fornecedor - artigos 2o e 3o da Lei 8078/90) e objetivos (produto e serviço - §§ 1o e 2o do artigo 3º da citada lei) de tal relação. 

Da análise dos autos é possível verificar que, em que pese a narrativa da parte Autora, não há nos autos elementos de prova suficientes, no sentido de embasar as suas alegações.

Destaco que, a parte Autora não discute, na demanda que ingressou em face da Ré anteriormente, sobre defeito na prestação de serviço de telefonia móvel, referente a linha nº (21) 985841745, conforme se verifica da inicial juntada as fls. 28/40. Assim, não há que se falar em vício do serviço referente a linha móvel. Ocorre que, a parte Autora não comprova o pagamento das faturas da sua linha móvel, que a Ré sustenta, em sua defesa, ter sido cancelada por inadimplência. 

Assim, não deve ser imputada responsabilidade à Ré pelo evento narrado, uma vez que a parte Autora não demonstrou ter a Ré, agido sem o cuidado e transparência, que devem nortear os negócios jurídicos e as relações de consumo. 

Portanto, considero que a parte Autora não logrou êxito em provar o fato constitutivo de seu direito (art. 373, I do CPC), razão pela qual não há como se acolher as suas pretensões.

Por derradeiro, ressalto que a reparação por danos morais somente pode decorrer de um ato ilícito. Por sua vez, o reconhecimento de um ato ilícito depende de uma conduta determinada que lhe tenha dado causa.

Inexiste nos autos qualquer prova de que a conduta da Ré haja, de forma real e concreta, imposto à parte Autora extraordinária dor, vexame ou humilhação, nem tampouco extremada ofensa à sua dignidade e honra, de forma a ensejar o advento do dano moral indenizável. 

Portanto, entendo incabível o pedido de indenização por danos morais formulado pela parte Autora, tendo em vista que, não há qualquer prova de conduta ilícita praticada pela parte Ré.


A conta do acima exposto, JULGO IMPROCEDENTES OS PEDIDOS formulados pela parte Autora. 


Sem custas e honorários vez que em sede de Juizado Especial Cível, conforme disposto no artigo 55 da lei 9.099/95.
 
	Certificado o trânsito em julgado e não havendo novas manifestações no prazo de 15 (quinze) dias, dê-se baixa e arquivem-se. Cientes as partes de que decorridos 90 dias da data do arquivamento definitivo os autos processuais serão eliminados, nos termos do artigo 1º do Ato Normativo Conjunto 01/2005, publicado no DORJ de 07/01/05.
	
Projeto de sentença sujeito à homologação, assim, remeto os autos ao MM. Juiz Togado, nos termos do artigo 40 da Lei nº 9.099/95.

Rio de Janeiro, 03 de Fevereiro de 2017.

VANESSA DE SOUZA BRISIS
Juíza Leiga";00042F30E302F47620C834D3DA114378AFB5C50557580A61;2016.208.027313-2
10;2016.001.278424-6;Homologo por sentença na forma do artigo 40 da Lei nº 9.099/95 o Projeto de Sentença elaborado pelo Juiz Leigo. PRI. Certifique-se o trânsito em julgado. Defiro desde já, se for o caso, independente de nova conclusão e havendo quitação da parte Autora, a expedição de mandado de pagamento. Após, dê-se baixa e arquivem-se.;00042F30E302F47620C834D3DA114378AFB5C50557580A61;2016.208.027313-2
11;2016.001.278424-6;"1308    \nESTADO DO RIO DE JANEIRO\nPODER JUDICIÁRIO\n...
Name: ANDPROCCLOB__TXT_DESCR, dtype: object";00041B4025424FE8E83B0B8E384ED1B29728C505033E572B;2016.001.025705-0
12;2016.001.278424-6;"Homologo, por sentença, para que surta seus efeitos legais, o projeto de sentença elaborado pelo juiz leigo, na forma do artigo 40 da Lei nº 9.099/95. 

Em caso de depósito judicial referente à condenação, expeça-se mandado de pagamento, independentemente de nova conclusão. 

Caso haja valor remanescente a ser recebido, manifeste-se o credor em 7 dias, sob pena de arquivamento dos autos. Após o trânsito em julgado, tratando-se de sentença de improcedência ou de extinção do feito sem resolução do mérito, dê-se baixa e arquivem-se imediatamente. 

Tratando-se de sentença de procedência, após o trânsito em julgado e o decurso do prazo de 15 dias para pagamento espontâneo do valor da condenação previsto no art. 523 do NCPC c/c o entendimento consolidado no enunciado nº 13.9.1 do Aviso nº 23/2008 do TJERJ, aguarde-se por mais 7 dias a manifestação das partes e, em seguida, caso permaneçam em silêncio, proceda-se a baixa e ao arquivamento. 

FICAM AS PARTES CIENTES DE QUE A NOVA SISTEMÁTICA DE CONTAGEM DE PRAZO ESTABELECIDO NO ART. 219 DO NCPC/2015 NÃO SE APLICA AOS JUIZADOS ESPECIAIS CÍVEIS, CONSOANTE NOTA TÉCNICA 01/2016 DO FONAJE DE 04/03/2016 C/C A PRIMEIRA PARTE DO ENUNCIADO 86 TAMBÉM DO FONAJE, COMPUTANDO-SE OS PRAZOS EM DIAS CORRIDOS, ASSIM PROCEDENDO COM A FINALIDADE PRECÍPUA DE SE ALCANÇAR A BOA GESTÃO CARTORÁRIA COM FUNDAMENTO NO PRINCÍPIO DA CELERIDADE QUE REGE A LEI 9.099/95.";00041B4025424FE8E83B0B8E384ED1B29728C505033E572B;2016.001.025705-0
13;2016.001.278424-6;"Homologo, por sentença, para que surta seus efeitos legais, o projeto de sentença elaborado pelo juiz leigo, na forma do artigo 40 da Lei nº 9.099/95. 

Em caso de depósito judicial referente à condenação, expeça-se mandado de pagamento, independentemente de nova conclusão. 

Caso haja valor remanescente a ser recebido, manifeste-se o credor em 7 dias, sob pena de arquivamento dos autos. Após o trânsito em julgado, tratando-se de sentença de improcedência ou de extinção do feito sem resolução do mérito, dê-se baixa e arquivem-se imediatamente. 

Tratando-se de sentença de procedência, após o trânsito em julgado e o decurso do prazo de 15 dias para pagamento espontâneo do valor da condenação previsto no art. 523 do NCPC c/c o entendimento consolidado no enunciado nº 13.9.1 do Aviso nº 23/2008 do TJERJ, aguarde-se por mais 7 dias a manifestação das partes e, em seguida, caso permaneçam em silêncio, proceda-se a baixa e ao arquivamento. 

FICAM AS PARTES CIENTES DE QUE A NOVA SISTEMÁTICA DE CONTAGEM DE PRAZO ESTABELECIDO NO ART. 219 DO NCPC/2015 NÃO SE APLICA AOS JUIZADOS ESPECIAIS CÍVEIS, CONSOANTE NOTA TÉCNICA 01/2016 DO FONAJE DE 04/03/2016 C/C A PRIMEIRA PARTE DO ENUNCIADO 86 TAMBÉM DO FONAJE, COMPUTANDO-SE OS PRAZOS EM DIAS CORRIDOS, ASSIM PROCEDENDO COM A FINALIDADE PRECÍPUA DE SE ALCANÇAR A BOA GESTÃO CARTORÁRIA COM FUNDAMENTO NO PRINCÍPIO DA CELERIDADE QUE REGE A LEI 9.099/95.";00042FE79C37FE0CE738AA07236CDB27C7B2C505015D641F;2016.001.022531-0
14;2016.001.278424-6;"Homologo o acordo celebrado entre as partes para que surta seus jurídicos e legais efeitos, e julgo o feito extinto, com resolução do mérito, nos termos do art. 487, inc. III, b, do novo Código de Processo Civil ( Lei nº 13.105/ 2015). 

Se for o caso, comprovado o depósito, expeça-se mandado de pagamento em favor da parte autora, independentemente de nova conclusão.   Após, nada mais sendo requerido, dê-se baixa e arquivem-se. 


Decorrido o prazo do cumprimento o acordo, aguarde-se por cinco dias a manifestação das partes; não havendo manifestação,  dê-se baixa e arquive-se.";00045B9A208A48AC29708D1AE79A66A4584BC5054E0A444A;2016.001.280661-8
15;2016.001.278424-6;"5354    ESTADO DO RIO DE JANEIRO\nPODER JUDICIÁRIO\nVI...
Name: ANDPROCCLOB__TXT_DESCR, dtype: object";00044AAD32D3FD96A6F994AA641D15DA4483C505182F5812;2016.001.108774-6
16;2016.001.278424-6;"Homologo, por sentença, para que surta seus efeitos legais, o projeto de sentença elaborado pelo juiz leigo, na forma do artigo 40 da Lei nº 9.099/95.  

Em caso de depósito judicial referente à condenação, expeça-se mandado de pagamento, independente de nova conclusão, cumprindo à parte ré, quando do pagamento, apresentar planilha discriminada do valor da condenação.  

Caso haja valor remanescente a ser recebido, manifeste-se o credor em 7 dias, sob pena de arquivamento dos autos. Após o trânsito em julgado, tratando-se de sentença de improcedência ou de extinção do feito sem resolução do mérito, dê-se baixa e arquivem-se imediatamente.  

Tratando-se de sentença de procedência, após o trânsito em julgado e o decurso do prazo de 15 dias para pagamento espontâneo do valor da condenação previsto no art. 523 do NCPC c/c o entendimento consolidado no enunciado nº 13.9.1 do Aviso nº 23/2008 do TJERJ, aguarde-se por mais 7 dias a manifestação das partes e, em seguida, caso permaneçam em silêncio, proceda-se a baixa e ao arquivamento.  

FICAM AS PARTES CIENTES DE QUE A NOVA SISTEMÁTICA DE CONTAGEM DE PRAZO ESTABELECIDO NO ART. 219 DO NCPC/2015 NÃO SE APLICA AOS JUIZADOS ESPECIAIS CÍVEIS, CONSOANTE NOTA TÉCNICA 01/2016 DO FONAJE DE 04/03/2016, COMPUTANDO-SE OS PRAZOS EM DIAS CORRIDOS, ASSIM PROCEDENDO COM A FINALIDADE PRECÍPUA DE SE ALCANÇAR A BOA GESTÃO CARTORÁRIA COM FUNDAMENTO NO PRINCÍPIO DA CELERIDADE QUE REGE A LEI 9.099/95.   

Cumpridas as formalidades legais, dê-se baixa e arquivem-se os autos.";00044AAD32D3FD96A6F994AA641D15DA4483C505182F5812;2016.001.108774-6
17;2016.001.278424-6;"Homologo, por sentença, para que surta seus efeitos legais, o projeto de sentença elaborado pelo juiz leigo, na forma do artigo 40 da Lei nº 9.099/95. 

Em caso de depósito judicial referente à condenação, expeça-se mandado de pagamento, independentemente de nova conclusão. 

Caso haja valor remanescente a ser recebido, manifeste-se o credor em 7 dias, sob pena de arquivamento dos autos. Após o trânsito em julgado, tratando-se de sentença de improcedência ou de extinção do feito sem resolução do mérito, dê-se baixa e arquivem-se imediatamente. 

Tratando-se de sentença de procedência, após o trânsito em julgado e o decurso do prazo de 15 dias para pagamento espontâneo do valor da condenação previsto no art. 523 do NCPC c/c o entendimento consolidado no enunciado nº 13.9.1 do Aviso nº 23/2008 do TJERJ, aguarde-se por mais 7 dias a manifestação das partes e, em seguida, caso permaneçam em silêncio, proceda-se a baixa e ao arquivamento. 

FICAM AS PARTES CIENTES DE QUE A NOVA SISTEMÁTICA DE CONTAGEM DE PRAZO ESTABELECIDO NO ART. 219 DO NCPC/2015 NÃO SE APLICA AOS JUIZADOS ESPECIAIS CÍVEIS, CONSOANTE NOTA TÉCNICA 01/2016 DO FONAJE DE 04/03/2016 C/C A PRIMEIRA PARTE DO ENUNCIADO 86 TAMBÉM DO FONAJE, COMPUTANDO-SE OS PRAZOS EM DIAS CORRIDOS, ASSIM PROCEDENDO COM A FINALIDADE PRECÍPUA DE SE ALCANÇAR A BOA GESTÃO CARTORÁRIA COM FUNDAMENTO NO PRINCÍPIO DA CELERIDADE QUE REGE A LEI 9.099/95.";00045F8F1EBE8DA13E6205BD71512E5E0016C50511223850;2016.001.111117-7
18;2016.001.278424-6;"3236    VI - JUIZADO ESPECIAL CÍVEL DA GÁVEA\nProc. Nº...
Name: ANDPROCCLOB__TXT_DESCR, dtype: object";0004E3AC3D8D944CA33A14E2479261E06365C5051A0E2E5D;2016.001.111525-0
