;processo;sentenca;similar_file;similar_processo
35;2016.001.278424-6;HOMOLOGO, por sentença, o ACORDO celebrado às fls. e, em consequência, JULGO EXTINTO O PROCESSO, com resolução do mérito, nos moldes do art. 487, III, do NCPC. Retiro o feito de pauta. Sem custas. Com o trânsito em julgado, arquivem-se.;000467E90361C839DCDB460213426725E1B9C50503485650;2016.001.014817-0
36;2016.001.278424-6;"Processo n°:  0081532-32.2016.8.19.0001
Autor: SUELY MARTINHO
Réu: OI MO?VEL S/A 

PROJETO DE SENTENÇA

Dispensado o relatório na forma do art. 38 da Lei 9.099/95.

Trata-se de ação em que a autora alega ser cliente dos serviços da ré, que, por sua vez, não se desincumbiu de prestá-los de forma adequada, tendo cancelado os serviços, de forma unilateral, o que lhe acarretou relevantes transtornos. Narra a demandante, ter solicitado a religação de sua linha de telefone, bem como, contratado novo plano junto a reclamada.

Pelo que, objetiva: a compensação por danos morais, no valor de R$ 12.000,00.

A parte ré foi citada e ofereceu defesa sob a forma escrita, tendo suscitado a preliminar de inépcia da inicial, além de pugnar pela improcedência dos pedidos, ao argumento de que não ocorreu falha na prestação do serviço.

Não acolho a preliminar de inépcia da inicial, suscitada pela ré, já que os pedidos e a causa de pedir são claros, e os documentos apresentados suficientes, tanto que permitiram a apresentação de defesa bem fundamentada, preenchendo os requisitos do art. 14, da Lei 9.099/90. 

Assim, presentes as condições para o regular exercício do direito de ação, bem como, os demais pressupostos da ação, passo a enfrentar o mérito.

A relação jurídica entre as partes é de consumo, já que estão presentes os requisitos subjetivos (consumidor e fornecedor, art. 2o c/c art. 17 e art. 3o da Lei 8.078/90) e objetivos (produto e serviço, §§ 1o e 2o do artigo 3o da mesma lei) de tal relação, impondo-se à demanda sob exame os preceitos do Código de Defesa do Consumidor.

Tratando-se de relação de consumo, frente à verossimilhança das alegações e a hipossuficiência da reclamante, pessoa física, é cabível a inversão do ônus da prova, a teor do art. 6º, VIII, do CDC, não tendo a ré, se desincumbido de provar fatos extintivos, modificativos ou impeditivos do direito da autora.

Cabe notar que, a ré não logrou êxito em demonstrar a inexistência de falha na prestação do serviço, uma vez que, juntou documentos produzidos de forma unilateral, incapazes de elidir as alegações da consumidora hipossuficiente, ou excluir sua responsabilidade objetiva, por evidente defeito na prestação de serviço, em conformidade com o disposto no § 3º do art. 14, da Lei 8.078/90, ou mesmo, na forma do art. 373, II, do CPC, à sua peça de defesa, ônus que lhe competia.

A reclamada não comprovou ter prestado o serviço de maneira efetiva e adequada, tampouco demonstrou a legitimidade em cancelar a prestação dos serviços objeto da lide, de forma unilateral.

 Na mensuração do dano moral, deve o magistrado se orientar pelos critérios de razoabilidade e proporcionalidade, não se olvidando de observar a ausência de gravidade maior no evento, motivo por que, fixo o dano imaterial no valor de R$ 2.000,00 (dois mil reais).

Pelo exposto, JULGO PARCIALMENTE PROCEDENTE O PEDIDO, para CONDENAR a ré: 1) a pagar à parte autora a quantia de R$ 2.000,00 (dois mil reais) pelos danos morais causados, com juros de 1% (um por cento) ao mês, contados da citação, e correção monetária, contados a partir da data da leitura de sentença. Dou pela extinção do processo com resolução do mérito, na forma do artigo 487, I, do Código de Processo Civil. 
Deverá a ré efetuar o pagamento do montante da condenação no prazo de 15 dias, após o trânsito em julgado, sob pena de multa de 10% (dez por cento) sobre o valor, independentemente de intimação, nos moldes do art. 523, §1º, do CPC.

Sem ônus de sucumbência em razão do disposto no artigo 55 da Lei nº 9.099/95.

Projeto de sentença sujeito à homologação pela MM. Juíza de Direito, com base no art. 40 da Lei nº 9099/95.

Rio de Janeiro, 15 de junho de 2016.


GUILHERME DE OLIVEIRA PIMENTEL
JUIZ LEIGO";00040824518674666E94A1B0FD4921E114A4C50507351F55;2016.001.068168-5
37;2016.001.278424-6;"Homologo, por sentença, para que surta seus efeitos legais, o projeto de sentença elaborado pelo juiz leigo, na forma do artigo 40 da Lei nº 9.099/95. 

Em caso de depósito judicial referente à condenação, expeça-se mandado de pagamento, independentemente de nova conclusão. 

Caso haja valor remanescente a ser recebido, manifeste-se o credor em 7 dias, sob pena de arquivamento dos autos. Após o trânsito em julgado, tratando-se de sentença de improcedência ou de extinção do feito sem resolução do mérito, dê-se baixa e arquivem-se imediatamente. 

Tratando-se de sentença de procedência, após o trânsito em julgado e o decurso do prazo de 15 dias para pagamento espontâneo do valor da condenação previsto no art. 523 do NCPC c/c o entendimento consolidado no enunciado nº 13.9.1 do Aviso nº 23/2008 do TJERJ, aguarde-se por mais 7 dias a manifestação das partes e, em seguida, caso permaneçam em silêncio, proceda-se a baixa e ao arquivamento. 

FICAM AS PARTES CIENTES DE QUE A NOVA SISTEMÁTICA DE CONTAGEM DE PRAZO ESTABELECIDO NO ART. 219 DO NCPC/2015 NÃO SE APLICA AOS JUIZADOS ESPECIAIS CÍVEIS, CONSOANTE NOTA TÉCNICA 01/2016 DO FONAJE DE 04/03/2016 C/C A PRIMEIRA PARTE DO ENUNCIADO 86 TAMBÉM DO FONAJE, COMPUTANDO-SE OS PRAZOS EM DIAS CORRIDOS, ASSIM PROCEDENDO COM A FINALIDADE PRECÍPUA DE SE ALCANÇAR A BOA GESTÃO CARTORÁRIA COM FUNDAMENTO NO PRINCÍPIO DA CELERIDADE QUE REGE A LEI 9.099/95.";00040824518674666E94A1B0FD4921E114A4C50507351F55;2016.001.068168-5
38;2016.001.278424-6;"898    PROJETO DE SENTENÇA\n\nAinda que dispensado o ...
Name: ANDPROCCLOB__TXT_DESCR, dtype: object";0004BB4875978179FA9053D0DB865938E577C50507562F44;2016.001.069449-7
39;2016.001.278424-6;"Homologo, por sentença, para que surta seus efeitos legais, o projeto de sentença elaborado pelo juiz leigo, na forma do artigo 40 da Lei nº 9.099/95. 

Em caso de depósito judicial referente à condenação, expeça-se mandado de pagamento, independentemente de nova conclusão. 

Caso haja valor remanescente a ser recebido, manifeste-se o credor em 7 dias, sob pena de arquivamento dos autos. Após o trânsito em julgado, tratando-se de sentença de improcedência ou de extinção do feito sem resolução do mérito, dê-se baixa e arquivem-se imediatamente. 

Tratando-se de sentença de procedência, após o trânsito em julgado e o decurso do prazo de 15 dias para pagamento espontâneo do valor da condenação previsto no art. 523 do NCPC c/c o entendimento consolidado no enunciado nº 13.9.1 do Aviso nº 23/2008 do TJERJ, aguarde-se por mais 7 dias a manifestação das partes e, em seguida, caso permaneçam em silêncio, proceda-se a baixa e ao arquivamento. 

FICAM AS PARTES CIENTES DE QUE A NOVA SISTEMÁTICA DE CONTAGEM DE PRAZO ESTABELECIDO NO ART. 219 DO NCPC/2015 NÃO SE APLICA AOS JUIZADOS ESPECIAIS CÍVEIS, CONSOANTE NOTA TÉCNICA 01/2016 DO FONAJE DE 04/03/2016 C/C A PRIMEIRA PARTE DO ENUNCIADO 86 TAMBÉM DO FONAJE, COMPUTANDO-SE OS PRAZOS EM DIAS CORRIDOS, ASSIM PROCEDENDO COM A FINALIDADE PRECÍPUA DE SE ALCANÇAR A BOA GESTÃO CARTORÁRIA COM FUNDAMENTO NO PRINCÍPIO DA CELERIDADE QUE REGE A LEI 9.099/95.";0004BB4875978179FA9053D0DB865938E577C50507562F44;2016.001.069449-7
40;2016.001.278424-6;"928    PROJETO DE SENTENÇA\n\nAinda que dispensado o ...
Name: ANDPROCCLOB__TXT_DESCR, dtype: object";0004BB4875978179FA9053D0DB865938E577C50507562F44;2016.001.069449-7
41;2016.001.278424-6;"
	Dispensado o relatório, consoante o artigo 38 da Lei nº. 9.099/95, passo a decidir.

	Alega a parte autora que teve seu nome inserido nos cadastros restritivos de crédito em razão de dívida que desconhece, já que não contratou o réu. Requer cancelamento do débito e da negativação e indenização a título de danos morais.

	Em sua contestação, alega o réu que a parte autora contratou o serviço e que foram prestadas todas as informações necessárias.

	Com efeito, a parte autora se identifica como consumidor por equiparação, já que vítima no evento. Deve-se dar prevalência dos direitos básicos previstos no art. 6°, II, III, IV e VIII do CDC.

	De acordo com o artigo 14 do CDC, o fornecedor de serviços responde, de forma objetiva, pela reparação dos danos causados ao consumidor por defeitos na prestação dos serviços, bem como por informações insuficientes e inadequadas sobre sua fruição e riscos. 

	Pela análise dos autos, verifica-se que o réu não comprovou a existência da contratação entre as partes, já que não trouxe contrato. 

	Assim, no caso em tela, mostra-se evidente todo o transtorno sofrido pela autora, uma vez que foi cobrado por dívida de que não deu causa.

Com efeito, por mais organizados que sejam as empresas, é possível ocorrerem falhas no sistema, como fraudes. No entanto, tais falhas não podem onerar o consumidor, que não contribuiu para a sua ocorrência. 

Assim, fixo a indenização no montante de R$ 8.000,00, diante da existência negativação.

	Posto isso, julgo procedente em parte o pedido para 1) determinar a expedição de ofício ao SPC/SERASA para que exclua o nome da parte autora de seus cadastros, em decorrência do aponte perpetrado pela parte ré, no prazo de 05 dias; para 2) condenar o réu a cancelar o débito em nome da parte autora, sob pena de multa de R$ 200,00 por cada cobrança indevida; e para 3) condenar o réu a indenizar a parte autora pelos danos morais experimentados, no valor de R$ 8.000,00 (oito mil e reais), com juros de 1% ao mês, a partir da citação, e correção a partir da leitura de sentença. Sem ônus sucumbenciais, consoante o artigo 55 da Lei 9.099/95.

	Anote-se o nome dos advogados da ré para fins de publicação, conforme requerimento formulado em contestação.

Projeto de sentença que se submete à homologação.

Rio de Janeiro, 29 de junho de 2016.";0004544382874FAE0247AA66E7FABC39CEA1C50518512A08;2016.204.014059-5
42;2016.001.278424-6;Dispensado o relatório na forma do art. 38 da Lei 9099/95. HOMOLOGO o projeto de sentença proferido pelo Juiz Leigo, para que produza seus jurídicos e legais efeitos, na forma do art. 40 da Lei 9.099/95.  FICAM AS PARTES CIENTES DE QUE, NOS TERMOS DO AVISO 02/2016 DA COJES (D.O. 31/03/2016) OS PRAZOS PROCESSUAIS EM SEDE DE JEC CONTINUARÃO A SER CONTADOS EM DIAS CORRIDOS, INAPLICÁVEL O ARTIGO 219 DO NCPC.Fica a parte ré ciente de que caso não pague a quantia certa a que foi condenada em 15 dias, contados do trânsito em julgado da sentença, o valor da condenação será acrescido de multa de 10%, por aplicação do artigo 523,§1º do CPC, sendo certo, ainda, que a comprovação do depósito deverá vir aos autos no prazo de 5 dias, após a efetivação. Comprovado o depósito nos autos, e a quitação por parte do credor, expeça-se mandado de pagamento. Após, dê-se baixa e arquive-se. Caso negativo, após o decurso do prazo de trinta dias do trânsito em julgado, dê-se baixa e arquive-se.;0004544382874FAE0247AA66E7FABC39CEA1C50518512A08;2016.204.014059-5
43;2016.001.278424-6;"HOMOLOGO, por sentença, o acordo celebrado entre as partes, para que produza seus jurídicos e legais efeitos. Assim sendo, JULGO EXTINTO O PROCESSO, com resolução de mérito, com fundamento no artigo 487, inciso III, alínea b, do CPC. Retiro de pauta a audiência anteriormente designada. 

Sem custas. 

REGISTRE-SE. 

Após, dê-se baixa e arquive-se.";0004775309B6C14C385194128D5DDE910985C50502175146;2016.001.048841-1
44;2016.001.278424-6;"PODER JUDICIÁRIO DO ESTADO DO RIO DE JANEIRO
XVII JUIZADO ESPECIAL CÍVEL
PROCESSO: 5751-74.2016.8.19.0204
AUTOR:  RAQUEL FREITAS MARTINS RODRIGUES
AUTOR: JOANILTON ANDRE MARTINS
RÉU: CLARO
PROJETO DE SENTENÇA
Dispensado o relatório nos termos do art. 38 da Lei 9099/95, passo a decidir. 
Reclamam  os autores que contrataram linha fixa da ré em 25/09/2015; que o contrato foi pactuado em nome da 1ª autora que é filha do 2º autor e a linha era para ser utilizado na loja do 2º autor; que a linha so funcionou por cinco dias, estando bloqueado. Requer obrigação de fazer para restabelecimento da linha e indenização por danos morais. 
Em Contestação a ré alega que não há falha na prestação do serviço. Inexistência de danos morais. 
A ré não comprova prestação do serviço contrato aos autores no período indicado, qual seja desde  setembro/2015, o que poderia ser feito, juntado o histórico de chamadas, o que não ocorreu, corroborando com a alegação autoral de que esta sem o serviço. Deve ser compelida a re ao imediato restabelecimento.  
A situação sob exame caracteriza dano moral  pela falha na prestação do serviço, que privou os autores e sua família do serviço essencial de telefonia, por cerca de 08 meses.   Desta forma arbitro o quantum indenizatório em R$ 4.000,00 (quatro mil reais),  de forma a compensar os autores bem  como a  indicar a ré que no futuro devem agir com respeito e transparência ao consumidor. 
Ante o exposto, JULGO PROCEDENTE EM PARTE os pedidos na forma do art. 487 NCPC, para: 1-Determinar que a ré restabeleça a linha de nº 3243-9188, no prazo de  05 dias,  sob pena de multa diária no valor de R$ 50,00, limitada a R$ 3.000,00 (três mil reais) a ser convertida em perdas e danos em caso de descumprimento.  2- Condenar a ré a indenizar os autores por danos morais, na quantia de R$ 4.000,00(quatro mil reais), na proporção de R$ 2.000,00 (dois mil reais) para cada autor, corrigidos desde a presente data  e juros de 1% ao mês  a contar da citação.  Sem custas e honorários. Submeto o presente projeto de sentença à apreciação do Juiz Togado, para homologação.
Rio de Janeiro, 29 de  Abril de 2016.
ANA QUÉZIA PEREIRA DE FREITAS
 JUIZA LEIGA";0004EE8FEA2CD0F72C6EA14D935142999022C504625F294F;2016.204.005736-9
45;2016.001.278424-6;Dispensado o relatório na forma do art. 38 da Lei 9099/95. HOMOLOGO o projeto de sentença proferido pelo Juiz Leigo, para que produza seus jurídicos e legais efeitos, na forma do art. 40 da Lei 9.099/95.  FICAM AS PARTES CIENTES DE QUE, NOS TERMOS DO AVISO 02/2016 DA COJES (D.O. 31/03/2016) OS PRAZOS PROCESSUAIS EM SEDE DE JEC CONTINUARÃO A SER CONTADOS EM DIAS CORRIDOS, INAPLICÁVEL O ARTIGO 219 DO NCPC.Fica a parte ré ciente de que caso não pague a quantia certa a que foi condenada em 15 dias, contados do trânsito em julgado da sentença, o valor da condenação será acrescido de multa de 10%, por aplicação do artigo 523,§1º do CPC, sendo certo, ainda, que a comprovação do depósito deverá vir aos autos no prazo de 5 dias, após a efetivação. Comprovado o depósito nos autos, e a quitação por parte do credor, expeça-se mandado de pagamento. Após, dê-se baixa e arquive-se. Caso negativo, após o decurso do prazo de trinta dias do trânsito em julgado, dê-se baixa e arquive-se.;0004EE8FEA2CD0F72C6EA14D935142999022C504625F294F;2016.204.005736-9
46;2016.001.278424-6;"Homologo, por sentença, para que surta seus efeitos legais, o projeto de sentença elaborado pelo juiz leigo, na forma do artigo 40 da Lei nº 9.099/95.  

Em caso de depósito judicial referente à condenação, expeça-se mandado de pagamento, independente de nova conclusão, cumprindo à parte ré, quando do pagamento, apresentar planilha discriminada do valor da condenação.  

Caso haja valor remanescente a ser recebido, manifeste-se o credor em 7 dias, sob pena de arquivamento dos autos. Após o trânsito em julgado, tratando-se de sentença de improcedência ou de extinção do feito sem resolução do mérito, dê-se baixa e arquivem-se imediatamente.  

Tratando-se de sentença de procedência, após o trânsito em julgado e o decurso do prazo de 15 dias para pagamento espontâneo do valor da condenação previsto no art. 523 do NCPC c/c o entendimento consolidado no enunciado nº 13.9.1 do Aviso nº 23/2008 do TJERJ, aguarde-se por mais 7 dias a manifestação das partes e, em seguida, caso permaneçam em silêncio, proceda-se a baixa e ao arquivamento.  

FICAM AS PARTES CIENTES DE QUE A NOVA SISTEMÁTICA DE CONTAGEM DE PRAZO ESTABELECIDO NO ART. 219 DO NCPC/2015 NÃO SE APLICA AOS JUIZADOS ESPECIAIS CÍVEIS, CONSOANTE NOTA TÉCNICA 01/2016 DO FONAJE DE 04/03/2016, COMPUTANDO-SE OS PRAZOS EM DIAS CORRIDOS, ASSIM PROCEDENDO COM A FINALIDADE PRECÍPUA DE SE ALCANÇAR A BOA GESTÃO CARTORÁRIA COM FUNDAMENTO NO PRINCÍPIO DA CELERIDADE QUE REGE A LEI 9.099/95.   

Cumpridas as formalidades legais, dê-se baixa e arquivem-se os autos.";0004A5B4C725E5EE8D45D8D383822714ADE6C5052A23261F;2016.001.130613-4
47;2016.001.278424-6;"Cuida-se de ação sob o rito sumaríssimo por meio da qual busca a parte demandante a condenação da ré (i) a restabelecer seu serviço de telefonia fixa; (ii) a devolver em dobro aquilo que lhe foi indevidamente cobrado e pago e (iii) a indenizar o consumidor por alegados danos morais.
Como causa de pedir, alega a demandante, em resumo, que sua linha telefônica (21) 2718-7737 parou de funcionar no final de março, apesar da regular quitação das faturas relativas ao serviço. Aduz que buscou a solução administrativa do problema, sem, contudo, ser atendida. 
Em contestação, a ré afirma que as alegações da autora são inverídicas, na medida em que a linha encontra-se ativa. Por fim, sustenta a impossibilidade de restituição das quantias cobradas e a falta de dano moral reconhecível no feito.
Embora dispensado pela norma do artigo 38 da Lei 9.099/95, é o breve relatório, DECIDO.
Convém frisar que a relação estabelecida entre as partes é de consumo, porquanto presentes os requisitos subjetivos (arts. 2º, caput, e 3º, caput, da Lei nº 8.078/90) e objetivo (art. 3º, § 2º, da Lei n.º 8.078/90) que a caracterizam. Aplicável, portanto, o regime jurídico especial da Lei n.º 8.078/90, que assegura ao consumidor como, medida protetiva, a inversão do ônus da prova (artigo 6º, VIII, do CDC). Contudo, a inversão ora deferida não libera o consumidor de produzir prova mínima do seu dirieto, notademanete quando lhe é possível produzir. 
A autora narra que não só as faturas estavam pagas quando o serviço foi injustamente interrompido, como também permaneceu sendo cobrada mesmo sem o serviço e que até o momento a empresa ré não reestabeleceu o serviço. 
Contudo, todos os documentos acostados para comprovar os pagamentos e as cobranças indevidas se referem a outro número de telefone, qual seja (21) 22498697. 
A autora não juntou sequer prova de titularidade da linha reclamada. Além de não determinar exatamente quando a linha parou de funcionar não comprova qualquer cobrança pelo serviço não prestado, bem como não comprova que as cobranças anteriores ao período reclamado foram quitadas. Os documentos constantes dos autos dizem respeito apenas às faturas até abril - fls. 24 e ss, e de outro número, sendo que a autora narra que informou a ré do problema em 29/03, razão pela qual o serviço prestado durante o mês de março seria devidamente cobrado e pago em abril. 
Longe de se presumir, aqui, a má-fé da autora, é necessário observar que a instrução da causa não aponta, de forma conclusiva, para uma falha na prestação do serviço capaz, eventualmente, de produzir na autora os danos descritos na inicial, e, assim, reconhecer o dever da ré de indenizá-la.
		Assim, diante da deficiência instrutória, não há como se concluir pela existência de nexo entre os danos descritos no feito e uma conduta da ré, razão pela qual, a despeito da inversão do ônus da prova, reconheço a improcedência dos pedidos formulados.
Pelo exposto, JULGO IMPROCEDENTES OS PEDIDOS veiculados na inicial.
		Sem custas e honorários, por força do disposto no artigo 55 da Lei Especial.

Rio de Janeiro, 19 de setembro de 2016


JULIANA CORREIA GOMES
JUÍZA LEIGA


 		Submeto o projeto de sentença à homologação do Dr. Juiz de Direito, na forma do art. 40 da Lei 9.099/95.";0004A5B4C725E5EE8D45D8D383822714ADE6C5052A23261F;2016.001.130613-4
48;2016.001.278424-6;"10491    Conforme já indicado no despacho de fl. 109, a...
Name: ANDPROCCLOB__TXT_DESCR, dtype: object";0004A5B4C725E5EE8D45D8D383822714ADE6C5052A23261F;2016.001.130613-4
49;2016.001.278424-6;"946    VI - JUIZADO ESPECIAL CÍVEL DA GÁVEA\nProc. Nº...
Name: ANDPROCCLOB__TXT_DESCR, dtype: object";0004691DB6E44F4F42F27921413589F68747C5050734335E;2016.001.062870-1
50;2016.001.278424-6;"HOMOLOGO, por sentença, para que produza seus efeitos legais, o ACORDO ajustado pelas partes e, em consequência, JULGO EXTINTO O PROCESSO com resolução do mérito, nos termos do art. 487, inciso III, alínea b, do Código de Processo Civil. Sem Custas. Registre-se. Dê-se baixa e arquivem-se os autos.
Defiro desde já, se for o caso, independente de nova conclusão e havendo quitação da parte Autora, a expedição de mandado de pagamento. 
Cientes as partes de que, decorridos 90 dias da data do arquivamento definitivo, os autos processuais (físicos) serão eliminados, nos termos do artigo 1°, do Ato Normativo Conjunto n° 01/2005. PRI.";0004C2FFD467AE04E4D6FE5F862743553577C50513240E3B;2016.208.000300-1
51;2016.001.278424-6;"Dispensado o relatório, nos termos do artigo 38, da Lei 9099/95, PASSO A DECIDIR.
A autora comprovou que sempre era cobrada pelo serviço ""OI VELOX"" (fls. 8 e 9) sem que tenha contratado/instalado.
Já o réu não trouxe aos autos qualquer fato impeditivo ou modificativo do direito da autora. Ora, cabia ao réu a apresentação do suposto contrato firmado com a autora ou a gravação da ligação telefônica na qual o serviço teria sido contratado, assim como a comprovação de que o serviço foi instalado e era utilizado pela autora. Assim, como o réu não produziu as provas que cabiam a ele, deve ser presumida como verdadeira a alegação da autora de que não contratou o referido serviço.
Portanto, diante da cobrança de serviço não contratado, restou configurada a falha na prestação do serviço, sendo devida indenização por danos morais in re ipsa, ou seja pela mera ocorrência do fato danoso, já que foi frustrada a legítima expectativa do autor em ter um serviço prestado de forma eficiente, segura e adequada pelo réu. Notadamente pelo fato da autora, inclusive, ter sofrido interrupção do serviço de telefonia em decorrência da cobrança indevida pelo serviço não contratado (fls. 8 e 13).
A fixação do quantum indenizatório deve ser pautada pelo bom senso e sopesar os fatos praticados pela parte ré contra a parte autora, cabendo, ainda, a observância dos princípios da razoabilidade, proporcionalidade e vedação ao enriquecimento sem causa. À luz de tais critérios, entendo que a quantia de R$ 3.000,00 é necessária e suficiente para compensar o abalo moral sofrido.
Isto posto, JULGO PROCEDENTE o pedido para CONDENAR o réu a pagar ao autor a quantia de R$ 3.000,00 (Três mil reais), monetariamente corrigida a contar da presente e acrescida de juros legais de 1% a/m (um por cento ao mês) a contar da citação. 

Sem custas e sem honorários, nos termos do artigo 55, da Lei 9099/95.";000498282B8A95B362DAF4A94C04752C573FC5051D4A5B44;2016.001.121664-9
52;2016.001.278424-6;"Homologo, por sentença, para que surta seus efeitos legais, o projeto de sentença elaborado pelo juiz leigo, na forma do artigo 40 da Lei nº 9.099/95.  

Em caso de depósito judicial referente à condenação, expeça-se mandado de pagamento, independente de nova conclusão, cumprindo à parte ré, quando do pagamento, apresentar planilha discriminada do valor da condenação.  

Caso haja valor remanescente a ser recebido, manifeste-se o credor em 7 dias, sob pena de arquivamento dos autos. Após o trânsito em julgado, tratando-se de sentença de improcedência ou de extinção do feito sem resolução do mérito, dê-se baixa e arquivem-se imediatamente.  

Tratando-se de sentença de procedência, após o trânsito em julgado e o decurso do prazo de 15 dias para pagamento espontâneo do valor da condenação previsto no art. 523 do NCPC c/c o entendimento consolidado no enunciado nº 13.9.1 do Aviso nº 23/2008 do TJERJ, aguarde-se por mais 7 dias a manifestação das partes e, em seguida, caso permaneçam em silêncio, proceda-se a baixa e ao arquivamento.  

FICAM AS PARTES CIENTES DE QUE A NOVA SISTEMÁTICA DE CONTAGEM DE PRAZO ESTABELECIDO NO ART. 219 DO NCPC/2015 NÃO SE APLICA AOS JUIZADOS ESPECIAIS CÍVEIS, CONSOANTE NOTA TÉCNICA 01/2016 DO FONAJE DE 04/03/2016, COMPUTANDO-SE OS PRAZOS EM DIAS CORRIDOS, ASSIM PROCEDENDO COM A FINALIDADE PRECÍPUA DE SE ALCANÇAR A BOA GESTÃO CARTORÁRIA COM FUNDAMENTO NO PRINCÍPIO DA CELERIDADE QUE REGE A LEI 9.099/95.   

Cumpridas as formalidades legais, dê-se baixa e arquivem-se os autos.";000498282B8A95B362DAF4A94C04752C573FC5051D4A5B44;2016.001.121664-9
53;2016.001.278424-6;"6376    PROJETO DE SENTENÇA\n\nAinda que dispensado o ...
Name: ANDPROCCLOB__TXT_DESCR, dtype: object";0004B1EBB081C4994F0A3463C2A801938E82C505290B0C3A;2016.001.178298-9
