;processo;sentenca;similar_file;similar_processo
121;2016.208.034782-6;"Processo nº: 0000599-33.2016.8.19.0208
Parte Autora: Rosangela Bonavita de Azevedo Rodrigues
Parte Ré: NET Rio



Projeto de Sentença


Dispensado o relatório nos termos do art. 38 da Lei n° 9.099/95, passo a decidir.

No caso dos autos, verifico que há necessidade de prova pericial técnica, a fim de ser constatado eventual vício do serviço, conforme alega a parte Autora, sendo tal prova incabível em sede de Juizados, não podendo a Ré ser compelida a se abster de tal produção de prova diante do rito processual escolhido pela parte Autora. 

Ressalto que, a parte Autora não apresentou as faturas de cobrança que alega ter contestado junto a Ré, tampouco comprova o pagamento anterior a solicitação de suspensão do serviço. Destaco, ainda, que a parte Ré afirma que a fatura com vencimento em novembro de 2015, refere-se ao serviço prestado em outubro de 2015. 

Ademais, a parte Autora requer o envio de boleto de saldo devedor, referente a parcelamento realizado em agosto de 2015, sem juntar qualquer prova, tampouco informar o valor que entende devido. 

Neste diapasão, não há como ser prolatada uma sentença de mérito - calcada, como deve ser, em um juízo de certeza - com base nos elementos constantes dos autos.

Portanto, impõe-se o acolhimento da questão preliminar de incompetência deste Juízo para o julgamento da presente demanda, uma vez que, de fato, a produção da prova pericial revela-se imprescindível à formação do juízo de certeza necessário à prolação de uma sentença de mérito.

A conta do acima exposto, JULGO EXTINTO O PROCESSO, SEM RESOLUÇÃO DO MÉRITO, nos termos do artigo 51, inciso II, da Lei nº 9.099/95. 

Sem custas e honorários vez que em sede de Juizado Especial Cível, conforme disposto no artigo 55 da lei 9.099/95.


	Certificado o trânsito em julgado e não havendo novas manifestações no prazo de 15 (quinze) dias, dê-se baixa e arquivem-se. Cientes as partes de que decorridos 90 dias da data do arquivamento definitivo os autos processuais serão eliminados, nos termos do artigo 1º do Ato Normativo Conjunto 01/2005, publicado no DORJ de 07/01/05.


Projeto de sentença sujeito à homologação, assim, remeto os autos ao MM. Juiz Togado, nos termos do artigo 40 da Lei nº 9.099/95.


Rio de Janeiro, 26 de Agosto 2016.


VANESSA DE SOUZA BRISIS
Juíza Leiga";00044A22FBFBD6FDB02D5031E8C147CB38A4C50514540234;2016.208.000593-9
122;2016.208.034782-6;Homologo por sentença na forma do artigo 40 da Lei nº 9.099/95 o Projeto de Sentença elaborado pelo Juiz Leigo. PRI. Certifique-se o trânsito em julgado. Defiro desde já, se for o caso, independente de nova conclusão e havendo quitação da parte Autora, a expedição de mandado de pagamento. Após, dê-se baixa e arquivem-se.;00044A22FBFBD6FDB02D5031E8C147CB38A4C50514540234;2016.208.000593-9
123;2016.208.034782-6;"11666    ESTADO DO RIO DE JANEIRO\nPODER JUDICIÁRIO\nVI...
Name: ANDPROCCLOB__TXT_DESCR, dtype: object";0004871C4527EFF1D3E4F634985C5B6C87D9C50534342716;2016.021.027084-0
124;2016.208.034782-6;Vistos etc. HOMOLOGO o PROJETO DE SENTENÇA proferido pelo DD. Juiz Leigo que me foi submetido, para que a mesma produza os seus jurídicos e legais efeitos, nos termos do artigo 4º, inciso III, da Resolução nº 08/2005, do Órgão Especial do TJ/RJ.  Sem custas judiciais, na forma da Lei nº 9.099/95. P.R.I. Certificado o trânsito em julgado, aguarde-se pronunciamento por 30 dias. Na inércia, dê-se baixa e arquive-se.;0004871C4527EFF1D3E4F634985C5B6C87D9C50534342716;2016.021.027084-0
125;2016.208.034782-6;"1347    Processo nº: 0002380-90.2016.2015.8.19.0208\nP...
Name: ANDPROCCLOB__TXT_DESCR, dtype: object";000407940B27D33E349A699D59A2B6C453A1C50502555405;2016.208.002350-4
126;2016.208.034782-6;"
Homologo por sentença na forma do artigo 40 da Lei nº 9.099/95 o Projeto de Sentença elaborado pelo Juiz Leigo. PRI. Após, certificado o trânsito em julgado, dê-se baixa e arquive-se.";000407940B27D33E349A699D59A2B6C453A1C50502555405;2016.208.002350-4
127;2016.208.034782-6;"3207    \nESTADO DO RIO DE JANEIRO\nPODER JUDICIÁRIO\n...
Name: ANDPROCCLOB__TXT_DESCR, dtype: object";000487F7B03E0D01FE906BC79192FB53937EC50514504D3A;2016.001.121631-5
128;2016.208.034782-6;"Homologo, por sentença, para que surta seus efeitos legais, o projeto de sentença elaborado pelo juiz leigo, na forma do artigo 40 da Lei nº 9.099/95. 

Em caso de depósito judicial referente à condenação, expeça-se mandado de pagamento, independentemente de nova conclusão. 

Caso haja valor remanescente a ser recebido, manifeste-se o credor em 7 dias, sob pena de arquivamento dos autos. Após o trânsito em julgado, tratando-se de sentença de improcedência ou de extinção do feito sem resolução do mérito, dê-se baixa e arquivem-se imediatamente. 

Tratando-se de sentença de procedência, após o trânsito em julgado e o decurso do prazo de 15 dias para pagamento espontâneo do valor da condenação previsto no art. 523 do NCPC c/c o entendimento consolidado no enunciado nº 13.9.1 do Aviso nº 23/2008 do TJERJ, aguarde-se por mais 7 dias a manifestação das partes e, em seguida, caso permaneçam em silêncio, proceda-se a baixa e ao arquivamento. 

FICAM AS PARTES CIENTES DE QUE A NOVA SISTEMÁTICA DE CONTAGEM DE PRAZO ESTABELECIDO NO ART. 219 DO NCPC/2015 NÃO SE APLICA AOS JUIZADOS ESPECIAIS CÍVEIS, CONSOANTE NOTA TÉCNICA 01/2016 DO FONAJE DE 04/03/2016 C/C A PRIMEIRA PARTE DO ENUNCIADO 86 TAMBÉM DO FONAJE, COMPUTANDO-SE OS PRAZOS EM DIAS CORRIDOS, ASSIM PROCEDENDO COM A FINALIDADE PRECÍPUA DE SE ALCANÇAR A BOA GESTÃO CARTORÁRIA COM FUNDAMENTO NO PRINCÍPIO DA CELERIDADE QUE REGE A LEI 9.099/95.";000487F7B03E0D01FE906BC79192FB53937EC50514504D3A;2016.001.121631-5
129;2016.208.034782-6;"HOMOLOGO, por sentença, para que produza seus efeitos legais, o ACORDO ajustado pelas partes e, em consequência, JULGO EXTINTO O PROCESSO com resolução do mérito, nos termos do art. 487, inciso III, alínea b, do Código de Processo Civil. Sem Custas. Registre-se. Dê-se baixa e arquivem-se os autos.
Defiro desde já, se for o caso, independente de nova conclusão e havendo quitação da parte Autora, a expedição de mandado de pagamento. 
Cientes as partes de que, decorridos 90 dias da data do arquivamento definitivo, os autos processuais (físicos) serão eliminados, nos termos do artigo 1°, do Ato Normativo Conjunto n° 01/2005. PRI.";0004A35CAA270FEDACB2CB57FE08FF573E58C50508612717;2016.208.006259-5
130;2016.208.034782-6;"Homologo o acordo celebrado entre as partes para que surta seus jurídicos e legais efeitos, e julgo o feito extinto, com resolução do mérito, nos termos do art. 487, inc. III, b, do novo Código de Processo Civil ( Lei nº 13.105/ 2015). 
Se for o caso, comprovado o depósito, expeça-se mandado de pagamento em favor da parte autora, independentemente de nova conclusão.  
Decorrido o prazo do cumprimento o acordo, aguarde-se por cinco dias a manifestação das partes; não havendo manifestação,  dê-se baixa e arquive-se. 
FICAM AS PARTES CIENTES DE QUE A NOVA SISTEMÁTICA DE CONTAGEM DE PRAZO ESTABELECIDO NO ART. 219 DO NCPC/2015 NÃO SE APLICA AOS JUIZADOS ESPECIAIS CÍVEIS, CONSOANTE NOTA TÉCNICA 01/2016 DO FONAJE DE 04/03/2016 C/C A PRIMEIRA PARTE DO ENUNCIADO 86 TAMBÉM DO FONAJE, COMPUTANDO-SE OS PRAZOS EM DIAS CORRIDOS, ASSIM PROCEDENDO COM A FINALIDADE PRECÍPUA DE SE ALCANÇAR A BOA GESTÃO CARTORÁRIA COM FUNDAMENTO NO PRINCÍPIO DA CELERIDADE QUE REGE A LEI 9.099/95.";000426FA3D367B17A6AEEA093BF28541B699C505063B0A61;2016.001.066506-0
131;2016.208.034782-6;"4067    PODER JUDICIÁRIO DO ESTADO DO RIO DE JANEIRO\n...
Name: ANDPROCCLOB__TXT_DESCR, dtype: object";00043B146149B998D153A920D6EFBC7389C6C5051D306427;2016.021.027885-0
132;2016.208.034782-6;Vistos etc. HOMOLOGO o PROJETO DE SENTENÇA proferido pelo DD. Juiz Leigo que me foi submetido, para que a mesma produza os seus jurídicos e legais efeitos, nos termos do artigo 4º, inciso III, da Resolução nº 08/2005, do Órgão Especial do TJ/RJ.  Sem custas judiciais, na forma da Lei nº 9.099/95. P.R.I. Certificado o trânsito em julgado, aguarde-se pronunciamento por 30 dias. Na inércia, dê-se baixa e arquive-se.;00043B146149B998D153A920D6EFBC7389C6C5051D306427;2016.021.027885-0
133;2016.208.034782-6;"5208    Processo nº: 0003480-80.2016.8.19.0208\nParte ...
Name: ANDPROCCLOB__TXT_DESCR, dtype: object";0004BFFC0419FA08DD7411C8FAB6052E0D4AC50520232441;2016.208.003446-0
134;2016.208.034782-6;Homologo por sentença na forma do artigo 40 da Lei nº 9.099/95 o Projeto de Sentença elaborado pelo Juiz Leigo. PRI. Certifique-se o trânsito em julgado. Defiro desde já, se for o caso, independente de nova conclusão e havendo quitação da parte Autora, a expedição de mandado de pagamento. Após, dê-se baixa e arquivem-se.;0004BFFC0419FA08DD7411C8FAB6052E0D4AC50520232441;2016.208.003446-0
135;2016.208.034782-6;"Projeto de Sentença

Dispensado relatório nos termos do art.38 da Lei nº 9099/95, passo a decidir.
Trata-se de demanda em que o autor narra estar recebendo diversas ligações da empresa ré, com a qual não possui qualquer relação jurídica. Alega que as ligações efetuadas, vem lhe causando transtornos. Requer a retirada do seu nome dos cadastros de cobrança da ré, bem como indenização a título de danos morais.
É o breve relatório, decido. 
Inicialmente, rechaço a preliminar suscitada pela ré, eis que não se trata de pedido de exibição de documentos que, por certo, ensejaria a sua extinção, em razão da inadmissibilidade do procedimento em sede de juizados especiais.
Ultrapassada a preliminar, passo a decidir o mérito.
A relação jurídica entre as partes é de consumo, já que estão presentes os requisitos subjetivos (consumidor e fornecedor ¿ artigos 2º e 3º da Lei 9078/90) e objetivos (produtos e serviço - §§1º e 2º do artigo 3º da citada lei) de tal relação.
Nesta esteira, incumbe a parte Ré o ônus de provar o fato modificativo ou extintivo do direito da parte autora, na forma do art.373, II, do Novo Código de Processo Civil e do art.14 §3º do Código do Consumidor.
Com efeito, a parte autora traz aos autos diversas ligações efetuadas pela empresa ré (fls.15/27). 
Contudo tal fato não ultrapassa a seara do mero aborrecimento, não havendo que se falar em indenização a título de danos morais.
Para o sucesso do pedido indenizatório, além da comprovação de prática de ato ilícito por parte da ré, deveriam os fatos narrados demonstrar que a sua conduta maculou a esfera psíquica da parte autora, causando-lhe sofrimento, dor, angústia e humilhação, extrapolando os limites do mero dissabor, inexistindo nos autos os referidos elementos passíveis de ensejar o dever de indenizar. 
A conta do acima exposto, JULGO IMPROCEDENTES OS PEDIDOS formulados.
Sem custas e honorários conforme disposto no artigo 55 da lei 9.099/95.
Ficam cientes as partes que o recurso deverá ser interposto no prazo de 10 (dez) dias, contados da ciência da sentença, por petição escrita, da qual constarão as razões e o pedido do recorrente, conforme artigo 42 da Lei 9.099/95.
Certificado o trânsito em julgado e não havendo novas manifestações no prazo de 15 (quinze) dias, dê-se baixa e arquivem-se. Cientes as partes de que decorridos 90 dias da data do arquivamento definitivo os autos processuais serão eliminados, nos termos do art.1º do Ato Normativo Conjunto 01/2005, publicado no DORJ de 07/01/05.
Projeto de sentença sujeito à homologação, assim, remeto os autos a MM. Juíza Togada, nos termos do art.40 da Lei nº 9.099/95.

Rio de Janeiro, 17 de setembro de 2016.

DIOGO DE PAULA TERRERI
Juiz Leigo";0004C788DA891A30F352728167F47C6A2DC0C5053518303C;2016.001.214935-8
136;2016.208.034782-6;"Homologo, por sentença, para que surta seus efeitos legais, o projeto de sentença elaborado pelo juiz leigo, na forma do artigo 40 da Lei nº 9.099/95. 

Em caso de depósito judicial referente à condenação, expeça-se mandado de pagamento, independentemente de nova conclusão. 

Caso haja valor remanescente a ser recebido, manifeste-se o credor em 7 dias, sob pena de arquivamento dos autos. Após o trânsito em julgado, tratando-se de sentença de improcedência ou de extinção do feito sem resolução do mérito, dê-se baixa e arquivem-se imediatamente. 

Tratando-se de sentença de procedência, após o trânsito em julgado e o decurso do prazo de 15 dias para pagamento espontâneo do valor da condenação previsto no art. 523 do NCPC c/c o entendimento consolidado no enunciado nº 13.9.1 do Aviso nº 23/2008 do TJERJ, aguarde-se por mais 7 dias a manifestação das partes e, em seguida, caso permaneçam em silêncio, proceda-se a baixa e ao arquivamento. 

FICAM AS PARTES CIENTES DE QUE A NOVA SISTEMÁTICA DE CONTAGEM DE PRAZO ESTABELECIDO NO ART. 219 DO NCPC/2015 NÃO SE APLICA AOS JUIZADOS ESPECIAIS CÍVEIS, CONSOANTE NOTA TÉCNICA 01/2016 DO FONAJE DE 04/03/2016 C/C A PRIMEIRA PARTE DO ENUNCIADO 86 TAMBÉM DO FONAJE, COMPUTANDO-SE OS PRAZOS EM DIAS CORRIDOS, ASSIM PROCEDENDO COM A FINALIDADE PRECÍPUA DE SE ALCANÇAR A BOA GESTÃO CARTORÁRIA COM FUNDAMENTO NO PRINCÍPIO DA CELERIDADE QUE REGE A LEI 9.099/95.";0004C788DA891A30F352728167F47C6A2DC0C5053518303C;2016.001.214935-8
137;2016.208.034782-6;Homologo para que produza os seus jurídicos e legais efeitos o acordo a que chegaram as partes e, em consequência, JULGO EXTINTO O PROCESSO COM RESOLUÇÃO DO MÉRITO, na forma do artigo 487, inciso III, bdo CPC.  Defiro, desde já expedição  de guia e de  mandado de pagamento, se for o caso, independente de nova conclusão.  Com o cumprimento ou decorrido o prazo sem manifestação da parte autora,  certifique-se o  trânsito em julgado, dê-se baixa e arquivem-se, ficando cientes as partes de que, após 90 dias da data do arquivamento definitivo, os autos serão eliminados, na forma do Ato Normativo Conjunto 01/2005, publicado no D.O. de 07/01/2005. P.R.I. Defiro o desentranhamento de documentos mediante cópia.;000444CEB3DA134BF2BF3E9C70B90F71F217C5050C4A1239;2016.204.005523-3
138;2016.208.034782-6;"Homologo, por sentença, para que surta seus efeitos legais, o projeto de sentença elaborado pelo juiz leigo, na forma do artigo 40 da Lei nº 9.099/95. 

Em caso de depósito judicial referente à condenação, expeça-se mandado de pagamento, independentemente de nova conclusão. 

Caso haja valor remanescente a ser recebido, manifeste-se o credor em 7 dias, sob pena de arquivamento dos autos. Após o trânsito em julgado, tratando-se de sentença de improcedência ou de extinção do feito sem resolução do mérito, dê-se baixa e arquivem-se imediatamente. 

Tratando-se de sentença de procedência, após o trânsito em julgado e o decurso do prazo de 15 dias para pagamento espontâneo do valor da condenação previsto no art. 523 do NCPC c/c o entendimento consolidado no enunciado nº 13.9.1 do Aviso nº 23/2008 do TJERJ, aguarde-se por mais 7 dias a manifestação das partes e, em seguida, caso permaneçam em silêncio, proceda-se a baixa e ao arquivamento. 

FICAM AS PARTES CIENTES DE QUE A NOVA SISTEMÁTICA DE CONTAGEM DE PRAZO ESTABELECIDO NO ART. 219 DO NCPC/2015 NÃO SE APLICA AOS JUIZADOS ESPECIAIS CÍVEIS, CONSOANTE NOTA TÉCNICA 01/2016 DO FONAJE DE 04/03/2016 C/C A PRIMEIRA PARTE DO ENUNCIADO 86 TAMBÉM DO FONAJE, COMPUTANDO-SE OS PRAZOS EM DIAS CORRIDOS, ASSIM PROCEDENDO COM A FINALIDADE PRECÍPUA DE SE ALCANÇAR A BOA GESTÃO CARTORÁRIA COM FUNDAMENTO NO PRINCÍPIO DA CELERIDADE QUE REGE A LEI 9.099/95.";0004C5F44AA1C31AA8C788A5E8698896C6E0C5050D3C295B;2016.001.068558-7
139;2016.208.034782-6;"1792    Dispensado o relatório nos termos do art. 38 d...
Name: ANDPROCCLOB__TXT_DESCR, dtype: object";0004C5F44AA1C31AA8C788A5E8698896C6E0C5050D3C295B;2016.001.068558-7
140;2016.208.034782-6;"1386    TRIBUNAL DE JUSTIÇA DO ESTADO DO RIO DE JANEIR...
Name: ANDPROCCLOB__TXT_DESCR, dtype: object";00044BF172A62FC3B7DFEDEF187BCE76ED80C505183D1B16;2016.208.001541-6
141;2016.208.034782-6;Homologo por sentença na forma do artigo 40 da Lei nº 9.099/95 o Projeto de Sentença elaborado pelo Juiz Leigo. PRI. Após, certificado o trânsito em julgado, dê-se baixa e arquive-se.;00044BF172A62FC3B7DFEDEF187BCE76ED80C505183D1B16;2016.208.001541-6
142;2016.208.034782-6;Recebo os embargos de declaração (fls.227/229), mas deixo de acolhê-los por pretenderem efeitos claramente infringentes, não havendo qualquer omissão, contradição ou mesmo dúvida na sentença.;00044BF172A62FC3B7DFEDEF187BCE76ED80C505183D1B16;2016.208.001541-6
143;2016.208.034782-6;"Processo nº 0011897-22.2016.8.19.0208
Parte Autora: Hamilton Passos de Oliveira
Parte Ré: Net S.A

Projeto de Sentença

Trata-se de ação em que a parte autora pleiteia a condenação da ré a restituição de débitos, além de ressarcimento por danos morais, sob o fundamento de que a parte ré imputou em sua fatura valores indevidos, já quitados anteriormente.

A parte ré, em sua peça de bloqueio, argui preliminar de falta de inépcia da inicial, e no mérito impugna os pedidos autorais, asseverando que não houve qualquer falha na prestação dos serviços.

É o breve relatório, conforme possibilita o artigo 38 da Lei n. 9099/95. Decido.

Rejeito a preliminar suscitada, uma vez que a petição inicial atende ao artigo 319 do CPC e obedece aos critérios de informalidade e simplicidade orientados pelo artigo 2º da lei 9.099/95.

Ultrapassada a preliminar acima, adentro o mérito.

A relação jurídica entre as partes é de consumo, já que estão presentes os requisitos subjetivos (consumidor e fornecedor ¿ artigos 2o e 3o da Lei 8078/90) e objetivos (produto e serviço ¿ §§ 1o e 2o do artigo 3º da citada lei) de tal relação. 

A parte autora apresentou nos autos os documentos de fls. 10/45, com as faturas em que alega que houve cobrança indevida.

 Não obstante, improcede o pedido de indenização por danos materiais, uma vez que a parte autora não apresentou planilha especificando quais os valores impugnados, não atendendo ao enunciado 3.3 do TJRJ, que dispõe que ¿Nas ações que tenham por fundamento a impugnação de ligações telefônicas faturadas, a petição inicial deve ser instruída com planilha que relacione tais ligações e seus respectivos valores.¿

Ademais, os comprovantes de pagamento juntados às fls. 16/24 estão completamente ilegíveis, não sendo possível minimamente visualizar o teor dos mesmos.

Por fim, em que pese o aborrecimento decorrente do fato narrado, este não se revela capaz de atingir a incolumidade psicológica ou qualquer outro aspecto da personalidade do consumidor, uma vez que a questão ora proposta se trata de mera questão patrimonial, sendo o caso de aplicação da Súmula 75 deste Tribunal, cujo teor estabelece que ""o simples descumprimento de dever legal ou contratual, por caracterizar mero aborrecimento, em princípio, não configura dano moral, salvo se da infração advém circunstância que atenta contra a dignidade da parte"", ressalva esta não comprovada no caso em tela.

Diante do exposto, JULGO IMPROCEDENTES OS PEDIDOS FORMULADOS, extinguindo o processo com resolução do mérito, na forma do artigo 487, inciso I do CPC.

Sem custas e honorários vez que em sede de Juizado Especial Cível, conforme disposto no artigo 55 da lei nº 9.099/95.

Cientes as partes do disposto no artigo 52, IV, da Lei n° 9.099/95, quanto à necessidade de cumprimento voluntário da sentença, sob pena de penhora, dispensada nova citação. 

Ficam, ainda, as partes intimadas de que em se tratando de sentença condenatória ao pagamento de quantia certa, o prazo previsto no artigo 523, § 1º, do CPC, para incidência da multa ali prevista (10%), contar-se-á da data do trânsito em julgado. 

Certificado o trânsito em julgado e não havendo novas manifestações no prazo de 15 (quinze) dias, dê-se baixa e arquivem-se. Projeto de sentença sujeito à homologação, assim, remeto os autos ao MM. Juiz Togado, nos termos do artigo 40 da Lei nº 9.099/95.

Rio de Janeiro, 19 de setembro de 2016.

ANA CLAUDIA DOS REIS ALVES
Juíza leiga";0004C1EC7C81F294D284A353420DDB952922C50525603957;2016.208.011771-7
144;2016.208.034782-6;Homologo por sentença na forma do artigo 40 da Lei nº 9.099/95 o Projeto de Sentença elaborado pelo Juiz Leigo. PRI. Certifique-se o trânsito em julgado. Defiro desde já, se for o caso, independente de nova conclusão e havendo quitação da parte Autora, a expedição de mandado de pagamento. Após, dê-se baixa e arquivem-se.;0004C1EC7C81F294D284A353420DDB952922C50525603957;2016.208.011771-7
145;2016.208.034782-6;"Processo n. 0002722-80.2016.8.19.0021.
Dispensado o relatório, na forma do art. 38, caput, da Lei 9.099 de 1995.
O autor propôs ação em face de CLARO ¿ BCP S.A., alegando que firmou com o réu um contrato de prestação de serviços de telefonia que incluía um chip de telefonia móvel. No entanto, o chip não foi entregue. Assim, pediu a entrega do chip na sua residência e indenização por danos morais.
A ré apresentou contestação genérica e não impugnou especificamente os fatos narrados pelo autor, estando, portanto, revel.
A revelia gera a presunção de veracidade dos fatos narrados pelo autor. Assim, entendo que houve falha na prestação do serviço da ré que não entregou o chip de telefonia móvel conforme contratado, sendo devida a entrega do chip.
Quanto aos danos morais, considero que a conduta da ré não causou aborrecimentos ao autor acima do normal na vida em sociedade, não podendo prosperar o pedido de indenização.
Pelo exposto, JULGO PROCEDENTE EM PARTE OS PEDIDOS para condenar a CLARO ¿ BCP S.A. a entregar na residência do autor, cujo endereço consta da inicial, um chip de telefonia móvel sem ônus, no prazo de 30 dias.
Com o trânsito em julgado, dê-se baixa e arquive-se.
P.R.I.C.";00048A7DD2246C4F02F10B655D36801A99B7C50506155221;2016.021.002517-0
146;2016.208.034782-6;"PROJETO DE SENTENÇA

		Ainda que dispensado o relatório, na forma do artigo 38 da lei 9.009/95, faço um breve relatório, após o qual passo a  decidir.
Trata-se de ação de obrigação de fazer c/c compensação por danos morais proposta por ANA LUIZA ESTRELLITA LINS NOGUEIRA em face de NET RIO LTDA, em que alega ter a ré deixado de instalar o serviço de combo (televisão + internet + telefone) contratado.
A ré, em sua contestação, alega ter ocorrido o cancelamento por parte da autora.
		Presentes os pressupostos processuais e as condições ao regular exercício do direito de ação, passa-se ao mérito.
É inegável tratar-se de relação de consumo, na medida em que estão presentes as figuras do consumidor, do fornecedor e do serviço, na forma dos arts. 2º e 3º do CDC, estando presentes os elementos subjetivos e objetivo.
A parte autora alega a ocorrência de um fato do serviço, na medida em que haveria, por parte da ré, a ausência de prestação do serviço de sinal de telefonia fixa, internet e televisão contratado pela parte autora sem qualquer justificativa plausível para tal.
A responsabilidade civil pelo fato do serviço (art. 14 do CDC) deve ser entendida como objetiva e decorrente do risco do empreendimento, razão pela qual haverá necessidade de demonstração de conduta, dano e nexo causal.
Assim sendo, na forma do art. 14, §3º do CDC, a inversão do ônus da prova se opera ope legis, na medida em que o fornecedor somente não será responsabilizado quando provar fato exclusivo da vítima ou de terceiro, ou que o defeito inexiste. 
Porém, quanto aos fatos constitutivos de seu direito, não há como se entender que haja tal inversão, notadamente quanto aos prejuízos ocasionados pela conduta da ré, devendo tais fatos serem comprovados pela autora, na forma do art. 373, I do CPC/2015 (art. 333, I do CPC/1973), não logrando êxito, uma vez que não traz aos autos qualquer protocolo de contato com a ré após o pedido de cancelamento, o que poderia ter feito, na medida em que trouxe os demais protocolos de contato com outras empresas que prestam o mesmo serviço. Assim sendo, não está caracterizado o ato ilícito capaz de gerar o dever de indenizar.
Diante do exposto, julgo IMPROCEDENTES os pedidos, na forma do art. 487, I do CPC;2015 (art. 269, I, do CPC/1973).
Retifique-se o polo passivo, para que passe a constar CLARO S.A.
Isento dos ônus sucumbências, na forma do art. 55 da lei 9.099/95. Submeto este Projeto de Sentença ao Juiz Togado, na forma do que dispõe o art. 40 da lei 9.099/95.

Rio de Janeiro, 22 de maio de 2016.

Janayme Vieira de Moraes
Juíza Leiga";00040DFF5447999889CCCF5A338E2D5D1E79C5050B643E3F;2016.001.070473-9
