;processo;sentenca;similar_file;similar_processo;similaridade
6;2016.021.043365-0;"Processo nº: 0022600-12.2016.8.19.0208
Parte Autora: Luiz Roberto Moreira da Silva
1ª Ré: Banco Itaucard
2ª Ré: Odonto Empresas Convênios Dentários

 
Projeto de Sentença


Dispensado o relatório nos termos do art. 38 da Lei n° 9.099/95, passo a decidir.

Inicialmente, não merece acolhimento a preliminar suscitada pela parte Ré, eis que o interesse de agir da parte Autora restou demonstrado pelos fatos narrados em sua petição inicial e pelo pedido formulado. Assim, a prestação jurisdicional revela-se adequada e necessária. 

Rejeito a preliminar de ilegitimidade passiva suscitada pelas Rés, eis que as condições da ação são aferidas à luz dos fatos narrados na petição inicial, com base nos ditames da Teoria da Asserção, através do exercício de um juízo de admissibilidade hipotético. Desta forma, considerando-se os fatos narrados na petição inicial, verifica-se que se encontra presente a pertinência subjetiva da lide, eis que a existência de responsabilidade civil das Rés constitue o próprio mérito da causa.

Destaco a preliminar de inépcia da inicial e a rejeito, diante do caráter meramente protelatório, eis que preenche os requisitos do artigo 282 do Código de Processo Civil e atende ao princípio da simplicidade dos Juizados.

Igualmente, não merece prosperar a preliminar de inépcia da inicial por iliquidez do pedido, pois todos os pedidos do autor são certos e não dependem de liquidação judicial, mas sim de meros cálculos aritméticos, o que é perfeitamente admissível em sede de Juizados Especiais Cíveis.

Inexiste outra preliminar a dirimir, razão pela qual, reconhecendo a existência dos pressupostos processuais e das condições de regular desenvolvimento acionário, passo ao exame do mérito.
A relação jurídica entre as partes é de consumo, já que estão presentes os requisitos subjetivos (consumidor e fornecedor - artigos 2o e 3o da Lei 8078/90) e objetivos (produto e serviço - §§ 1o e 2o do artigo 3º da citada lei) de tal relação. 

No caso vertente, a parte Autora afirma que possui um cartão de credito administrado pela 1ª Ré, onde é debitado um serviço contratado junto a 2ª Ré. Afirma que em setembro de 2015 solicitou o cancelamento do plano, com protocolo informado na inicial, em razão de débitos indevidos, realizados na fatura do seu cartão com vencimento em 11/09/2015. Afirma que foi autorizado a abater o valor de R$50,74, referente a três parcelas do plano debitadas na fatura. Ocorre que, continuaram as cobranças indevidas na fatura do seu cartão.

Verifico que, as Rés realizam o estorno de uma parcela do plano odontológico, no valor de R$16,90, e as outras duas parcelas que não foram pagas continuaram a ser cobradas a título de saldo financeiro e encargos, tendo em vista que a fatura, com vencimento em setembro de 2015, não foi paga na sua integralidade. 

Destaco que, as Rés informam que as duas parcelas cobradas são devidas, uma vez que se refere ao serviço prestado antes do cancelamento. Todavia, a parte Autora afirma que, no momento do cancelamento, junto a 2ª Ré, acordou que os três débitos seriam estornados da fatura do seu cartão, conforme protocolo informado.

Incumbe a parte Ré o ônus de provar o fato modificativo ou extintivo do direito da parte Autora, na forma do art. 373, I do Código de Processo Civil e do art. 14 §3º do Código do Consumidor. Entendo que há solidariedade entre as Rés com relação ao estorno a ser realizado, uma vez que o serviço foi cancelado. 

Em assim sendo, tenho como parcialmente procedentes as razões invocadas ao embasamento da pretensão autoral, devendo as Rés estornarem a cobrança do saldo financeiro e encargos, oriundo do não pagamento do valor total da fatura com vencimento 11/09/2015 (fls. 84), no cartão de credito da parte Autora nº 5448.****.****.4148, que foi alterado para o nº 5355..****.****.2885; para que se efetive o pedido de abstenção das referidas cobranças, tendo em vista que não houve pagamento por parte do Autor das parcelas do plano odontológico, devendo assim o valor ser estornado. Já com relação a suposta diferença cobrada a maior na fatura, com vencimento em 11/09/2015, verifico que a 1ª Ré esclarece, em sua defesa as fls. 64, que não foram somados pela parte Autora alguns valores devidos. Assim, entendo que não merece prosperar o pedido de ressarcimento material em dobro.

No que pertine ao pedido de compensação por danos morais, salienta-se que o mero inadimplemento contratual não configura por si só dano moral, visto não agride a dignidade humana. 

Neste sentido, verifico que inexiste nos autos qualquer prova de que a conduta da Ré haja, de forma real e concreta, imposto a parte Autora extraordinária dor, vexame ou humilhação, nem tampouco extremada ofensa à sua dignidade e honra, de forma a ensejar o advento do dano moral indenizável. 
A este respeito, releva notar que meros dissabores ou aborrecimentos cotidianos, inerentes à vida moderna, não constituem fato gerador do prejuízo extrapatrimonial passível de ensejar a obrigação de indenizar. 

Entendo, pois, incabível a pretensão autoral de compensação por danos morais, uma vez que, do relato contido na petição inicial, não se deflui a existência de qualquer lesão à sua honra ou a outro bem integrante de sua personalidade.



A conta do acima exposto, JULGO PARCIALMENTE PROCEDENTES OS PEDIDOS para condenar as Rés a estornarem a cobrança do saldo financeiro e encargos, oriundo do não pagamento do valor total da fatura com vencimento 11/09/2015 (fls. 84), no cartão de credito da parte Autora nº 5448.****.****.4148, que foi alterado para o nº 5355..****.****.2885, no prazo de 30 dias a contar da publicação da presente, sob pena de multa única no valor de R$500,00 (quinhentos reais).


Sem custas e honorários vez que em sede de Juizado Especial Cível, conforme disposto no artigo 55 da lei 9.099/95.


Cientes as partes do disposto no artigo 52, IV, da Lei n° 9.099/95, quanto à necessidade de cumprimento voluntário da sentença, sob pena de penhora, dispensada nova citação. 


	Ficam, ainda, as partes intimadas de que em se tratando de sentença condenatória ao pagamento de quantia certa, o prazo previsto no art. 523 do CPC, para incidência da multa ali prevista (10%), contar-se-á da data do trânsito em julgado. 
 

	Certificado o trânsito em julgado e não havendo novas manifestações no prazo de 15 (quinze) dias, dê-se baixa e arquivem-se. Cientes as partes de que decorridos 90 dias da data do arquivamento definitivo os autos processuais serão eliminados, nos termos do artigo 1º do Ato Normativo Conjunto 01/2005, publicado no DORJ de 07/01/05.


Projeto de sentença sujeito à homologação, assim, remeto os autos ao MM. Juiz Togado, nos termos do artigo 40 da Lei nº 9.099/95.


Rio de Janeiro, 27 de Janeiro de 2017.


VANESSA DE SOUZA BRISIS
Juíza Leiga";000483489CAE23790F9A30982C68F5C08B93C5054C244719;2016.208.022341-4;0.7706769704818726
7;2016.021.043365-0;Homologo por sentença na forma do artigo 40 da Lei nº 9.099/95 o Projeto de Sentença elaborado pelo Juiz Leigo. PRI. Certifique-se o trânsito em julgado. Defiro desde já, se for o caso, independente de nova conclusão e havendo quitação da parte Autora, a expedição de mandado de pagamento. Após, dê-se baixa e arquivem-se.;000483489CAE23790F9A30982C68F5C08B93C5054C244719;2016.208.022341-4;0.7706769704818726
8;2016.021.043365-0;"Tendo em vista a penhora de numerário suficiente ao pagamento do débito perseguido na presente (fls. 244), ""in albis"" de embargos, JULGO EXTINTA a execução, com fulcro no art. 924,II, do CPC.
Expeça(m)-se mandado(s) de pagamento em favor da exequente e/ou seu(ua) patrono(a), desde que com poderes para tanto.
Certificado o trânsito em julgado, dê-se baixa e arquivem-se. P.R.I.";000483489CAE23790F9A30982C68F5C08B93C5054C244719;2016.208.022341-4;0.7706769704818726
9;2016.021.043365-0;"Dispensado o relatório, na forma do art. 38, da Lei 9.099/95. Decido. 
HOMOLOGO o projeto de sentença elaborado pelo Juiz Leigo, que passa a valer como fundamentação deste, com fulcro, na Lei Estadual nº 4578/05 e na Resolução nº 08/05 do E. Órgão Especial do TJRJ, e RESOLVE-SE o mérito, com base no art. 487, I, do NCPC. 
Publique-se. Aguarde-se a data designada para a leitura de sentença.
Após, certificado o trânsito dê-se baixa e arquive-se.";0004F4805B6DCF5144DC7CFB4DC7A7628B69C50603084509;2016.063.012769-8;0.7693136930465698
10;2016.021.043365-0;"	Dispensado o relatório na forma do artigo 38 da Lei 9.099/95, decido.
	A parte autora alega falha na prestação do serviço, uma vez que o réu lhe cobrou encargos por ter atrasado apenas dois dias o pagamento da fatura. Em contestação, o réu afirma que a cobrança foi decorrente da mora do consumidor, pelo que requer a improcedência dos pedidos.
	Estando presentes as condições da ação e os pressupostos de constituição e desenvolvimento regular do processo, passo a decidir o mérito. 
	O Código de Defesa do Consumidor, visando prover um maior equilíbrio nas relações de consumo - face a reconhecida vulnerabilidade do consumidor - criou uma série de normas protetivas. Dentre tais normas, está presente a possibilidade de inversão do ônus da prova em favor do consumidor, uma forma de facilitar defesa deste no processo. 
	Todavia, para que o Magistrado proceda com a inversão do ônus da prova, não basta que a lide sob exame advenha de uma relação de consumo. Isso porque a inversão do ônus da prova não é direito subjetivo do consumidor, mas sim uma possibilidade processual, condicionada à hipossuficiência ou à verossimilhança de suas alegações, apreciadas de acordo com o prudente arbítrio do magistrado. 
	Após uma detida análise dos elementos apresentados nos autos, conclui-se que não estão presentes os requisitos mínimos para a concessão da inversão do ônus da prova. No tocante a verossimilhança, se faz necessário que a parte autora apresente um mínimo de demonstração no sentido de que sua alegação é verossímil. Deve oferecer elementos, dados, ou indícios quaisquer que, em confronto com a narração das circunstâncias de que dá conta a inicial, possam induzir a um ´quê´ de verdade. Nesse sentido, a súmula 330 do TJRJ, in verbis:

	Nº. 330 ""Os princípios facilitadores da defesa do consumidor em juízo, notadamente o da inversão do ônus da prova, não exoneram o autor do ônus de fazer, a seu encargo, prova mínima do fato constitutivo do alegado direito.""

	 No caso em tela, a parte autora não logrou êxito em comprovar a ocorrência dos fatos como apresentados. De fato, a parte autora não carreou aos autos nenhuma prova ou indício capaz de evidenciar a existência de defeito imputável ao réu. 
	Isso porque ela própria afirma que pagou a fatura com atraso de dois dias, motivo que legitima ao réu que a cobra todos os encargos decorrentes de tal mora, que passam a incidir a partir do momento em que é considerada inadimplente, ou seja, o dia seguinte ao do vencimento. 
	Assim, não há mínima demonstração de que o réu praticou qualquer conduta ilícita.
	Nessa mesma esteira, também não se verifica hipossuficiência da parte autora no caso em discussão. Isso porque a hipossuficiência prevista no art. 6o, VIII, da Lei 8.078/90, deve ser entendida como a impossibilidade de produção da prova e não como a simples presença de um desnível econômico. 
	A parte autora possuía os meios para produzir provas a seu favor, ainda que mínimas, mas não o fez. O ônus da prova é uma regra de conduta dirigida às partes, que indica quais fatos que a cada uma cabe provar e ao juiz, que indica como ele deverá julgar acaso não encontre a prova dos fatos. 
	Logo, aquele que tem interesse em ver sua pretensão acolhida deve cuidar em trazer aos autos do processo todas as provas capazes de influenciar na decisão do órgão julgador. Assim, tendo em vista que as provas e indícios presentes nos autos não apontam a caracterização da responsabilidade civil da parte ré, se conclui que só resta a rejeição do pedido autoral.
	Em face do exposto, JULGO IMPROCEDENTE O PEDIDO. 
	Sem custas e honorários, na forma do art. 55 da Lei nº. 9.099/95.
	Submeto o presente projeto à homologação pela MM. Juíza de Direito.";0004F4805B6DCF5144DC7CFB4DC7A7628B69C50603084509;2016.063.012769-8;0.7693136930465698
11;2016.021.043365-0;"Processo : 0032784-27.2016.8.19.0208
Autor: LUIS KLEBER DOS SANTOS MENEZES 
Réu: WMB COMERCIO ELETRONICO LTDA 
Réu: ITAUCARD 

Projeto de Sentença

Trata-se de ação de indenização na qual alega a parte autora que adquiriu, pela internet, um ""Purificador de água Facilite Refrigerado CPB35AB ¿ eficiência bacteriológica consul"", que somado ao frete teve um custo total no valor de R$ 582,50. Porém, antes da entrega solicitou o cancelamento da compra. Informa ainda, que as compra fio realizada através de cartão de crédito. Assim, requer seja condenada a ré a restituir o valor pago, na forma dobrada, e em compensação por dano moral. 
 
A ré em contestação argui preliminar de perda do objeto, em virtude da falta de interesse de agir, aduzindo que o valor pago foi estornado. Sustenta a ausência de ato ilícito; a impossibilidade de restituição de valores; o descabimento da repetição em dobro; e a inexistência do dano moral. 
 
É o breve relatório, conforme possibilita o artigo 38 da Lei n. 9099/95. Decido.

Rejeito  a  preliminar  de  falta  de  interesse  de  agir,  uma  vez  que  há  utilidade  e  necessidade  do provimento jurisdicional na espécie. 

Ultrapassada a questão acima, adentro o mérito.
 
A  relação  entre  as  partes  é  de  consumo,  nos  termos  da  lei  8078/90,  sendo,  portanto,  a responsabilidade  da  ré  objetiva,  respondendo  pelos  danos  causados  (arts.  6º,  VI  e  14  da  lei 8078/90).   
 
No caso em exame, verifica-se que as fls. 81/82, que consta ocancelamento da compra e o estorno do valor da compra, feito pela ré. Dessa  forma,  tendo  ocorrido  a  restituição  total  do  valor  da  compra,  efetuada  pela  parte  ré,  se demonstram regulares os descontos das parcelas mostradas nas faturas. 
 
Assim  sendo,  não  tendo  havido  ato  ilícito  praticado  pela  parte  ré,  entendo  que  deve  ser desacolhido o pleito autoral. 
 
Isto  posto,  JULGO  IMPROCEDENTES  OS  PEDIDOS,  e  em  consequência,  resolvo  o  processo  com mérito, na forma do art. 487, inciso I, do CPC.

Sem custas e honorários vez que em sede de Juizado Especial Cível, conforme disposto no artigo 55 da lei 9.099/95.

Cientes as partes do disposto no artigo 52, IV, da Lei n° 9.099/95, quanto à necessidade de cumprimento voluntário da sentença, sob pena de penhora, dispensada nova citação. 

Ficam, ainda, as partes intimadas de que em se tratando de sentença condenatória ao pagamento de quantia certa, o prazo previsto no art. 523, §1º do CPC, para incidência da multa ali prevista (10%), contar-se-á da data do trânsito em julgado. 

Certificado o trânsito em julgado e não havendo novas manifestações no prazo de 15 (quinze) dias, dê-se baixa e arquivem-se. 

Projeto de sentença sujeito à homologação, assim, remeto os autos a MM. Juiz Togado, nos termos do artigo 40 da Lei nº 9.099/95.";0004A9D1B065115E92B3DDAD361977E3EA4AC50604364856;2016.208.032392-5;0.7568807005882263
12;2016.021.043365-0;Homologo por sentença na forma do artigo 40 da Lei nº 9.099/95 o Projeto de Sentença elaborado pelo Juiz Leigo. PRI. Após, certificado o trânsito em julgado, dê-se baixa e arquive-se.;0004A9D1B065115E92B3DDAD361977E3EA4AC50604364856;2016.208.032392-5;0.7568807005882263
13;2016.021.043365-0;"Homologo o acordo celebrado entre as partes para que surta seus jurídicos e legais efeitos, e julgo o feito extinto, com resolução do mérito, nos termos do art. 487, inc. III, b, do novo Código de Processo Civil ( Lei nº 13.105/ 2015). 

Se for o caso, comprovado o depósito, expeça-se mandado de pagamento em favor da parte autora, independentemente de nova conclusão.   Após, nada mais sendo requerido, dê-se baixa e arquivem-se. 


Decorrido o prazo do cumprimento o acordo, aguarde-se por cinco dias a manifestação das partes; não havendo manifestação,  dê-se baixa e arquive-se.";00043C0564A9BE12882A365EB3B449AD775DC5054F55270F;2016.001.284003-1;0.751057505607605
14;2016.021.043365-0;"Embora dispensado o relatório, na forma do Art. 38, caput, da lei 9.099/95, convém fazer uma breve síntese acerca dos fatos relevantes da causa.

Em síntese, trata-se de ação em que pretende o autor a declaração de inexistência de dívida, bem como a condenação da ré ao pagamento de quantia a título de compensação por danos morais.

Como fundamento de sua pretensão, afirma que é titular de cartão de crédito administrado pela instituição financeira ré, e que no dia 19/12/2015 efetuou o pagamento integral da fatura, no valor de R$ 407,96 (quatrocentos e sete reais e noventa e seis centavos). Todavia, dias depois, ao tentar realizar uma compra com o cartão, teve sua tentativa negada. Narra que ao contatar a administradora do cartão descobriu que o pagamento feito em dezembro não havia sido processado.

Regularmente citada e intimada, a ré apresentou contestação em audiência de conciliação, instrução e julgamento. Sustenta que inexiste responsabilidade de sua parte, na medida em que o autor não comprova o pagamento da fatura com vencimento em dezembro, mas apenas que agendou o referido pagamento para o dia 21/12/2015. Alega que o saldo continuou em aberto, e por esta razão não se verifica qualquer irregularidade em sua conduta.

FUNDAMENTOS: 

A relação jurídica entre as partes é de consumo, pois presentes os elementos previstos nos artigos 2º e 3º, caput, do CDC, sendo, portanto, impositiva a aplicação da Lei 8.078/90.

Contudo, em que pese seja de consumo a relação jurídica existente entre as partes, tem o consumidor o ônus de produzir prova mínima a respeito da existência do direito que alega, na forma do Art. 373, I, do CPC. Neste sentido, convém transcrever o entendimento pacífico do TJ/RJ acerca do tema:

Súmula Nº. 330 ""Os princípios facilitadores da defesa do consumidor em juízo, notadamente o da inversão do ônus da prova, não exoneram o autor do ônus de fazer, a seu encargo, prova mínima do fato constitutivo do alegado direito.""

Afirma a parte autora que efetuou o pagamento da fatura no valor de R$ 407,96 no dia 19/12/2015.

Todavia, o comprovante acostado às fls. 25, assim como sustentou a ré em sua contestação, comprova que o autor realizou uma operação junto ao banco Bradesco no dia 19/12/2015, agendando o pagamento da quantia de R$ 407,96 para o dia 21/12/2015. Todavia, o demandante não juntou aos autos o extrato de sua conta corrente demonstrando que no dia 21/12/2015 o respectivo valor foi lançado a débito. Somente assim comprovaria o efetivo pagamento da fatura.

A parte autora deixou de prova a existência do fato constitutivo do direito pretendido, descumprindo o disposto no Art. 373, I, do Código de Processo Civil.

Nesta perspectiva, inexiste falha na prestação de serviços por parte da instituição financeira ré, de modo que os pedidos devem ser julgados improcedentes.

  DISPOSITIVO:

Pelo exposto, JULGO IMPROCEDENTES os pedidos, na forma do Art. 487, I, do Código de Processo Civil. Sem custas, nem honorários advocatícios, nos termos do artigo 55, da Lei 9099/95.

 Publique-se. Registre-se. Intimem-se.

Remeto os autos ao M.M. Juiz de Direito para homologação deste projeto de sentença, na forma do Artigo 40, da Lei 9.099/95.


Duque de Caxias, 19 de janeiro de 2017.";0004FE84261F45F7ED36D104C43FEE0EB8C9C505580D1346;2016.021.058262-9;0.7465063333511353
15;2016.021.043365-0;Vistos etc. HOMOLOGO o PROJETO DE SENTENÇA proferido pelo DD. Juiz Leigo que me foi submetido, para que a mesma produza os seus jurídicos e legais efeitos, nos termos do artigo 4º, inciso III, da Resolução nº 08/2005, do Órgão Especial do TJ/RJ.  Sem custas judiciais, na forma da Lei nº 9.099/95. P.R.I. Certificado o trânsito em julgado, aguarde-se pronunciamento por 30 dias. Na inércia, dê-se baixa e arquive-se.;0004FE84261F45F7ED36D104C43FEE0EB8C9C505580D1346;2016.021.058262-9;0.7465063333511353
16;2016.021.043365-0;"Dispensado o relatório, na forma da lei. Homologa-se a desistência manifestada em audiência quanto ao réu EXTRA. Impugna a parte autora valores cobrados em sua fatura de cartão de crédito - ""avaliação emergencial de crédito"", ""seguro compra segura"" e ""envio de mensagem automática"" -, afirmando ausência de solicitação. Ao contrário do que afirma, a contratação do ""seguro compra segura"" está a fls. 65-66, mas não trouxe a parte ré comprovação de que, para o contrato celebrado com o autor, incidiriam as demais tarifas. Veja-se, a fl. 69, a indicação, em contrato padrão, de que estas verbas ""poderão ser cobradas conforme o tipo do seu cartão"", nada esclarecido especificamente acerca daquele titularizado pela parte autora. Assim com razão em parte o autor, impositiva a devolução, em dobro, dos valores cobrados a título de ""avaliação emergencial de crédito"" e ""envio de mensagem automática"" . Mas dos fatos não se extrai qualquer dano moral, tratando-se de meras cobranças.
Isto posto, EXTINGUE-SE O PROCESSO SEM RESOLUÇÃO DO MÉRITO, quanto ao réu EXTRA, na forma do artigo 485, VIII, do CPC e, quanto ao réu ITAÚ, RESOLVE-SE O MÉRITO, na forma do artigo 487, I, do NCPC, julgando-IMPROCEDENTE o pedido de reparação por dano moral e PARCIALMENTE PROCEDENTES os demais, DESCONSTITUÍDOS os contratos referentes à ""avaliação emergencial de crédito"" e ""envio de mensagem automática"", abstendo-se a ré de novas cobranças, pena de multa a ser fixada em eventual fase de cumprimento de sentença, condenada a parte ré, ainda, a pagar ao autor, em dobro, o valor de R$ 99,20, corrigido monetariamente e a contar de cada pagamento, e acrescido de juros de 1% a.m, a contar da citação.
Ausentes despesas processuais ou honorários, descabidos nesta fase. P.R.I., cientificadas as partes acerca das regras do artigo 523 e parágrafos. Após certificado o trânsito em julgado, dê-se baixa e arquive-se.";0004C47D9F4882D345435169BFC08AAD494FC50555524A48;2016.021.055282-0;0.7431265115737915
17;2016.021.043365-0;"Sustenta o   Recorrente  através do  Recurso de  Embargo de  Declaração    em face   da  Sentença   proferida  ,   vicio   que deve ensejar  a  devida    integração  para o  aperfeiçoamento da  prestação jurisdicional .

Não merece   reparo  a  Sentença    eis que entendo que   já  houve  pronunciamento correto e preciso   sob todos os   pontos   sustentados       na peça inicial como na   defesa da  ré.

Esclareço por fim  que   pretende  a  Embargante  por  via  reflexa discutir o mérito   da Sentença não sendo o  Embargos de  Declaração o Recurso  cabível.

Deve ser acrescentado ainda que o Recurso  é   inadequado  em razão da   sua devolutividade restrita  , o  que não permite   alteração   substancial. 

Ante o exposto ,  conheço do recurso e nego provimento ao mesmo .
Intimem-se.";0004C47D9F4882D345435169BFC08AAD494FC50555524A48;2016.021.055282-0;0.7431265115737915
18;2016.021.043365-0;Projeto em Revisão;0004BBAFA600A25A958B4B6F7932C35C57FEC5055A2D5A37;2016.204.032477-3;0.7393187284469604
