;processo;sentenca;similar_file;similar_processo;similaridade
19;2016.021.043365-0;"PODER JUDICIÁRIO DO ESTADO DO RIO DE JANEIRO
XVII JUIZADO ESPECIAL CÍVEL

PROCESSO: 32825-06.2016.8.19.0204
AUTOR: NANCI MOTTA FLORES
RÉU: BANCO ITAUCARD
PROJETO DE SENTENÇA

Dispensado o relatório nos termos do art. 38 da Lei 9099/95, passo a decidir. 

Reclama a autora que adquiriu aparelho rastreador CAR SYSTEM em setembro/2014, no valor de R$ 1.356,00 a ser pago em seis parcelas no cartão de credito; que o réu fez a cobrança em duplicidade e vem sendo paga; que reclamou da cobrança indevida, não sendo atendida. Requer devolução em dobro do valor pago indevidamente e indenização por danos morais.


Em contestação o réu suscita preliminar de ilegitimidade passiva. No mérito, que a autora não procurou o réu para tratativa do desacordo comercial; que fez contato apenas com a comerciante; inexistência de danos materiais e morais. 


Rejeito a preliminar de ilegitimidade passiva suscitada aplicando a teoria da Asserção. 

O réu não comprova a regularidada da transação que impugna a ré, mesmo tomando conhecimento dos fatos, nada trouxe a fim de comprovar que ao menos apurou o ocorrido. Desta forma, ante a irregularidade da compra, faz jus a autora a restituição do valor pago indevidamente na forma em dobro, no total de R$ 2712,00, já na forma em dobro.

A autora não comprova a repercussão e os danos que os fatos narrados tenha  lhe causado, não sendo o fato, gerador de dano moral. Para a configuração de dano moral, necessário se faz que haja relato do fato danoso e das suas repercussões na vida do ofendido, o que não foi comprovado. O dano moral deve ser compreendido como circunstância não habitual que interfere na esfera psíquica do indivíduo de modo a causar-lhe desequilíbrio seu bem estar, sendo aplicado a sumula 230 TJRJ, razão pela qual se tem a improcedência do pedido de indenização por danos morais.  


Ante o exposto, JULGO PROCEDENTE em parte os pedidos na forma do art. 487 NCPC, para: 1- Condenar o réu a restituir a autora a quantia de R$ 2712,00, já na forma em dobro, corrigidos desde o desembolso e juros de 1% ao mês a contar da citação. IMPROCEDENTE o pedido de indenização por danos morais. Sem custas e honorários, nos termos do art. 55 da Lei 9099/95.  Submeto o presente projeto de sentença à apreciação do Juiz Togado, para homologação.


Rio de Janeiro, 27 de Janeiro de 2017.

ANA QUÉZIA PEREIRA DE FREITAS   - JUIZA LEIGA";0004BBAFA600A25A958B4B6F7932C35C57FEC5055A2D5A37;2016.204.032477-3;0.7393187284469604
20;2016.021.043365-0;Dispensado o relatório na forma do art. 38 da Lei 9099/95. HOMOLOGO o projeto de sentença proferido pelo Juiz Leigo, para que produza seus jurídicos e legais efeitos, na forma do art. 40 da Lei 9.099/95.  FICAM AS PARTES CIENTES DE QUE, NOS TERMOS DO AVISO 02/2016 DA COJES (D.O. 31/03/2016) OS PRAZOS PROCESSUAIS EM SEDE DE JEC CONTINUARÃO A SER CONTADOS EM DIAS CORRIDOS, INAPLICÁVEL O ARTIGO 219 DO NCPC.Fica a parte ré ciente de que caso não pague a quantia certa a que foi condenada em 15 dias, contados do trânsito em julgado da sentença, o valor da condenação será acrescido de multa de 10%, por aplicação do artigo 523,§1º do CPC, sendo certo, ainda, que a comprovação do depósito deverá vir aos autos no prazo de 5 dias, após a efetivação. Comprovado o depósito nos autos,  expeça-se mandado de pagamento. Após, dê-se baixa e arquive-se. Caso negativo, após o decurso do prazo de trinta dias do trânsito em julgado, dê-se baixa e arquive-se.;0004BBAFA600A25A958B4B6F7932C35C57FEC5055A2D5A37;2016.204.032477-3;0.7393187284469604
