;processo;sentenca;similar_file;similar_init;similar_processo;similaridade
18;2016.001.265830-7;"ESTADO DO RIO DE JANEIRO
PODER JUDICIÁRIO
V JUIZADO ESPECIAL CÍVEL DA COMARCA DA CAPITAL

Processo nº 0096094-46.2016.8.19.0001
Primeiro Autor: JULIA LEAL DANZIGER
Segundo Autor: ERICO SANTOS DE SOUZA
Primeiro Réu: UNITED AIRLINES
Segundo Réu: AZUL LINHAS AÉREAS

PROJETO DE SENTENÇA

Dispensado o relatório na forma do artigo 38 da Lei n0 9099/95.
			Alegam os autores, em resumo, que adquiriram passagens aéreas no site da primeira Ré, UNITED, para Hosuton com escala em São Paulo, cabendo a segunda demandada, em parceira com a primeira, realizar o trajeto Rio de Janeiro ¿ São Paulo. Informam que no voo de ida para a capital paulista, previsto para 19:50h, somente decolou as 23¿00hs, fazendo com que perdessem a conexão para os Estados Unidos. Que apenas no dia seguinte conseguiram viajar para Houston, não tendo as Rés prestado qualquer assistência. Requerem indenização por dano moral e material.
Primeiramente os Autores firmaram acordo com a primeira Ré, homologado as fls.78, prosseguindo o feito em relação a segunda Ré. 

			Analisando os autos, constata-se a existência de relação de consumo a ensejar a aplicação da Lei n0 8078/90.

A Ré alega, em breve síntese, que o atraso ocorreu por problemas meteorológicos, sem trazer aos autos qualquer prova que rebata aquela apresentada pelos autores, de fls. 12, que apresenta a tela informativa do aeroporto comprovando que outros voos estavam decolados, sem problemas aparentes.
Restou claro, com essa prova autoral, a falha na prestação do serviço,  considerando que cabe â empresa aérea o dever de prestar serviços eficientes e adequados, restando comprovado a falha na prestação do serviço, com fundamento na teoria do risco do empreendimento, no qual, aquele que se disponha a exercer qualquer atividade no mercado de consumo deverá suportar o ônus decorrentes dos vícios e defeitos do produto ou do serviço oferecido, considerando a jurisprudência dominante  que tratar-se a presente hipótese de fortuito interno:
ESTADO DO RIO DE JANEIRO PODER JUDICIÁRIO QUARTA TURMA RECURSAL CÍVEL Recurso nº 0132197-96.2009.8.19.0001 Recorrente: MANOEL LUIZ GUIMARÃES CAVALCANTI Recorrido: SOCIETE AIR FRANCE VOTO Cuida-se de recurso contra a sentença proferida pelo Juízo monocrático que julgou improcedente o pedido autoral. Relação de consumo. Responsabilidade objetiva. Falha na prestação do serviço. Autor sustenta na inicial que o vôo de Edimburgo com destino a Paris atrasou aproximadamente três horas, ocasionando transtornos. A reclamada aduz que o atraso ocorreu em razão de problemas mecânicos detectados na aeronave. O Juízo a quo julgou improcedente o pedido autoral, sob o fundamento de que o evento narrado pelo reclamante traduz mero dissabor. Sentença que merece reforma. A alegação de problemas mecânicos detectados na aeronave não constitui excludente ao dever de indenizar. Fortuito interno. O atraso de aproximadamente três horas para a realização do vôo, configura lesão da seara extrapatrimonial. Dano moral que deve ser estabelecido com razoabilidade, levando-se em conta o critério compensatório-punitivo. Ante o exposto, voto no sentido de conhecer do recurso e dar-lhe parcial provimento para reforma a sentença e condenar a ré ao pagamento da quantia de R$ 3.000,00 (três mil reais), corrigida monetariamente e acrescida de juros legais a contar da publicação desta decisão. Sem ônus sucumbenciais. Rio de Janeiro, 08 de abri de 2010. GRÁCIA CRISTINA MOREIRA DO ROSÁRIO JUÍZA RELATORA (Processo n.0132197-96.2009.8.19.0001)

	Resta evidente, portanto, que estão presentes os elementos da responsabilidade civil que se configura com a presença da conduta, dano e nexo causal, sendo dispensável neste caso a presença do elemento culpa por se tratar de responsabilidade objetiva. Ademais, o mero fato da ocorrência do atraso do voo é o bastante para configurar a falha na prestação do serviço que, por conseguinte, acarreta um prejuízo para o consumidor, sobretudo quando seguido da perda da conexão.

Assim, não há dúvida da ocorrência de dano moral, diante do atraso de horas no voo Rio de Janeiro ¿ São Paulo e, por conseguinte, a perda da conexão para Houston e os diversos transtornos narrados na peça exordial, fatos esses que geram sentimento de intranquilidade, angústia, ansiedade e sensação de impotência, sentimentos que violam o direito da personalidade de qualquer homem médio, a merecer, portanto, a compensação adequada pelos danos morais. Com relação ao quantum a ser pago, devem ser consideradas as características e condições do ofensor, bem como as do ofendido, devendo-se atentar mais ao caráter punitivo-pedagógico, razão pela qual entendo que, no presente caso, a quantia deve ser de R$4.000,00 (quatro mil reais), para cada autor.

Quanto ao dano material, os autores não comprovaram a titularidade do cartão que consta a despesa com o aluguel de um veículo contida na fatura de fls.23/26, já que não consta o nome deles naquele documento, deixando de estar comprovado, assim, o prejuízo material.

	Isso posto, JULGO PROCEDENTE o pedido para condenar a segunda Ré, AZUL, a: 1) pagar para cada Autor, a quantia de R$4.000,00 (quatro mil reais), a título de dano moral, com correção monetária desta data até o efetivo pagamento e juros de mora de 1% ao mês, a contar da citação. JULGO IMPROCEDENTE o pedido de dano material, na forma do artigo 487, I do CPC.
			
Sem custas e honorários.

Nos termos do artigo 40 da Lei n0 9099/95, submeto o presente projeto de sentença à homologação pela MM. Juíza de Direito.



Maria Fernanda Miranda Lyra
Juíza Leiga";00049279057DD00506C413E8375431AAFFB633C5050A115C;0004B39C06EA141D6F2247A34BF8AC8B4BD7C5045A452944;2016.001.080844-2;0.5340480804443359
19;2016.001.265830-7;"Homologo o acordo celebrado entre os autores e a 1ª ré para que surta seus jurídicos e legais efeitos, e julgo o feito extinto, com resolução do mérito, nos termos do art. 487, III, b, do CPC.  Noticiado o cumprimento do acordo, dê-se baixa  em nome da 1ª ré.
 
Aguarde-se a audiência designada eis que o feito vai  prosseguir em face da 2ª ré.";00049279057DD00506C413E8375431AAFFB633C5050A115C;0004B39C06EA141D6F2247A34BF8AC8B4BD7C5045A452944;2016.001.080844-2;0.5340480804443359
20;2016.001.265830-7;"Homologo, por sentença, para que surta seus efeitos legais, o projeto de sentença elaborado pelo juiz leigo, na forma do artigo 40 da Lei nº 9.099/95. 

Em caso de depósito judicial referente à condenação, expeça-se mandado de pagamento, independentemente de nova conclusão. 

Caso haja valor remanescente a ser recebido, manifeste-se o credor em 7 dias, sob pena de arquivamento dos autos. Após o trânsito em julgado, tratando-se de sentença de improcedência ou de extinção do feito sem resolução do mérito, dê-se baixa e arquivem-se imediatamente. 

Tratando-se de sentença de procedência, após o trânsito em julgado e o decurso do prazo de 15 dias para pagamento espontâneo do valor da condenação previsto no art. 523 do NCPC c/c o entendimento consolidado no enunciado nº 13.9.1 do Aviso nº 23/2008 do TJERJ, aguarde-se por mais 7 dias a manifestação das partes e, em seguida, caso permaneçam em silêncio, proceda-se a baixa e ao arquivamento. 

FICAM AS PARTES CIENTES DE QUE A NOVA SISTEMÁTICA DE CONTAGEM DE PRAZO ESTABELECIDO NO ART. 219 DO NCPC/2015 NÃO SE APLICA AOS JUIZADOS ESPECIAIS CÍVEIS, CONSOANTE NOTA TÉCNICA 01/2016 DO FONAJE DE 04/03/2016 C/C A PRIMEIRA PARTE DO ENUNCIADO 86 TAMBÉM DO FONAJE, COMPUTANDO-SE OS PRAZOS EM DIAS CORRIDOS, ASSIM PROCEDENDO COM A FINALIDADE PRECÍPUA DE SE ALCANÇAR A BOA GESTÃO CARTORÁRIA COM FUNDAMENTO NO PRINCÍPIO DA CELERIDADE QUE REGE A LEI 9.099/95.";00049279057DD00506C413E8375431AAFFB633C5050A115C;0004B39C06EA141D6F2247A34BF8AC8B4BD7C5045A452944;2016.001.080844-2;0.5340480804443359
21;2016.001.265830-7;"Homologo, por sentença, para que surta seus efeitos legais, o projeto de sentença elaborado pelo juiz leigo, na forma do artigo 40 da Lei nº 9.099/95. 

Em caso de depósito judicial referente à condenação, expeça-se mandado de pagamento, independentemente de nova conclusão. 

Caso haja valor remanescente a ser recebido, manifeste-se o credor em 7 dias, sob pena de arquivamento dos autos. Após o trânsito em julgado, tratando-se de sentença de improcedência ou de extinção do feito sem resolução do mérito, dê-se baixa e arquivem-se imediatamente. 

Tratando-se de sentença de procedência, após o trânsito em julgado e o decurso do prazo de 15 dias para pagamento espontâneo do valor da condenação previsto no art. 523 do NCPC c/c o entendimento consolidado no enunciado nº 13.9.1 do Aviso nº 23/2008 do TJERJ, aguarde-se por mais 7 dias a manifestação das partes e, em seguida, caso permaneçam em silêncio, proceda-se a baixa e ao arquivamento. 

FICAM AS PARTES CIENTES DE QUE A NOVA SISTEMÁTICA DE CONTAGEM DE PRAZO ESTABELECIDO NO ART. 219 DO NCPC/2015 NÃO SE APLICA AOS JUIZADOS ESPECIAIS CÍVEIS, CONSOANTE NOTA TÉCNICA 01/2016 DO FONAJE DE 04/03/2016 C/C A PRIMEIRA PARTE DO ENUNCIADO 86 TAMBÉM DO FONAJE, COMPUTANDO-SE OS PRAZOS EM DIAS CORRIDOS, ASSIM PROCEDENDO COM A FINALIDADE PRECÍPUA DE SE ALCANÇAR A BOA GESTÃO CARTORÁRIA COM FUNDAMENTO NO PRINCÍPIO DA CELERIDADE QUE REGE A LEI 9.099/95.";0004454B13F1D26F3C2DD6E40976009A3A12C50512615760;0004E47235E59DC363896D18AE61F4284311C505095E043C;2016.001.051028-3;0.5311602354049683
22;2016.001.265830-7;"
ESTADO DO RIO DE JANEIRO
PODER JUDICIÁRIO
V Juizado Especial Cível da Comarca da Capital 
Processo n° 0060603-75.2016.8.19.001
Autor: HENRIQUE CASTRO DE ANDRADE 
Réu: VRG LINHAS AÉREAS
Réu: AZUL LINHAS AÉREAS S/A
PROJETO DE SENTENÇA

Dispensado o relatório, conforme possibilita o artigo 38 da Lei n. 9.099/95, passo a decidir.

Cuidam os autos de ação de conhecimento em que reclama a parte autora de defeito na prestação do serviço ofertado pela primeira ré consistente no fato de cancelar unilateralmente o voo previamente contratado, transferindo-o , após longo período para voo operado pela segunda ré, o qual também apresentou diversos problemas atrasando a sua viagem, sendo certo que não foi prestado auxílio com alimentação.

A parte ré VRG LINHAS AÉREAS foi citada e ofereceu contestação escrita, onde perseguiu a improcedência do pedido ao argumento de que não ocorreu defeito na prestação do serviço.

Com relação a empresa AZUL a parte autora celebrou acordo em audiência de instrução e julgamento, o qual deve ser homologado, sendo, portanto, julgado extinto o processo sem  resolução do mérito com relação a referida empresa na forma do art. 487, III, B,  do CPC.
     
 A relação jurídica entre as partes é de consumo, já que estão presentes os requisitos subjetivos (consumidor e fornecedor ¿ art. 2o c/c art. 17 e art. 3o da Lei 8.078/90) e objetivos (produto e serviço ¿ §§ 1o e 2o do artigo 3o da mesma lei) de tal relação.





      O consumidor é vulnerável tecnicamente para produção efetiva da prova acerca dos fatos narrados na peça vestibular, visto que não detém o monopólio dos meios disponibilizados pela ré na prestação de seus serviços. Ademais, os documentos acostados aos autos conferem verossimilhança às alegações proferidas pelo consumidor, razão pela qual, inverte-se o ônus da prova ao teor do art. 6º,VIII do CDC. 


                     A responsabilidade civil da parte ré pelo fornecimento de serviço é objetiva (artigo 14 do Código de Defesa do Consumidor), assim, responde pelos danos causados à parte autora ainda que ausente sua culpa, arcando com os riscos de seu empreendimento, dos quais somente se exonera acaso comprove algumas das situações previstas no § 3º do art. 14, da Lei 8.078/90.

A ré não trouxe aos autos prova no sentido do impedimento do voo no horário previsto.

Oportuno destacar que, questão relacionada ao mau tempo configura fortuito interno a ensejar aplicação do enunciado de súmula 94 do TJRJ, devendo ainda ser ressaltado que o acordo com a AZUL no caso concreto não gera a extinção do feito com a empresa VRG, visto que ocorreram novos defeitos na prestação do serviço.
 
Cabe notar que, a ré não se desincumbiu do ônus que lhe é imposto por lei, bem como não juntou qualquer documento capaz de elidir as alegações do consumidor hipossuficiente, ou excluir sua responsabilidade objetiva, por evidente defeito na prestação de serviço, em conformidade com o disposto no § 3º do art. 14, da Lei 8.078/90, ou mesmo, na forma do art. 373, II, do CPC.

   Com efeito, como restou demonstrado o prejuízo material narrado na peça vestibular, deve ser acolhido no valor de  R$571,22 (quinhentos e setenta e um reais e vinte e dois centavos).

                   O dano moral decorre in re ipsa da conduta sofrida, pois o comportamento da parte ré consistente no atraso excessivo da viagem frustrou às legítimas expectativas do consumidor.





Na mensuração do dano moral, deve o magistrado se orientar pelos critérios de razoabilidade e proporcionalidade, não se olvidando de observar os diversos defeitos na prestação dos serviços e o atraso na viagem contratada, motivo por que, fixo o dano imaterial no valor de R$ 4.000,00 (quatro mil reais).


Posto isso, Julgo Extinto o Processo Sem Resolução do Mérito com relação ao réu AZUL na forma do art. 487,III, B, do CPC e JULGO PARCIALMENTE PROCEDENTE O PEDIDO e extinta a fase de conhecimento com resolução do mérito na forma do art. 487, I do CPC, para: 1) condenar a parte ré VRG LINHAS AÉREAS a pagar a parte autora, a título de compensação por danos morais, a quantia de R$ 4.000,00  (quatro mil reais), corrigida monetariamente desde a presente e acrescida de juros legais de 1% ao mês a partir da citação; 2) condenar o réu VRG LINHAS AÉREAS a indenizar o autor na quantia de  R$571,22 (quinhentos e setenta e um reais e vinte e dois centavos)  acrescidos de juros de 1% ao mês a contar da citação e correção monetária desde o ajuizamento da demanda.


O réu deverá efetuar o pagamento dos valores da condenação no prazo de 15 (quinze) dias do trânsito em julgado da sentença, sob pena de incidência da multa de 10% (dez por cento) sobre o valor da condenação prevista no artigo 523, parágrafo primeiro, do Código de Processo Civil. 

Sem ônus sucumbenciais, face o disposto no artigo 55, da Lei nº 9.099/95. Após o trânsito em julgado, dê-se baixa e arquivem-se. P.R.I. 

Projeto de sentença sujeito à homologação pela MM. Juiz de Direito, com base no art. 40, da Lei 9.099/95. 

Rio de Janeiro, 07 de Julho de 2016.

Everardo Mendes de Araújo
Juiz Leigo";0004454B13F1D26F3C2DD6E40976009A3A12C50512615760;0004E47235E59DC363896D18AE61F4284311C505095E043C;2016.001.051028-3;0.5311602354049683
23;2016.001.265830-7;"Homologo, por sentença, para que surta seus efeitos legais, o projeto de sentença elaborado pelo juiz leigo, na forma do artigo 40 da Lei nº 9.099/95. 

Em caso de depósito judicial referente à condenação, expeça-se mandado de pagamento, independentemente de nova conclusão. 

Caso haja valor remanescente a ser recebido, manifeste-se o credor em 7 dias, sob pena de arquivamento dos autos. Após o trânsito em julgado, tratando-se de sentença de improcedência ou de extinção do feito sem resolução do mérito, dê-se baixa e arquivem-se imediatamente. 

Tratando-se de sentença de procedência, após o trânsito em julgado e o decurso do prazo de 15 dias para pagamento espontâneo do valor da condenação previsto no art. 523 do NCPC c/c o entendimento consolidado no enunciado nº 13.9.1 do Aviso nº 23/2008 do TJERJ, aguarde-se por mais 7 dias a manifestação das partes e, em seguida, caso permaneçam em silêncio, proceda-se a baixa e ao arquivamento. 

FICAM AS PARTES CIENTES DE QUE A NOVA SISTEMÁTICA DE CONTAGEM DE PRAZO ESTABELECIDO NO ART. 219 DO NCPC/2015 NÃO SE APLICA AOS JUIZADOS ESPECIAIS CÍVEIS, CONSOANTE NOTA TÉCNICA 01/2016 DO FONAJE DE 04/03/2016 C/C A PRIMEIRA PARTE DO ENUNCIADO 86 TAMBÉM DO FONAJE, COMPUTANDO-SE OS PRAZOS EM DIAS CORRIDOS, ASSIM PROCEDENDO COM A FINALIDADE PRECÍPUA DE SE ALCANÇAR A BOA GESTÃO CARTORÁRIA COM FUNDAMENTO NO PRINCÍPIO DA CELERIDADE QUE REGE A LEI 9.099/95.";00049BED34FF51B1F4E2FB436998B91249D8C5051048141C;0004FBA399DC5A88BD79F1C77E9A03E83183C5050214202A;2016.001.110690-0;0.5231630802154541
24;2016.001.265830-7;"
ESTADO DO RIO DE JANEIRO
PODER JUDICIÁRIO
V JUIZADO ESPECIAL CÍVEL DA COMARCA DA CAPITAL 


Processo nº:   0129443-40.2016.8.19.0001

Autor: AFONSO HERIQUE CARVALHO MEDEIROS e ROSANA RIBEIRO DA SILVA

Réu: AZUL LINHAS AÉREAS BRASILEIRA S.A


PROJETO DE SENTENÇA

Dispensado o relatório na forma do art. 38 da Lei 9.099/95.

Trata-se de ação em que os autores alegam terem contratado um voo, para o dia 06.09.15, junto à reclamada, no qual sua bagagem foi extraviada. Afirmam os demandantes ainda que, a referida mala foi entregue no dia 08.09.2015, às 04:30, com a ausência de diversos bens adquiridos, o que lhes acarretou relevantes transtornos.

Pelo que, objetiva: a compensação pelos danos morais, no valor de R$ 17.600,00.

A parte ré foi citada e ofereceu defesa sob a forma escrita, tendo pugnado pela improcedência dos pedidos do demandante, ao argumento de que não ocorreu falha na prestação do serviço.

Assim, presentes as condições para o regular exercício do direito de ação, bem como, os demais pressupostos da ação, passo a enfrentar o mérito.

A relação jurídica entre as partes é de consumo, já que estão presentes os requisitos subjetivos (consumidor e fornecedor, art. 2o c/c art. 17 e art. 3o da Lei 8.078/90) e objetivos (produto e serviço,  §§ 1o e 2o do artigo 3o da mesma lei) de tal relação, impondo-se à demanda sob exame os preceitos do Código de Defesa do Consumidor.

Tratando-se de relação de consumo, frente à verossimilhança das alegações e a hipossuficiência dos reclamantes, pessoas físicas, é cabível a inversão do ônus da prova, a teor do art. 6º, VIII, do CDC, não tendo a ré, se desincumbido de provar fatos extintivos, modificativos ou impeditivos do direito dos autores.

Cabe notar que, a ré não logrou êxito em demonstrar a inexistência de falha na prestação do serviço, uma vez que, juntou documentos produzidos de forma unilateral, incapazes de elidir as alegações dos consumidores hipossuficientes, ou excluir sua responsabilidade objetiva, por evidente defeito na prestação de serviço, em conformidade com o disposto no § 3º do art. 14, da Lei 8.078/90, ou mesmo, na forma do art. 373, II, do CPC, à sua peça de defesa, ônus que lhe competia.

A parte ré não demonstrou ter prestado o serviço de maneira efetiva, não tendo comprovado a efetiva entrega da bagagem aos consumidores, no momento de sua chegado ao local do destino.

Cabe ressaltar ainda que, no serviço de transporte, o transportador tem o dever de conduzir o passageiro e sua bagagem incólumes, no tempo e modo previstos, até seu destino, o que não correu no presente caso.

O dano moral decorre in re ipsa da conduta sofrida, pois a conduta do réu frustrou às legítimas expectativas do consumidor.

 Na mensuração do dano moral, deve o magistrado se orientar pelos critérios de razoabilidade e proporcionalidade, não se olvidando de observar ausência de gravidade maior no evento, motivo por que, fixo o dano imaterial no valor de R$ 4.000,00 (quatro mil reais).

Pelo exposto, JULGO PARCIALMENTE PROCEDENTE O PEDIDO, para CONDENAR a ré: 1) a pagar aos autores a quantia de R$ 4.000,00 (quatro mil reais) pelos danos morais causados, com juros de 1% (um por cento) ao mês, contados da citação, e correção monetária, contados a partir da data da leitura de sentença. Dou pela extinção do processo com resolução do mérito, na forma do artigo 487, I, do Código de Processo Civil. 

Deverá a ré efetuar o pagamento do montante da condenação no prazo de 15 dias, após o trânsito em julgado, sob pena de multa de 10% (dez por cento) sobre o valor, independentemente de intimação, nos moldes do art. 523, §1ª do CPC.

Sem ônus de sucumbência em razão do disposto no artigo 55 da Lei nº 9.099/95.

Projeto de sentença sujeito à homologação pela MM. Juíza de Direito, com base no art. 40 da Lei nº 9099/95.

Rio de Janeiro, 14 de junho de 2016.


ANDRÉA LUCIA DUARTE DOS SANTOS
JUIZA LEIGA";00049BED34FF51B1F4E2FB436998B91249D8C5051048141C;0004FBA399DC5A88BD79F1C77E9A03E83183C5050214202A;2016.001.110690-0;0.5231630802154541
25;2016.001.265830-7;Tendo em vista fls. 142, acolho a impugnação à impugnação , extinguindo a execução. Sem custas e sem honorários. Transitado em julgado expeça-se mandado de pagamento em favor do autor quanto ao valor depositado e em favor do réu quanto ao valor penhorado. Após, dê-se baixa e arquive-se.;00049BED34FF51B1F4E2FB436998B91249D8C5051048141C;0004FBA399DC5A88BD79F1C77E9A03E83183C5050214202A;2016.001.110690-0;0.5231630802154541
