;processo;sentenca;similar_file;similar_init;similar_processo;similaridade
24;2016.001.051037-4;"Dispensado o relatório, nos termos do artigo 38, da Lei 9099/95, PASSO A DECIDIR.

O autor comprovou que comprou através da primeira ré (decolar) pacote para viajar de RIO DE JANEIRO A PUNTA DEL LESTE (fls. 19/21). Contudo, o voo foi cancelado por suposto (fls. 26). Alega o autor que buscou providencias das empresas rés, que nada fizeram. Tendo em vista a negativa administrativa das rés em ressarcir suas despesas, requer a condenação ao pagamento de indenização por danos materiais no valor total de R$7.673,92 relativo ao pacote, aluguel do carro e duas viagens de taxi. 
Já os réus não trouxeram aos autos qualquer fato impeditivo ou modificativo do direito do autor. A primeira ré arguiu preliminar de ilegitimidade passiva aduzindo ser mera intermediária. No mérito sustenta que nos termos da compra há previsão expressa de que a decolar não se responsabiliza por cancelamento de voo. Já a segunda ré se limitou a invocar mau tempo.
Inicialmente afasto a preliminar arguida, isso porque as rés integram a cadeia de consumo pelo que respondem solidariamente. 
 Além disso, a empresa aérea sequer cumpriu sua obrigação de realocar o autor em outro voo com horário próximo nem tampouco as rés devolveram os valores gastos com a viagem que não se concretizou. Assim, restou configurada a falha na prestação do serviço.
É devida a indenização dos danos materiais no valor de R$7.533,92 que foram comprovados às fls. 19/22. Contudo, deixo de considerar como dano material o valor gasto pelo autor com taxi já que não foi efetivamente comprovado. 
Reconheço, ainda a indenização por danos morais in re ipsa, ou seja pela mera ocorrência do fato danoso, já que foi frustrada a legítima expectativa do autor em ter um serviço prestado de forma eficiente, segura e adequada pelos réus. 
A fixação do quantum indenizatório deve ser pautada pelo bom senso e sopesar os fatos praticados pela parte ré contra a parte autora, cabendo, ainda, a observância dos princípios da razoabilidade, proporcionalidade e vedação ao enriquecimento sem causa. À luz de tais critérios, entendo que a quantia de R$ 5.000,00 é necessária e suficiente para compensar o abalo moral sofrido.
Isto posto, JULGO PARCIALMENTE PROCEDENTE os pedidos para CONDENAR os réus, solidariamente, a pagar ao autor a titulo de danos materiais quantia de R$7.533,92 (sete mil quinhentos e trinta e tres reais e noventa e dois centavos) monetariamente corrigida a contar da presente e acrescida de juros legais de 1% a/m (um por cento ao mês) a contar do desembolso; bem como a titulo de danos morais quantia de R$5.000,00 (cinco mil reais), monetariamente corrigida a contar da presente e acrescida de juros legais de 1% a/m (um por cento ao mês) a contar da citação. 
		Sem custas e honorários, por força do disposto no artigo 55 da Lei Especial.
Rio de Janeiro, 25 de julho de 2016

JULIANA CORREIA GOMES
JUÍZA LEIGA

Submeto o projeto de sentença à homologação da Dra. Juíza de Direito, na forma do art. 40 da Lei 9.099/95.";00049B96398B102EA69720568E817C680DDEC50513454429;0004563292E3BEECF99021EE03B439886893C50504063C06;2016.001.091751-6;0.5433075428009033
25;2016.001.051037-4;"RETIFICO, DE OFÍCIO, O ERRO MATERIAL CONSTANTE DO DISPOSITIVO DO PROJETO DE SENTENÇA, PARA CONSTAR QUE: ""...pagar ao autor a título de danos materiais, a quantia de R$ 7.533,92 (sete mil quinhentos e trinta e tres reais e noventa e dois centavos) monetariamente corrigida a contar do efetivo desembolso e acrescida de juros legais de 1% a/m (um por cento ao mês) a contar da citação..."".

Homologo, por sentença, para que surta seus efeitos legais, o projeto de sentença elaborado pelo juiz leigo, na forma do artigo 40 da Lei nº 9.099/95.  

Em caso de depósito judicial referente à condenação, expeça-se mandado de pagamento, independentemente de nova conclusão.  

Caso haja valor remanescente a ser recebido, manifeste-se o credor em 7 dias, sob pena de arquivamento dos autos. Após o trânsito em julgado, tratando-se de sentença de improcedência ou de extinção do feito sem resolução do mérito, dê-se baixa e arquivem-se imediatamente.  

Tratando-se de sentença de procedência, após o trânsito em julgado e o decurso do prazo de 15 dias para pagamento espontâneo do valor da condenação previsto no art. 523 do NCPC c/c o entendimento consolidado no enunciado nº 13.9.1 do Aviso nº 23/2008 do TJERJ, aguarde-se por mais 7 dias a manifestação das partes e, em seguida, caso permaneçam em silêncio, proceda-se a baixa e ao arquivamento.  

FICAM AS PARTES CIENTES DE QUE A NOVA SISTEMÁTICA DE CONTAGEM DE PRAZO ESTABELECIDO NO ART. 219 DO NCPC/2015 NÃO SE APLICA AOS JUIZADOS ESPECIAIS CÍVEIS, CONSOANTE NOTA TÉCNICA 01/2016 DO FONAJE DE 04/03/2016, COMPUTANDO-SE OS PRAZOS EM DIAS CORRIDOS, ASSIM PROCEDENDO COM A FINALIDADE PRECÍPUA DE SE ALCANÇAR A BOA GESTÃO CARTORÁRIA COM FUNDAMENTO NO PRINCÍPIO DA CELERIDADE QUE REGE A LEI 9.099/95.   

Cumpridas as formalidades legais, dê-se baixa e arquivem-se os autos.";00049B96398B102EA69720568E817C680DDEC50513454429;0004563292E3BEECF99021EE03B439886893C50504063C06;2016.001.091751-6;0.5433075428009033
26;2016.001.051037-4;HOMOLOGO, por sentença, o ACORDO celebrado às fls. e, em consequência, JULGO EXTINTO O PROCESSO, com resolução do mérito, nos moldes do art. 487, III, do NCPC. Retiro o feito de pauta. Sem custas. Com o trânsito em julgado, arquivem-se.;00049C3263331D76BB61A51A68004FC45120C505030C3A03;0004CC012D54012988D670A088D814B14646C504441A5918;2016.001.060960-3;0.5330836176872253
27;2016.001.051037-4;"ESTADO DO RIO DE JANEIRO
PODER JUDICIÁRIO
V JUIZADO ESPECIAL CÍVEL DA COMARCA DA CAPITAL

Processo nº 0025655-10.2016.8.19.0001
Autor: IGOR MOREIRA MATOS
Réu: AZUL LINHAS AÉREAS BRASILEIRAS S/A



PROJETO DE SENTENÇA

Dispensado o relatório na forma do artigo 38 da Lei n0 9099/95.
			Alega a parte Autora, em resumo, que adquiriu passagem aérea pra Florianópolis, com conexão em Campinas. Que na cidade de Campinas o voo foi cancelado, tendo o Autor pego um voo para Navegantes, sob a promessa da Ré que disponibilizaria o transporte para Florianópolis. Afirma que a Ré não providenciou o translado. Informa que chegou no destino com 6 horas de atraso. Requer indenização por dano moral.
			Analisando os autos, constata-se a existência de relação de consumo a ensejar a aplicação da Lei n0 8078/90.
		A Ré alega que o cancelamento do voo ocorreu por problemas mecânicos na aeronave, o que caracteriza falha na prestação do serviço, onde os riscos do empreendimento devem ser enquadrados como fortuito interno, que não exonera a responsabilidade do fornecedor, devendo ser responsabilizada pelos danos causados a Autora na forma do artigo 6, VI do CDC.
Assim, não há dúvida da ocorrência de dano moral, diante do cancelamento do voo de Campinas para Florianópolis e da falsa promessa de translado da cidade de Navegasntes para o destino escolhido pelo Autor, o que consolida o dano moral de forma in re ipsa, diante dos aborrecimentos e  sentimentos de intranquilidade, angústia, ansiedade, agonia e impotência, sendo certo que tais sentimentos violaram direito da personalidade da autora, a merecer a compensação adequada pelos danos morais.

Assim, com relação ao quantum a ser pago, devem ser consideradas as características e condições do ofensor, a extensão do dano, bem como as do ofendido, devendo-se atentar mais ao caráter punitivo-pedagógico, razão pela qual entendo que, no presente caso, a quantia deve ser de R$4.000,00 (sete mil reais).
	
	Isso posto, JULGO PROCEDENTE o pedido para condenar a Ré a pagar a Autora, a quantia de R$4.000,00 (quatro mil reais), a título de dano moral, com correção monetária contado da data designada para leitura desta sentença e juros de mora de 1% ao mês, a contar da citação.
Sem custas e honorários.

Nos termos do artigo 40 da Lei n0 9099/95, submeto o presente projeto de sentença à homologação pela MM. Juíza de Direito.



Maria Fernanda Miranda Lyra
Juíza Leiga";000484F3DF79058A8437392B77172F41C3F1C5045A602E4D;0004847289CE85B20737F5FFAC2038676559C50449632820;2016.001.020491-3;0.527538001537323
28;2016.001.051037-4;"Homologo, por sentença, para que surta seus efeitos legais, o projeto de sentença elaborado pelo juiz leigo, na forma do artigo 40 da Lei nº 9.099/95. 

Em caso de depósito judicial referente à condenação, expeça-se mandado de pagamento, independentemente de nova conclusão. 

Caso haja valor remanescente a ser recebido, manifeste-se o credor em 7 dias, sob pena de arquivamento dos autos. Após o trânsito em julgado, tratando-se de sentença de improcedência ou de extinção do feito sem resolução do mérito, dê-se baixa e arquivem-se imediatamente. 

Tratando-se de sentença de procedência, após o trânsito em julgado e o decurso do prazo de 15 dias para pagamento espontâneo do valor da condenação previsto no art. 523 do NCPC c/c o entendimento consolidado no enunciado nº 13.9.1 do Aviso nº 23/2008 do TJERJ, aguarde-se por mais 7 dias a manifestação das partes e, em seguida, caso permaneçam em silêncio, proceda-se a baixa e ao arquivamento. 

FICAM AS PARTES CIENTES DE QUE A NOVA SISTEMÁTICA DE CONTAGEM DE PRAZO ESTABELECIDO NO ART. 219 DO NCPC/2015 NÃO SE APLICA AOS JUIZADOS ESPECIAIS CÍVEIS, CONSOANTE NOTA TÉCNICA 01/2016 DO FONAJE DE 04/03/2016 C/C A PRIMEIRA PARTE DO ENUNCIADO 86 TAMBÉM DO FONAJE, COMPUTANDO-SE OS PRAZOS EM DIAS CORRIDOS, ASSIM PROCEDENDO COM A FINALIDADE PRECÍPUA DE SE ALCANÇAR A BOA GESTÃO CARTORÁRIA COM FUNDAMENTO NO PRINCÍPIO DA CELERIDADE QUE REGE A LEI 9.099/95.";000484F3DF79058A8437392B77172F41C3F1C5045A602E4D;0004847289CE85B20737F5FFAC2038676559C50449632820;2016.001.020491-3;0.527538001537323
29;2016.001.051037-4;"LUCAS CARDOSO NAVES ingressou com a presente ação de indenização em face da AZUL LINHAS AÉREAS BRASILEIRAS S/A alegando, em síntese, que adquiriu da ré passagens aéreas. Ocorre que solicitou a alteração da data e foi surpreendido posteriormente com a verificação de que as passagens haviam sido canceladas. Requereu, assim, ao final a procedência do pedido, com a condenação da ré ao pagamento de danos materiais e morais. 
Contestação do réu, conforme termo dos autos, com preliminar de falta de inépcia e no mérito alegou que o cancelamento das passagens ocorreu através do acesso ao website da ré com o uso dos dados pessoais do autor. Nega a ré qualquer ingerência sobre a questão, para requerer a improcedência.
Afasto a preliminar de inépcia da inicial, pois a peça de ingresso preenche minimamente os requisitos do CPC.
A relação existente entre as partes é de consumo, razão pela qual se aplica o disposto no CDC especialmente no que concerne à boa-fé, o direito do consumidor à informação, a proteção do consumidor contra práticas abusivas, o dever do fornecedor de solucionar o vício do serviço/produto no prazo de 30 dias, etc.
Acrescente-se ainda a este rol o disposto no art. 6º, VIII do CDC que estabelece a inversão do ônus da prova em caso de verossimilhança das alegações ou hipossuficiência da parte. 
Alega a autora que adquiriu passagens aéreas, posteriormente canceladas sem sua solicitação. Os documentos anexados na inicial, não contraditados pela ré, provam as assertivas autorais. 
O réu por sua vez afirma que as alterações foram realizadas através do cadastro da parte autora.
Entretanto, as provas produzidas pelo o réu nesse sentido são apenas documentos inidôneos, pois produzidos unilateralmente.
Patente, portanto, a responsabilidade civil objetiva da ré e ausente excludente da causalidade.
A devolução deve se dar na forma simples, pois se está diante de mero caso de inexecução contratual.
Quanto ao dano moral, nestas hipóteses penso estar presente, diante da recalcitrância da ré em solucionar a questão na esfera administrativa, obrigando o autor a ingressar em Juízo, com presumida frustração para o consumidor.
Por ""dano moral"", compreende-se ""a dor, o espanto, a emoção, a vergonha, a injúria física e moral, a dolorosa sensação experimentada pela vítima"" (AGUIAR DIAS), ou seja, são aqueles resultados do ato ilícito que apenas ofendem bens jurídicos, notadamente relacionados à personalidade e ao corpo, sem prejuízo material, ou ainda, no conceito de WILSON MELLO DA SILVA (""O dano moral e sua reparação"", n. 157, 3a. ed.,1965): ""Danos morais são lesões sofridas pelo sujeito físico ou pessoa natural de direito em seu patrimônio ideal, entendendo-se por patrimônio ideal, em contraposição a patrimônio material, o conjunto de tudo aquilo que não seja suscetível de valor econômico.""
A argumentação de que inexiste prova do dano moral deita por terra, quando se sabe que este, exatamente por não corresponder a um resultado concreto, como o dano material, é freqüentemente presumido, pela análise do que de ordinário acontece, face ao que ocorre em casos semelhantes, cuja aplicação justifica-se à falta de norma expressa que regule a conceituação e mensuração do dano moral e ainda diante da inversão do ônus da prova, pela aplicação do artigo 6º, VIII, da lei 8.078/90 ao caso, pela qual caberia à ré provar, pelos meios lícitos, que tal não ocorreu.
	Tal prova, contudo, não foi feita, pelo que é afastada a argumentação da demandada.
	Resta, portanto, a verificação do quantum da indenização, que deve considerar o caráter dúplice da indenização por dano moral: um, de ""cunho punitivo"", para sancionar-se o indivíduo ou a pessoa jurídica responsável objetivamente pelo ato ilícito que praticou, para que, assim, não cometa mais tão grave ilícito com outras pessoas e, outro, de ""cunho compensatório"", destinado à vítima, para que receba uma soma que lhe proporcione prazeres como contrapartida do mal sofrido. (CAIO MÁRIO DA SILVA PEREIRA, ""Responsabilidade Civil"", Forense, pg. 55, 5a ed.,1994).
Assim sendo, entendemos pela utilização dos critérios acima referidos que, quanto ao primeiro aspecto do dano moral, o valor pleiteado na inicial é demasiado, devendo ser fixado em R$ 3.000,00 (três mil reais).

FACE AO EXPOSTO, JULGO PARCIALMENTE PROCEDENTE O PEDIDO, para CONDENAR a ré a pagar à parte autora, a título de dano material, o valor de R$1.559,30, acrescido de correção monetária do desembolso e juros de mora de 1% ao mês da citação e declaro extinto o feito com resolução de mérito e a pagar à parte autora, a título de dano moral, o valor de R$3.000,00, acrescido de correção monetária do desembolso e juros de mora de 1% ao mês da citação e declaro extinto o feito com resolução de mérito com fulcro no art. 487, I do CPC. Sem custas e honorários, pois em sede de JEC. Após o trânsito em julgado, dê-se baixa e arquive-se.";000420D91122D4C03A2761D1656753AD6B17C50556045449;0004F01F9045855B2C6D477C2BD62597A6F7C505350C6128;2016.001.335103-9;0.5238297581672668
30;2016.001.051037-4;"
Processo 0349663-75.2016.2016.8.19.0001

AUTORES: PEDRO PAULO RIOS VIEIRA DOS SANTOS e ADRIANA DE MESQUITA BOUGLEUX - (Adv. Gabriela Bezerra Bento, OAB 109818)
RÉU: AZUL LINHAS AÉREAS BRASILEIRAS S.A - (Adv. Angela dos Santos, OAB 80957)
Representante: Lusinete Maria dos Santos. 
	

TERMO DE AUDIÊNCIA 
Ao terceiro dia do mês de fevereiro de 2016, na sala de audiências do VI Juizado Especial Cível, em sessão presidida pelo Juiz MAURO NICOLAU JÚNIOR, feito o pregão, às 10h45min, compareceram as partes e advogados conforme acima mencionado. Proposta a conciliação esta restou infrutífera tendo a parte ré se reportado à contestação já apresentada por meio eletrônico da qual teve vista a parte contrária. Encerrada a fase probatória visto que as partes afirmaram a inexistência de outras provas a produzir, em alegações finais os doutos patronos se reportaram à inicial e contestação. A seguir pelo MM. Juiz foi proferida a seguinte SENTENÇA: PEDRO PAULO RIOS VIEIRA DOS SANTOS e ADRIANA DE MESQUITA BOUGLEUX ajuizaram ação indenizatória por danos morais e materiais contra AZUL LINHAS AÉREAS BRASILEIRAS S.A. Registra que os autores adquiriram, junto à Ré, bilhetes de viagem do voo 2884 de Recife para Parnaíba, em 30/07/16, às 12:20 horas. Que o destino final dos autores serio Chaval, no interior do Ceará. Informa que o carrinho de bebe que levavam, jamais chegou até os autores. Que o carrinho foi encontrado no setor dentro de um saco plástico sem etiqueta, o setor de triagem. Que teve que carregar seu filho no colo durante a viagem, por uma semana, e por conta disso quedou-se enferma. Que a ré em nenhum momento sugeriu alternativa para o caso. Requer: 
I - A citação da ré
II - A inversão do ônus da prova; 
III - A condenação da ré ao pagamento de danos morais no importe de 40 salários mínimos mais 20% de honorários advocatícios, em caso de Recurso;
Passagem às fls. 26/28; certidão de nascimento a fls. 29; registro de irregularidade de bagagens às fls. 30/33; declaração medica a fls. 34. 
Citação e Intimação a fls. 38. Contestação às fls. 41/63, alega, em sede preliminar, a incompetência dos juizados especiais cíveis para julgar a presente demanda, tendo em vista a necessidade de perícia. No mérito, impugna o registro de irregularidade de bagagem realizado pelos autores, pois não há qualquer informação do tipo, muito menos que o carrinho chegou a ser despachado ou que possuía a etiqueta (TAG) de bagagem. Ao que tange a alegação do carrinho não possuir etiqueta de bagagem, esclarece que não houve apresentação do carrinho no check-in razão pela qual não constou a etiqueta. Que após realizar busca pelo carrinho o mesmo foi encontrado, tendo a ré enviado no dia 06.08.2016. Justifica a demora no envio do carrinho em razão da ausência de voo para a localidade dos autores. Audiência de conciliação realizada a fls. 80, na qual a ré ofertou a proposta de R$ 1.000,00 para cada autor, tendo como contra posposta o valor de R$ 5.000,00, a qual restou infrutífera. É O RELATÓRIO. DECIDO. A ré recebeu o carrinho de bebê dos autores na condição de depositário para transporta-lo para o mesmo destino dos autores que, no entanto, por motivo não justificado, acabou se extraviando e só lhes foi entregue após uma semana. Por tais motivos JULGO PROCEDENTE o pedido contido na peça preambular para condenar a ré ao pagamento do valor de R$ 5.000,00 a cada um dos autores, com juros de mora de 1% ao mês desde a citação e correção monetária a partir desta data. Intimados em audiência, registre-se e cumpra-se. Certificados o trânsito em julgado e a inexistência de custas a recolher dê-se baixa e arquive-se. Nada mais havendo a ser consignado considerando que as partes e seus patronos afirmaram a inexistência de dúvidas ou impugnações quanto ao conteúdo da presente ata foi a audiência encerrada as 11:22 horas. 

MAURO NICOLAU JUNIOR
Juiz de Direito";00040B64E97773B263C4A0907A3E7FFF1758C50562035C28;00041903F4B47CE2927A565BAED9E5FF1F09C505122E560F;2016.001.302229-9;0.5203954577445984
