;processo;sentenca;similar_file;similar_init;similar_processo;similaridade
13;2016.001.172291-9;"Homologo, por sentença, para que surta seus efeitos legais, o projeto de sentença elaborado pelo juiz leigo, na forma do artigo 40 da Lei nº 9.099/95.  

Em caso de depósito judicial referente à condenação, expeça-se mandado de pagamento, independentemente de nova conclusão.  

Caso haja valor remanescente a ser recebido, manifeste-se o credor em 7 dias, sob pena de arquivamento dos autos. Após o trânsito em julgado, tratando-se de sentença de improcedência ou de extinção do feito sem resolução do mérito, dê-se baixa e arquivem-se imediatamente.  

Tratando-se de sentença de procedência, após o trânsito em julgado e o decurso do prazo de 15 dias para pagamento espontâneo do valor da condenação previsto no art. 523 do NCPC c/c o entendimento consolidado no enunciado nº 13.9.1 do Aviso nº 23/2008 do TJERJ, aguarde-se por mais 7 dias a manifestação das partes e, em seguida, caso permaneçam em silêncio, proceda-se a baixa e ao arquivamento.  

FICAM AS PARTES CIENTES DE QUE A NOVA SISTEMÁTICA DE CONTAGEM DE PRAZO ESTABELECIDO NO ART. 219 DO NCPC/2015 NÃO SE APLICA AOS JUIZADOS ESPECIAIS CÍVEIS, CONSOANTE NOTA TÉCNICA 01/2016 DO FONAJE DE 04/03/2016, COMPUTANDO-SE OS PRAZOS EM DIAS CORRIDOS, ASSIM PROCEDENDO COM A FINALIDADE PRECÍPUA DE SE ALCANÇAR A BOA GESTÃO CARTORÁRIA COM FUNDAMENTO NO PRINCÍPIO DA CELERIDADE QUE REGE A LEI 9.099/95.   

Cumpridas as formalidades legais, dê-se baixa e arquivem-se os autos.";00047634F82CB4718541B70AA959015080A5C505022F563E;0004EE4F7FB9DCAA90EDF53A836ECF24BFB9C5050C54415E;2016.001.049050-8;0.7727538347244263
14;2016.001.172291-9;"Dispensado o relatório, na forma do art. 38, da Lei 9.099/95. Decido. 
HOMOLOGO o projeto de sentença elaborado pelo Juiz Leigo, que passa a valer como fundamentação deste, com fulcro, na Lei Estadual nº 4578/05 e na Resolução nº 08/05 do E. Órgão Especial do TJRJ, e RESOLVE-SE o mérito, com base no art. 487, I, do NCPC. 
Publique-se. Aguarde-se a data designada para a leitura de sentença.
Após, certificado o trânsito em julgado e comprovado o depósito, no prazo devido, expeça-se mandado de pagamento, independente de nova conclusão. 
Nada mais havendo, dê-se baixa e arquive-se.";000479E94ABDB4637A23922EE77C8ACC7E8BC50552462F5C;000478735171C09DDEF55D92C6755E6C1F5FC5050F59150C;2016.063.010170-3;0.7685225009918213
15;2016.001.172291-9;"Dispensado relatório nos termos do artigo 38, da Lei nº 9.099/95. 

Trata-se de ação indenizatória ajuizada por EDUARDO JOSE SILVA MATTOS em face de BANCO ITAUCARD S/A e PAGSEGURO INTERNET LTDA. Alega a parte autora, em síntese que: a) é titular dos cartões de crédito n° 5489.xxxx.xxxx.4422 e 5267.xxxx.xxxx.9739; b) em 16/09/2016 abasteceu a moto no valor de R$ 15,00 pago por meio do cartão de crédito nº 5489.xxxx.xxxx.4422, porém, na fatura com vencimento em 18/10/2016 a cobrança foi lançada em duplicidade; c) no dia 17/09/2016 abasteceu novamente a moto no valor de R$ 25,00 pago por meio do cartão de crédito nº 5267.xxxx.xxxx.9739, porém, na fatura com vencimento em 15/10/2016 a cobrança também foi lançada em duplicidade; d) o pagamento no dia 17/09/2016 tinha sido inicialmente no cartão de credito nº 5489.xxxx.xxxx.4422, mas segundo o frentista a operação não tinha sido concluído, motivo pelo qual, utilizou o outro cartão, contudo, a cobrança foi lançada na fatura. Pleiteia a restituição em dobro do valor pago, bem como, indenização por danos morais.

Em contestação, os réus alegam, preliminarmente ilegitimidade passiva, e no mérito, ambos pugnam pela improcedência, em sua totalidade, dos pedidos autorais.

Com relação à preliminar de ilegitimidade passiva dos réus, tal matéria insere-se no mérito, motivo pelo qual será conjuntamente com este enfrentada. Portanto, considerando a confusão, tal preliminar deve ser rechaçada e não deve ser analisada antes e fora do mérito, passando a ser verificada adiante.

Não restando mais nenhuma preliminar, passo à análise do mérito.

Inicialmente cabe esclarecer que o caso em tela consiste numa relação de consumo. Essa conclusão depreende-se da jurisprudência do STJ que entende aplicável a Lei 8.078/90 toda vez que uma das partes do contrato, independentemente de ser pessoa física ou jurídica, for vulnerável em relação à outra parte (o fornecedor). Assim, diante da configuração da hipossuficiência da autora, é cabível a inversão do ônus da prova, conforme estabelece o artigo 6º, VIII, do CDC.

Compulsando os autos, verifica-se às fls. 11 a cobrança em duplicidade do valor de R$ 15,00 e a cobrança de um único valor de R$ 25,00, todos referente ao posto de gasolina. Já às fls. 12 consta a cobrança em duplicidade do valor de R$ 25,00 no mesmo dia dessa cobrança no outro cartão (fls. 11). Às fls. 137 o 2º réu comprova que recebeu do 1º réu e repassou para o posto de gasolina os dois pagamentos no valor de R$ 15,00, todavia, às fls. 141 o 2º réu demonstra que somente recebeu do 1º réu e repassou para o posto de gasolina um pagamento do valor de R$ 25,00. Assim, o 2º réu somente é responsável solidário pela cobrança em duplicidade do valor de R$ 15,00.

Nesse contexto, cabia às rés comprovarem a legitimidade da cobrança, ônus do qual não se desincumbiu. Desse modo, é inquestionável a falta contratual perpetrada pela empresa ré ao cobrar da parte autora valores indevidos, configurando-se em falha na prestação do serviço, cujas consequências deve a ré suportar, por conta dos riscos do empreendimento.

Dessa feita, há que se acolher o pleito autoral, de modo a condenar as empresas rés à devolução em dobro dos valores cobrados indevidamente, a tal título, nos termos do artigo 42, parágrafo único do CDC.

No que tange ao pedido de indenização extrapatrimonial, formulado pela autora, deve tal pedido ser acolhido, haja vista que a conduta da ré impôs à reclamante o dispêndio de energia física e moral para solução da questão, diligenciando junto à ré, inutilmente, e esse sofrimento deve ser recomposto. 

A não solução do vício do serviço contratado, sem ônus à autora, ademais das infrutíferas tentativas de solução pacífica do problema diretamente junto ao réu, causaram, sem qualquer dúvida, constrangimento e angústia à parte autora.

Assim sendo, configurado está o dano moral, devendo ser acolhido o pedido de indenização extrapatrimonial pleiteado pela autora, evidenciado pelo próprio fato. Conforme lição do Desembargador SÉRGIO CAVALIERI FILHO ""o dano moral existe in re ipsa"", ou seja, ""está ínsito na própria ofensa, decorre da gravidade do ilícito em si"" (Programa de Responsabilidade Civil, 2ª ed., Malheiros, p. 80).

No que tange a fixação do quantum debeatur, não resultou comprovado qualquer prejuízo moral de natureza extraordinária que justifique o excessivo valor pleiteado. No tocante à sua quantificação, deve o julgador pautar-se pelo princípio da lógica do razoável, sem esquecer do caráter punitivo e inibidor da reincidência que deve revestir dita condenação, sem que tal medida sirva também de fator de legitimação do enriquecimento sem causa. Destarte, com base em tais premissas, entende este julgador por fixar o valor da indenização devida pela requerida ao requerente em R$ 1.500,00 (hum mil e quinhentos reais).

Pelo exposto, resolvo o mérito na forma do artigo 487, I do CPC, e JULGO PROCEDENTE os pedidos autorais para: 
1.	condenar os réus, solidariamente, ao pagamento do valor de R$ 30,00 (trinta reais), calculado como devolução em dobro, corrigido, monetariamente, desde a data do desembolso e acrescido de juros de 1% ao mês, a partir da citação;
2.	condenar o 1º réu ao pagamento do valor de R$ 100,00 (cem reais), calculado como devolução em dobro, corrigido, monetariamente, desde a data do desembolso e acrescido de juros de 1% ao mês, a partir da citação;
3.	condenar os réus, solidariamente, a pagarem ao autor a quantia de R$ 1.500,00 (hum mil e quinhentos reais), a título de compensação por danos morais, acrescido de correção monetária a contar da presente sentença (Súmula 362 do STJ), e juros de mora de 1% ao mês, estes a incidir da data da sentença.

Sem custas e honorários advocatícios conforme artigo 55 da Lei 9.099/95.

Publique-se. Registre-se. Intimem-se.";000479E94ABDB4637A23922EE77C8ACC7E8BC50552462F5C;000478735171C09DDEF55D92C6755E6C1F5FC5050F59150C;2016.063.010170-3;0.7685225009918213
16;2016.001.172291-9;"Processo nº: 0031869-75.2016.8.19.0208
Parte Autora: Ana Carolina de Souza Dutra Avila
1ª Ré: Marisa Lojas Varejista 
2ª Ré: Banco Itaucard



Projeto de Sentença



Dispensado o relatório nos termos do art. 38 da Lei n° 9.099/95, passo a decidir.

Inicialmente, deve ser extinto o processo, sem resolução do mérito, com relação ao pedido de devolução da quantia paga título de juros, tendo em vista que já foi realizado o estorno, assim, houve perda superveniente do objeto.

Rejeito a preliminar de ilegitimidade passiva suscitada pelas Rés, eis que as condições da ação são aferidas à luz dos fatos narrados na petição inicial, com base nos ditames da Teoria da Asserção, através do exercício de um juízo de admissibilidade hipotético. Desta forma, considerando-se os fatos narrados na petição inicial, verifica-se que se encontra presente a pertinência subjetiva da lide, eis que a existência de responsabilidade civil das Rés constituem o próprio mérito da causa.

Inexiste outra preliminar a dirimir, razão pela qual, reconhecendo a existência dos pressupostos processuais e das condições de regular desenvolvimento acionário, passo ao exame do mérito.

Cabe destacar que a relação jurídica entre as partes é de consumo, já que estão presentes os requisitos subjetivos (consumidor e fornecedor ¿ artigos 2o e 3o da Lei 8078/90) e objetivos (produto e serviço ¿ §§ 1o e 2o do artigo 3º da citada lei) de tal relação. 

No caso vertente, a parte Autora afirma que efetuou compras na loja da 1ª Ré, no valor de R$129,97, parcelado em 03 prestações de R$43,32, sem juros, no seu cartão de credito administrado pela 2ª Ré. Todavia, afirma que na fatura do cartão consta a cobrança de juros com a parcela. Afirma que entrou em contato com a Ré, mas as três parcelas foram cobradas no valor de R$49,66.

Em AIJ, a parte Autora afirma que a 2ª Ré já realizou o estorno do valor de R$19,01, cobrado a título de juros.

Cumpre esclarecer, que a restituição deve ser feita de forma simples, como já realizada, uma vez não configurada a hipótese de pagamento indevido, nos termos do parágrafo único do art. 42 do CDC. 

No que pertine ao pedido de compensação por danos morais, salienta-se que o mero inadimplemento contratual não configura por si só dano moral, visto não agride a dignidade humana. 

Neste sentido, verifico que inexiste nos autos qualquer prova de que a conduta da Ré haja, de forma real e concreta, imposto a parte Autora extraordinária dor, vexame ou humilhação, nem tampouco extremada ofensa à sua dignidade e honra, de forma a ensejar o advento do dano moral indenizável. 
A este respeito, releva notar que meros dissabores ou aborrecimentos cotidianos, inerentes à vida moderna, não constituem fato gerador do prejuízo extrapatrimonial passível de ensejar a obrigação de indenizar. 

Entendo, pois, incabível a pretensão autoral de compensação por danos morais, uma vez que, do relato contido na petição inicial, não se deflui a existência de qualquer lesão à sua honra ou a outro bem integrante de sua personalidade.



A conta do acima exposto, 


JULGO EXTINTO O PROCESSO, sem resolução do mérito, com relação ao pedido de devolução da quantia paga a título de juros, por perda superveniente do objeto.


JULGO IMPROCEDENTES os demais pedidos autorais.
Sem custas e honorários vez que em sede de Juizado Especial Cível, conforme disposto no artigo 55 da lei 9.099/95.
 

	Certificado o trânsito em julgado e não havendo novas manifestações no prazo de 15 (quinze) dias, dê-se baixa e arquivem-se. Cientes as partes de que decorridos 90 dias da data do arquivamento definitivo os autos processuais serão eliminados, nos termos do artigo 1º do Ato Normativo Conjunto 01/2005, publicado no DORJ de 07/01/05.
	

Projeto de sentença sujeito à homologação, assim, remeto os autos ao MM. Juiz Togado, nos termos do artigo 40 da Lei nº 9.099/95.


Rio de Janeiro, 20 de Março de 2017.


VANESSA DE SOUZA BRISIS
Juíza Leiga";0004CE8152A4ABBBBE09D7C6D9C87D5D679DC50602583A4C;00046FC8A1F372BB0A6FC46DFC109E6F9812C5052C55282B;2016.208.031493-6;0.7622085809707642
17;2016.001.172291-9;Homologo por sentença na forma do artigo 40 da Lei nº 9.099/95 o Projeto de Sentença elaborado pelo Juiz Leigo. PRI. Certifique-se o trânsito em julgado. Defiro desde já, se for o caso, independente de nova conclusão e havendo quitação da parte Autora, a expedição de mandado de pagamento. Após, dê-se baixa e arquivem-se.;0004CE8152A4ABBBBE09D7C6D9C87D5D679DC50602583A4C;00046FC8A1F372BB0A6FC46DFC109E6F9812C5052C55282B;2016.208.031493-6;0.7622085809707642
18;2016.001.172291-9;"Dispensado o relatório, na forma do art. 38, da Lei 9.099/95. Decido. 
HOMOLOGO o projeto de sentença elaborado pelo Juiz Leigo, que passa a valer como fundamentação deste, com fulcro, na Lei Estadual nº 4578/05 e na Resolução nº 08/05 do E. Órgão Especial do TJRJ, e RESOLVE-SE o mérito, com base no art. 487, I, do NCPC. 
Publique-se. Aguarde-se a data designada para a leitura de sentença.
Após, certificado o trânsito dê-se baixa e arquive-se.";0004F4805B6DCF5144DC7CFB4DC7A7628B69C50603084509;0004B7FF4CEBA289076A932B44BB97CB72F9C5050D263A1F;2016.063.012769-8;0.7606638073921204
19;2016.001.172291-9;"	Dispensado o relatório na forma do artigo 38 da Lei 9.099/95, decido.
	A parte autora alega falha na prestação do serviço, uma vez que o réu lhe cobrou encargos por ter atrasado apenas dois dias o pagamento da fatura. Em contestação, o réu afirma que a cobrança foi decorrente da mora do consumidor, pelo que requer a improcedência dos pedidos.
	Estando presentes as condições da ação e os pressupostos de constituição e desenvolvimento regular do processo, passo a decidir o mérito. 
	O Código de Defesa do Consumidor, visando prover um maior equilíbrio nas relações de consumo - face a reconhecida vulnerabilidade do consumidor - criou uma série de normas protetivas. Dentre tais normas, está presente a possibilidade de inversão do ônus da prova em favor do consumidor, uma forma de facilitar defesa deste no processo. 
	Todavia, para que o Magistrado proceda com a inversão do ônus da prova, não basta que a lide sob exame advenha de uma relação de consumo. Isso porque a inversão do ônus da prova não é direito subjetivo do consumidor, mas sim uma possibilidade processual, condicionada à hipossuficiência ou à verossimilhança de suas alegações, apreciadas de acordo com o prudente arbítrio do magistrado. 
	Após uma detida análise dos elementos apresentados nos autos, conclui-se que não estão presentes os requisitos mínimos para a concessão da inversão do ônus da prova. No tocante a verossimilhança, se faz necessário que a parte autora apresente um mínimo de demonstração no sentido de que sua alegação é verossímil. Deve oferecer elementos, dados, ou indícios quaisquer que, em confronto com a narração das circunstâncias de que dá conta a inicial, possam induzir a um ´quê´ de verdade. Nesse sentido, a súmula 330 do TJRJ, in verbis:

	Nº. 330 ""Os princípios facilitadores da defesa do consumidor em juízo, notadamente o da inversão do ônus da prova, não exoneram o autor do ônus de fazer, a seu encargo, prova mínima do fato constitutivo do alegado direito.""

	 No caso em tela, a parte autora não logrou êxito em comprovar a ocorrência dos fatos como apresentados. De fato, a parte autora não carreou aos autos nenhuma prova ou indício capaz de evidenciar a existência de defeito imputável ao réu. 
	Isso porque ela própria afirma que pagou a fatura com atraso de dois dias, motivo que legitima ao réu que a cobra todos os encargos decorrentes de tal mora, que passam a incidir a partir do momento em que é considerada inadimplente, ou seja, o dia seguinte ao do vencimento. 
	Assim, não há mínima demonstração de que o réu praticou qualquer conduta ilícita.
	Nessa mesma esteira, também não se verifica hipossuficiência da parte autora no caso em discussão. Isso porque a hipossuficiência prevista no art. 6o, VIII, da Lei 8.078/90, deve ser entendida como a impossibilidade de produção da prova e não como a simples presença de um desnível econômico. 
	A parte autora possuía os meios para produzir provas a seu favor, ainda que mínimas, mas não o fez. O ônus da prova é uma regra de conduta dirigida às partes, que indica quais fatos que a cada uma cabe provar e ao juiz, que indica como ele deverá julgar acaso não encontre a prova dos fatos. 
	Logo, aquele que tem interesse em ver sua pretensão acolhida deve cuidar em trazer aos autos do processo todas as provas capazes de influenciar na decisão do órgão julgador. Assim, tendo em vista que as provas e indícios presentes nos autos não apontam a caracterização da responsabilidade civil da parte ré, se conclui que só resta a rejeição do pedido autoral.
	Em face do exposto, JULGO IMPROCEDENTE O PEDIDO. 
	Sem custas e honorários, na forma do art. 55 da Lei nº. 9.099/95.
	Submeto o presente projeto à homologação pela MM. Juíza de Direito.";0004F4805B6DCF5144DC7CFB4DC7A7628B69C50603084509;0004B7FF4CEBA289076A932B44BB97CB72F9C5050D263A1F;2016.063.012769-8;0.7606638073921204
20;2016.001.172291-9;"Dispensado o relatório na forma do artigo 38 da Lei 9.099/95, decido.
	Trata-se de ação pelo procedimento sumaríssimo por meio da qual a parte autora requer seja o réu condenado a compensar os danos morais experimentados por ter ficar impossibilitada de usar o cartão de crédito/débito. O réu afirma que não praticou conduta ilícita, pois o plástico foi cancelado por suspeita de fraude, pelo que não há danos a serem compensados.
	Estando presentes as condições da ação e os pressupostos de constituição e desenvolvimento regular do processo, passo a analisar o mérito. 
A relação de direito material havida entre as partes é de consumo, já que presentes os requisitos objetivos (art. 3º, §1º e 2º, da Lei 8.078/90) e subjetivos (arts. 2º e 3º, da Lei 8.078/90) de tal relação. Por essa razão, impõe-se a inteira aplicação do Código de Defesa do Consumidor, o qual positiva um núcleo de regras e princípios protetores dos direitos dos consumidores enquanto tais, prevendo inclusive a possibilidade de inversão do ônus da prova, o que ora se faz, na forma do artigo 6º, VIII, da Lei 8.078/90. 
	Nesse contexto, tem-se que o CDC estabelece que é dever do fornecedor transmitir informação adequada e clara sobre os diferentes produtos e serviços, com especificação correta de quantidade, características, composição, qualidade e preço, bem como sobre os riscos que apresentem (art. 6º, III).
	Informação adequada, nos termos do art. 6º, III, do CDC, é aquela que se apresenta simultaneamente completa, gratuita e útil, vedada, neste último caso, a diluição da comunicação efetivamente relevante pelo uso de informações soltas, redundantes ou destituídas de qualquer serventia para o consumidor.
	Nas práticas comerciais, instrumento que por excelência viabiliza a circulação de bens de consumo, a oferta e apresentação de produtos ou serviços devem assegurar informações corretas, claras, precisas, ostensivas e em língua portuguesa sobre suas características, qualidades, quantidade, composição, preço, garantia, prazos de validade e origem, entre outros dados, bem como sobre os riscos que apresentam à saúde e segurança dos consumidores (art. 31 do CDC). 
	Segundo Herman Benjamin, a obrigação de informação é desdobrada pelo art. 31 do CDC, em quatro categorias principais, imbricadas entre si: a) informação-conteúdo (= características intrínsecas do produto e serviço), b) informação-utilização (= como se usa o produto ou serviço), c) informação-preço (= custo, formas e condições de pagamento), e d) informação-advertência (= riscos do produto ou serviço). 
	Assim, tem-se que a obrigação de informação exige comportamento positivo, pois o CDC rejeita tanto a regra do ""caveat emptor"" como a subinformação, o que transmuda o silêncio total ou parcial do fornecedor em patologia repreensível, relevante apenas em desfavor do profissional, inclusive como oferta e publicidade enganosa por omissão. 
	No caso em tela verifica-se o vício de informação, uma vez que, em que pese o réu pudesse fazer o bloqueio do cartão, em nenhum momento a autora foi informada de que o cartão seria bloqueado, de forma a evitar que passasse por situação vexatória. Por isso, há falha na prestação do serviço e, consequentemente, responsabilidade do fornecedor.
Seguindo-se a isso, tem-se que a lei somente afasta essa responsabilidade nos casos de fato exclusivo da vítima, fato de terceiro e caso fortuito ou força maior. No caso em tela, não verifico a existência de qualquer causa capaz de afastar o nexo de causalidade, impondo-se a responsabilidade pelos danos causados por sua conduta. 
Trata-se de responsabilidade objetiva pelo fato do serviço, fundada na teoria do risco do empreendimento, segundo a qual todo aquele que se dispõe a exercer alguma atividade no campo do fornecimento de bens e serviços tem o dever de responder pelos fatos e vícios resultantes do empreendimento independentemente de culpa. Esta obrigação é imanente ao dever de obediência às normas técnicas e de segurança, decorrendo a responsabilidade do simples fato de dispor-se alguém a realizar atividade de executar determinados serviços. Em suma, os riscos do empreendimento correm por conta do fornecedor de serviços e não do consumidor. 
Embora afirme a parte ré que a parte autora não sofreu dano moral, esta passou vexame no estabelecimento comercial por não poder pagar as suas compras, o que causaria em qualquer pessoa um enorme sentimento de frustração.
Além disso, verifico que estão presentes os requisitos necessários para que o lesado possa ter direito à reparação, quais sejam: a) que sofra dano injusto de caráter pessoal, moral ou patrimonial; b) que seja decorrente de fato de terceiro; c) que haja nexo causal entre o evento e a ação do terceiro.
Sem dúvidas, no caso em tela houve a conjugação dos três pressupostos acima mencionados, não havendo como se negar que tal fato lhe gerou danos. Assim, merece procedência o pedido no que tange o dano moral, pois, por se tratar de algo imaterial ou ideal, está ínsito na própria ofensa, de tal modo que, provado o fato danoso, ipso facto está demonstrado o dano moral.
Em face do exposto, JULGO PROCEDENTE em parte O PEDIDO para condenar a ré a: a) a pagar à parte autora a quantia de R$ 2.000,00 (dois mil reais) a título de compensação dos danos morais,  quantia essa que deve ser corrigida monetariamente e acrescida de juros legais desde a data desta sentença; b) desbloquear o cartão da autora, no prazo de 15 dias, sob pena de pagamento de multa diária de R$ 100,00 que vigerá por trinta dias.
Sem custas e honorários, na forma do art. 55 da Lei nº. 9.099/95.
Submeto o presente projeto à homologação pela MM. Juíza de Direito.";0004793F46255FD57AE1438030262FC43C10C5053E2C112D;0004A8EB36A4C5FE7ECBD9B511F46DBA7795C5051A291F3A;2016.063.008306-3;0.7588174939155579
21;2016.001.172291-9;"Dispensado o relatório, na forma do art. 38, da Lei 9.099/95. Decido. 
HOMOLOGO o projeto de sentença elaborado pelo Juiz Leigo, que passa a valer como fundamentação deste, com fulcro, na Lei Estadual nº 4578/05 e na Resolução nº 08/05 do E. Órgão Especial do TJRJ, e RESOLVE-SE o mérito, com base no art. 487, I, do NCPC. 
Publique-se e intimem-se as partes da sentença.
Após, certificado o trânsito em julgado e comprovado o depósito, no prazo devido, expeça-se mandado de pagamento, independente de nova conclusão. 
Nada mais havendo, dê-se baixa e arquive-se.	";0004793F46255FD57AE1438030262FC43C10C5053E2C112D;0004A8EB36A4C5FE7ECBD9B511F46DBA7795C5051A291F3A;2016.063.008306-3;0.7588174939155579
