;processo;sentenca;similar_file;similar_init;similar_processo;similaridade
0;2016.001.051037-4;"Homologo, por sentença, para que surta seus efeitos legais, o projeto de sentença elaborado pelo juiz leigo, na forma do artigo 40 da Lei nº 9.099/95.  

Em caso de depósito judicial referente à condenação, expeça-se mandado de pagamento, independente de nova conclusão, cumprindo à parte ré, quando do pagamento, apresentar planilha discriminada do valor da condenação.  

Caso haja valor remanescente a ser recebido, manifeste-se o credor em 7 dias, sob pena de arquivamento dos autos. Após o trânsito em julgado, tratando-se de sentença de improcedência ou de extinção do feito sem resolução do mérito, dê-se baixa e arquivem-se imediatamente.  

Tratando-se de sentença de procedência, após o trânsito em julgado e o decurso do prazo de 15 dias para pagamento espontâneo do valor da condenação previsto no art. 523 do NCPC c/c o entendimento consolidado no enunciado nº 13.9.1 do Aviso nº 23/2008 do TJERJ, aguarde-se por mais 7 dias a manifestação das partes e, em seguida, caso permaneçam em silêncio, proceda-se a baixa e ao arquivamento.  

FICAM AS PARTES CIENTES DE QUE A NOVA SISTEMÁTICA DE CONTAGEM DE PRAZO ESTABELECIDO NO ART. 219 DO NCPC/2015 NÃO SE APLICA AOS JUIZADOS ESPECIAIS CÍVEIS, CONSOANTE NOTA TÉCNICA 01/2016 DO FONAJE DE 04/03/2016, COMPUTANDO-SE OS PRAZOS EM DIAS CORRIDOS, ASSIM PROCEDENDO COM A FINALIDADE PRECÍPUA DE SE ALCANÇAR A BOA GESTÃO CARTORÁRIA COM FUNDAMENTO NO PRINCÍPIO DA CELERIDADE QUE REGE A LEI 9.099/95.   

Cumpridas as formalidades legais, dê-se baixa e arquivem-se os autos.";0004DA70A0AB4AAA9A8049A3AAC4B71B3036C5056232311A;0004FB46338AABF7B23C6CB5FE7B4BABD5F2C50516540B41;2016.001.303739-4;0.7098938226699829
1;2016.001.051037-4;"Dispensado o relatório, na forma do art. 38, da Lei nº 9.099/95.
Trata-se de ação de conhecimento por meio da qual a parte autora busca a reparação de danos materiais e morais em decorrência da perda da conexão que fez com que ele e sua mulher tivessem que pernoitar em Natal para, após, seguir viagem ao destino final. 
A ré foi citada e apresentou contestação escrita, na qual sustenta a culpa exclusiva do autor, uma vez que este não compareceu em tempo hábil para o embarque, e a inexistência de danos a serem reparados. 
Trata-se de relação jurídica disciplinada pelo Código de Defesa do Consumidor, porquanto as partes satisfazem os requisitos objetivos e subjetivos dos artigos 2º e 3º da Lei 8.078/1990.
O autor pretende a indenização de danos materiais e morais decorrentes da perda da conexão do voo em Confins, todavia suas alegações são inverossímeis, já que, ainda que tenha recebido informação errada do preposto da ré, o que não foi demonstrado nos autos, é fato notório, todo aeroporto possui painéis informativos a respeito dos horários dos voos e dos respectivos portões de embarque. 
Assiste, portanto, razão à ré no que diz respeito à culpa exclusiva do autor, o que impõe a improcedência dos pedidos.
No que se refere ao extravio de bagagem, este ocorreu já na volta da viagem, não tendo o autor experimentado qualquer prejuízo, uma vez que recebeu sua bagagem sem quaisquer avarias. 
Destarte, não se vislumbra qualquer falha na prestação de serviços do réu apta a causar danos na esfera de intimidade do consumidor, e como, do nada, nada surge, não há falar-se tampouco em dano moral a ser compensado.
Isso posto, JULGO IMPROCEDENTES OS PEDIDOS e dou por extinto o processo com resolução de mérito, na forma do artigo 487, I do Código de Processo Civil. Sem custas e honorários advocatícios, na forma do art. 55, da Lei 9.099/1995.
Transitada em julgado, dê-se baixa e arquivem-se. P.R.I.
Projeto de sentença sujeito à homologação pelo MM. Juiz de Direito, com base no art. 40 da Lei nº 9.099/95.
Rio de Janeiro, 08 de março de 2017.
LUIZ EDUARDO FERREIRA DE MORAES
JUIZ LEIGO";0004DA70A0AB4AAA9A8049A3AAC4B71B3036C5056232311A;0004FB46338AABF7B23C6CB5FE7B4BABD5F2C50516540B41;2016.001.303739-4;0.7098938226699829
2;2016.001.051037-4;"Homologo, por sentença, para que surta seus efeitos legais, o projeto de sentença elaborado pelo juiz leigo, na forma do artigo 40 da Lei nº 9.099/95. 

Em caso de depósito judicial referente à condenação, expeça-se mandado de pagamento, independentemente de nova conclusão. 

Caso haja valor remanescente a ser recebido, manifeste-se o credor em 7 dias, sob pena de arquivamento dos autos. Após o trânsito em julgado, tratando-se de sentença de improcedência ou de extinção do feito sem resolução do mérito, dê-se baixa e arquivem-se imediatamente. 

Tratando-se de sentença de procedência, após o trânsito em julgado e o decurso do prazo de 15 dias para pagamento espontâneo do valor da condenação previsto no art. 523 do NCPC c/c o entendimento consolidado no enunciado nº 13.9.1 do Aviso nº 23/2008 do TJERJ, aguarde-se por mais 7 dias a manifestação das partes e, em seguida, caso permaneçam em silêncio, proceda-se a baixa e ao arquivamento. 

FICAM AS PARTES CIENTES DE QUE A NOVA SISTEMÁTICA DE CONTAGEM DE PRAZO ESTABELECIDO NO ART. 219 DO NCPC/2015 NÃO SE APLICA AOS JUIZADOS ESPECIAIS CÍVEIS, CONSOANTE NOTA TÉCNICA 01/2016 DO FONAJE DE 04/03/2016 C/C A PRIMEIRA PARTE DO ENUNCIADO 86 TAMBÉM DO FONAJE, COMPUTANDO-SE OS PRAZOS EM DIAS CORRIDOS, ASSIM PROCEDENDO COM A FINALIDADE PRECÍPUA DE SE ALCANÇAR A BOA GESTÃO CARTORÁRIA COM FUNDAMENTO NO PRINCÍPIO DA CELERIDADE QUE REGE A LEI 9.099/95.";0004C53FA4897AD59A2222B3C8E0B874A7E2C5050B215711;0004B03DE0F541ABAA514113571D0A2E8F98C50449193B08;2016.001.015073-4;0.6017858982086182
3;2016.001.051037-4;"
 
ESTADO DO RIO DE JANEIRO
PODER JUDICIÁRIO
V Juizado Especial Cível da Comarca da Capital 
Processo n° 0019326-79.2016.8.19.001
Autor: MIGUEL EDUARDO BENIA PARADA   
Réu: AZUL LINHAS AÉREAS
PROJETO DE SENTENÇA

Dispensado o relatório, conforme possibilita o artigo 38 da Lei n. 9.099/95, passo a decidir.

Cuidam os autos de ação de conhecimento em que reclama a parte autora de defeito na prestação do serviço ofertado pela ré consistente no fato de não lograr êxito em realizar o ""check-in"" e efetuar o embarque, somente lhe restando remarcar a passagem para quatro dias após tendo em vista se tratar de viagem internacional.

A parte ré foi citada e ofereceu contestação escrita, onde perseguiu a improcedência do pedido ao argumento de que não ocorreu defeito na prestação do serviço, haja vista que o autor não compareceu para embarque.


     
 A relação jurídica entre as partes é de consumo, já que estão presentes os requisitos subjetivos (consumidor e fornecedor - art. 2o c/c art. 17 e art. 3o da Lei 8.078/90) e objetivos (produto e serviço - §§ 1o e 2o do artigo 3o da mesma lei) de tal relação.

      Os documentos de fls.64/67 conferem verossimilhança às alegações proferidas pelo consumidor, no que concerne ao fato de ter chegado em tempo hábil para realização do embarque, razão pela qual, inverte-se o ônus da prova ao teor do art. 6º,VIII do CDC. 




                     A responsabilidade civil da parte ré pelo fornecimento de serviço é objetiva (artigo 14 do Código de Defesa do Consumidor), assim, responde pelos danos causados à parte autora ainda que ausente sua culpa, arcando com os riscos de seu empreendimento, dos quais somente se exonera acaso comprove algumas das situações previstas no § 3º do art. 14, da Lei 8.078/90.

A ré não trouxe aos autos prova no sentido de que o impedimento do embarque foi decorrente de culpa exclusiva do consumidor, não trazendo aos autos qualquer prova neste sentido, sendo certo que tal fato seria possível, na medida em que bastaria exibir câmeras do horário do embarque.

 A reclamada não apresentou nos autos qualquer motivo plausível para justificar sua conduta, sendo forçoso inferir que seu ato foi obtido ao arrepio do Princípio da Boa Fé Objetiva.

Cabe notar que, a ré não se desincumbiu do ônus que lhe é imposto por lei, bem como não juntou qualquer documento capaz de elidir as alegações do consumidor hipossuficiente, ou excluir sua responsabilidade objetiva, por evidente defeito na prestação de serviço, em conformidade com o disposto no § 3º do art. 14, da Lei 8.078/90, ou mesmo, na forma do art. 373, II, do CPC.


                      O dano moral decorre in re ipsa da conduta sofrida, pois o comportamento da parte ré frustrou às legítimas expectativas do consumidor.

Na mensuração do dano moral, deve o magistrado se orientar pelos critérios de razoabilidade e proporcionalidade, não se olvidando de observar gravidade maior no evento, motivo por que, fixo o dano imaterial no valor de R$ 4.000,00 (quatro mil reais).

Posto isso, JULGO PARCIALMENTE PROCEDENTE O PEDIDO e extinta a fase de conhecimento com resolução do mérito na forma do art. 487, I do CPC, para condenar a parte ré a pagar a parte autora, a título de compensação por danos morais, a quantia de R$ 4.000,00  (quatro mil reais), corrigida monetariamente desde a presente e acrescida de juros legais de 1% ao mês a partir da citação; 

O réu deverá efetuar o pagamento dos valores da condenação no prazo de 15 (quinze) dias do trânsito em julgado da sentença, sob pena de incidência da multa de 10% (dez por cento) sobre o valor da condenação.
 
Sem ônus sucumbenciais, face o disposto no artigo 55, da Lei nº 9.099/95. Após o trânsito em julgado, dê-se baixa e arquivem-se. P.R.I. 

Projeto de sentença sujeito à homologação pela MM. Juiz de Direito, com base no art. 40, da Lei 9.099/95. 

Rio de Janeiro, 18 de Maio de 2016.

Everardo Mendes de Araújo
Juiz Leigo";0004C53FA4897AD59A2222B3C8E0B874A7E2C5050B215711;0004B03DE0F541ABAA514113571D0A2E8F98C50449193B08;2016.001.015073-4;0.6017858982086182
4;2016.001.051037-4;"Dispensado o relatório, na forma do art. 38, da Lei nº 9.099/95.
Trata-se de ação de conhecimento por meio da qual o autor busca a reparação de danos materiais e morais decorrentes da falta de auxílio material por parte dos prepostos do réu, no momento em que percebeu haver esquecido seu Ipad no interior da aeronave, omissão que culminou com a perda de seu voo de conexão para o Rio de Janeiro.
A ré foi citada e apresentou contestação escrita, na qual invocou a culpa exclusiva do autor e sustentou a inexistência de defeito na prestação do serviço e de danos a serem reparados.
Trata-se de relação jurídica disciplinada pelo Código de Defesa do Consumidor, porquanto as partes satisfazem os requisitos objetivos e subjetivos dos artigos 2º e 3º da Lei 8.078/1990.
Embora o autor tenha esquecido seu Ipad no interior da aeronave, o que poderia ser considerado culpa exclusiva do consumidor, já que cabia a ele a guarda e vigilância de seus pertences, o desenrolar dos fatos, tal como narrado na petição inicial, demonstrou que a ré falhou na prestação de seus serviços, uma vez que, ao ser comunicada do esquecimento, praticamente, nada fez para ajudar o autor, recusando-lhe tratamento cortês devido a qualquer consumidor, principalmente diante de uma situação como a narrada na petição inicial.
A prova disso é que o autor só conseguiu localizar seu aparelho com auxílio de força policial e por meio de aplicativo próprio do fabricante para encontrar aparelhos extraviados ou furtados da marca, o qual sinalizou que o dispositivo estava por perto. E, tanto foi assim, que o Ipad foi localizado em área restrita para funcionários.
É óbvio que o equipamento do autor não se deslocou sozinho do assento onde ele viajou para o local onde foi encontrado. É claro que alguém o apanhou seja para entregar no escritório de achados e perdidos do aeroporto, seja para entregar à autoridade policial, seja para cometer um ilícito. 
Há um princípio inerente e mesmo orientador nos serviços públicos: o da cortesia, o qual não foi observado pelos prepostos do réu, os quais, simplesmente, preferiram dar desculpas inaceitáveis para suas recusas em acatar uma simples solicitação: buscar o aparelho eletrônico do autor por ele deixado no encosto da poltrona à frente da por ele utilizada durante o voo que acabara de chegar.
O convencimento deste juízo é no sentido de que o consumidor não foi tratado com o devido cuidado e zelo pelo fornecedor de serviços, desídia que fez com que perdesse tempo precioso buscando ajuda para encontrar pertence de valor inestimável seu, a ponto de fazer com que perdesse seu voo de conexão e ficasse privado de seus pertences durante sua estada forçada em outra cidade, tudo, graças à falta do devido dever de cuidado para com o consumidor.
Resta configurado o fato do serviço, por cujos danos dele decorrentes responde objetivamente o fornecedor de serviços, na forma do que dispõe o artigo 14, §1º do Código de Defesa do Consumidor.
Passo a analisar os pedidos formulados na petição inicial.
O pedido de ressarcimento por danos materiais é procedente, pois as despesas incorridas pelo autor decorreram diretamente da falha na prestação de serviços, pois tivessem os prepostos do réu atendido à solicitação do autor na primeira vez em que este se dirigiu àqueles, certamente, o consumidor não teria perdido seu voo.
O valor da hospedagem foi provado nos autos e o da despesa com traslados, embora tenham sido objeto de estimativas por parte do consumidor, não foi especificamente impugnado pelo réu, o qual preferiu amarrar-se na tese da culpa exclusiva do autor.
O valor da condenação deve ser monetariamente corrigido desde a data do desembolso (Súmula 331 do e. TJRJ) e acrescido de juros de mora de 1% (um por cento) ao mês desde a data da citação, por tratar-se de responsabilidade civil contratual (artigo 406 do Código Civil cc artigo 161, §1º do CTN - Súmula 95 do e. TJRJ).
No que se refere ao pedido de compensação por danos morais, o artigo 375 do Novo Código de Processo Civil autoriza o julgador a julgar de acordo com as regras da experiência. 
O dano moral, consoante lição do Professor e Desembargador Sergio Cavalieri Filho, ""é a lesão de bem integrante da personalidade, tal como a honra, a liberdade, a saúde, a integridade psicológica, causando dor, sofrimento, tristeza, vexame e humilhação à vítima"" (in Programa de Responsabilidade Civil, 1998, p. 74).
É fato notório que, em circunstâncias como as narradas na petição inicial, o consumidor forçado a empreender verdadeira peregrinação em busca de uma ajuda, suplicando, em vão, a devida atenção dos prepostos do réu, sendo obrigado a buscar guarida junto à autoridade policial para recuperar seu dispositivo eletrônico, e que, ao final dessa odisseia, ainda descobre que perdeu seu voo de conexão e ficou sem sua bagagem, experimenta desesperos, angústias, revoltas, ansiedades e outros transtornos em sua esfera de intimidade que ultrapassam sobremaneira as raias do mero aborrecimento.
Na espécie, o dano moral decorre in re ipsa da conduta sofrida, pois a conduta da parte Ré revelou lesão aos bens que integram a personalidade da parte Autora.
Concluída a existência de dano moral, passo à fixação do valor justo para a sua compensação, observando o que preceitua o artigo 944 do Código Civil, ou seja, a extensão do dano. E, nesta demanda, considerando-se as circunstâncias dos autos reputo o valor de R$5.000,00, razoável, proporcional e suficiente para compensar o consumidor pelos dissabores por ele experimentados, importância a ser corrigida monetariamente desde a data da sentença (verbetes sumulares nº 362 do STJ e 97 do TJRJ) e acrescida de juros de mora de 1% (um por cento) ao mês desde a data da citação, por tratar-se de responsabilidade civil contratual (artigos 405 a 407 do Código Civil e artigo 161, §1º do CTN - Súmula 95 do TJRJ).
Isso posto, JULGO PARCIALMENTE PROCEDENTE O PEDIDO para condenar a parte Ré a: 1) pagar à parte autora, a título de indenização por danos materiais, a quantia de  R$277,46 (duzentos e setenta e sete reais e quarenta e seis centavos) monetariamente corrigida desde a data do desembolso e acrescida de juros de mora de 1% (um por cento) ao mês desde a citação e 2) pagar à parte autora, a título de compensação por danos morais, a quantia de R$5.000,00 (cinco mil reais), corrigida monetariamente a partir da data da sentença e acrescida de juros de mora de 1% (um por cento) ao mês desde a citação. Dou por extinto o processo com resolução de mérito, na forma do artigo 487, I, parte final, do Novo Código de Processo Civil. 
Sem custas e honorários advocatícios, na forma do art. 55, da Lei 9.099/1995.
Transitada em julgado, aguarde-se o decurso do prazo de 15 dias para pagamento espontâneo do valor da condenação previsto no art. 523 do NCPC c/c o entendimento consolidado no enunciado nº 13.9.1 do Aviso nº 23/2008 do TJERJ, aguarde-se por mais 7 dias a manifestação das partes e, em seguida, caso permaneçam em silêncio, proceda-se à baixa e ao arquivamento. 
P.R.I.
Projeto de sentença sujeito à homologação pelo MM. Juiz de Direito, com base no art. 40 da Lei nº 9.099/95.
Rio de Janeiro, 04 de maio de 2017.
LUIZ EDUARDO FERREIRA DE MORAES
JUIZ LEIGO";0004C974A5F075E891F6FBADEC6415431A30C50609100E40;00041C394B281DECFE76A2C976F762A0AD58C50516110C44;2016.001.374420-7;0.5958545207977295
5;2016.001.051037-4;"Homologo, por sentença, para que surta seus efeitos legais, o projeto de sentença elaborado pelo juiz leigo, na forma do artigo 40 da Lei nº 9.099/95.   
 
Em  caso  de  depósito  judicial  referente  à  condenação,  expeça-se mandado  de  pagamento, independentemente de nova conclusão.   
 
Caso  haja  valor  remanescente  a  ser  recebido,  manifeste-se  o  credor  em 7  dias,  sob  pena  de arquivamento dos autos. Após o trânsito em julgado, tratando-se de sentença de improcedência ou de extinção do feito sem resolução do mérito, dê-se baixa e arquivem-se imediatamente.   
 
 
Tratando-se de sentença de procedência, após o trânsito em julgado e o decurso do prazo de 15 dias  para  pagamento  espontâneo  do  valor  da  condenação  previsto  no  art.  523  do  NCPC  c/c  o entendimento consolidado no enunciado nº 13.9.1 do Aviso nº 23/2008 do TJERJ, aguarde-se por mais 7 dias a manifestação das partes e, em seguida, caso permaneçam em silêncio, proceda-se a baixa e ao arquivamento.   
 
FICAM  AS  PARTES  CIENTES  DE  QUE  A  NOVA  SISTEMÁTICA DE  CONTAGEM  DE  PRAZO ESTABELECIDO  NO  ART.  219  DO NCPC/2015  NÃO  SE  APLICA  AOS  JUIZADOS  ESPECIAIS CÍVEIS, CONSOANTE NOTA TÉCNICA 01/2016 DO FONAJE DE 04/03/2016 C/C A PRIMEIRA PARTE DO ENUNCIADO 86 TAMBÉM DO FONAJE, COMPUTANDO-SE OS PRAZOS EM DIAS CORRIDOS, ASSIM PROCEDENDO COM A FINALIDADE PRECÍPUA DE SE ALCANÇAR A BOA GESTÃO CARTORÁRIA COM FUNDAMENTO NO PRINCÍPIO DA CELERIDADE QUE REGE A LEI 9.099/95.";0004C974A5F075E891F6FBADEC6415431A30C50609100E40;00041C394B281DECFE76A2C976F762A0AD58C50516110C44;2016.001.374420-7;0.5958545207977295
6;2016.001.051037-4;"HOMOLOGO, por sentença, o acordo celebrado entre as partes, para que produza seus jurídicos e legais efeitos. Assim sendo, JULGO EXTINTO O PROCESSO, com resolução de mérito, com fundamento no artigo 487, inciso III, alínea b, do CPC. Sem custas. 
 
Cumprida a obrigação, dê-se baixa e arquive-se.";000496C4924D0AF9AA530A86047AE1DF1259C50539134525;00041CF57FDC5A830FD0D5FDFD00BEED07BAC505052A0A4A;2016.001.205675-7;0.5830402374267578
