;processo;sentenca;similar_file;similar_init;similar_processo;similaridade
0;2016.001.172291-9;"PODER JUDICIÁRIO DO ESTADO DO RIO DE JANEIRO
I JUIZADO ESPECIAL CÍVEL ¿ DUQUE DE CAXIAS

PROCESSO Nº: 0044142-65.2016.8.19.0021
AUTOR: JARBAS GOMES
RÉU: BANCO ITAU S/A

		PROJETO DE SENTENÇA

Vistos, etc.

Dispensado o relatório nos termos do art. 38, da Lei nº 9.099/95, passo a decidir.

Narra a parte autora que é cliente da empresa ré, possuindo um cartão de credito de nº: 5224********2338, pagando suas contas rigorosamente em dia. Aduz que a empresa ré vem cobrando mensalmente a importância de R$ 5,30, referente a um ¿SEGURO MAX PROTEÇÃO,  TARIFA AVAL EMERGENCIAL DE CREDITO, no valor de R$ 18,90, e ANUIDADE DIFERENCIADA R$ 8,90 e 4,00, totalizando a quantia de R$ 37,10, mensalmente. Afirma que por diversas vezes solicitou o cancelamento da cobrança, sendo acatado, porém voltou a descontar no mês seguinte até momento do ajuizamento da demanda. Pleiteia a restituição em dobro do valor cobrado, que perfaz R$ 269,30, bem como o pagamento de indenização por danos morais. 

A ré, em contestação, pugna pela improcedência do pleito autoral.

Preenchidas, portanto, as condições da ação e estando presentes os pressupostos processuais, passo à apreciação do mérito.
                                                                                                                                                                                                                                                                                                                                                                                                                                                                                                                                                                                                                                                                                                                             
É inquestionável que se trata de relação jurídica de consumo, com aplicação das normas contidas na Lei nº 8.078/1990, fazendo prevalecer os princípios e as regras cogentes nela inseridas e que têm por escopo basilar favorecer o elo mais fraco nesse vínculo e, assim, reequilibrar as forças entre os envolvidos na disputa, em regra, desproporcional e injusta, operando-se a inversão do ônus da prova, na inteligência do artigo 6º, inciso VIII, do CDC, haja vista a verossimilhança dos fatos narrados na inicial e a hipossuficiência técnica da parte autora operando-se a inversão do ônus da prova, na inteligência do artigo 6º, inciso VIII, do CDC.

Em relação à tal inversão, é importante destacar o entendimento de Sergio Cavalieri Filho, in Programa de Direito do Consumidor, Editora Atlas, 2ª. Edição, pág.99:

¿Pode o juiz proceder à inversão do ônus da prova quando verossímil a alegação do consumidor e/ou em face de sua hipossuficiência. Verossímil é aquilo que é crível ou aceitável em face de uma realidade fática. Não se trata de prova robusta e definitiva, mas da chamada prova de primeira aparência, prova de verossimilhança. Decorrente das regras da experiência comum, que permite um juízo de probabilidade. ¿    

Sendo assim, tratando-se de relação de consumo que desafia responsabilidade civil de natureza objetiva pelo fato do serviço, responde o prestador do serviço independentemente da comprovação de culpa, de modo que só se afasta a sua responsabilidade se demonstrar a ocorrência de uma das causas que excluem o próprio nexo causal enunciadas no parágrafo 3º do art. 14 do Código de Defesa do Consumidor. 

No caso vertente, a parte autora se insurge contra as cobranças realizadas em suas faturas de cartão de crédito, denominadas de Anuidade Diferenciada, Tarifa Aval Emergencial e Seguro Max Proteção.

A ré, por sua vez, sustenta que a anuidade é devida como contraprestação à administradora pela disponibilização de rede de estabelecimentos afiliados, instalada no País e/ou no Exterior, para pagamentos de bens e serviços, sendo permitida a cobrança no máximo uma vez a cada doze meses, consoante Resolução BACEN nº 3919.

Sustenta a ré que pode excepcionalmente aprovar transações que excedam o limite de crédito disponível no cartão, sendo que disponibiliza aos seus clientes a contratação do serviço de avaliação emergencial de crédito, que consiste na avaliação da viabilidade e dos riscos para a concessão de crédito, em caráter emergencial, para realização de operação acima do limite disponível no cartão.

Acrescenta a demandada que após explicadas as principais características do seguro, bem como informados dados do produto (valor do prêmio, data de vencimento, vigência, coberturas etc), a parte autora anuiu com a oferta, o que afasta qualquer hipótese de fraude ou falha na prestação do serviço.

Com efeito, verifica-se que a parte autora acostou às fls. 12/39 as faturas do cartão de crédito constando as cobranças questionadas, contudo, todas desacompanhadas do comprovante de pagamento. 

Portanto, em que pese a parte ré não ter acostado aos autos o contrato devidamente assinado, a fim de legitimar a referida cobrança, não há como se acolher o pedido de devolução em dobros dos valores questionados, haja vista que a parte autora não comprovou o pagamento, não se desincumbindo do seu ônus, nos termos do artigo 373, inc. I, do CPC.

Frise-se que a parte autora questiona cobranças realizadas desde o ano de 2013, porém somente ajuizou na presente demanda em 07/08/2016, não havendo sequer comprovado o pagamento das aludidas cobranças, o que leva a concluir que a hipótese retratada nos autos revela mero dissabor, aborrecimento, mágoa ou sensibilidade exacerbada, a não autorizar a indenização por danos morais. 

Sendo assim, não se verifica, na espécie, a existência de uma situação intensa e duradoura de dor e aflição, suficiente para provocar um desequilíbrio psicológico no indivíduo. 

Importante salientar que a mais abalizada doutrina, capitaneada pelo eminente Desembargador Sérgio Cavalieri Filho, vem asseverando que ""só deve ser reputado como dano moral a dor, vexame, sofrimento ou humilhação que, fugindo à normalidade, interfira intensamente... no comportamento psicológico do indivíduo, causando-lhe aflições, angústia, desequilíbrio em seu bem estar. Mero dissabor, aborrecimento, mágoa, irritação ou sensibilidade exacerbada estão fora da órbita do dano moral, porquanto, além de fazerem parte da normalidade do nosso dia-a-dia ... tais situações não são tão intensas e duradouras, a ponto de romper o equilíbrio psicológico do indivíduo. Se assim não se entender, acabaremos por banalizar o dano moral, ensejando ações judiciais em busca de indenizações pelos mais triviais aborrecimentos."" (in ""Programa de Responsabilidade Civil"", pg.99, Malheiros Editores, 4ª edição). 

Portanto, aplica-se ao caso em tela o Enunciado 14.4.3 dos Juizados Especiais Cíveis que prevê que ""o inadimplemento contratual por si só, não enseja dano moral, salvo se da infração advém circunstância que atenta contra a dignidade da parte"".

Ante o exposto, JULGO IMPROCEDENTES os pedidos, extinguindo o feito com resolução do mérito, na forma do artigo 487, I CPC.

Sem custas, nem honorários advocatícios, nos termos do artigo 55 da Lei 9099/1995.

Publique-se. Registre-se. Intimem-se.

Rio de Janeiro, 22 de novembro de 2016.

________________________________________
Ana Elisabeth de Paula Santos
            
Juíza Leiga

Remeto os autos ao MM. Juiz Togado, para posterior homologação.";0004FC0FF3A7B5EA81945010F1981E65CD56C50547321F1F;0004BD873445E60AEB968C4C9E6B3FC6FF99C50464171B20;2016.021.043365-0;0.817725419998169
1;2016.001.172291-9;Vistos etc. HOMOLOGO o PROJETO DE SENTENÇA proferido pelo DD. Juiz Leigo que me foi submetido, para que a mesma produza os seus jurídicos e legais efeitos, nos termos do artigo 4º, inciso III, da Resolução nº 08/2005, do Órgão Especial do TJ/RJ.  Sem custas judiciais, na forma da Lei nº 9.099/95. P.R.I. Certificado o trânsito em julgado, aguarde-se pronunciamento por 30 dias. Na inércia, dê-se baixa e arquive-se.;0004FC0FF3A7B5EA81945010F1981E65CD56C50547321F1F;0004BD873445E60AEB968C4C9E6B3FC6FF99C50464171B20;2016.021.043365-0;0.817725419998169
2;2016.001.172291-9;"Processo: 0046562-43.2016.8.19.0021 
Autor: LINA MEIRE FREITAS DE OLIVEIRA
Réu: ITAÚ UNIBANCO S/A

PROJETO DE SENTENÇA

Vistos, etc.

Embora dispensado o relatório (artigo 38, caput, da Lei nº 9.099/95), passo a um breve resumo dos fatos.

Trata-se de demanda ajuizada por LINA MEIRE FREITAS DE OLIVEIRA em face de ITAÚ UNIBANCO S/A, ambos já qualificados nos autos, pelo rito sumariíssimo, objetivando liminarmente a expedição de oficio para o SPC e SERASA para que seja excluído seu nome a pedido da Ré; no mérito requer que o Réu seja condenado a dar baixa no débito, ante o comprovado pagamento, a confirmação dos efeitos da tutela, bem como o pagamento de R$ 15.000,00 a título de indenização por dano moral 

Afirma a autora possuía cartão de credito junto à ré, ocorre que após dificuldades financeiras, deixou de adimplir com alguns compromissos, inclusive o pagamento mensal da fatura de seu cartão de crédito, administrado pela ré. Alega que em janeiro/2016, recebeu em sua residência uma cobrança no valor de R$ 636,67 e efetuou o pagamento de boa fé em 26/01/2016, conforme comprovante, porém, para sua surpresa no mês de fevereiro/2016 continuou a receber cobranças da ré. Aduz que entrou em contato com o Réu e não obteve êxito.

A parte ré foi citada e ofereceu contestação escrita com preliminar e com documentos. Suscita a preliminar de inépcia da inicial requerendo a aplicação do Enunciado 02.2016 do TJ/COJES. No mérito, sustenta que inexiste direito a ser amparado à parte autora. Requereu a improcedência do pedido. 

É o breve relatório. 

Não há dúvida ser de consumo a relação jurídica conflitiva. A ré se subsumi no caput do art. 3.º do Código de Defesa do Consumidor. O serviço que presta alberga-se no § 2.º do Código de Defesa do Consumidor. Estão presentes o pressuposto subjetivo e objetivo de tal relação.

Narrou à parte autora que realizou o pagamento da fatura do seu cartão de crédito, com atraso, que mesmo tendo realizado o pagamento de sua dívida o Réu permaneceu realizando cobranças em seu nome.

Analisando a documentação acostada aos autos se verifica que a parte autora não apresentou as faturas de cobranças emitidas pelo Réu, assim como não apresentou o comprovante de pagamento em que alegou ter realizado com atraso.

O Réu, por sua vez apresentou as faturas com os débitos e pagamentos realizados pela parte autora, no corpo de sua contestação, no entanto, em audiência de instrução o patrono da parte autora impugnou os documentos apresentados pelo Réu (fls.77).

No caso presente, a petição inicial carece de informações fundamentais ao correto julgamento da lide, sem as quais torna-se impossível prolatar sentença líquida.

Em casos tais, deve a parte autora juntar aos autos planilha demonstrativa dos valores que entende que são indevidos, mencionando ainda em que meses foram cobrados, bem como as faturas de cobranças emitidas pelo Réu, no período impugnado, com os respectivos comprovantes de pagamentos.

A simples exibição de mensagem de texto de celular não supre a necessidade de apresentação das faturas e planilha acima mencionada. 

Cumpre destacar que a parte autora requereu, em sua inicial, a produção de todas as provas em direito permitidas.

Assim, o pedido de baixa do débito existente em nome da parte autora, sem que seja apresentada as faturas com os respectivos comprovantes de pagamentos, deve ser julgado extinto sem resolução do mérito, ante a necessidade de realização de perícia. 

Resta prejudicado o pedido de indenização por dano moral.

Por todo o acima exposto, e mais o contido nos autos, com base no artigo 40, da Lei 9.099/95, JULGO EXTINTO O PROCESSO SEM RESOLUÇÃO DO MÉRITO, na forma do art. 51, II da Lei nº 9.099/95.

Outrossim, ante a preliminar suscitada pelo Réu, determino à parte autora para que junte aos autos comprovante de residência oriundo de concessionária de serviço público (Luz, água, telefone FIXO ou gás) ou declaração daquele com quem resida ou declaração da associação de moradores, em 05 (cinco) dias, sob pena de desconsideração da sentença e extinção do processo sem resolução do mérito.

Sem custas ou honorários, conforme art. 55 da Lei nº. 9.099/95.

Após, o trânsito em julgado, dê-se baixa e arquivem-se, advertidas as partes da possibilidade de se incinerarem os autos após 180 dias do arquivamento definitivo (art. 1º, Ato Normativo Conjunto 01/2005, publicado no Diário Oficial em 07/01/2005), pelo que defiro, desde logo, o desentranhamento dos documentos originais, por quem os juntou, mediante a substituição por cópias. 

Observe o cartório o nome do advogado da parte ré, conforme pedido na contestação para futuras publicações.

Publique-se. Registre-se. Intimem-se.

Duque de Caxias, 12 de dezembro de 2016

________________________________________
Vanessa Vieira da Silva Cardoso de Lima Salles
Juíza Leiga

Façam-se os autos conclusos ao MM. Juiz de Direito, Presidente deste Juizado Especial Cível, para apreciação do presente parecer, a teor do art. 40, da Lei nº 9.099/95.";0004F8729652D490791DF9C63EE2856F64FFC50540532919;00042E2B3593C665016458DA55571CFD125EC5045B35481A;2016.021.045760-4;0.8168617486953735
3;2016.001.172291-9;Vistos etc. HOMOLOGO o PROJETO DE SENTENÇA proferido pelo DD. Juiz Leigo que me foi submetido, para que a mesma produza os seus jurídicos e legais efeitos, nos termos do artigo 4º, inciso III, da Resolução nº 08/2005, do Órgão Especial do TJ/RJ.  Sem custas judiciais, na forma da Lei nº 9.099/95. P.R.I. Certificado o trânsito em julgado, aguarde-se pronunciamento por 30 dias. Na inércia, dê-se baixa e arquive-se.;0004F8729652D490791DF9C63EE2856F64FFC50540532919;00042E2B3593C665016458DA55571CFD125EC5045B35481A;2016.021.045760-4;0.8168617486953735
4;2016.001.172291-9;"Processo nº:		 0035011-87.2016.8.19.0208    
Parte Autora: 	 VILMA MARIA MELGAÇO RODRIGUES
Parte Ré: 		BANCO ITAUCARD S A


Projeto de Sentença

Trata-se de ação em que a parte Autora alega  falha na prestação dos serviços,  pois  possui cartão do banco Réu e nunca efetuou o pagamento de anuidade, mas a partir da fatura com vencimento em 05/04/2016, o banco Réu passou a cobrar anuidade no valor de R$ 66.75. Informa que tentou resolver administrativamente a questão, sem obter êxito.

Pretende com a presente ação  que a Ré seja  condenada  na devolução em dobro dos valores cobrados, bem como na condenação ao pagamento de danos morais.

A parte  Ré em sua peça de bloqueio,  requer a improcedência total dos pedidos, pois não praticou nenhum ato que pudesse ser fato gerador de dano moral para o Autor. Informa por fim que efetuou o estorno do valor cobrado na fatura de janeiro de 2017.

Na audiência de realizada, a parte Autora não estava com a fatura com vencimento em janeiro de 2017, para confirmar o estorno dos valores cobrados.

Este é o breve relatório na forma do art. 38 da Lei nº 9.099/95, passo a decidir.

Inexiste preliminar a dirimir, razão pela qual, reconhecendo a existência dos pressupostos processuais e das condições de regular desenvolvimento acionário, passo ao exame do mérito.

Cabe destacar que a relação jurídica entre as partes é de consumo, já que estão presentes os requisitos subjetivos (consumidor e fornecedor ¿ artigos 2o e 3o da Lei 8078/90) e objetivos (produto e serviço ¿ §§ 1o e 2o do artigo 3º da citada lei) de tal relação. 

A parte autora faz prova do alegado através da juntada dos documentos (faturas mensais)  que acompanham a inicial, demonstrando que a anuidade não era cobrada.

Incumbia a ré o ônus de provar que informou adequadamente a  parte Autora da existência de cobrança de anuidade, trazendo aos autos contrato contendo a assinatura da parte Autora,  contendo esta previsão de cobrança de anuidade, o que não logrou fazer.

Diante da ausência de prova, por parte da ré, quanto a existência de contrato assinado entre as partes legitimando as cobranças efetuadas, procedente se mostra o pedido de devolução do valor pago em dobro.

Além disso, deve ser reconhecida a aplicação do princípio da boa-fé objetiva da autora, já que os fatos narrados pela mesma são dotados de verossimilhança, e representam situação que se mostra comum no dia a dia. 

Presumem-se, portanto, verdadeiros os fatos narrados pela autora em sua petição inicial de que a parte Autora não foi informada, na ocasião da contratação do cartão de crédito, que o mesmo possuía anuidade a ser paga.

É cediço que a Ré responde objetivamente, independente da existência ou não de culpa, fundado na teoria do risco do empreendimento.  Como fornecedor, correm por sua conta os riscos do seu empreendimento, cabendo-lhe arcar com os prejuízos decorrentes de seu erro, ou descaso.  

Em assim sendo, tenho como procedentes as razões invocadas ao embasamento da pretensão autoral  para devolução do valor das anuidades pagas, em dobro.

No que pertine ao pedido de compensação por danos morais, é entendimento deste Juízo que o mero inadimplemento contratual não configura por si só dano moral, visto não agride a dignidade humana. 

Afora a cobrança indevida realizada, não houvera a efetivação de nenhum outro ato que extrapolasse o cunho patrimonial do contrato e que atingisse a dignidade do autor. Inexiste nos autos qualquer prova de que a conduta da Ré haja, de forma real e concreta, imposto a parte autora extraordinária dor, vexame ou humilhação, nem tampouco extremada ofensa à sua dignidade e honra, de forma a ensejar o advento do dano moral indenizável. 

A este respeito, releva notar que meros dissabores ou aborrecimentos cotidianos, inerentes à vida moderna, não constituem fato gerador do prejuízo extrapatrimonial passível de ensejar a obrigação de indenizar. 

Diante do acima exposto, JULGO PROCEDENTE EM PARTE O PEDIDO DA PARTE AUTORA para Condenar a Ré a  pagar para a autora o valor de R$ 801,00 (oitocentos e um reais), valor este já em dobro,  a título de danos materiais, com juros e correção monetária a contar desde a citação, corrigida monetariamente com base nos índices oficiais da CGJ e acrescida de juros na taxa de 1% (um por cento) ao mês, a partir da leitura da presente.

Por fim, JULGO IMPROCEDENTE o pedido de indenização por danos morais por ausência de violação a qualquer direito da personalidade do autor.

Em conseqüência, JULGO o processo extinto, com julgamento do mérito, na forma do artigo 487, I, do CPC.

Sem custas e honorários vez que em sede de Juizado Especial Cível, conforme disposto no artigo 55 da lei 9.099/95.

Ficam, ainda, as partes intimadas de que em se tratando de sentença condenatória ao pagamento de quantia certa, o prazo previsto no art. 523 do CPC, para incidência da multa ali prevista (10%), contar-se-á da data do trânsito em julgado. 

Cientes as partes do disposto no artigo 52, IV, da Lei n° 9.099/95, quanto à necessidade de cumprimento voluntário da sentença, sob pena de penhora, dispensada nova citação. 

Certificado o trânsito em julgado e não havendo novas manifestações no prazo de 15 (quinze) dias, dê-se baixa e arquivem-se. Cientes as partes de que decorridos 90 dias da data do arquivamento definitivo os autos processuais serão eliminados, nos termos do artigo 1º do Ato Normativo Conjunto 01/2005, publicado no DORJ de 07/01/05.

Projeto de sentença sujeito à homologação, assim, remeto os autos a MM. Juiz Togado, nos termos do artigo 40 da Lei nº 9.099/95.";00048F64A01CBA1342D0C8DC4CEFCF8E1198C5060F2E1C16;0004DE0BD1A38AE2F6EE5C577D0A56D440D5C5053A4E445C;2016.208.034590-8;0.7885197401046753
5;2016.001.172291-9;Homologo por sentença na forma do artigo 40 da Lei nº 9.099/95 o Projeto de Sentença elaborado pelo Juiz Leigo. PRI. Certifique-se o trânsito em julgado. Defiro desde já, se for o caso, independente de nova conclusão e havendo quitação da parte Autora, a expedição de mandado de pagamento. Após, dê-se baixa e arquivem-se.;00048F64A01CBA1342D0C8DC4CEFCF8E1198C5060F2E1C16;0004DE0BD1A38AE2F6EE5C577D0A56D440D5C5053A4E445C;2016.208.034590-8;0.7885197401046753
