;processo;sentenca;similar_file;similar_processo;similaridade
13;2016.001.284003-1;"Homologo, por sentença, para que surta seus efeitos legais, o projeto de sentença elaborado pelo juiz leigo, na forma do artigo 40 da Lei nº 9.099/95. 

Em caso de depósito judicial referente à condenação, expeça-se mandado de pagamento, independentemente de nova conclusão. 

Caso haja valor remanescente a ser recebido, manifeste-se o credor em 7 dias, sob pena de arquivamento dos autos. Após o trânsito em julgado, tratando-se de sentença de improcedência ou de extinção do feito sem resolução do mérito, dê-se baixa e arquivem-se imediatamente. 

Tratando-se de sentença de procedência, após o trânsito em julgado e o decurso do prazo de 15 dias para pagamento espontâneo do valor da condenação previsto no art. 523 do NCPC c/c o entendimento consolidado no enunciado nº 13.9.1 do Aviso nº 23/2008 do TJERJ, aguarde-se por mais 7 dias a manifestação das partes e, em seguida, caso permaneçam em silêncio, proceda-se a baixa e ao arquivamento. 

FICAM AS PARTES CIENTES DE QUE A NOVA SISTEMÁTICA DE CONTAGEM DE PRAZO ESTABELECIDO NO ART. 219 DO NCPC/2015 NÃO SE APLICA AOS JUIZADOS ESPECIAIS CÍVEIS, CONSOANTE NOTA TÉCNICA 01/2016 DO FONAJE DE 04/03/2016 C/C A PRIMEIRA PARTE DO ENUNCIADO 86 TAMBÉM DO FONAJE, COMPUTANDO-SE OS PRAZOS EM DIAS CORRIDOS, ASSIM PROCEDENDO COM A FINALIDADE PRECÍPUA DE SE ALCANÇAR A BOA GESTÃO CARTORÁRIA COM FUNDAMENTO NO PRINCÍPIO DA CELERIDADE QUE REGE A LEI 9.099/95.";0004F1BE051452F724869F2947CE9E635D8CC505571E203F;2016.001.336696-1;0.7580870985984802
14;2016.001.284003-1;"PODER JUDICIÁRIO DO ESTADO DO RIO DE JANEIRO
I JUIZADO ESPECIAL CÍVEL ¿ DUQUE DE CAXIAS

PROCESSO Nº: 0044142-65.2016.8.19.0021
AUTOR: JARBAS GOMES
RÉU: BANCO ITAU S/A

		PROJETO DE SENTENÇA

Vistos, etc.

Dispensado o relatório nos termos do art. 38, da Lei nº 9.099/95, passo a decidir.

Narra a parte autora que é cliente da empresa ré, possuindo um cartão de credito de nº: 5224********2338, pagando suas contas rigorosamente em dia. Aduz que a empresa ré vem cobrando mensalmente a importância de R$ 5,30, referente a um ¿SEGURO MAX PROTEÇÃO,  TARIFA AVAL EMERGENCIAL DE CREDITO, no valor de R$ 18,90, e ANUIDADE DIFERENCIADA R$ 8,90 e 4,00, totalizando a quantia de R$ 37,10, mensalmente. Afirma que por diversas vezes solicitou o cancelamento da cobrança, sendo acatado, porém voltou a descontar no mês seguinte até momento do ajuizamento da demanda. Pleiteia a restituição em dobro do valor cobrado, que perfaz R$ 269,30, bem como o pagamento de indenização por danos morais. 

A ré, em contestação, pugna pela improcedência do pleito autoral.

Preenchidas, portanto, as condições da ação e estando presentes os pressupostos processuais, passo à apreciação do mérito.
                                                                                                                                                                                                                                                                                                                                                                                                                                                                                                                                                                                                                                                                                                                             
É inquestionável que se trata de relação jurídica de consumo, com aplicação das normas contidas na Lei nº 8.078/1990, fazendo prevalecer os princípios e as regras cogentes nela inseridas e que têm por escopo basilar favorecer o elo mais fraco nesse vínculo e, assim, reequilibrar as forças entre os envolvidos na disputa, em regra, desproporcional e injusta, operando-se a inversão do ônus da prova, na inteligência do artigo 6º, inciso VIII, do CDC, haja vista a verossimilhança dos fatos narrados na inicial e a hipossuficiência técnica da parte autora operando-se a inversão do ônus da prova, na inteligência do artigo 6º, inciso VIII, do CDC.

Em relação à tal inversão, é importante destacar o entendimento de Sergio Cavalieri Filho, in Programa de Direito do Consumidor, Editora Atlas, 2ª. Edição, pág.99:

¿Pode o juiz proceder à inversão do ônus da prova quando verossímil a alegação do consumidor e/ou em face de sua hipossuficiência. Verossímil é aquilo que é crível ou aceitável em face de uma realidade fática. Não se trata de prova robusta e definitiva, mas da chamada prova de primeira aparência, prova de verossimilhança. Decorrente das regras da experiência comum, que permite um juízo de probabilidade. ¿    

Sendo assim, tratando-se de relação de consumo que desafia responsabilidade civil de natureza objetiva pelo fato do serviço, responde o prestador do serviço independentemente da comprovação de culpa, de modo que só se afasta a sua responsabilidade se demonstrar a ocorrência de uma das causas que excluem o próprio nexo causal enunciadas no parágrafo 3º do art. 14 do Código de Defesa do Consumidor. 

No caso vertente, a parte autora se insurge contra as cobranças realizadas em suas faturas de cartão de crédito, denominadas de Anuidade Diferenciada, Tarifa Aval Emergencial e Seguro Max Proteção.

A ré, por sua vez, sustenta que a anuidade é devida como contraprestação à administradora pela disponibilização de rede de estabelecimentos afiliados, instalada no País e/ou no Exterior, para pagamentos de bens e serviços, sendo permitida a cobrança no máximo uma vez a cada doze meses, consoante Resolução BACEN nº 3919.

Sustenta a ré que pode excepcionalmente aprovar transações que excedam o limite de crédito disponível no cartão, sendo que disponibiliza aos seus clientes a contratação do serviço de avaliação emergencial de crédito, que consiste na avaliação da viabilidade e dos riscos para a concessão de crédito, em caráter emergencial, para realização de operação acima do limite disponível no cartão.

Acrescenta a demandada que após explicadas as principais características do seguro, bem como informados dados do produto (valor do prêmio, data de vencimento, vigência, coberturas etc), a parte autora anuiu com a oferta, o que afasta qualquer hipótese de fraude ou falha na prestação do serviço.

Com efeito, verifica-se que a parte autora acostou às fls. 12/39 as faturas do cartão de crédito constando as cobranças questionadas, contudo, todas desacompanhadas do comprovante de pagamento. 

Portanto, em que pese a parte ré não ter acostado aos autos o contrato devidamente assinado, a fim de legitimar a referida cobrança, não há como se acolher o pedido de devolução em dobros dos valores questionados, haja vista que a parte autora não comprovou o pagamento, não se desincumbindo do seu ônus, nos termos do artigo 373, inc. I, do CPC.

Frise-se que a parte autora questiona cobranças realizadas desde o ano de 2013, porém somente ajuizou na presente demanda em 07/08/2016, não havendo sequer comprovado o pagamento das aludidas cobranças, o que leva a concluir que a hipótese retratada nos autos revela mero dissabor, aborrecimento, mágoa ou sensibilidade exacerbada, a não autorizar a indenização por danos morais. 

Sendo assim, não se verifica, na espécie, a existência de uma situação intensa e duradoura de dor e aflição, suficiente para provocar um desequilíbrio psicológico no indivíduo. 

Importante salientar que a mais abalizada doutrina, capitaneada pelo eminente Desembargador Sérgio Cavalieri Filho, vem asseverando que ""só deve ser reputado como dano moral a dor, vexame, sofrimento ou humilhação que, fugindo à normalidade, interfira intensamente... no comportamento psicológico do indivíduo, causando-lhe aflições, angústia, desequilíbrio em seu bem estar. Mero dissabor, aborrecimento, mágoa, irritação ou sensibilidade exacerbada estão fora da órbita do dano moral, porquanto, além de fazerem parte da normalidade do nosso dia-a-dia ... tais situações não são tão intensas e duradouras, a ponto de romper o equilíbrio psicológico do indivíduo. Se assim não se entender, acabaremos por banalizar o dano moral, ensejando ações judiciais em busca de indenizações pelos mais triviais aborrecimentos."" (in ""Programa de Responsabilidade Civil"", pg.99, Malheiros Editores, 4ª edição). 

Portanto, aplica-se ao caso em tela o Enunciado 14.4.3 dos Juizados Especiais Cíveis que prevê que ""o inadimplemento contratual por si só, não enseja dano moral, salvo se da infração advém circunstância que atenta contra a dignidade da parte"".

Ante o exposto, JULGO IMPROCEDENTES os pedidos, extinguindo o feito com resolução do mérito, na forma do artigo 487, I CPC.

Sem custas, nem honorários advocatícios, nos termos do artigo 55 da Lei 9099/1995.

Publique-se. Registre-se. Intimem-se.

Rio de Janeiro, 22 de novembro de 2016.

________________________________________
Ana Elisabeth de Paula Santos
            
Juíza Leiga

Remeto os autos ao MM. Juiz Togado, para posterior homologação.";0004FC0FF3A7B5EA81945010F1981E65CD56C50547321F1F;2016.021.043365-0;0.751057505607605
15;2016.001.284003-1;Vistos etc. HOMOLOGO o PROJETO DE SENTENÇA proferido pelo DD. Juiz Leigo que me foi submetido, para que a mesma produza os seus jurídicos e legais efeitos, nos termos do artigo 4º, inciso III, da Resolução nº 08/2005, do Órgão Especial do TJ/RJ.  Sem custas judiciais, na forma da Lei nº 9.099/95. P.R.I. Certificado o trânsito em julgado, aguarde-se pronunciamento por 30 dias. Na inércia, dê-se baixa e arquive-se.;0004FC0FF3A7B5EA81945010F1981E65CD56C50547321F1F;2016.021.043365-0;0.751057505607605
16;2016.001.284003-1;"Vistos, etc. Diante da ausência injustificada da parte autora na audiência de conciliação, embora devidamente intimada, JULGO EXTINTO O PROCESSO, SEM APRECIAÇÃO DO MÉRITO, com base no art. 51, I, da Lei 9.099/95. 
Isento  a   parte autora ao pagamento das custas processuais. 
Publicada   nas mãos da  Escrivã.
Defiro eventual desentranhamento requerido pelas  partes.
Após as formalidades legais, dê-se baixa e arquive-se. P.R.I.";00041E47EB950E43EB2EDEF31429225D7914C50513010E25;2016.021.010793-9;0.7437159419059753
17;2016.001.284003-1;"		Dispensado o relatório na forma do artigo 38 da Lei 9.099/95.
		Trata-se de ação de conhecimento sob o rito sumaríssimo da Lei 9.099/95, por meio da qual a parte autora busca a inversão do ônus da prova e a reparação por danos morais que alega ter sofrido, por excesso de transações realizadas não reconhecidas pelo Autor em seu cartão de crédito.
		A parte ré foi citada e ofereceu contestação escrita, sustentando, no mérito, em síntese, a boa-fé na solução do problema, a inexistência de dano material ante ao ressarcimento prévio e a ausência de danos morais indenizáveis.
		O Autor denuncia ter sofrido prejuízos de ordem moral em virtude de estar sendo alvo de excessivas cobranças indevidas decorrentes de compras por ele não reconhecidas, nos valores de R$ 422,23, em janeiro de 2016; R$ 230,61, em março de 2016; R$ 416,63, em março de 2016; doze parcelas de R$ 217,35, em abril de 2016.
		O Réu, em sua defesa, não nega tais fatos, limitando-se a aduzir a boa-fé na solução dos problemas, uma vez que devolveu os valores ao Autor antes da propositura da demanda.
		A relação estabelecida entre as partes é de consumo, uma vez presentes os requisitos subjetivos (artigo 2º, caput e artigo 3º, caput, ambos da Lei 8.078/90) e objetivos (artigo 3º, § 2º da Lei 8.078/90), incidindo, desta forma, a aplicação do CDC ao caso.
		A questão sob exame trata de fato do serviço, que enseja inversão do ônus da prova ope legis, ou seja, por expressa disposição de Lei, com fulcro no artigo 14 do CDC.
		Em virtude do ônus da prova invertido em favor do consumidor caberia ao Réu provar os fatos extintivos ou modificativos do direito do Autor, ao que dispõe o artigo 373, inciso II do CPC/2015.
		Inicialmente, destaque-se que é incontroverso nos autos as quatro cobranças não autorizadas pelo Autor realizadas nas faturas de seu cartão de crédito dos meses de janeiro, março e abril de 2016 (fls. 36/39, 48/51 e 52/55).
		Em que pese às alegações do Réu, as mesmas não são suficientes para afastar sua responsabilidade no caso em questão, restando, portanto, configurado o defeito na prestação de seu serviço, devendo os danos dele decorrentes ser reparados.
		Sendo assim, vislumbra-se a ocorrência de danos morais a serem indenizados.
		O dano moral, consoante lição do Professor e Desembargador Sergio Cavalieri Filho, ""é a lesão de bem integrante da personalidade, tal como honra, a liberdade, a saúde, a integridade psicológica, causando dor, sofrimento, tristeza, vexame e humilhação à vítima"" (in Programa de Responsabilidade Civil, 1998, p. 74).
		É fato notório que, em circunstâncias como as narradas na petição inicial, a conduta do Réu foi desidiosa, sendo perfeitamente admissível que o Autor tenha experimentado transtornos em sua esfera de intimidade que ultrapassam sobremaneira as raias do mero aborrecimento cotidiano.
		Destaque-se que ocorreram quatro transações não autorizadas pelo Autor em três meses, quase que consecutivas, o que evidencia a reiteração da conduta negligente da instituição financeira, tendo o Autor despendido tempo e energia para entrar em contato com o Réu, bem como para contestar e solicitar o reembolso dos valores (fls. 20/35 e 60/68), além de ter efetuado a troca do plástico, sem conseguir coibir a reincidência das mesmas (fl. 23).
		Ademais, em virtude do ocorrido, a referida indenização deve ainda assumir um caráter pedagógico-punitivo, com o intuito de desestimular a ocorrência de praticas idênticas em casos semelhantes.
		Todavia, deve ser levada em consideração a boa-fé do Réu em contornar as questões a ele trazidas, uma vez que ressarciu ao Autor todos os prejuízos materiais a que fora submetido, conforme revelam as faturas de fls. 48/50, 52/55 e 56/59. 
		Concluída a existência de dano moral, passo a fixação do valor justo para a sua compensação, observando o preceito insculpido no artigo 944 do CC/2012, ou seja, a extensão do dano.
		Portanto, considerando as circunstâncias dos autos e observados os princípios da razoabilidade e proporcionalidade, com o intuito de se evitar o enriquecimento sem causa do Autor, fixo a indenização por danos morais em R$ 2.000,00.
		Pelo exposto, JULGO PROCEDENTES EM PARTE os pedidos para condenar o Réu ao pagamento ao Autor do valor de R$ 2.000,00, a título de indenização por danos morais, acrescido de juros moratórios de 1% ao mês contados da citação e correção monetária incidente a partir da data desta decisão.
		Sem custas e honorários, conforme estabelece o artigo 55 da Lei 9.099/95.
		Dou por extinto o processo com resolução de mérito, na forma do artigo 487, inciso I do CPC/2015.
		Cientes as partes do disposto no artigo 52, inciso IV da Lei 9.099/95, quanto a necessidade de cumprimento voluntário da sentença, sob pena de penhora, dispensada nova citação.
		Ficam ainda as partes intimadas de que em se tratando de sentença condenatória ao pagamento de quantia certa, o prazo previsto no artigo 523 do CPC/2015, para incidência da multa ali prevista (10 por cento) contar-se-á do trânsito em julgado da sentença, independentemente de intimação, aplicando-se analogicamente os termos do Aviso n.º 36/2006 (D.O. 01/08/2006) da Presidência deste Tribunal.
		Certificado o trânsito em julgado e mantendo-se inerte o interessado, dê-se baixa e arquivem-se.
		Cientes as partes, na forma do art. 1º, § 1º do Ato Normativo Conjunto 01/2005, publicado no DOERJ em 07/01/2005, que os autos processuais findos serão eliminados após o prazo de 180 (cento e oitenta) dias da data do arquivamento definitivo.
		Ficam as partes cientes de que a nova sistemática de contagem de prazo estabelecido no artigo 219 do NCPC não se aplica no âmbito dos Juizados Especiais Cíveis, consoante nota técnica 01/2016 do FONAJE de 04/03/2016, computando-se os prazos em dias corridos, assim procedendo com a finalidade precípua de se alcançar a boa gestão cartorária com fundamento no principio da celeridade que rege a Lei 9.099/95.
		P.R.I.	
		Projeto de sentença sujeito à homologação pelo MM. Juiz de Direito, com base no artigo 40 da Lei nº 9.099/95.";0004519CAF22868E9C8587B31ED7B6777F6CC505305F0723;2016.001.172291-9;0.7427473664283752
18;2016.001.284003-1;"Homologo, por sentença, para que surta seus efeitos legais, o projeto de sentença elaborado pelo juiz leigo, na forma do artigo 40 da Lei nº 9.099/95.  

Em caso de depósito judicial referente à condenação, expeça-se mandado de pagamento, independente de nova conclusão, cumprindo à parte ré, quando do pagamento, apresentar planilha discriminada do valor da condenação.  

Caso haja valor remanescente a ser recebido, manifeste-se o credor em 7 dias, sob pena de arquivamento dos autos. Após o trânsito em julgado, tratando-se de sentença de improcedência ou de extinção do feito sem resolução do mérito, dê-se baixa e arquivem-se imediatamente.  

Tratando-se de sentença de procedência, após o trânsito em julgado e o decurso do prazo de 15 dias para pagamento espontâneo do valor da condenação previsto no art. 523 do NCPC c/c o entendimento consolidado no enunciado nº 13.9.1 do Aviso nº 23/2008 do TJERJ, aguarde-se por mais 7 dias a manifestação das partes e, em seguida, caso permaneçam em silêncio, proceda-se a baixa e ao arquivamento.  

FICAM AS PARTES CIENTES DE QUE A NOVA SISTEMÁTICA DE CONTAGEM DE PRAZO ESTABELECIDO NO ART. 219 DO NCPC/2015 NÃO SE APLICA AOS JUIZADOS ESPECIAIS CÍVEIS, CONSOANTE NOTA TÉCNICA 01/2016 DO FONAJE DE 04/03/2016, COMPUTANDO-SE OS PRAZOS EM DIAS CORRIDOS, ASSIM PROCEDENDO COM A FINALIDADE PRECÍPUA DE SE ALCANÇAR A BOA GESTÃO CARTORÁRIA COM FUNDAMENTO NO PRINCÍPIO DA CELERIDADE QUE REGE A LEI 9.099/95.   

Cumpridas as formalidades legais, dê-se baixa e arquivem-se os autos.";0004519CAF22868E9C8587B31ED7B6777F6CC505305F0723;2016.001.172291-9;0.7427473664283752
