;processo;sentenca;similar_file;similar_init;similar_processo;similaridade
7;2016.001.051037-4;"VI - JUIZADO ESPECIAL CÍVEL DA GÁVEA
Proc. Nº:  76442-43/16 (VIRTUAL)
Autor:  DANIEL MUNIZ CAMARGO
Réu:  AZUL LINHAS AÉREAS BRASILEIRAS
ASSENTADA

Aos 03 dias do mês de junho de 2016, às 14:10 hs., na sala de audiências deste Juízo, perante a M.M.ª Juíza de Direito Dra. SIMONE CAVALIERI FROTA, realizou-se, na hora aprazada, a audiência de Conciliação, Instrução e Julgamento. Ao pregão, responderam as partes acompanhadas de seus patronos.   Aberta a audiência, renovada a conciliação no valor de R$2.500,00 de danos morais e R$104,89 de danos materiais, a mesma não foi aceita pelo autor.  Pela parte ré foi apresentada contestação escrita, já acostada aos autos.   Declararam as partes não terem mais provas a produzir.  Em alegações finais, as partes se reportaram aos seus arrazoados.  Pela MM. Juíza foi proferida a seguinte SENTENÇA: Dispensado o relatório, de acordo com o artigo 38 da Lei n. 9.099/95.  Trata-se de relação de consumo, que deve ser analisada à luz da lei 8078/90.  Conforme se infere, alega o autor que adquiriu  passagem  aérea  da  referente  ao  trecho  Rio  de Janeiro/RJ  (SDU)  -  Campinas/SP  (VCP)  -  Corumbá/MS  (CMG),  previsto para o dia 05/10/2015, às 09h52.   Narra que o voo contratado saiu do Rio de Janeiro às 10h50, chegando às 12h06 no aeroporto de Campinas para a conexão, ou seja, com 01h02 de atraso, o que o fez perder o voo de conexão que estava previsto para saída às 12h08.  Alega que devido à perda do voo foi oferecido ao Autor somente um voucher de alimentação no valor de R$21,00 (vinte e um reais), que só poderia ser utilizado num único restaurante e numa seleção de pratos montados, e que só poderia ser liberado mediante assinatura do Autor em um termo abdicando de pleitear quaisquer direitos, o que o fez recusar o voucher.    Narra que foi lhe oferecido realocação em um voo para o aeroporto de Campo Grande/MS, que fica a 426km do destino final do Autor. Então, às 16h50 pegou o voo AD442,  saindo  de  Campinas  e  chegando  em  Campo  Grande  às  18h37.  E, posteriormente, pegou um ônibus da viação Andorinha de Campo Grande, chegando à Corumbá às 05h40 do dia 06/10/2015, arcando com o custo por conta própria.  Relata que a Ré se negou a dar ao Autor um formulário por escrito referente ao motivo da perda da conexão e ainda informou por e-mail ao Autor que a falha foi da Ré.  Por  fim,  afirma  que  estava  inicialmente  previsto  para  chegar  à  Corumbá  às 13h15, porém chegou apenas às 05h40 do dia seguinte (06/10/2015), ou seja, mais de 15 horas de atraso até seu destino final.  Em sua defesa, alega a ré que o atraso  no  voo   do  Autor  veio  a  ocorrer,  única  e exclusivamente,  em  decorrência  das  péssimas  condições  climáticas  que  acometiam a cidade do Rio de Janeiro no dia 05/10/2015, sendo certo que em função do mau tempo no referido dia a torre de comando do aeroporto Santos Dumont/RJ  determinou  o  fechamento  temporário  da  pista  de  pouso  e decolagens.   As alegações do autor restaram suficientemente demonstradas de sorte a justificar o acolhimento de sua pretensão.  Conquanto sustente a ré que as falhas decorreram por motivo de força maior, tenho que razão não a assiste.   O atraso no voo e a perda da conexão são inquestionáveis.  Assim,  tenho por comprovado que, durante as 15 horas em que o autor aguardou para chegar ao seu destino final, a ré não lhe prestou qualquer auxílio ou assessoria adequada.  A defesa não comprovou que o autor foi reacomodado no primeiro voo disponível, reduzindo o tempo de espera para chegar ao seu destino final.   É o quanto basta para demonstrar as sucessivas falhas na prestação de serviço por parte da ré, dando causa a todo drama retratado na inicial. Falhou a ré ao deixar de diligenciar para evitar a perda dos voos dos passageiros com conexão; deixar de prestar assessoria e suporte durante a espera pela nova conexão e deixar de diligenciar por novo voo no menor tempo possível.      No caso, de nada aproveita à defesa a arguição de força maior, pois não se cogita da responsabilidade da empresa aérea por pousar com uma hora de atraso, mas sim da falha na prestação de seu serviço após esse atraso.   O período de tolerância de 4 horas previstos no  Código Brasileiro de Aeronáutica e na Resolução nº. 141/2010, da ANAC são impertinentes, como se vê. Repita-se, a responsabilidade da ré não decorre do atraso de uma hora, mas sim da falta de suporte que deu causa à perda da conexão e total desamparo do consumidor até chegar ao seu destino final quinze horas após o tempo inicialmente previsto.   As intempéries da natureza nem sempre caracterizam a irresistibilidade para o transportador aéreo. Além de devidamente equipado com avançada tecnologia para prever e evitar riscos,  pode e deve minorar as consequências da força maior. Se não pode impedir o mau tempo, pode prevê-lo e evitar a viagem, ou atenuar os seus efeitos hospedando os passageiros  e dando-lhes tratamento adequado.   Não se trata de responsabilizar o transportador aéreo pelo fenômeno natural em si, mas pela ineficácia do serviço que presta, face a não realização, em  tempo hábil, dos reparos necessários à continuação do fornecimento do serviço.  Finalmente, de se registrar que sendo o transporte aéreo serviço público concedido pela União, não podem as empresas que o exploram ficar fora do regime de indenização integral estatuído no Código de Defesa do Consumidor (art. 6, I e VI e art. 25). Não vale argumentar que o CDC, por ser lei geral posterior, não derrogou o Código Brasileiro de Aeronáutica, de natureza especial e anterior - lex posterior generalis non derrogat priori speciali - , porque essa regra, além de não ser absoluta, não tem aplicação no caso em exame. O CDC, em observância a preceito constitucional, veio para implantar uma Política Nacional de Relações de Consumo, estabelecendo uma ordem jurídica uniforme e geral destinada a tutelar os interesses patrimoniais e morais de todos os consumidores. Vale dizer, concentrou em um único diploma a disciplina legal de todas as relações contratuais e extracontratuais do mercado de consumo brasileiro. Tratando-se de relação de consumo, o CDC é lei própria, específica e exclusiva; a lei que estabeleceu a Política Nacional de Relações de Consumo, consolidando em um só diploma legal todos os princípios pertinentes à matéria, em razão de competência que lhe foi atribuída peal própria Constituição Federal. E, na matéria de sua competência específica, nenhuma outra lei pode a ele (CDC) se sobrepor ou subsistir. Pode apenas coexistir naquilo que com ele não for incompatível. "" ( Programa de Responsabilidade Civil - 12 edição - Sérgio Cavalieri Filho).   Neste sentido tem se posicionado nossa jurisprudência, como se vê dos seguintes arestos:

RECURSO EXTRAORDINÁRIO. DANOS MORAIS DECORRENTES DE ATRASO OCORRIDO EM VOO INTERNACIONAL. APLICAÇÃO DO CÓDIGO DE DEFESA DO CONSUMIDOR. MATÉRIA INFRACONSTITUCIONAL. NÃO CONHECIMENTO. 1. O princípio da defesa do consumidor se aplica a todo o capítulo constitucional da atividade econômica. 2. Afastam-se as normas especiais do Código Brasileiro da Aeronáutica e da Convenção de Varsóvia quando implicarem retrocesso social ou vilipêndio aos direitos assegurados pelo Código de Defesa do Consumidor. 3. Não cabe discutir, na instância extraordinária, sobre a correta aplicação do Código de Defesa do Consumidor ou sobre a incidência, no caso concreto, de específicas normas de consumo veiculadas em legislação especial sobre o transporte aéreo internacional. Ofensa indireta à Constituição de República. 4. Recurso não conhecido.

(STF - RE: 351750 RJ, Relator: Min. MARCO AURÉLIO, Data de Julgamento: 17/03/2009,  Primeira Turma)


""RESPONSABILIDADE CIVIL - TRANSPORTE AÉREO - ATRASO EM VÔO INTERNACIONAL - EXCLUDENTE DA RESPONSABILIDADE - AUSÊNCIA DE PROVA - INDENIZAÇÃO TARIFADA - CÓDIGO DE DEFESA DO CONSUMIDOR- APLICABILIDADE - PRECEDENTES - VALOR INDENIZATÓRIO - QUANTUM DEVIDO - ALTERAÇÃO - RECURSO PARCIALMENTE PROVIDO""(STJ, RESP nº 184.558-SP, rel. Min. SÁLVIO DE FIGUEIREDO TEIXEIRA, DJU 08/06/2.001) ""PROCESSO CIVIL - RECURSO ESPECIAL - DANO MORAL -ATRASO DE VÔO - CONVENÇÃO DE VARSÓVIA - APLICAÇÃO DO CDC - VALOR DA INDENIZAÇÃO - MATÉRIA FÁTICA"". I -Aplica-se o CDC e não a Convenção de Varsóvia, no caso de constrangimento provocado por atraso de vôo II - O valor da indenização, fixado dentro da razoabilidade, não enseja especial"" (STJ, AI nº 377689-RJ, rel. Min. ANTONIO DE PÁDUA RIBEIRO, DJU 05/06/2.001)

""RESPONSABILIDADE CIVIL - AÇÃO REGRESSIVA - TRANSPORTE AÉREO - EXTRAVIO DE MERCADORIA - INAPLICABILIDADE DA CONVENÇÃO DE VARSÓVIA - RELAÇÃO DE CONSUMO - INCIDÊNCIA DO CÓDIGO DE DEFESA DO CONSUMIDOR - INDENIZAÇÃO AMPLA - ORIENTAÇÃO DO TRIBUNAL - RECURSO PROVIDO (STJ, RESP nº 257.298-SP, rel. Min. SÁLVIO DE FIGUEIREDO TEIXEIRA, DJU 11/06/2.001) ""Com o advento do Código de Defesa do Consumidor, a indenização pelo extravio de mercadoria não está sob o regime tarifado, subordinando-se ao princípio da ampla reparação, configurada a relação de consumo. O Código de Defesa do Consumidor não permite que disposições legais restrinjam a indenização pelo mau uso do serviço. Ao contrário, suas disposições assentam que a reparação deve ser a mais ampla possível. Exemplificando, seu artigo 51, par.3º, II considera abusiva a cláusula que restringe direito inerente à natureza do contrato, ou que possa proporcional desequilíbrio contratual, sendo certo estar incluída, nessa hipótese, a cláusula que cause exoneração ou diminuição excessiva da responsabilidade"" (RESP nº 209.527-0RJ, DJ 05/03/2.001).

À luz destes ensinamentos, é inquestionável que a empresa aérea não pode se furtar de responder de forma objetiva pelos danos que a prestação defeituosa de seu serviço causou à parte autora.    Em razão da falha da ré o autor suportou perda da conexão, falta de suporte, assessoria e quinze horas de espera para chegada a seu destino final, configurando o dano moral. Neste ponto a razão se coloca ao lado daqueles que entendem que o dano moral está implícito na própria ofensa, de tal modo que, provado o fato danoso, ipso facto está demonstrado o dano moral à guisa de uma presunção natural, uma presunção hominis ou facti, que decorre das regras da experiência comum. Afinal, a condenação, além de se destinar a compensar a vítima pelo desgaste físico e emocional resultante da resistência injustificada ao cumprimento de uma obrigação legal, também apresenta um aspecto pedagógico, servindo de advertência para que o causador do dano e seus congêneres se abstenham de praticar atos geradores deste dano.  Assim, entendo que uma indenização no valor de R$5.000,00 (cinco   mil reais)  é razoável para o caso em exame.   Finalmente, quanto ao pedido de danos materiais,  observo que este merece em parte acolhida.  Embora o autor pretenda ser restituído pelo valor total da passagem, observo que embora de maneira diversa da contratada, a prestação de serviço foi feita.  A passagem inicialmente tinha como destino final a cidade de Corumbá. No entanto, o autor desembarcou em Campo Grande.    O serviço foi prestado e a restituição do valor correspondente não se justifica. A inexecução parcial do serviço, correspondente á perda da conexão e realocação do autor num voo com destino final diverso do contratado justificam o pleito tão somente quanto aos danos morais.  Por outro lado, observo que o autor se onerou com o deslocamento terrestre entre o destino final contratado e a cidade onde efetivamente desembarcou, devendo a ré arcar com os custos correspondentes.  Legítima, assim, a restituição do valor pago pelo ônibus.  
Diante do exposto, JULGO PARCIALMENTE PROCEDENTES OS PEDIDOS para condenar a ré a: 
1) devolver à parte autora o valor de R$104,89, referente à passagem de ônibus, corrigido desde o desembolso e acrescido de juros de mora desde a citação;
2) indenizar os prejuízos morais impingidos à parte autora, mediante o pagamento da verba indenizatória fixada em R$5.000,00 (cinco  mil reais), corrigida a contar desta data e acrescida de juros de mora a contar da citação.
JULGO IMPROCEDENTE o pedido de devolução do valor da passagem. 
Sem custas, nem honorários, na forma do artigo 55 da Lei 9.099/95.  Publicado em audiência.  Registre-se.  Cientes os presentes. Em caso de condenação em obrigação de pagar, certificado o trânsito em julgado e juntada guia de depósito judicial, EXPEÇA-SE MANDADO DE PAGAMENTO. Mantendo-se inerte o interessado, dê-se baixa e arquivem-se, lembrando-se às partes que  90 dias após o arquivamento definitivo os autos serão eliminados por incineração, nos termos do Ato Normativo Conjunto 01/2005, publicado no D.O. de 07/01/2005.  Nada mais havendo, foi determinado o encerramento da presente às 14:20 horas.


SIMONE CAVALIERI FROTA
JUÍZA DE DIREITO

Autor: ________________________________________________
Advogado do autor: ______________________________________
Réu:____________________________________________________
Advogado do réu:_________________________________________

";00047DA7070E7FF5F9C020DC0AD68D45FC74C5050D441A1A;0004E0C09E45BEA243429B201B209DD570DCC50509315A63;2016.001.064251-5;0.5771374702453613
8;2016.001.051037-4;"Homologo, por sentença, para que surta seus efeitos legais, o projeto de sentença elaborado pelo juiz leigo, na forma do artigo 40 da Lei nº 9.099/95. 

Em caso de depósito judicial referente à condenação, expeça-se mandado de pagamento, independentemente de nova conclusão. 

Caso haja valor remanescente a ser recebido, manifeste-se o credor em 7 dias, sob pena de arquivamento dos autos. Após o trânsito em julgado, tratando-se de sentença de improcedência ou de extinção do feito sem resolução do mérito, dê-se baixa e arquivem-se imediatamente. 

Tratando-se de sentença de procedência, após o trânsito em julgado e o decurso do prazo de 15 dias para pagamento espontâneo do valor da condenação previsto no art. 523 do NCPC c/c o entendimento consolidado no enunciado nº 13.9.1 do Aviso nº 23/2008 do TJERJ, aguarde-se por mais 7 dias a manifestação das partes e, em seguida, caso permaneçam em silêncio, proceda-se a baixa e ao arquivamento. 

FICAM AS PARTES CIENTES DE QUE A NOVA SISTEMÁTICA DE CONTAGEM DE PRAZO ESTABELECIDO NO ART. 219 DO NCPC/2015 NÃO SE APLICA AOS JUIZADOS ESPECIAIS CÍVEIS, CONSOANTE NOTA TÉCNICA 01/2016 DO FONAJE DE 04/03/2016 C/C A PRIMEIRA PARTE DO ENUNCIADO 86 TAMBÉM DO FONAJE, COMPUTANDO-SE OS PRAZOS EM DIAS CORRIDOS, ASSIM PROCEDENDO COM A FINALIDADE PRECÍPUA DE SE ALCANÇAR A BOA GESTÃO CARTORÁRIA COM FUNDAMENTO NO PRINCÍPIO DA CELERIDADE QUE REGE A LEI 9.099/95.";00042F11BB0D9F402D798D72D675BA0B53DDC5050D5E1138;00045BA82753B9047B3ED4D86E107E18C57AC50446631626;2016.001.101387-8;0.5759707689285278
9;2016.001.051037-4;"
ESTADO DO RIO DE JANEIRO
PODER JUDICIÁRIO
V JUIZADO ESPECIAL CÍVEL DA COMARCA DA CAPITAL 


Processo n°:  0119232-42.2016.8.19.0001

Autor: LIZANDRA THURLER CARVALHO

Réu: AZUL LINHAS AÉREAS BRASILEIRAS SA


PROJETO DE SENTENÇA


Dispensado o relatório na forma do art. 38 da Lei 9.099/95.

Trata-se de ação em que a autora alega ter contratado um voo junto a reclamada, com retorno para o dia 14.10.2015, que por sua vez, não se desincumbiu de prestar o serviço de forma adequada, tendo em vista que sua mala foi extraviada, sendo entregue no dia 15.10.2015, o que lhe acarretou relevantes transtornos.

Pelo que, objetiva: a compensação por danos morais, em valor arbitrado pelo juízo.

O presente feito deve ser extinto sem resolução do mérito por incompetência territorial, conforme arguido pela parte ré.

O presente juízo, no entanto, não é competente territorialmente para conhecer e processar a presente demanda. Isto porque, nenhuma das partes possui endereço localizado na abrangência da competência deste Juizado Especial, visto que a parte autora tem domicilio em Botafogo, conforme fls. 18, e a ré, em são Paulo, não havendo razão jurídica para processar a demanda neste juízo, em obediência ao enunciado 2.2.4, Aviso 33/2008, TJ/RJ. 
O art. 4º, & ú, I da Lei 9.099/95 estabelece que é competente para processo e julgamento de causas de menor complexidade o juízo do foro do domicílio do autor, ou, a critério deste, do local onde o réu exerça atividades profissionais ou econômicas ou mantenha estabelecimento, filial, agência, sucursal ou escritório.
Em consequência aplica-se o Enunciado n° 2.2.5 dos Juizados Especiais Estaduais, publicado no Aviso n° 23/2008, o qual transcreve-se: 


¿2.2.5- Salvo nos locais onde haja órgão distribuidor para Juizados com a mesma competência, o juiz deverá, com base na violação do princípio do juiz natural, reconhecer de ofício a incompetência nos casos em que a ação for proposta no juizado de localização de um dos estabelecimentos de parte com multiplicidade de endereços, sem que se trate da sede ou sem que haja relação do estabelecimento: (i) com o domicílio residencial do autor; (ii) com o local onde a obrigação deva ser cumprida; ou (iii) com o lugar do ato ou fato lesivo ou serviço prestado.¿ (grifamos).

Por isso, a incompetência territorial importa em extinção do feito, conforme regra legal expressa neste sentido. Fica, portanto, inviabilizada a apreciação e o julgamento da presente causa.

Diante de todo exposto, JULGO EXTINTO O FEITO SEM RESOLUÇÃO DE MÉRITO, com fulcro no art. 51, III da Lei n. 9.099/95. 
Sem ônus de sucumbência em razão do disposto no artigo 55 da Lei nº 9.099/95.

Projeto de sentença sujeito à homologação pela MM. Juíza de Direito, com base no art. 40 da Lei nº 9099/95.


Rio de Janeiro, 02 de julho de 2016.


ANDRÉA LUCIA DUARTE DOS SANTOS
JUIZA LEIGA";00042F11BB0D9F402D798D72D675BA0B53DDC5050D5E1138;00045BA82753B9047B3ED4D86E107E18C57AC50446631626;2016.001.101387-8;0.5759707689285278
10;2016.001.051037-4;"Cuida-se de ação sob o rito sumaríssimo por meio da qual busca a parte demandante a condenação da ré ao pagamento indenização por danos morais em razão de extravio de bagagem.
Embora dispensado pela norma do artigo 38 da Lei 9.099/95, é o breve relatório. DECIDO.
No caso, impositiva é a extinção do feito, sem resolução de mérito, com o reconhecimento da incompetência deste Juízo. Ressalta-se que nos termos do enunciado 2.2.4 do Aviso 23/2008 do TJRJ: A incompetência territorial pode ser reconhecida de ofício no sistema dos Juizados Especiais Cíveis. No caso concreto, o réu possui endereço em São Paulo. A parte autora, por sua vez, comprovou, endereço na Rua Sarapui 48 casa BOTAFOGO /RJ (FLS. 10). Desse modo, a opção do autor para fins de escolha do foro competente, conforme artigos 101, I, do CDC c/c artigos 94, caput e 100, IV, do CPC, se dá apenas entre o foro de seu endereço e o da ré, conforme art. 4º da Lei 9.099/95. 
Esse entendimento visa resguardar a eficiência da administração da justiça e afastar violações ao princípio do juiz natural. Portanto, incabível a distribuição da ação no Juizado da Gávea por mera liberalidade ou preferência do autor, se não há prova de que neste é o domicílio do autor ou que ocorreu o fato que embasa a ação, ou o ato ilícito reclamado.
Ante o exposto, julgo extinto o processo, sem resolução de mérito, na forma do art. 51, III da Lei 9.099/95. Sem custas e honorários, por força do disposto no artigo 55 da Lei Especial.

Rio de Janeiro, 17 de novembro de 2016

JULIANA CORREIA GOMES
JUÍZA LEIGA

 		Submeto o projeto de sentença à homologação do Dra. Juíza de Direito, na forma do art. 40 da Lei 9.099/95.";00047E7879D418386D35AF2DE5C953A3B3E6C50538530C0D;0004BBDE1236E575573845DB09F2EB67E9A2C504584D1046;2016.001.191040-2;0.5750482082366943
11;2016.001.051037-4;"Homologo, por sentença, para que surta seus efeitos legais, o projeto de sentença elaborado pelo juiz leigo, na forma do artigo 40 da Lei nº 9.099/95.  

Em caso de depósito judicial referente à condenação, expeça-se mandado de pagamento, independente de nova conclusão, cumprindo à parte ré, quando do pagamento, apresentar planilha discriminada do valor da condenação.  

Caso haja valor remanescente a ser recebido, manifeste-se o credor em 7 dias, sob pena de arquivamento dos autos. Após o trânsito em julgado, tratando-se de sentença de improcedência ou de extinção do feito sem resolução do mérito, dê-se baixa e arquivem-se imediatamente.  

Tratando-se de sentença de procedência, após o trânsito em julgado e o decurso do prazo de 15 dias para pagamento espontâneo do valor da condenação previsto no art. 523 do NCPC c/c o entendimento consolidado no enunciado nº 13.9.1 do Aviso nº 23/2008 do TJERJ, aguarde-se por mais 7 dias a manifestação das partes e, em seguida, caso permaneçam em silêncio, proceda-se a baixa e ao arquivamento.  

FICAM AS PARTES CIENTES DE QUE A NOVA SISTEMÁTICA DE CONTAGEM DE PRAZO ESTABELECIDO NO ART. 219 DO NCPC/2015 NÃO SE APLICA AOS JUIZADOS ESPECIAIS CÍVEIS, CONSOANTE NOTA TÉCNICA 01/2016 DO FONAJE DE 04/03/2016, COMPUTANDO-SE OS PRAZOS EM DIAS CORRIDOS, ASSIM PROCEDENDO COM A FINALIDADE PRECÍPUA DE SE ALCANÇAR A BOA GESTÃO CARTORÁRIA COM FUNDAMENTO NO PRINCÍPIO DA CELERIDADE QUE REGE A LEI 9.099/95.   

Cumpridas as formalidades legais, dê-se baixa e arquivem-se os autos.";00047E7879D418386D35AF2DE5C953A3B3E6C50538530C0D;0004BBDE1236E575573845DB09F2EB67E9A2C504584D1046;2016.001.191040-2;0.5750482082366943
12;2016.001.051037-4;"Homologo o acordo celebrado entre as partes para que surta seus jurídicos e legais efeitos, e julgo o feito extinto, com resolução do mérito, nos termos do art. 487, inc. III, b, do novo Código de Processo Civil ( Lei nº 13.105/ 2015). 

Se for o caso, comprovado o depósito, expeça-se mandado de pagamento em favor da parte autora, independentemente de nova conclusão.  

Decorrido o prazo do cumprimento o acordo, aguarde-se por cinco dias a manifestação das partes; não havendo manifestação,  dê-se baixa e arquive-se.";000479D11EF5FDCC99F1F5C2407F0A9A8A8FC505145A5343;0004CB939DBFDE97C4C9B8EA2313F74E05BDC5044F173A1C;2016.001.122629-1;0.5715984106063843
13;2016.001.051037-4;"Homologo o acordo celebrado entre as partes para que surta seus jurídicos e legais efeitos, e julgo o feito extinto, com resolução do mérito, nos termos do art. 487, inc. III, b, do novo Código de Processo Civil ( Lei nº 13.105/ 2015). 

Se for o caso, comprovado o depósito, expeça-se mandado de pagamento em favor da parte autora, independentemente de nova conclusão.   Após, nada mais sendo requerido, dê-se baixa e arquivem-se. 


Decorrido o prazo do cumprimento o acordo, aguarde-se por cinco dias a manifestação das partes; não havendo manifestação,  dê-se baixa e arquive-se.";0004C7DF90EE1586A45A00A14421BB6C0BADC505313B3C23;00043666FF2D0D6ABCC461CE715F660DB8AAC505082B2F39;2016.001.205099-8;0.5704181790351868
