;processo;sentenca;similar_file;similar_init;similar_processo;similaridade
15;2016.001.143686-8;"
ESTADO DO RIO DE JANEIRO
PODER JUDICIÁRIO
V JUIZADO ESPECIAL CÍVEL DA COMARCA DA CAPITAL 


Processo n°:  0169552-96.2016.8.19.0001

Autor: PEDRO MOREIRA ALVES DE BRITO

Réu: ITAUCARD S/A e REDE BRASIL - GESTÃO DE ATIVOS LTDA

PROJETO DE SENTENÇA

Dispensado o relatório na forma do art. 38 da Lei 9.099/95.

Trata-se de ação em que o autor alega terem as reclamadas negativado seu nome no cadastro restritivo de crédito, com base em uma suposta dívida, referente a um suposto contrato nunca contratado, acarretando lhe relevantes transtornos.  Narra o demandante ainda que, além das cobranças via correios, recebe e-mails e telefonemas cobrando a dívida.

Pelo que, objetiva: a retirada do nome da parte autora dos cadastros restritivos de crédito, bem como, do 6° ofício de registro civil de títulos e documentos e pessoas jurídicas do Distrito Federal; se abstenham de efetuar qualquer tipo de cobrança referente aos valores objeto da lide; a declaração de inexistência de relação obrigacional entre o autor e as partes; bem como, a compensação por danos morais, em valor arbitrado pelo juízo.

As partes rés foram citadas e ofereceram defesas sob a forma escrita, onde suscitaram a preliminar de ilegitimidade passiva, além de pugnar pela improcedência dos pedidos, ao argumento de que não ocorreu falha na prestação do serviço.

Rejeito a preliminar de ilegitimidade passiva suscitada pela 2° ré, porquanto as condições para o regular exercício do direito de ação são aferidas à luz das alegações da parte autora constantes na petição inicial. Na espécie, a parte autora alega haver sofrido danos para o qual concorreu o réu, em face do qual propôs esta ação de responsabilidade civil. Nesses termos, a demanda foi corretamente proposta. Se o réu suscitante da preliminar foi ou não responsável pelos danos alegados na petição inicial, isso é matéria a ser examinada no mérito.
Assim, presentes as condições para o regular exercício do direito de ação, bem como, os demais pressupostos da ação, passo a enfrentar o mérito.

Decreto a revelia da segunda reclamada (REDE BRASIL - GESTÃO DE ATIVOS LTDA, diante de sua ausência à época da Audiência de Instrução e Julgamento, nos termos do artigo 9º da Lei 9.099/95. 

Nesse passo, em que pese não se operar automaticamente o efeito material da revelia, previsto no art. 344 do CPC, consoante entendem a doutrina e jurisprudência majoritárias, os fatos narrados pela autora na exordial devem ser reputados como verdadeiros, uma vez que dotados de verossimilhança. 

Tratando-se de relação de consumo, frente à verossimilhança das alegações e a hipossuficiência do reclamante, pessoa física, é cabível a inversão do ônus da prova, a teor do art. 6º, VIII, do CDC, não tendo as rés, se desincumbido de provar fatos extintivos, modificativos ou impeditivos do direito do autor.

Cabe notar que, as rés não lograram êxito em demonstrar a inexistência de falha na prestação do serviço, uma vez que, não juntaram qualquer documento capaz de elidir as alegações do consumidor hipossuficiente, ou excluir sua responsabilidade objetiva, por evidente defeito na prestação de serviço, em conformidade com o disposto no § 3º do art. 14, da Lei 8.078/90, ou mesmo, na forma do art. 373, II, do CPC, à sua peça de defesa, ônus que lhe competia.

As reclamadas não comprovaram ter prestado o serviço de maneira efetiva e adequada, não tendo demonstrado a contratação do suposto serviço objeto da lide, tampouco, justificativa plausível para a validade da cobrança efetuada.

Assim, merece acolhimento os pedidos para que as rés se abstenham de efetuar qualquer tipo de cobrança referente aos valores objeto da lide; bem como, de declaração de inexistência de relação obrigacional entre o autor e as partes.

O dano moral decorre in re ipsa da conduta sofrida, pois a conduta do réu frustrou às legítimas expectativas do consumidor.
Na mensuração do dano moral, deve o magistrado se orientar pelos critérios de razoabilidade e proporcionalidade, não se olvidando de observar que o fato versa sobre apontamento indevido, motivo por que, fixo o dano imaterial no valor de R$ 3.000,00 (três mil reais).

Com relação ao pedido de retirada do nome da parte autora dos cadastros restritivos de crédito, bem como, do 6° ofício de registro civil de títulos e documentos e pessoas jurídicas do Distrito Federal, este merece improcedência, uma vez que, não há nos autos prova de que o nome do requerente tenha sido negativado, o que impede a procedência do presente desiderato.

Pelo exposto, JULGO PARCIALMENTE PROCEDENTES OS PEDIDOS, para CONDENAR as rés, SOLIDARIAMENTE: 1) a se absterem de efetuar qualquer tipo de cobrança referente aos valores objeto da lide, a partir da publicação da sentença, sob pena de multa equivalente ao dobro de cada valor cobrado; 2) a declarar a inexistência de relação obrigacional entre o autor e as partes; 3) a pagar à parte autora a quantia de R$ 3.000,00 (três mil reais) pelos danos morais causados, com juros de 1% (um por cento) ao mês, contados da citação, e correção monetária, contados a partir da data da leitura de sentença; 4) a confirmar a decisão que antecipou os efeitos da tutela concedida de fls. 64, tornando-a definitiva. Dou pela extinção do processo com resolução do mérito, na forma do artigo 487, I, do Código de Processo Civil. 

Deverão as rés efetuar o pagamento do montante da condenação no prazo de 15 dias, após o trânsito em julgado, sob pena de multa de 10% (dez por cento) sobre o valor, independentemente de intimação, nos moldes do art. 523, §1ª, do CPC.

Sem ônus de sucumbência em razão do disposto no artigo 55 da Lei nº 9.099/95.

Projeto de sentença sujeito à homologação pela MM. Juíza de Direito, com base no art. 40 da Lei nº 9099/95.


Rio de Janeiro, 13 de setembro de 2016.


ANDRÉA LUCIA DUARTE DOS SANTOS
JUIZA LEIGA";00049897E2A425AF18E3EDBEA26360331E1FC5052A610859;0004A45597738D36B0BFD79DBF64D32A5B24C5045D1C284B;2016.001.146414-1;0.8867937922477722
16;2016.001.143686-8;"Homologo, por sentença, para que surta seus efeitos legais, o projeto de sentença elaborado pelo juiz leigo, na forma do artigo 40 da Lei nº 9.099/95. 

Em caso de depósito judicial referente à condenação, expeça-se mandado de pagamento, independentemente de nova conclusão. 

Caso haja valor remanescente a ser recebido, manifeste-se o credor em 7 dias, sob pena de arquivamento dos autos. Após o trânsito em julgado, tratando-se de sentença de improcedência ou de extinção do feito sem resolução do mérito, dê-se baixa e arquivem-se imediatamente. 

Tratando-se de sentença de procedência, após o trânsito em julgado e o decurso do prazo de 15 dias para pagamento espontâneo do valor da condenação previsto no art. 523 do NCPC c/c o entendimento consolidado no enunciado nº 13.9.1 do Aviso nº 23/2008 do TJERJ, aguarde-se por mais 7 dias a manifestação das partes e, em seguida, caso permaneçam em silêncio, proceda-se a baixa e ao arquivamento. 

FICAM AS PARTES CIENTES DE QUE A NOVA SISTEMÁTICA DE CONTAGEM DE PRAZO ESTABELECIDO NO ART. 219 DO NCPC/2015 NÃO SE APLICA AOS JUIZADOS ESPECIAIS CÍVEIS, CONSOANTE NOTA TÉCNICA 01/2016 DO FONAJE DE 04/03/2016 C/C A PRIMEIRA PARTE DO ENUNCIADO 86 TAMBÉM DO FONAJE, COMPUTANDO-SE OS PRAZOS EM DIAS CORRIDOS, ASSIM PROCEDENDO COM A FINALIDADE PRECÍPUA DE SE ALCANÇAR A BOA GESTÃO CARTORÁRIA COM FUNDAMENTO NO PRINCÍPIO DA CELERIDADE QUE REGE A LEI 9.099/95.";00049897E2A425AF18E3EDBEA26360331E1FC5052A610859;0004A45597738D36B0BFD79DBF64D32A5B24C5045D1C284B;2016.001.146414-1;0.8867937922477722
17;2016.001.143686-8;"Dispensado o relatório nos termos do art. 38, da Lei 9.099/95.
HOMOLOGO, para que produza seus jurídicos e legais efeitos, o acordo estabelecido pelas partes. Por conseguinte JULGO EXTINTO o presente processo, com julgamento do mérito, na forma do art. 487, III, ""b"" do NCPC.
Sem custas ou honorários. 
Após o trânsito em julgado, cumpridas todas as formalidades legais, dê-se baixa e arquivem-se. 
P.I.";000429F639DC77474ED95E20AD447B847339C50604443D06;0004D7F4712C5C6994D11C9C278DEAF791A7C5050D4B3A35;2016.063.013543-9;0.8850016593933105
18;2016.001.143686-8;"Vistos, etc.
Dispensado relatório nos termos do artigo 38, da Lei nº 9.099/95. 
Trata-se de ação indenizatória ajuizada por LEANDRO DE LIMA GUARABU, em face de BANCO ITAUCARD S.A., por meio do qual o autor impugna as cobranças lançadas pelo réu em seu cartão de crédito, bem como formula pedido de cancelamento do acordo firmado, com a devolução das parcelas pagas. 
Em contestação, o réu pugna pela improcedência, em sua totalidade, dos pedidos autorais.
Trata-se, indiscutivelmente, de relação jurídica de consumo, com aplicação das normas contidas na Lei 8078/1990, sendo cabível, ante a configuração da hipossuficiência da autora, a inversão do ônus da prova, conforme estabelece o artigo 6º, VIII CDC.
Todavia, não há como se adentrar ao mérito na presente demanda, ante a evidente incompetência desse d. Juízo.
A presente demanda tem por cerne cobranças que foram lançadas no cartão de crédito do autor, na fatura do cartão de crédito, bem como valores que foram debitados da conta-corrente, os quais o autor aduz serem indevidas, formulando pedido de devolução em dobro.
Contudo, conforme reconhecido pelo próprio autor e comprovado nos Autos, houve um crédito no valor total das parcelas da compra cancelada, com posterior cobrança de parcelas, aduzindo o autor que, em verdade, fora cobrado por parcelas indevidas.
Assim sendo, se verifica que, para um regular julgamento da presente demanda, mister se faz uma prova pericial contábil mais complexa, a fim de comprovar se, efetivamente, houve cobrança de encargos contratuais acima do que seria efetivamente devido pela autora.  
Contudo, não sendo a mesma compatível com o rito dos Juizados Especiais, haja vista não se configurar a hipótese prevista artigo 35 da Lei 9099/1995, motivo pelo qual mostra-se incompetente esse Juízo para o julgamento da presente demanda.
	
Ante o exposto, JULGO EXTINTO O FEITO, SEM RESOLUÇÃO DO MÉRITO, nos termos do artigo 51, II DA Lei 9099/1995. 
Sem custas, nem honorários advocatícios, nos termos do artigo 55 da Lei 9099/1995.
Publique-se. Registre-se. Intimem-se.


Duque de Caxias, 06 de Março de 2017.

________________________________________
Claudia Regina Bento de Freitas
Juiza Leiga

Remeto os autos ao MM. Juiz Togado, para posterior homologação.


Homologo por sentença, para que produza seus efeitos legais e jurídicos, o projeto
de sentença acima apresentado, na forma do art. 40 da Lei nº 9.099/95.

Duque de Caxias, 08/03/2017.

__________________________________________________________
Juiz de Direito";000464E47593DCA91B0EA2595D20FECB4C41C506032C4E0B;00041C1B4A88FAA15EA6935AB70A00B74596C5052E331B08;2016.021.070684-7;0.8841356039047241
19;2016.001.143686-8;Vistos etc. HOMOLOGO o PROJETO DE SENTENÇA proferido pelo DD. Juiz Leigo que me foi submetido, para que a mesma produza os seus jurídicos e legais efeitos, nos termos do artigo 4º, inciso III, da Resolução nº 08/2005, do Órgão Especial do TJ/RJ.  Sem custas judiciais, na forma da Lei nº 9.099/95. P.R.I. Certificado o trânsito em julgado, aguarde-se pronunciamento por 30 dias. Na inércia, dê-se baixa e arquive-se.;000464E47593DCA91B0EA2595D20FECB4C41C506032C4E0B;00041C1B4A88FAA15EA6935AB70A00B74596C5052E331B08;2016.021.070684-7;0.8841356039047241
20;2016.001.143686-8;Vistos etc. HOMOLOGO o PROJETO DE SENTENÇA proferido pelo DD. Juiz Leigo que me foi submetido, para que a mesma produza os seus jurídicos e legais efeitos, nos termos do artigo 4º, inciso III, da Resolução nº 08/2005, do Órgão Especial do TJ/RJ.  Sem custas judiciais, na forma da Lei nº 9.099/95. P.R.I. Certificado o trânsito em julgado, aguarde-se pronunciamento por 30 dias. Na inércia, dê-se baixa e arquive-se.;0004EE8887C433F61C0759849B13792A7CEAC5052A1E6461;0004DDD7410B20D93D6137F2509F2323499FC505053F251A;2016.021.022193-1;0.8836711049079895
21;2016.001.143686-8;"PODER JUDICIÁRIO DO ESTADO DO RIO DE JANEIRO
I JUIZADO ESPECIAL CÍVEL ¿ DUQUE DE CAXIAS 

PROCESSO Nº: 0022599-06.2016.8.19.0021
AUTOR: JOÃO ASCENDINO DE SANTANA
RÉU: ITAU UNIBANCO S/A

PROJETO DE SENTENÇA

Vistos, etc.
Dispensado relatório nos termos do art. 38, da Lei nº 9.099/95. 
Trata-se de ação ajuizada por JOÃO ASCENDINO DE SANTANA em face de ITAU UNIBANCO S/A objetivando a declaração de inexistência do contrato 0048875897020150727, em seu nome, a devolução em dobro de valores pagos no importe de R$ 1.880,00 e compensação por danos morais. Sustenta que vem sendo descontado acerca de um contrato de empréstimo consignado que não contratou. 
Decisão indeferindo a antecipação dos efeitos da tutela, à fl. 28.
A parte ré foi citada e ofereceu contestação escrita e, no mérito, sustenta que inexiste direito a ser amparado à parte autora. Requereu a improcedência do pedido. 
É o breve relatório. 
A relação estabelecida entre as partes é de consumo, porquanto presentes os requisitos subjetivos (arts. 2º, caput, e 3º, caput, da Lei nº 8.078/90) e objetivo (art. 3º, § 2º, da Lei n.º 8.078/90) que a caracterizam. Aplicável, portanto, o regime jurídico especial da Lei n.º 8.078/90, a qual abriga a responsabilidade do tipo objetiva, em que é necessária, apenas, a prova do dano e do nexo causal, sendo despicienda a culpa da ré, e ainda assegura ao consumidor, como medida protetiva, a inversão do ônus da prova (artigo 6º, VIII, do CDC), haja vista a verossimilhança dos fatos narrados na petição inicial, bem como sua condição de hipossuficiente e vulnerável na relação de consumo. 
Fato integrativo do direito alegado e que, todavia, não foi impugnado especificamente pela ré, conquanto ônus que lhe competia por força do que estatui o art. 341 do NCPC, presumindo-se verdadeira a afirmação.
Conforme se depreende dos autos a parte autora vem recebendo cobranças que não reconhece. Alega que tal débito refere-se a contrato de empréstimo que não aderiu, relatando que jamais recebeu algum crédito por parte do banco réu. 
A ré por seu turno afirma que não foi verificada qualquer irregularidade na cobrança. 
No caso presente, a parte ré não demonstrou a legalidade da contratação e regular cobrança. 
Na verdade, era dever da parte ré fazer prova dos fatos modificativos, extintivos ou impeditivos do direito autoral, na forma do art. 373, II do NCPC, bem como não demonstrou a ocorrência de uma das excludentes de responsabilidade civil no CDC, já que a responsabilidade objetiva do fornecedor de bens e serviços, através art. 14 daquele diploma legal, somente pode ser afastada se comprovada a culpa exclusiva do consumidor ou de terceiro para a ocorrência do evento danoso, nos termos que lhe impõe o art. 14, § 3º, incisos I e II da Lei nº 8.078/90, o que não foi feito, limitando-se a parte ré a apresentar impressos de tela de computador, sem qualquer valor probatório, eis que produzido unilateralmente.
Ante a ausência de prova da legitimidade do débito imputado ao autor, se reputam ilegítimas as cobranças a ele enviadas. Em decorrência lógica, acolho o pedido de declaração de inexistência de débito e do contrato.
Assim sendo, e mais, considerando as alegações veiculadas pela parte autora em sua petição inicial e na audiência realizada perante este juízo, tenho como parcialmente procedentes as razões autorais invocadas ao embasamento de sua pretensão. 
É nítida a falha na prestação do serviço que não se mostrou seguro ou eficiente, a qual deve ser absorvida pela ré a título de risco do empreendimento, pois não fez prova de qualquer excludente de responsabilidade, devendo, portanto, responder pelos danos causados ao consumidor.
Dessa forma, reconheço a violação às legítimas expectativas do consumidor, sendo certo que a atitude do fornecedor de serviço não se afigura compatível com a boa-fé objetiva contratual, o dever de informar e a transparência máxima esperada na relação de consumo, o que sem dúvida alguma se afigura como prática abusiva e desrespeitosa nas relações contratuais, especialmente nas de consumo. 
Assim, faz jus à restituição do valor de R$ 1.880,00, mas na forma simples e não em dobro, pois não caracterizada a hipótese do art. 42, parágrafo único do CDC e não demonstrada a má-fé da fornecedora. 
Quanto ao pedido de indenização extrapatrimonial, formulado pela autora, deve o mesmo ser acolhido ante a configuração do dano moral indenizável, evidenciado pelo próprio fato. Conforme lição do Desembargador SÉRGIO CAVALIERI FILHO ""o dano moral existe in re ipsa"", ou seja, ""está ínsito na própria ofensa, decorre da gravidade do ilícito em si"" (Programa de Responsabilidade Civil, 2ª ed., Malheiros, p. 80).
No que tange ao quantum debeatur, deve o mesmo ser fixado de forma proporcional, moderada e razoável, compatível com a reprovabilidade da conduta ilícita, a intensidade e duração do sofrimento experimentado, a capacidade econômica do causador do dano e as condições sociais da vítima, dentre outras circunstâncias relevantes.
Com base em tais critérios, e o decurso de tempo sem qualquer solução por parte do réu, entende esse Juízo que o valor de R$ 8.000,00 (oito mil reais) mostra-se razoável e proporcional.

Ante o exposto, JULGO PROCEDENTES EM PARTE os pedidos autorais, extinguindo o feito com resolução do mérito, nos termos do artigo 487, I do Novo CPC, para: a) declarar a inexistência do contrato 0048875897020150727, em nome da parte autora e débitos vinculados objeto da lide; c) condenar a ré a indenizar a parte autora pelos danos materiais no valor total de R$ 1.880,00 (hum mil oitocentos e oitenta reais), corrigidos monetariamente desde a data do pagamento e juros de mora de 1% ao mês a partir da citação; c) condenar a ré a pagar a autora a quantia de R$ 8.000,00 (oito mil reais), a título de compensação por danos morais, acrescido de correção monetária a contar da presente sentença, e juros de mora de 1% ao mês, estes a incidir da data da citação. 

A parte ré fica ciente de que deverá depositar as quantias acima fixadas, referentes ás condenações de pagar quantia certa, no prazo de 15 (quinze) dias após o trânsito em julgado sob pena de multa de 10%, conforme prevista no artigo 523, I do Novo CPC, e nos termos do Enunciado Jurídico 13.9.1 do Aviso 23/2008.
Publicações, intimações e retificações conforme requerido pelas partes. No caso de retificação de nome, oficie-se ao Distribuidor e anote-se onde couber. 
Sem ônus sucumbenciais em razão do art. 55 da Lei n. 9.099/95.
Remeto à apreciação do MM. Juiz Togado, na forma do disposto no art. 40, da lei 9099/95.
Duque de Caxias, 25 de outubro de 2016.

Adriana do Rosario Soneira
Juíza Leiga";0004EE8887C433F61C0759849B13792A7CEAC5052A1E6461;0004DDD7410B20D93D6137F2509F2323499FC505053F251A;2016.021.022193-1;0.8836711049079895
22;2016.001.143686-8;Considerando que o presente Acordo versa sobre direitos patrimoniais de caráter privado, HOMOLOLO o mesmo com fundamento no Art. 487, III,  alínea  b do NCPC,  para que possa produzir seus efeitos legais, sem que isso implique em afronta aos artigos 494 e 505 do Código de Processo Civil.;0004EE8887C433F61C0759849B13792A7CEAC5052A1E6461;0004DDD7410B20D93D6137F2509F2323499FC505053F251A;2016.021.022193-1;0.8836711049079895
23;2016.001.143686-8;"Homologo o acordo celebrado entre as partes para que surta seus jurídicos e legais efeitos, e julgo o feito extinto, com resolução do mérito, nos termos do art. 487, inc. III, b, do novo Código de Processo Civil ( Lei nº 13.105/ 2015). 
Se for o caso, comprovado o depósito, expeça-se mandado de pagamento em favor da parte autora, independentemente de nova conclusão.  
Decorrido o prazo do cumprimento o acordo, aguarde-se por cinco dias a manifestação das partes; não havendo manifestação,  dê-se baixa e arquive-se. 
FICAM AS PARTES CIENTES DE QUE A NOVA SISTEMÁTICA DE CONTAGEM DE PRAZO ESTABELECIDO NO ART. 219 DO NCPC/2015 NÃO SE APLICA AOS JUIZADOS ESPECIAIS CÍVEIS, CONSOANTE NOTA TÉCNICA 01/2016 DO FONAJE DE 04/03/2016 C/C A PRIMEIRA PARTE DO ENUNCIADO 86 TAMBÉM DO FONAJE, COMPUTANDO-SE OS PRAZOS EM DIAS CORRIDOS, ASSIM PROCEDENDO COM A FINALIDADE PRECÍPUA DE SE ALCANÇAR A BOA GESTÃO CARTORÁRIA COM FUNDAMENTO NO PRINCÍPIO DA CELERIDADE QUE REGE A LEI 9.099/95.";000472A0AEDD9E4692CB4AAFAB4B7F1B9364C5050639280B;000444530E78A52B0EA0940C0B2B807B72DBC50460301B36;2016.001.080448-5;0.8815971612930298
24;2016.001.143686-8;Vistos etc. HOMOLOGO o PROJETO DE SENTENÇA proferido pelo DD. Juiz Leigo que me foi submetido, para que a mesma produza os seus jurídicos e legais efeitos, nos termos do artigo 4º, inciso III, da Resolução nº 08/2005, do Órgão Especial do TJ/RJ.  Sem custas judiciais, na forma da Lei nº 9.099/95. P.R.I. Certificado o trânsito em julgado, aguarde-se pronunciamento por 30 dias. Na inércia, dê-se baixa e arquive-se.;0004E50638D83FF589A4BE39629E1796B324C505312D573A;0004D388AEDF78BC2FECF52890327B847EF8C504631F5807;2016.021.031425-8;0.8812191486358643
