;processo;sentenca;similar_file;similar_init;similar_processo;similaridade
22;2016.001.172291-9;"Processo nº: 0031869-75.2016.8.19.0208
Parte Autora: Ana Carolina de Souza Dutra Avila
1ª Ré: Marisa Lojas Varejista 
2ª Ré: Banco Itaucard



Projeto de Sentença



Dispensado o relatório nos termos do art. 38 da Lei n° 9.099/95, passo a decidir.

Inicialmente, deve ser extinto o processo, sem resolução do mérito, com relação ao pedido de devolução da quantia paga título de juros, tendo em vista que já foi realizado o estorno, assim, houve perda superveniente do objeto.

Rejeito a preliminar de ilegitimidade passiva suscitada pelas Rés, eis que as condições da ação são aferidas à luz dos fatos narrados na petição inicial, com base nos ditames da Teoria da Asserção, através do exercício de um juízo de admissibilidade hipotético. Desta forma, considerando-se os fatos narrados na petição inicial, verifica-se que se encontra presente a pertinência subjetiva da lide, eis que a existência de responsabilidade civil das Rés constituem o próprio mérito da causa.

Inexiste outra preliminar a dirimir, razão pela qual, reconhecendo a existência dos pressupostos processuais e das condições de regular desenvolvimento acionário, passo ao exame do mérito.

Cabe destacar que a relação jurídica entre as partes é de consumo, já que estão presentes os requisitos subjetivos (consumidor e fornecedor ¿ artigos 2o e 3o da Lei 8078/90) e objetivos (produto e serviço ¿ §§ 1o e 2o do artigo 3º da citada lei) de tal relação. 

No caso vertente, a parte Autora afirma que efetuou compras na loja da 1ª Ré, no valor de R$129,97, parcelado em 03 prestações de R$43,32, sem juros, no seu cartão de credito administrado pela 2ª Ré. Todavia, afirma que na fatura do cartão consta a cobrança de juros com a parcela. Afirma que entrou em contato com a Ré, mas as três parcelas foram cobradas no valor de R$49,66.

Em AIJ, a parte Autora afirma que a 2ª Ré já realizou o estorno do valor de R$19,01, cobrado a título de juros.

Cumpre esclarecer, que a restituição deve ser feita de forma simples, como já realizada, uma vez não configurada a hipótese de pagamento indevido, nos termos do parágrafo único do art. 42 do CDC. 

No que pertine ao pedido de compensação por danos morais, salienta-se que o mero inadimplemento contratual não configura por si só dano moral, visto não agride a dignidade humana. 

Neste sentido, verifico que inexiste nos autos qualquer prova de que a conduta da Ré haja, de forma real e concreta, imposto a parte Autora extraordinária dor, vexame ou humilhação, nem tampouco extremada ofensa à sua dignidade e honra, de forma a ensejar o advento do dano moral indenizável. 
A este respeito, releva notar que meros dissabores ou aborrecimentos cotidianos, inerentes à vida moderna, não constituem fato gerador do prejuízo extrapatrimonial passível de ensejar a obrigação de indenizar. 

Entendo, pois, incabível a pretensão autoral de compensação por danos morais, uma vez que, do relato contido na petição inicial, não se deflui a existência de qualquer lesão à sua honra ou a outro bem integrante de sua personalidade.



A conta do acima exposto, 


JULGO EXTINTO O PROCESSO, sem resolução do mérito, com relação ao pedido de devolução da quantia paga a título de juros, por perda superveniente do objeto.


JULGO IMPROCEDENTES os demais pedidos autorais.
Sem custas e honorários vez que em sede de Juizado Especial Cível, conforme disposto no artigo 55 da lei 9.099/95.
 

	Certificado o trânsito em julgado e não havendo novas manifestações no prazo de 15 (quinze) dias, dê-se baixa e arquivem-se. Cientes as partes de que decorridos 90 dias da data do arquivamento definitivo os autos processuais serão eliminados, nos termos do artigo 1º do Ato Normativo Conjunto 01/2005, publicado no DORJ de 07/01/05.
	

Projeto de sentença sujeito à homologação, assim, remeto os autos ao MM. Juiz Togado, nos termos do artigo 40 da Lei nº 9.099/95.


Rio de Janeiro, 20 de Março de 2017.


VANESSA DE SOUZA BRISIS
Juíza Leiga";00043D2795A028FFD7AA360A6B60AB2AFA0AC506025A0D5F;00042609BC0E78F94B64D3AA5A958A1D355CC50535014338;2016.208.031493-6;0.7558811902999878
23;2016.001.172291-9;Homologo por sentença na forma do artigo 40 da Lei nº 9.099/95 o Projeto de Sentença elaborado pelo Juiz Leigo. PRI. Certifique-se o trânsito em julgado. Defiro desde já, se for o caso, independente de nova conclusão e havendo quitação da parte Autora, a expedição de mandado de pagamento. Após, dê-se baixa e arquivem-se.;00043D2795A028FFD7AA360A6B60AB2AFA0AC506025A0D5F;00042609BC0E78F94B64D3AA5A958A1D355CC50535014338;2016.208.031493-6;0.7558811902999878
24;2016.001.172291-9;"Dispensado o relatório nos termos do art. 38 da Lei nº 9.099/95, passo a decidir.

Inexiste preliminar a dirimir, razão pela qual, reconhecendo a existência dos pressupostos processuais e das condições ao regular desenvolvimento da ação, passo ao exame do mérito.

A relação jurídica entre as partes é de consumo, já que estão presentes os requisitos subjetivos (consumidor e fornecedor - artigos 2º e 3º da Lei nº 8.078/90) e os objetivos (produto e serviço - §1º e 2º do artigo 3º da citada lei) de tal relação.

No caso em comento, a Autora afirma que é cliente do banco Réu e possui cartão de crédito, tendo sido surpreendida com compras não reconhecidas nas faturas vencidas em 02/06/2015 e 02/07/2015, as quais foram por ela impugnadas administrativamente, sem êxito, pelo que requer indenização por danos morais e o imediato cancelamento das cobranças contestadas.

Em AIJ, a parte Ré requereu depoimento pessoal da parte Autora, no qual a Autora afirmou guardar a senha do seu cartão juntamente com este, em sua carteira, que ninguém tem acesso, que não foi furtada ou roubada e que é necessário, para as compras, também a sua assinatura. 

Diante da afirmação da parte Autora, ainda que esta afirme não emprestar o seu cartão a ninguém e nem ter sido furtada ou roubada, impõe-se o reconhecimento de excludente da responsabilidade objetiva do banco Réu, pois ao guardar a senha junto com o seu cartão de crédito, a Autora violou o seu dever de guarda e conservação, sendo importante ressaltar que a Autora, independentemente de sua condição financeira, é pessoa capaz e esclarecida o suficiente para compreender que a sua senha é pessoal e intrasferível e que, ao anotá-la junto ao seu cartão, aumenta muito o risco de sofrer prejuízos por condutas praticadas por terceiros de má-fé. 

Dessa forma, entendo que restou demonstrada culpa exclusiva de terceiro, para o que a Autora contribuiu, não existindo nos autos qualquer indício de conduta culposa pela parta Ré. 

Portanto, considero que a parte Autora não logrou êxito em provar o fato constitutivo de seu direito (art. 373, I, do Código de Processo Civil), razão pela qual não há como se acolher os seus pedidos.

Por derradeiro, ressalto que a reparação por danos morais somente pode decorrer de um ato ilícito. Por sua vez, o reconhecimento de um ato ilícito depende de uma conduta determinada que lhe tenha dado causa. 

Inexiste nos autos qualquer prova de que a conduta da Ré haja, de forma real e concreta, imposto à parte Autora extraordinária dor, vexame ou humilhação, nem tampouco extremada ofensa à sua dignidade e honra, de forma a ensejar o advento do dano moral indenizável.

 Portanto, entendo incabível o pedido de indenização por danos morais formulado pela parte Autora, tendo em vista que não há qualquer prova de conduta ilícita praticada pela parte Ré.

A conta do acima exposto, JULGO IMPROCEDENTES OS PEDIDOS formulados pela parte Autora; 

Sem custas e honorários vez que em sede de Juizado Especial Cível, conforme disposto no artigo 55 da Lei nº 9.099/95.

Certificado o trânsito em julgado e não havendo novas manifestações no prazo de 15 (quinze) dias, dê-se baixa e arquivem-se. Cientes as partes de que decorridos 90 dias da data do arquivamento definitivo, os autos processuais serão eliminados, nos termos do artigo 1º do Ato Normativo Conjunto 01/2005, publicado no DORJ de 07/01/05.

Projeto de sentença sujeito à homologação, assim, remeto os autos à MM. Juíza Togada, nos termos do artigo 40 da Lei nº 9.099/95.";0004DE5420883F2F924FC9C7E51F46E0A40BC50528062659;000499076D92D6DE54673CF2D7138F7655A5C5050B2B434D;2016.001.176049-0;0.7550208568572998
25;2016.001.172291-9;"Homologo, por sentença, para que surta seus efeitos legais, o projeto de sentença elaborado pelo juiz leigo, na forma do artigo 40 da Lei nº 9.099/95. 

Em caso de depósito judicial referente à condenação, expeça-se mandado de pagamento, independentemente de nova conclusão. 

Caso haja valor remanescente a ser recebido, manifeste-se o credor em 7 dias, sob pena de arquivamento dos autos. Após o trânsito em julgado, tratando-se de sentença de improcedência ou de extinção do feito sem resolução do mérito, dê-se baixa e arquivem-se imediatamente. 

Tratando-se de sentença de procedência, após o trânsito em julgado e o decurso do prazo de 15 dias para pagamento espontâneo do valor da condenação previsto no art. 523 do NCPC c/c o entendimento consolidado no enunciado nº 13.9.1 do Aviso nº 23/2008 do TJERJ, aguarde-se por mais 7 dias a manifestação das partes e, em seguida, caso permaneçam em silêncio, proceda-se a baixa e ao arquivamento. 

FICAM AS PARTES CIENTES DE QUE A NOVA SISTEMÁTICA DE CONTAGEM DE PRAZO ESTABELECIDO NO ART. 219 DO NCPC/2015 NÃO SE APLICA AOS JUIZADOS ESPECIAIS CÍVEIS, CONSOANTE NOTA TÉCNICA 01/2016 DO FONAJE DE 04/03/2016 C/C A PRIMEIRA PARTE DO ENUNCIADO 86 TAMBÉM DO FONAJE, COMPUTANDO-SE OS PRAZOS EM DIAS CORRIDOS, ASSIM PROCEDENDO COM A FINALIDADE PRECÍPUA DE SE ALCANÇAR A BOA GESTÃO CARTORÁRIA COM FUNDAMENTO NO PRINCÍPIO DA CELERIDADE QUE REGE A LEI 9.099/95.";0004DE5420883F2F924FC9C7E51F46E0A40BC50528062659;000499076D92D6DE54673CF2D7138F7655A5C5050B2B434D;2016.001.176049-0;0.7550208568572998
26;2016.001.172291-9;"Ao 23º dia do mês de Novembro de 2016, às 15:12 horas, na sala de audiências do Juizado Especial Cível da Comarca de Três Rios, perante o MMª. Juíza de Direito Drª. Elen de Freitas Barbosa, foi aberta a audiência de instrução e julgamento nos autos do processo supra mencionado. Efetuado o pregão, ao mesmo respondeu a parte autora e a(s) parte(s) ré(s) representada(s) por seu(s) preposto(s) e advogado(s) acima mencionado(s). Tentada a conciliação, a mesma foi aceita nos seguintes termos: 1) A 1ª parte ré pagará a parte autora o valor de R$ 900,00 (novecentos reais), no prazo de 30 (trinta) dias corridos, a contar da presente; 2) O pagamento será feito mediante depósito identificado em nome da parte autora, CPF nº. 097.957.847-73. Comprovado o depósito, expeça-se mandado de pagamento, independente de nova conclusão; 3) O não cumprimento da cláusula acima importará na incidência de multa de 30% sobre o valor acordado; 4) Com o depósito a parte autora, dará plena quitação as duas partes rés. Pela MMª. Drª. Juíza foi proferida a seguinte SENTENÇA: Considerando a vontade manifestada pelas partes, HOMOLOGO o acordo celebrado, nesta data, para que surta seus jurídicos e legais efeitos. Por via de conseqüência JULGO EXTINTO o processo, COM RESOLUÇÃO DO MÉRITO, nos termos do artigo 487, III, b do NCPC. Sem custas e honorários. Publicada em audiência. Intimados os presentes. Registre-se. Com o trânsito em julgado, dê-se baixa e arquivem-se. Nada mais havendo, às 15:15 horas, encerrou-se a presente, que vai por todos assinada, após lido e achado conforme. Eu, _______, Lídia Wendling Pessamilio Botelho, mat. 01/21290 digitei e eu, _______, Victor Pires da Silva, Escrivão mat. 01/06145, subscrevo.";0004B0CDBD96BDD55D621EDF5EC5B8503E7DC5052C544F0A;00042542BDCECB60E8D369ABD088A6250F91C50503563E3D;2016.063.006840-2;0.7391338348388672
27;2016.001.172291-9;Projeto em Revisão;0004036B6B666DC8BACC9443FCAC01A71625C505370F151A;0004DD09AD38B23556D8071F0116CB6A3094C50461483C1D;2016.204.021544-3;0.7386592626571655
28;2016.001.172291-9;"Dispensado o relatório, consoante o artigo 38 da Lei nº. 9.099/95, passo a decidir.

Alega a parte autora ser titular de cartão administrado pelo réu e que, na fatura vencida em abril de 2016, realizou pagamento parcial, restando o valor de R$ 177,32, porém houve a cobrança deste valor mais R$ 180,35, que seria o mesmo adicionado de encargos, gerando cobrança indevida. Requer refaturamento, estorno de juros e indenização por danos morais.

Em sua contestação, alega o réu que não houve cobrança indevida.

	Trata-se de relação de consumo, nos termos do Código de Defesa do Consumidor. De acordo com o inciso I, art. 373, do Código de Processo Civil, é ônus da parte autora a apresentação provas constitutivas de seu direito, o que não ocorreu no caso.

	A caracterização de relação de consumo não afasta necessidade de demonstrar fatos constitutivos dos direitos alegados, pois a inversão do ônus da prova não constitui ferramenta processual para auxiliar quem nada prova.

A autora narra, em sua petição inicial, que deixou de realizar o pagamento da fatura vencida em abril em seu valor total. 

	Por outro lado, os valores cobrados decorrem de encargos de mora parcial nos diversos meses que são questionados nos autos. Deve-se ponderar, ainda, que a autora sequer aponta quais valores considera indevidos. 

	Posto isso, julgo IMprocedente o pedido. Sem ônus sucumbenciais, consoante o artigo 55 da Lei 9.099/95.

	Anote-se o nome dos advogados da ré para fins de publicação, conforme requerimento formulado em contestação.

Projeto de sentença que se submete à homologação.";0004036B6B666DC8BACC9443FCAC01A71625C505370F151A;0004DD09AD38B23556D8071F0116CB6A3094C50461483C1D;2016.204.021544-3;0.7386592626571655
29;2016.001.172291-9;Dispensado o relatório na forma do art. 38 da Lei 9099/95. HOMOLOGO o projeto de sentença proferido pelo Juiz Leigo, para que produza seus jurídicos e legais efeitos, na forma do art. 40 da Lei 9.099/95.  FICAM AS PARTES CIENTES DE QUE, NOS TERMOS DO AVISO 02/2016 DA COJES (D.O. 31/03/2016) OS PRAZOS PROCESSUAIS EM SEDE DE JEC CONTINUARÃO A SER CONTADOS EM DIAS CORRIDOS, INAPLICÁVEL O ARTIGO 219 DO NCPC.Fica a parte ré ciente de que caso não pague a quantia certa a que foi condenada em 15 dias, contados do trânsito em julgado da sentença, o valor da condenação será acrescido de multa de 10%, por aplicação do artigo 523,§1º do CPC, sendo certo, ainda, que a comprovação do depósito deverá vir aos autos no prazo de 5 dias, após a efetivação. Comprovado o depósito nos autos, e a quitação por parte do credor, expeça-se mandado de pagamento. Após, dê-se baixa e arquive-se. Caso negativo, após o decurso do prazo de trinta dias do trânsito em julgado, dê-se baixa e arquive-se.;0004036B6B666DC8BACC9443FCAC01A71625C505370F151A;0004DD09AD38B23556D8071F0116CB6A3094C50461483C1D;2016.204.021544-3;0.7386592626571655
30;2016.001.172291-9;"Homologo o acordo celebrado entre as partes para que surta seus jurídicos e legais efeitos, e julgo o feito extinto, com resolução do mérito, nos termos do art. 487, inc. III, b, do novo Código de Processo Civil ( Lei nº 13.105/ 2015). 

Se for o caso, comprovado o depósito, expeça-se mandado de pagamento em favor da parte autora, independentemente de nova conclusão.   Após, nada mais sendo requerido, dê-se baixa e arquivem-se. 


Decorrido o prazo do cumprimento o acordo, aguarde-se por cinco dias a manifestação das partes; não havendo manifestação,  dê-se baixa e arquive-se.";00043C0564A9BE12882A365EB3B449AD775DC5054F55270F;0004EF9C497021AE8F23C8EB9A7102E606ECC505153D2A56;2016.001.284003-1;0.7335891723632812
31;2016.001.172291-9;"
Processo 0395626-09.2016.8.19.0001

AUTOR: VICTOR FIGUEIREDO GENOVES - (Adv. Leandro Nunes da Cunha Moreira, OAB 199163)
RÉU: ITAÚ UNIBANCO S/A - (Adv. Veronica Cuiabano Figueiredo, OAB 176437)
Representante: Renato Gonçalves Junior. 
	

TERMO DE AUDIÊNCIA 
Ao décimo sétimo dia do mês de fevereiro de 2016, na sala de audiências do VI Juizado Especial Cível, em sessão presidida pelo Juiz MAURO NICOLAU JÚNIOR, feito o pregão, às 16h00min, compareceram as partes e advogados conforme acima mencionado. Proposta a conciliação esta restou infrutífera tendo a parte ré se reportado à contestação já apresentada por meio eletrônico da qual teve vista a parte contrária. Encerrada a fase probatória visto que as partes afirmaram a inexistência de outras provas a produzir, em alegações finais os doutos patronos se reportaram à inicial e contestação. A seguir pelo MM. Juiz foi proferida a seguinte SENTENÇA: VICTOR FIGUEIREDO GENOVES ajuizou ação de indenização por danos morais contra ITAÚ UNIBANCO S/A. Registra que, no dia 12/11/2016, o autor se dirigiu às Lojas Americanas para comprar um aparelho celular com o intuito de presentear sua sogra através do cartão de credito, quando foi informado pelo caixa que o cartão não passou. Que no mesmo instante ligou para o Banco ITAÚ (protocolo 20163179196210000) para resolver a situação, uma vez que o seu limite de crédito é de R$ 8.003,39 e a compra foi de R$ 2.797,87, mas a ré não soube informar o porquê de o cartão ter sido negado. Alega que o demandante resolveu pagar no débito, mesmo sem fundos para tanto, além de saldo negativo com o consequente uso do cheque especial, e para que não ficasse muito tempo com saldo negativo sua esposa transferiu R$ 2.000,00 de sua poupança. Requer: 
I - A citação da ré;
II -  A inversão do ônus da prova; 
III - A condenação da empresa ré ao pagamento de danos morais no valor de R$ 10.000,00

Nota fiscal a fls. 11; consulta de lançamentos a fls. 12/14. Contestação às fls. 34/77, onde alega que o réu agiu corretamente em negar a transação de R$ 2.777,89, no estabelecimento Lojas Americanas, em 12/11/2016, na medida em que tal transação estava fora do perfil de utilização do cartão pela parte autora, o que acionou o sistema de segurança do réu acarretou o bloqueio da transação como medida de segurança. Audiência de conciliação realizada a fls. 103, a qual restou infrutífera. É O RELATÓRIO. DECIDO. Pretende o autor a condenação do réu ao pagamento de indenização por dano moral. Afirma ter sido recusado o pagamento com cartão de crédito sem qualquer justificativa. O réu afirma em contestação que a recusa foi injustificada na medida em que a compra que o autor tentava fazer estava ""fora de seu perfil"" e, assim, houve o acionamento do sistema de segurança. Diversamente do que afirma o réu, os extratos das faturas por ele próprio trazidas com a peça de defesa, demonstram que o autor faz uso regular de seu cartão de crédito com faturas mensais que ultrapassam, em muito, o valor da compra que pretendia fazer. Em consequência, o fato impeditivo do direito do autor não restou comprovado, ao contrário, foi desmentido pelo próprio réu que o alegou. Cuida-se de hipótese característica de julgamento antecipado da lide, na forma do artigo 330, inciso I, do Código de Processo Civil, uma vez que desnecessária a produção de provas oral e pericial. A relação travada entre as partes é de consumo, por ser a autora consumidora, nos termos do artigo 2º do Código de Defesa do Consumidor, ao passo que o réu é prestador de serviços, conforme dispõe o artigo 3º do mesmo Diploma. Nos termos do artigo 14 do CDC incumbe ao réu demonstrar a inexistência de falha na prestação do serviço, para tanto, deve demonstrar que não existe defeito no serviço ou que o fato é exclusivo do consumidor ou de terceiro.   Já o consumidor, deve demonstrar o fato, dano e o nexo causal entre os dois primeiros. Incontroversos a relação jurídica existente entre as partes e o bloqueio do cartão de crédito de titularidade da autora. Ademais, é cediço ser necessária prévia notificação para que a instituição financeira proceda ao bloqueio do cartão do consumidor, evitando, assim, a exposição à situação constrangedora consistente na recusa de aquisição de determinada mercadoria em estabelecimento comercial. Confira-se a jurisprudência do Egrégio Tribunal de Justiça deste Estado:

AGRAVO LEGAL NA APELAÇÃO CÍVEL. DECISÃO MONOCRÁTICA QUE NEGOU PROVIMENTO AO RECURSO. AÇÃO DE INDENIZAÇÃO POR DANOS  MORAIS.  RITO  SUMÁRIO.  BLOQUEIO DO CARTÃO  DE CRÉDITO SEM A  PRÉVIA NOTIFICAÇÃO DO CONSUMIDOR. FALHA NA PRESTAÇÃO DO SERVIÇO. FRUSTRAÇÃO DA EXPECTATIVA. SENTENÇA CONDENANDO O RÉU AO PAGAMENTO DE INDENIZAÇÃO POR DANOS MORAIS QUE NÃO MERECE REFORMA, SOBRETUDO EM RAZÃO DO SEU CARÁTER PEDAGÓGICO. FUNDAMENTOS INABALADOS. RECURSO CONHECIDO. PROVIMENTO NEGADO. (APELAÇÃO.  Processo 0042835-86.2010.8.19.0021.  Des. MARIA REGINA NOVA ALVES.  QUINTA CÂMARA CÍVEL - Julgamento: 06/03/2012)


APELAÇÃO. Ação indenizatória c/c obrigação de fazer. O bloqueio de cartão de crédito, sem notificação prévia, ofende direitos da personalidade, configurando  dano  moral  indenizável. Redução da verba compensatória de modo a consultar a razoabilidade e a proporcionalidade, a par de atender a seu caráter dúplice (compensatório e punitivo). Aplicação da parte final do verbete 75, da Súmula do TJRJ. Recurso a que se dá parcial provimento. (APELAÇÃO.  Processo 0147833-68.2010.8.19.0001.  Des. JESSE TORRES.  SEGUNDA CÂMARA CÍVEL - Julgamento: 21/10/2011)


Assim, sendo ilícito o bloqueio do cartão de crédito sem justificativa idônea e prévia comunicação ao consumidor, ensejando constrangimento no momento da aquisição de mercadoria, surge o dever de indenizar o dano moral configurado, conforme precedentes acima citados. O quantum debeatur deve ser fixado em atenção aos princípios da proporcionalidade e razoabilidade, e, por isso, arbitro o dano moral suportado pela autora no valor de R$ 10.000,00 (dez mil reais), por entender que guarda consonância com os princípios citados bem como as circunstâncias do caso concreto, mormente ante a habitual impontualidade da autora, como se vê das faturas juntadas aos autos. Por tais motivos JULGO PROCEDENTE o pedido para condenar o réu ao pagamento do valor de R$ 10.000,00 a título de indenização por danos morais, com juros contados da citação e correção monetária desta data. Intimados em audiência, registre-se e cumpra-se. Certificados o trânsito em julgado e a inexistência de custas a recolher dê-se baixa e arquive-se. Nada mais havendo a ser consignado considerando que as partes e seus patronos afirmaram a inexistência de dúvidas ou impugnações quanto ao conteúdo da presente ata foi a audiência encerrada as 16:05 horas. 

MAURO NICOLAU JUNIOR
Juiz de Direito";0004841F3E7200B930D4713F78B8F1A82C8DC505634B0628;00042DCB7FCD46C6C41496C9899074F48B1BC50522091225;2016.001.344782-1;0.7303789854049683
