;processo;sentenca;similar_file;similar_init;similar_processo;similaridade
14;2016.001.051037-4;"ESTADO DO RIO DE JANEIRO
PODER JUDICIÁRIO
VI Juizado Especial Cível da Comarca da Capital - RJ

Processo nº: 0173580-10.2016.8.19.0001
Autor: JOÃO PAULO CAVALCANTI DA SILVA
Réu: AZUL LINHAS AÉREAS BRASIELIRAS S.A.

PROJETO DE SENTENÇA

Cuida-se de ação sob o rito sumaríssimo por meio da qual busca a parte demandante a condenação da ré ao pagamento de indenização por danos materiais e morais.
Como causa de pedir, alega o demandante, em resumo, que contratou com a ré transporte aéreo para a ilha de Fernando de Noronha. Conforme narrado, suas bagagens não foram devolvidas no desembarque (incluindo sua prancha de surfe), porém apenas no final da tarde do dia seguinte (mais de 24 horas depois). O autor informou que a ré o orientou a realizar as compras necessárias que tais gastos seriam ressarcidos no prazo de dez dias. Ocorre que a ré não apenas demorou aproximadamente dois meses para fazer o reembolso como ainda o fez de forma parcial.
		A ré, em contestação, afirma que a bagagem do autor foi devolvida em tempo exíguo, de forma intacta e com todos os seus pertences pessoais, e que seus gastos emergenciais foram reembolsados. No mais, alega que, por cortesia, seu voo de volta foi reagendado, não havendo, assim, dano material ou moral a ser indenizado.
		Embora dispensado pela norma do artigo 38 da Lei 9.099/95, é o breve relatório, DECIDO.
 Inicialmente, convém frisar que a relação estabelecida entre as partes é de consumo, porquanto presentes os requisitos subjetivos (arts. 2º, caput, e 3º, caput, da Lei nº 8.078/90) e objetivo (art. 3º, § 2º, da Lei n.º 8.078/90) que a caracterizam. 
Portanto, é ônus do fornecedor demonstrar os fatos extintivos ou modificativos do direito do autor. Assim sendo, defiro a inversão do ônus da prova.
Os fatos não chegam a ser negados pela ré, que alega, apenas, que tomou todas as medidas possíveis desde que constatado o extravio, razão pela qual não haveria danos a serem indenizados.
Não se discute, portanto, que a ré falhou na prestação do seu serviço, já que sua obrigação era devolver os pertences do autor no momento do desembarque, não mais de 24h após.
A existência dos danos alegados será analisada a seguir.
O autor comprova, pelos documentos que acompanham a inicial, ter realizado gastos excepcionais, que somente se justificaram em razão da falha aludida.
Apesar da promessa de que obteria reembolso, a ré somente lhe pagou a quantia de R$ 100,00, conforme se verifica da documentação juntada pela própria ré, quantia essa que não cobra os gastos incorridos pelo autor, motivo pelo qual deverá ela indenizá-lo pela diferença ainda não ressarcida.
Não havendo, pela ré, impugnação específica aos valores pedidos na inicial, condeno-a ao pagamento da quantia de R$ 805,00 (oitocentos e cinco reais), conforme pedido pelo autor.
No mais, claros, ainda, são os danos morais indenizáveis alegados na inicial.
O extravio narrado, como se sabe, por si só, é capaz de gerar angústia e apreensão ao consumidor que em muito ultrapassam os chamados meros dissabores do dia a dia, atingindo a sua dignidade e autorizando, portanto, o reconhecimento de danos morais alegados, ainda que pelo período de pouco mais de um dia.
O autor, em razão da falha da ré, foi obrigado a permanecer quase dois dias inteiros de viagem sem seus pertences pessoais, havendo, dentre eles, sua prancha de surfe, transportada com a finalidade de praticar tal esporte na ilha, bastante procurada pelos adeptos da modalidade..
Levando em consideração, portanto, a extensão dos danos sofridos pelo autor e a reprovação que recai sobre a conduta da ré, fixo em R$ 6.000,00 (seis mil reais) o valor a ser pago a título de indenização por danos morais, valor, contudo, inferior ao pedido na inicial.
Pelo exposto, JULGO PARCIALMENTE PROCEDENTES OS PEDIDOS veiculados na inicial, a fim de CONDENAR A RÉ a pagar ao autor, a título de indenização por danos materiais, a quantia de R$ 805,00 (oitocentos e cinco reais), acrescida de juros de 1% ao mês desde a data a data da citação e correção monetária segundo os índices fornecidos pela CGJ/TJ desde o desembolso.
 		Condeno a ré, ainda, a pagar ao autor a quantia de R$ 6.000,00 (seis mil reais) a título de indenização por danos morais, acrescida de juros de 1% ao mês desde a data a data da citação e correção monetária segundo os índices fornecidos pela CGJ/TJ desde a data da sentença.
		Sem custas e honorários, por força do disposto no artigo 55 da Lei Especial.

P.R.I.

Rio de Janeiro, 5 de agosto de 2016

RENATO PERROTTA
JUIZ LEIGO


 		Submeto o projeto de sentença à homologação do Dr. Juiz de Direito, na forma do art. 40 da Lei 9.099/95.";0004844E036C99BB557EE0829AA3D0B5C37DC505275F3948;0004F0185034B78D46A3CB56106611F33481C5044F285A15;2016.001.149617-8;0.5618861317634583
15;2016.001.051037-4;"Homologo, por sentença, para que surta seus efeitos legais, o projeto de sentença elaborado pelo juiz leigo, na forma do artigo 40 da Lei nº 9.099/95.  

Em caso de depósito judicial referente à condenação, expeça-se mandado de pagamento, independente de nova conclusão, cumprindo à parte ré, quando do pagamento, apresentar planilha discriminada do valor da condenação.  

Caso haja valor remanescente a ser recebido, manifeste-se o credor em 7 dias, sob pena de arquivamento dos autos. Após o trânsito em julgado, tratando-se de sentença de improcedência ou de extinção do feito sem resolução do mérito, dê-se baixa e arquivem-se imediatamente.  

Tratando-se de sentença de procedência, após o trânsito em julgado e o decurso do prazo de 15 dias para pagamento espontâneo do valor da condenação previsto no art. 523 do NCPC c/c o entendimento consolidado no enunciado nº 13.9.1 do Aviso nº 23/2008 do TJERJ, aguarde-se por mais 7 dias a manifestação das partes e, em seguida, caso permaneçam em silêncio, proceda-se a baixa e ao arquivamento.  

FICAM AS PARTES CIENTES DE QUE A NOVA SISTEMÁTICA DE CONTAGEM DE PRAZO ESTABELECIDO NO ART. 219 DO NCPC/2015 NÃO SE APLICA AOS JUIZADOS ESPECIAIS CÍVEIS, CONSOANTE NOTA TÉCNICA 01/2016 DO FONAJE DE 04/03/2016, COMPUTANDO-SE OS PRAZOS EM DIAS CORRIDOS, ASSIM PROCEDENDO COM A FINALIDADE PRECÍPUA DE SE ALCANÇAR A BOA GESTÃO CARTORÁRIA COM FUNDAMENTO NO PRINCÍPIO DA CELERIDADE QUE REGE A LEI 9.099/95.   

Cumpridas as formalidades legais, dê-se baixa e arquivem-se os autos.";0004844E036C99BB557EE0829AA3D0B5C37DC505275F3948;0004F0185034B78D46A3CB56106611F33481C5044F285A15;2016.001.149617-8;0.5618861317634583
16;2016.001.051037-4;"Dispensado o relatório nos termos do artigo 38 da Lei 9.099/95, bem como a luz dos princípios da oralidade, simplicidade, informalidade, economia processual e celeridade, instituídos no artigo 2º da Lei dos Juizados Especiais, passo a decidir:

O Código do Consumidor no seu artigo 14 disciplinou a responsabilidade por danos causados aos consumidores em razão da prestação de serviços defeituosos, em exata correspondência com o artigo 12. O caput do dispositivo prevê a responsabilidade do fornecedor de serviços, independentemente da extensão da culpa, acolhendo, também, nesta sede, os postulados da responsabilidade objetiva. O fornecedor de serviço só não será responsabilizado quando provar que, tendo prestado o serviço, o defeito inexistiu ou a culpa exclusiva do consumidor ou de terceiro.

É certo que o exercício do direito de defesa é um ônus, não traduzindo, pois, nem uma obrigação e nem um dever, já que é incumbência atribuída a um sujeito em seu próprio interesse. Ao tomar conhecimento da demanda contra si proposta, pode a parte ré exercitar o direito de defesa. A contestação é o meio, por excelência, deste exercício e reveste-se de caráter preclusivo, já que, uma vez ofertada, tem se por consumado o direito de defesa, salvo incidentes qualquer das hipóteses elencadas no artigo 342 do Novo Código de Processo Civil, sendo certo que, consoante o artigo 434, do referido diploma legal, deve a parte instruir a resposta com os documentos destinados a provar-lhes as alegações.

Após acurada análise dos elementos coligidos aos autos, extrai-se ter restado demonstrada a falha na prestação do serviço da parte ré, consubstanciada na ausência de cumprimento do serviço conforme contratado evidenciado às fls.16/18, sendo certo que a alegação de cancelamento do voo de conexão da parte autora em razão de necessidade de manutenção da aeronave, traduz, fortuito interno, risco inerente da atividade desenvolvida, impondo-se o dever de indenizar com a reparação integral dos prejuízos causados.

Os danos morais são evidentes e decorreram dos constrangimentos indevidamente impostos à parte autora, notadamente no que concerne na ausência de cumprimento do serviço conforme contratado inicialmente, sendo da própria lei a reparabilidade de danos morais decorrentes de sofrimentos, dor, perturbações emocionais e psíquicas, constrangimento, angústia e desconforto espiritual por bem ou serviço defeituoso ou inadequadamente fornecido, devendo o quantum indenizatório observar os critérios e princípios que informam o instituto.

O dano material restou comprovado às fls.15. 

Isto posto, JULGO PROCEDENTE o pedido para condenar a parte ré a restituir a parte autora a quantia de R$80,00, corrigida monetariamente do desembolso e com juros da citação, pelos danos materiais, bem como a indenizá-la com o valor de R$3.000,00, acrescidos de juros desde a citação e correção monetária a contar deste julgado, pelos danos morais. 

Sem custas e honorários. PRI. Após o trânsito em julgado, dê-se baixa e arquive-se.";0004DA4262C4B2F193035759B3B8127B55B3C505141C5749;0004ED47A862016CADED9C3D943F54C78E09C50445075547;2016.001.080545-3;0.5540595054626465
17;2016.001.051037-4;"Dispensado o relatório na forma do art. 38 da Lei 9.099/95.

Trata-se de ação em que o autor alega ter adquirido passagens junto a reclamada, que, por sua vez, não se desincumbiu de prestar o serviço de forma adequada, visto os diversos problemas ocorridos durante o percurso do voo, inclusive com o cancelamento do mesmo.

Pelo que, objetiva: o pagamento pelos danos materiais, na quantia de R$ 370,00; bem como, a compensação por danos morais, no valor de R$ 10.000,00.

O presente feito deve ser extinto sem resolução do mérito por incompetência territorial.

A parte autora reside no Bairro do FLAMENGO, conforme fls. 18, e a reclamada, foi regularmente citada no Centro (fls. 62). 
O presente juízo, no entanto, não é competente territorialmente para conhecer e processar a presente demanda. Isto porque, nenhuma das partes possui endereço localizado na abrangência da competência deste Juizado Especial, não havendo razão jurídica para processar a demanda neste juízo, em obediência ao enunciado 2.2.4, Aviso 33/2008, TJ/RJ. 
O art. 4º, & ú, I da Lei 9.099/95 estabelece que é competente para processo e julgamento de causas de menor complexidade o juízo do foro do domicílio do autor, ou, a critério deste, do local onde o réu exerça atividades profissionais ou econômicas ou mantenha estabelecimento, filial, agência, sucursal ou escritório.
Em consequência aplica-se o Enunciado n° 2.2.5 dos Juizados Especiais Estaduais, publicado no Aviso n° 23/2008, o qual transcreve-se: 


""2.2.5- Salvo nos locais onde haja órgão distribuidor para Juizados com a mesma competência, o juiz deverá, com base na violação do princípio do juiz natural, reconhecer de ofício a incompetência nos casos em que a ação for proposta no juizado de localização de um dos estabelecimentos de parte com multiplicidade de endereços, sem que se trate da sede ou sem que haja relação do estabelecimento: (i) com o domicílio residencial do autor; (ii) com o local onde a obrigação deva ser cumprida; ou (iii) com o lugar do ato ou fato lesivo ou serviço prestado."" (grifamos).

Por isso, a incompetência territorial importa em extinção do feito, conforme regra legal expressa neste sentido. Fica, portanto, inviabilizada a apreciação e o julgamento da presente causa.

Diante de todo exposto, JULGO EXTINTO O FEITO SEM RESOLUÇÃO DE MÉRITO, com fulcro no art. 51, III da Lei n. 9.099/95. 
Sem ônus de sucumbência em razão do disposto no artigo 55 da Lei nº 9.099/95.

Projeto de sentença sujeito à homologação pela MM. Juíza de Direito, com base no art. 40 da Lei nº 9099/95.


Rio de Janeiro, 05 de dezembro de 2016.


ANDRÉA LUCIA DUARTE DOS SANTOS
JUIZA LEIGA";00049C27351568A7A22330E30F50E931A5B8C5054635203B;000448324652AE2E5BB6C93D7FD0737042B0C5051709151B;2016.001.255157-4;0.5540388226509094
18;2016.001.051037-4;"Homologo, por sentença, para que surta seus efeitos legais, o projeto de sentença elaborado pelo juiz leigo, na forma do artigo 40 da Lei nº 9.099/95. 

Em caso de depósito judicial referente à condenação, expeça-se mandado de pagamento, independentemente de nova conclusão. 

Caso haja valor remanescente a ser recebido, manifeste-se o credor em 7 dias, sob pena de arquivamento dos autos. Após o trânsito em julgado, tratando-se de sentença de improcedência ou de extinção do feito sem resolução do mérito, dê-se baixa e arquivem-se imediatamente. 

Tratando-se de sentença de procedência, após o trânsito em julgado e o decurso do prazo de 15 dias para pagamento espontâneo do valor da condenação previsto no art. 523 do NCPC c/c o entendimento consolidado no enunciado nº 13.9.1 do Aviso nº 23/2008 do TJERJ, aguarde-se por mais 7 dias a manifestação das partes e, em seguida, caso permaneçam em silêncio, proceda-se a baixa e ao arquivamento. 

FICAM AS PARTES CIENTES DE QUE A NOVA SISTEMÁTICA DE CONTAGEM DE PRAZO ESTABELECIDO NO ART. 219 DO NCPC/2015 NÃO SE APLICA AOS JUIZADOS ESPECIAIS CÍVEIS, CONSOANTE NOTA TÉCNICA 01/2016 DO FONAJE DE 04/03/2016 C/C A PRIMEIRA PARTE DO ENUNCIADO 86 TAMBÉM DO FONAJE, COMPUTANDO-SE OS PRAZOS EM DIAS CORRIDOS, ASSIM PROCEDENDO COM A FINALIDADE PRECÍPUA DE SE ALCANÇAR A BOA GESTÃO CARTORÁRIA COM FUNDAMENTO NO PRINCÍPIO DA CELERIDADE QUE REGE A LEI 9.099/95.";00049C27351568A7A22330E30F50E931A5B8C5054635203B;000448324652AE2E5BB6C93D7FD0737042B0C5051709151B;2016.001.255157-4;0.5540388226509094
19;2016.001.051037-4;"Homologo, por sentença, para que surta seus efeitos legais, o projeto de sentença elaborado pelo juiz leigo, na forma do artigo 40 da Lei nº 9.099/95.  

Em caso de depósito judicial referente à condenação, expeça-se mandado de pagamento, independente de nova conclusão, cumprindo à parte ré, quando do pagamento, apresentar planilha discriminada do valor da condenação.  

Caso haja valor remanescente a ser recebido, manifeste-se o credor em 7 dias, sob pena de arquivamento dos autos. Após o trânsito em julgado, tratando-se de sentença de improcedência ou de extinção do feito sem resolução do mérito, dê-se baixa e arquivem-se imediatamente.  

Tratando-se de sentença de procedência, após o trânsito em julgado e o decurso do prazo de 15 dias para pagamento espontâneo do valor da condenação previsto no art. 523 do NCPC c/c o entendimento consolidado no enunciado nº 13.9.1 do Aviso nº 23/2008 do TJERJ, aguarde-se por mais 7 dias a manifestação das partes e, em seguida, caso permaneçam em silêncio, proceda-se a baixa e ao arquivamento.  

FICAM AS PARTES CIENTES DE QUE A NOVA SISTEMÁTICA DE CONTAGEM DE PRAZO ESTABELECIDO NO ART. 219 DO NCPC/2015 NÃO SE APLICA AOS JUIZADOS ESPECIAIS CÍVEIS, CONSOANTE NOTA TÉCNICA 01/2016 DO FONAJE DE 04/03/2016, COMPUTANDO-SE OS PRAZOS EM DIAS CORRIDOS, ASSIM PROCEDENDO COM A FINALIDADE PRECÍPUA DE SE ALCANÇAR A BOA GESTÃO CARTORÁRIA COM FUNDAMENTO NO PRINCÍPIO DA CELERIDADE QUE REGE A LEI 9.099/95.   

Cumpridas as formalidades legais, dê-se baixa e arquivem-se os autos.";0004D7F2B2151ECFA61470C0933E76037671C505503B3E25;0004BB5A738D56E48389CA4D6F0C7C995F0FC50523563D33;2016.001.253181-2;0.5498784780502319
20;2016.001.051037-4;"Dispensado o relatório, nos termos do artigo 38, da Lei 9099/95, PASSO A DECIDIR.
O autor afirma que contratou com a ré transporte aéreo para realizar viagem a trabalho em 1o julho de SDU-POA saindo 8:40 e chegando às 10:45, no entanto foi informado que o embarque estava atrasado, a previsão para embarque passou para as 9:00, no entanto, ao retornar com 10 minutos de antecedência, o embarque já estava fechado havendo negativa da ré em realocá-lo em outro voo. Assim, requer a condenação da ré a pagar indenização por danos morais.
Em contestação, o réu sustenta culpa exclusiva do autor e ausência de conteúdo probatório. 
Inicialmente, cabe ressaltar que a relação jurídica entre as partes é de consumo, devendo ser aplicado o CDC. No entanto, cabe ao autor produzir prova mínima do seu direito, notadamente quando absolutamente possível de ser produzida. 
O autor não logrou em comprovar suas alegações na medida em que não juntou qualquer documento de mudança do horário de embarque para as 9:00h nem do embarque fechado com 10 minutos de antecedência. Os documentos de fls. 50/51 somente comprovam um pequeno atraso de 20 minutos incapaz de gerar qualquer dano moral. 
 Assim, tem-se que se o autor ao verificar que o embarque estava atrasado e não acompanhou o momento exato no qual seria realizado, perdeu o voo por culpa exclusiva sua, sendo que a ré não teve qualquer comportamento ilícito capaz de lhe gerar danos morais indenizáveis. 
Longe de se presumir, aqui, a má-fé do autor, é necessário observar que a instrução da causa não aponta, de forma conclusiva, para uma falha na prestação do serviço capaz, eventualmente, de produzir no autor os danos descritos na inicial, e, assim, reconhecer o dever da ré de indenizá-lo.
		Assim, diante da deficiência instrutória, não há como se concluir pela existência de nexo entre os danos descritos no feito e uma conduta da ré, razão pela qual, a despeito da inversão do ônus da prova, reconheço a improcedência dos pedidos formulados.
Pelo exposto, JULGO IMPROCEDENTES OS PEDIDOS veiculados na inicial.
		Sem custas e honorários, por força do disposto no artigo 55 da Lei Especial.
 		
Rio de Janeiro, 13 de fevereiro de 2017

JULIANA CORREIA GOMES
JUÍZA LEIGA



 		Submeto o projeto  de sentença à homologação do Dra. Juíza de Direito, na forma do art. 40 da Lei 9.099/95.";0004D7F2B2151ECFA61470C0933E76037671C505503B3E25;0004BB5A738D56E48389CA4D6F0C7C995F0FC50523563D33;2016.001.253181-2;0.5498784780502319
21;2016.001.051037-4;"HOMOLOGO, por sentença, o acordo celebrado entre as partes, para que produza seus jurídicos e legais efeitos. Assim sendo, JULGO EXTINTO O PROCESSO, com resolução de mérito, com fundamento no artigo 487, inciso III, alínea b, do CPC. Sem custas. 

Cumprido o acordo, dê-se baixa e arquive-se, independentemente de conclusão.";00043222A7CA1264EB280D457E5B13BA10CFC5051F3F6338;0004ED27ED92D31C60CA20A45035DD107F18C505055C423A;2016.001.125609-0;0.5489917397499084
22;2016.001.051037-4;"ESTADO DO RIO DE JANEIRO
PODER JUDICIÁRIO
1º Juizado Especial Cível da Comarca de Duque de Caxias - RJ

Processo: 0033861-50.2016.8.19.0021
Parte autora: GILBERTO OLIVEIRA JOAQUIM JUNIOR
Parte ré: AZUL LINHAS AÉREAS BRASILEIRAS S/A 

PROJETO DE SENTENÇA

Dispensado o relatório, na forma do artigo 38 da Lei 9099/95. Contudo, em breve síntese trata-se de demanda ajuizada pela parte autora objetivando compensação por danos morais. Sustenta que o autor que adquiriu junto a ré passagens aéreas referente ao trecho de ida Rio de Janeiro/RJ (GIG) - Belo Horizonte/MG (CNF) no dia 11/06/2016. Afirma que ao desembarcar em Belo Horizonte/MG (CNF) constatou o extravio de sua bagagem, destacando que o motivo de sua viagem era participar da celebração de um casamento designado para o próprio dia. Alega que já que na bagagem constava a vestimenta para participação do casamento, lavrou o Registro de Irregularidade de Bagagem - RIB, sendo obrigado a participar da cerimônia com a roupa que usava na viagem. Pontua que somente recebeu a bagagem no dia 12/06 já ultrapassado a meia noite, através de um taxista contratado pela Ré.

A parte ré foi citada e ofereceu contestação e, no mérito, sustenta que inexiste direito a ser amparado à parte autora. Invocou a ausência de danos a serem reparados. Requereu a improcedência do pedido. 

É o breve relatório. 

A relação jurídica objeto da presente demanda é de consumo, uma vez que a parte autora encontra-se abarcada pelo conceito normativo positivado nos arts. 2o c/c 17 c/c 29 da Lei n. 8.078/90 e, igualmente, a parte ré subsume-se ao conceito do art. 3o do referido diploma legal. Por essa razão, impõe-se a inteira aplicação das normas previstas no Código de Defesa do Consumidor. 

Verossímil a alegação autoral, cabível, portanto, a inversão do ônus da prova nos termos do art. 6º, inciso VIII da Lei 8078/90.

Fato integrativo do direito alegado e que, todavia, não foi impugnado pela re, conquanto ônus que lhe competia por força do que estatui o art. 341 do NCPC, presumindo-se verdadeira a afirmação.

Conforme se depreende dos autos a parte autora alega danos em razão do extravio de sua bagagem em voo nacional. 

A ré por seu turno afirma que não houve danos causados em razão do extravio, pois afirma que fez a entrega da bagagem após 1 dia. 

Como dito, trata-se de fato do serviço, conforme o art. 14, caput, do CPDC, no qual prevê a responsabilidade objetiva, onde é desnecessária a prova da culpa do agente causador do dano. Ademais, desnecessária a comprovação da culpa, uma vez que a responsabilidade da parte ré é objetiva, não conseguindo a parte ré comprovar nenhuma excludente de nexo causalidade. Trata-se do risco do empreendimento, onde a ré lucra com o bônus, mas também deve arcar com o ônus.

Assim sendo, e mais, considerando as alegações veiculadas pela parte autora em sua petição inicial e na audiência realizada perante este juízo, tenho como parcialmente procedentes as razões autorais invocadas ao embasamento de sua pretensão. 

É nítida a falha na prestação do serviço que não se mostrou seguro ou eficiente, a qual deve ser absorvida pela ré a título de risco do empreendimento, devendo, portanto, responder pelos danos causados ao consumidor.

No que se refere aos danos morais, entendo cabíveis. Vale ressaltar que o dano moral, em uma sociedade de consumo de massa, há de ser considerado não só sob um aspecto meramente ressarcitório, mas também sob o ângulo preventivo-pedagógico, visando chamar a atenção para que os fatos lesivos não tornem a ocorrer. A conduta do réu, a toda evidência, merece ser rechaçada. Evidente, à luz das normas de experiência, o dano moral experimentado, diante dos sucessivos desgastes para obter a sua bagagem.

A árdua missão de tarifar o dano moral é da exclusiva responsabilidade do juiz que deve atuar em face do caso concreto, com moderação e prudência, não perdendo de vista que a indenização deve ser a mais completa possível, mas sem tornar-se fonte de lucro, caracterizando enriquecimento excessivo. Assim, à luz desses fundamentos e observadas as peculiaridades do caso em tela, tenho como razoável a quantia de R$ 2.000,00 (dois mil reais).


Face aos argumentos expendidos, JULGO PROCEDENTE EM PARTE O PEDIDO e extinta a fase de cognição com resolução do mérito, na forma do art. 487, inciso I do Novo Código de Processo Civil, para condenar a parte ré a pagar à parte autora, a título de reparação pelos danos morais experimentados, o valor de R$ 2.000,00 (dois mil reais), com correção monetária e juros de 1% ao mês, a contar da data da publicação desta sentença.

Após o trânsito em julgado, aguarde-se o cumprimento da sentença, ciente o réu de que o não pagamento do valor da condenação no prazo de 15 dias, a contar da data do trânsito em julgado, acarretará a aplicação da multa de 10% sobre o valor da condenação, conforme art. 523, § 1º do NCPC, independentemente de nova intimação.

Observe o cartório o(s) nome(s) do(s) advogado(s) do(s) réu(s) para futuras publicações. Anote-se onde couber.

Sem ônus sucumbenciais em razão do art. 55 da Lei n. 9.099/95.

Remeto à apreciação do MM. Juiz Togado, na forma do disposto no art. 40, da lei 9099/95.
		
Duque de Caxias, 18 de novembro de 2016.

CLENILSON FERREIRA NETO
Juiz Leigo";00048566B9C7ACD67921B32215A0FEE2BEE4C5053E2E4154;000468D59C87749F60384E49A142A46F36A7C5045564524A;2016.021.033137-2;0.5441204309463501
23;2016.001.051037-4;Vistos etc. HOMOLOGO o PROJETO DE SENTENÇA proferido pelo DD. Juiz Leigo que me foi submetido, para que a mesma produza os seus jurídicos e legais efeitos, nos termos do artigo 4º, inciso III, da Resolução nº 08/2005, do Órgão Especial do TJ/RJ.  Sem custas judiciais, na forma da Lei nº 9.099/95. P.R.I. Certificado o trânsito em julgado, aguarde-se pronunciamento por 30 dias. Na inércia, dê-se baixa e arquive-se.;00048566B9C7ACD67921B32215A0FEE2BEE4C5053E2E4154;000468D59C87749F60384E49A142A46F36A7C5045564524A;2016.021.033137-2;0.5441204309463501
