;processo;sentenca;similar_file;similar_init;similar_processo;similaridade
7;2016.001.143686-8;"Homologo, por sentença, para que surta seus efeitos legais, o projeto de sentença elaborado pelo juiz leigo, na forma do artigo 40 da Lei nº 9.099/95. 

Em caso de depósito judicial referente à condenação, expeça-se mandado de pagamento, independentemente de nova conclusão. 

Caso haja valor remanescente a ser recebido, manifeste-se o credor em 7 dias, sob pena de arquivamento dos autos. Após o trânsito em julgado, tratando-se de sentença de improcedência ou de extinção do feito sem resolução do mérito, dê-se baixa e arquivem-se imediatamente. 

Tratando-se de sentença de procedência, após o trânsito em julgado e o decurso do prazo de 15 dias para pagamento espontâneo do valor da condenação previsto no art. 523 do NCPC c/c o entendimento consolidado no enunciado nº 13.9.1 do Aviso nº 23/2008 do TJERJ, aguarde-se por mais 7 dias a manifestação das partes e, em seguida, caso permaneçam em silêncio, proceda-se a baixa e ao arquivamento. 

FICAM AS PARTES CIENTES DE QUE A NOVA SISTEMÁTICA DE CONTAGEM DE PRAZO ESTABELECIDO NO ART. 219 DO NCPC/2015 NÃO SE APLICA AOS JUIZADOS ESPECIAIS CÍVEIS, CONSOANTE NOTA TÉCNICA 01/2016 DO FONAJE DE 04/03/2016 C/C A PRIMEIRA PARTE DO ENUNCIADO 86 TAMBÉM DO FONAJE, COMPUTANDO-SE OS PRAZOS EM DIAS CORRIDOS, ASSIM PROCEDENDO COM A FINALIDADE PRECÍPUA DE SE ALCANÇAR A BOA GESTÃO CARTORÁRIA COM FUNDAMENTO NO PRINCÍPIO DA CELERIDADE QUE REGE A LEI 9.099/95.";0004B0602759BB8DAA8C56B2C26E116FE101C5050D333649;00040067FEC9B68E8FA4A8707506E8B2ADF9C5050A1F3030;2016.001.039066-6;0.8910115957260132
8;2016.001.143686-8;"PROJETO DE SENTENÇA

Ainda que dispensado o relatório, na forma do artigo 38 da lei 9.009/95, faço um breve relatório, após o qual passo a decidir
Trata-se de ação de obrigação de fazer c/c reparação por danos materiais c/c compensação por danos morais proposta por EDISON VANDER PIEDADE em face de BANCO ITAU S.A., em que alega haver cobrança por seguro não contratado.
A ré, em sua contestação, alega a ausência de danos à parte autora.
		Presentes os pressupostos processuais e as condições ao regular exercício do direito de ação, passa-se ao mérito.
É inegável tratar-se de relação de consumo, na medida em que estão presentes as figuras do consumidor, do fornecedor e do serviço, na forma dos arts. 2º e 3º do CDC e súmula 297 do STJ, estando presentes os elementos subjetivos e objetivo.
Conclui-se, compulsando os autos, pela ocorrência de um fato do serviço, previsto no art. 14 do CDC, na medida em que a ré procedeu à cobrança de seguro não contratado pela parte autora.
Assim sendo, na forma do art. 14, §3º do CDC, a inversão do ônus da prova se opera ope legis, na medida em que o fornecedor somente não será responsabilizado quando provar fato exclusivo da vítima ou de terceiro, ou que o defeito inexiste.
Porém, quanto aos fatos constitutivos de seu direito, não há como se entender que haja tal inversão, notadamente quanto aos prejuízos ocasionados pela conduta da ré, devendo tais fatos serem comprovados pela autora, na forma do art. 373, I do CPC/2015 (art. 333, I do CPC/1973), logrando êxito em fls. 26-32, em que traz os comprovantes do seguro não desejado (¿ITAU SEG VIDA PF¿), com os descontos em sua conta corrente (fls. 18-25), bem como em fls. 40 com a reclamação administrativa e o consequente cancelamento em fls. 41.
Em sua contestação, a ré afirma não ocorrer qualquer dano à parte autora, porém não traz aos autos qualquer documento em que seja possível verificar a anuência do autor em relação ao referido desconto.
Em relação ao dano patrimonial, tendo a autora trazido a prova do efetivo pagamento dos valores cobrados indevidamente, se faz necessária a restituição dos mesmos, que não deverá se dar da forma simples, na medida em que a aplicação do art. 42, p. único apenas prevê a restituição em dobro quando houver má-fé por parte do fornecedor na cobrança, o que ocorre no caso em tela, posto que não houve contratação. 
Assim sendo, o valor a ser devolvido totaliza R$ 3.474,12 (três mil quatrocentos e setenta e quatro reais e doze centavos), conforme fls. 18-25.
Quanto aos danos morais alegadamente sofridos, como houve violação dos deveres anexos do contrato, não tendo o fornecedor agido com lealdade e nos ditames da boa-fé objetiva que deve regular as relações de consumo, e, tendo em o valor total descontado indevidamente, além da reiteração da conduta por , é possível concluir pela ocorrência de abalos psíquicos capazes de afetar os direitos da personalidade, tornando os danos morais presumidos (in ré ipsa), não se podendo aplicar a súmula 75 do TJRJ de forma a não se considerar o ocorrido como mero aborrecimento diário que tem reflexos exclusivamente patrimoniais, até mesmo em aplicação á função punitivo-pedagógica da compensação por danos morais.
No tocante ao quantum da indenização fixado, em que pese não haver parâmetros objetivos para o seu estabelecimento, observo que o valor não deve levar ao enriquecimento do credor e tampouco à ruína do devedor.
Nesse sentido, deve mais do que possuir cunho punitivo, ter caráter educativo àquele que agiu indevidamente ao ferir a honra e a imagem de outrem, compensando de forma pecuniária a pessoa lesada no seu íntimo, na forma dos arts. 5º, X da CRFB e 6º, VI do CDC.
Assim, observando-se os parâmetros acima mencionados e considerando-se as informações constantes dos autos, entendo que a indenização por danos morais no valor de R$ 2.000,00 (dois mil reais) é justa, adequada e atende os princípios da proporcionalidade e razoabilidade. 
Pelo exposto, julgo PROCEDENTE EM PARTE, na forma do art. 487, I do CPC/2015 (art. 269, I, do CPC/1973), o pedido para: 1) CONDENAR a ré ao pagamento da quantia de R$ 3.474,12 (três mil quatrocentos e setenta e quatro reais e doze centavos), a título de reparação por danos materiais, devendo o valor ser corrigido monetariamente a partir do desembolso, e com juros de 1% ao mês a contar da citação; 3) CONDENAR a ré ao pagamento da quantia de R$ 2.000,00 (dois mil reais), a título de compensação pelos danos morais, devendo o valor ser corrigido monetariamente a partir do arbitramento e com juros de 1% ao mês a partir da citação.
Isento dos ônus sucumbências, na forma do art. 55 da lei 9.099/95. Submeto este Projeto de Sentença ao Juiz Togado, na forma do que dispõe o art. 40 da lei 9.099/95.

Rio de Janeiro, 31 de maio de 2016.

Janayme Vieira de Moraes
Juíza Leiga";0004B0602759BB8DAA8C56B2C26E116FE101C5050D333649;00040067FEC9B68E8FA4A8707506E8B2ADF9C5050A1F3030;2016.001.039066-6;0.8910115957260132
9;2016.001.143686-8;" Homologo o acordo celebrado entre as partes para que surta seus jurídicos e legais efeitos, e julgo o feito extinto, com resolução do mérito, nos termos do art. 487, inc. III, b, do novo Código de Processo Civil ( Lei nº 13.105/ 2015). Se for o caso, comprovado o depósito, expeça-se mandado de pagamento em favor da parte autora, independentemente de nova conclusão.   Após, nada mais sendo requerido, dê-se baixa e arquivem-se. 
Decorrido o prazo do cumprimento o acordo, aguarde-se por cinco dias a manifestação das partes; não havendo manifestação,  dê-se baixa e arquive-se.";0004B0602759BB8DAA8C56B2C26E116FE101C5050D333649;00040067FEC9B68E8FA4A8707506E8B2ADF9C5050A1F3030;2016.001.039066-6;0.8910115957260132
10;2016.001.143686-8;"Dispensado o relatório, na forma do artigo 38 da Lei 9099/95, passo a decidir.

Alega a parte autora ter sido surpreendida com a cobrança, na sua conta corrente, de seguro familiar, o qual não contratou. Relata que a cobrança de R$ 20,00 foi retirada do montante que deveria ser destinado ao título de capitalização que contratou, no valor de R$ 70,00. Requer manutenção o título de capitalização com descontos de R$ 70,00 e indenização pelos danos materiais e morais sofridos.

	Em sua contestação, alega o réu que inexiste dano moral.

Por ser relação de consumo toda relação jurídico-obrigacional que liga um consumidor a um fornecedor, tendo como objeto o fornecimento de um produto ou da prestação de um serviço, conclui-se que a relação existente entre as partes é de consumo, portanto a referida demanda será analisada sob a ótica do Código de Defesa do Consumidor.

   A hipótese constante dos autos, como salientado, é de fato do serviço, cuja previsão se encontra no art. 14 da Lei 8078 /90, e este se caracteriza quando gera um acidente de consumo. O acidente de consumo se dá quando o defeito do serviço se exterioriza, atingindo o consumidor em sua incolumidade física, econômica ou psíquica. 

	Deste modo, caberia ao réu comprovar que não houve falha na prestação do serviço, o que não ocorreu. 

Ressalte-se que o réu não trouxe qualquer documento visando à contratação do seguro; os documentos de fls. 16/18 nada mencionam acerca do seguro descontado em fls. 19/21. Não demonstrou, ainda, o ressarcimento.

Ressalta-se que é lícita somente a cobrança de produto ou serviço que interesse ao consumidor. Merece acolhida, portanto, o pedido de restituição do valor pago, em dobro, diante do que dispõe o art. 42, p. único, do CDC.
Por outro lado, os fatos narrados pela autora não demonstram repercussão de ordem imaterial.
Isso posto, JULGO PROCEDENTE EM PARTE O PEDIDO para 1) condenar o réu a realizar os descontos referentes ao título de capitalização da parte autora, no valor de R$ 70,00, sob pena de multa de R$ 100,00 por cobrança em desacordo; para 2) condenar o réu a cancelar o seguro objeto dos autos, em nome da parte autora, no prazo de quinze dias, sob pena de multa de R$ 100,00 por cada cobrança indevida; e para 3) condenar o réu a restituir à parte autora o valor de R$ 240, com correção monetária a partir do desembolso e juros de mora a partir da citação. Deixo de condenar em despesas processuais e honorários advocatícios com base no art. 55 da Lei n° 9.099/95. 
Anote-se onde couber o nome do patrono indicado na peça de defesa da parte ré para as futuras publicações.
   
Projeto de sentença que se submete à homologação, nos termos do art.40, Lei nº 9.099/95.

Rio de Janeiro, 12 de dezembro de 2016.";0004963A89C157F6B65929774A47755BAED9C50556062861;00044FA2E4D7B8E37852321244DFC084F9CEC5052D4E272D;2016.204.030800-7;0.8892722129821777
11;2016.001.143686-8;Dispensado o relatório na forma do art. 38 da Lei 9099/95. HOMOLOGO o projeto de sentença proferido pelo Juiz Leigo, para que produza seus jurídicos e legais efeitos, na forma do art. 40 da Lei 9.099/95.  FICAM AS PARTES CIENTES DE QUE, NOS TERMOS DO AVISO 02/2016 DA COJES (D.O. 31/03/2016) OS PRAZOS PROCESSUAIS EM SEDE DE JEC CONTINUARÃO A SER CONTADOS EM DIAS CORRIDOS, INAPLICÁVEL O ARTIGO 219 DO NCPC.Fica a parte ré ciente de que caso não pague a quantia certa a que foi condenada em 15 dias, contados do trânsito em julgado da sentença, o valor da condenação será acrescido de multa de 10%, por aplicação do artigo 523,§1º do CPC, sendo certo, ainda, que a comprovação do depósito deverá vir aos autos no prazo de 5 dias, após a efetivação. Comprovado o depósito nos autos,  expeça-se mandado de pagamento. Após, dê-se baixa e arquive-se. Caso negativo, após o decurso do prazo de trinta dias do trânsito em julgado, dê-se baixa e arquive-se.;0004963A89C157F6B65929774A47755BAED9C50556062861;00044FA2E4D7B8E37852321244DFC084F9CEC5052D4E272D;2016.204.030800-7;0.8892722129821777
12;2016.001.143686-8;"     Tendo em   vista que  houve  acordo entre  as  partes , JULGO  EXTINTO COM  RESOLUÇÃO DO MÉRITO, na forma do artigo  487, III,  alínea  b ,  do CPC.


 Sem custas. Após as formalidades legais, dê-se baixa e arquive-se. P.R.I.";0004FCE7D26423E05C25B100559080D53175C505163E112A;0004FC887D5BA9166ADD69460F88A714B65DC5044647152B;2016.021.012434-2;0.8891558647155762
13;2016.001.143686-8;"PODER JUDICIÁRIO DO ESTADO DO RIO DE JANEIRO
I JUIZADO ESPECIAL CÍVEL ¿ DUQUE DE CAXIAS
Processo n°: 0028975-08.2016.8.19.0021 
1º Autor: LUIZ CARLOS DOS SANTOS
2º Autor: JAQUELINE LUZIA SILVA DOS SANTOS
Réu: ITAU UNIBANCO S/A

PROJETO DE SENTENÇA

Vistos, etc.

Dispensado relatório nos termos do art. 38, da Lei nº 9.099/95, passo a decidir. 

Narra a inicial que o 1º autor é cliente da ré há mais de 5 anos, sendo titular do cartão de crédito nº 5304.5202.5640.9938 e um adicional que fez para a 2ª autora sob o nº 53045202.4504.0851, sempre honrando com suas obrigações contratuais. Que em 02/03/2016 foi fazer compras e no momento de passar o cartão foi informada que o mesmo estava bloqueado. Aduz que ficou completamente constrangida, já que o fato ocorreu na presença de outros consumidores. Menciona que ligou para o réu, não recebendo uma explicação plausível para a não autorização das compras, não sendo dito o motivo pelo qual o cartão se encontrava bloqueado. Que somente não passou vexame maior, porque estava com dinheiro e teve que pagar as compras à vista. Alega que em 03/03/2016 a 2ª Autora ligou para a ré, sendo  informada que o cartão sob o nº 53045202.4504.0851, havia sido bloqueado devido a uma suposta fraude. Relata que em 05/03/ 2016 a 2º autora ligou novamente para o réu. Que em 10/03/2016 a 2ª autora foi ao mercado com o cartão do 1º Autor e ao passar as mercadorias foi constatado que também estava bloqueado, apesar de não existir nenhuma justificativa. Pleiteia indenização por danos morais; a restituição da senha dos cartões sob nº 5304.5202.5640.9938 e um adicional que fez para a sua filha sob o nº 53045202.4504.0851.

A ré, em contestação, pugna pela improcedência do pedido autoral.

Preenchidas, portanto, as condições da ação e estando presentes os pressupostos processuais, passo à apreciação do mérito.

É inquestionável que se trata de relação jurídica de consumo, com aplicação das normas contidas na Lei nº 8.078/1990, fazendo prevalecer os princípios e as regras cogentes nela inseridas e que têm por escopo basilar favorecer o elo mais fraco nesse vínculo e, assim, reequilibrar as forças entre os envolvidos na disputa, em regra, desproporcional e injusta.

É cediço que o art. 6º, inciso VIII do Código de Defesa do Consumidor permite que a defesa dos direitos do consumidor em juízo seja facilitada pelo mecanismo da inversão do ônus da prova, atenuando, assim, a regra do art. 373 do CPC, onde se encontra estabelecido o princípio de caber ao autor a prova do fato constitutivo do seu direito, e ao réu a do fato impeditivo ou extintivo do direito do autor. 

Contudo, a inversão do ônus da prova, não pode ser considerada norma geral automaticamente observável em todo e qualquer processo pertinente a relação de consumo. 

Assim sendo, em regra, o consumidor é a parte mais fraca no mercado de consumo, a lei inclui entre as medidas protetivas que lhe são proporcionadas a da possibilidade de inversão do ônus da prova. 

Todavia, não se pode olvidar que o inciso VIII, do art. 6º do CDC, autoriza essa providência apenas quando o juiz venha a constatar a verossimilhança da alegação do consumidor, ou sua hipossuficiência, ""segundo as regras ordinárias de experiência.""

Portanto, não se trata de inversão compulsória, sendo simples faculdade judicial que pode, ou não, ser concedida, dependendo da verossimilhança das afirmações feitas pelo consumidor ou na sua hipossuficiência, a faculdade judicial não pode ser manejada em favor do consumidor, sob pena de configurar-se ato abusivo, com violação do princípio do devido processo legal. 

No caso vertente, a parte autora alega que sofreu constrangimentos ao tentar realizar compras e sacar o valor disponível do seu limite, haja vista que seu cartão de crédito foi cancelado sem aviso prévio.

A ré, por sua vez, sustenta que a parte autora não faz prova de suas alegações.

Compulsando os autos se verifica que não obstante a parte autora alegar que sofreu constrangimentos, a mesma não se desincumbiu de comprovar a exposição frente a terceiros por supostas compras não autorizadas pela ré, pois bastava trazer uma testemunha que supostamente tenha presenciado os fatos narrados na exordial, se tratando de prova de fácil produção.

Ademais observa-se que não há qualquer indicação de protocolo de atendimento a fim de tornar verossímeis as alegações autorais.

Frise-se que a própria parte autora menciona que conseguiu  realizar o pagamento das compras por outros meios.

Assim, os documentos acostados pela parte autora não são suficientes a demonstrar a alegado constrangimento mediante a recusa na utilização do cartão de crédito.

Nesse contexto, incumbia a parte autora a comprovação dos fatos constitutivos de seu direito, na forma do artigo 373, inc. I, do CPC, importando a ausência de prova na improcedência da pretensão veiculada.

Sendo assim, não há como se acolher o pedido de restabelecimento do cartão de crédito, bem como de sua respectiva senha, haja vista que não restou comprovada a alegada ausência de autorização para realização de compras. 

Além disso, os fatos narrados na inicial não ultrapassam a esfera do mero dissabor enfrentados no cotidiano, que não enseja indenização por danos morais, sendo forçosa a aplicação da Sumula nº 75 do TJERJ.

Nesse sentido:


SESSÃO: 30/06/2015 PROCESSO Nº: 0000675-80.2014.8.19.0029 RELATORA: DRA. MARCIA CORREIA HOLLANDA RECORRENTE: CLEITON CARVALHO AFFONSO DO NASCIMENTO RECORRIDOS: MERCADO MURANO LTDA. E HSBC BANK BRASIL S/A-BANCO MÚLTIPLO VOTO Trata-se de recursos inominados interpostos pelo autor e pelo segundo réu, HSBC BANK BRASIL, contra sentença que julgou parcialmente procedente o pedido em relação ao segundo réu, HSBC BANK BRASIL, condenando-o ao pagamento da quantia de R$ 1.000,00 a título de danos morais e julgou improcedente o pedido de restituição do valor indevidamente descontado no cartão de crédito do autor. Julgou, ainda, improcedentes os pedidos formulados em face do primeiro réu, MERCADO MURADO LTDA. Pretende o autor a majoração da verba indenizatória, ao passo que o segundo réu pretende a reforma integral da sentença e, subsidiariamente, a redução do quantum indenizatório. A controvérsia restringe-se em saber se os fatos vivenciados pelo autor são geradores de danos morais causados pela parte ré. Na presente hipótese, a recusa de autorização para pagamento de compra com cartão de crédito é um fato que pode ocorrer com qualquer usuário, em razão de diversos motivos. Tal fato não extrapola os limites do mero aborrecimento, tratando-se de singelo inadimplemento contratual, incidindo o verbete nº 75, da Súmula deste E. Tribunal. Neste sentido, o Superior Tribunal de Justiça, decidiu: Agravo regimental. Recurso especial não admitido. Compra não autorizada. Cartão de crédito. Dano moral. Dissídio não configurado. Pedido de indenização por dano moral em razão de ter sido negada ao autor, pela administradora de cartão de crédito, autorização para efetuar compra em estabelecimento comercial credenciado. Afirmou o Tribunal que ""mero aborrecimento decorrente da não aceitação do cartão de crédito em estabelecimento credenciado, não se pode considerar como dissabor suficiente a configurar dano moral"". Acatar a tese recursal de que houve indevida inscrição do cartão do recorrente em lista de crédito suspenso constitui questão de fato, inviável de apreço em sede de recurso especial. Incidência da Súmula nº 07/STJ. Mantido o entendimento de que ""o mero dissabor não pode ser alçado ao patamar do dano moral, mas somente aquela agressão que exacerba a naturalidade dos fatos da vida, causando fundadas aflições ou angústias no espírito de quem ela se dirige"" (REsp nº 403.919/MG, Quarta Turma, Relator o Senhor Ministro Cesar Asfor Rocha, DJ de 04/8/03). 2. Dissídio jurisprudencial não configurado ante à ausência de identidade fática entre os julgados. 3. Agravo regimental desprovido."" (AgRg no Ag 537867/RJ. Relator Ministro CARLOS ALBERTO MENEZES DIREITO. Órgão Julgador T3 - TERCEIRA TURMA, data do Julgamento 16/03/2004. Data da Publicação/Fonte DJ 03/05/2004 p. 154). Sobre o tema, cita-se entendimento desta Corte Estadual de Justiça: ""APELAÇÃO CÍVEL. AÇÃO INDENIZATÓRIA. RITO ORDINÁRIO. Danos morais. Impossibilidade de utilização do cartão de crédito no mercado. Alegação de falha no serviço e humilhação. Sentença improcedente. Apelo do autor. Sentença bem lançada. Mero aborrecimento. O autor imputa à ré a responsabilidade civil pela alegada falha no serviço e bloqueio indevido do cartão de crédito. Todavia, o mesmo sequer trouxe aos autos a declaração do estabelecimento com o fim de comprovar as suas assertivas, no sentido de que houve recusa do réu em aprovar a compra. Descumprimento do art. 333, I, do CPC. No mais, eventual impossibilidade de utilização do cartão em comento nas circunstâncias dos autos não fera o dano moral pretendido. Descumprimento do dever contratual que não importa, por si só, no dever de indenizar. Inteligência contida na Súmula 75 deste E. TJR. Razões recursais manifestamente improcedentes a atrair a regra do art. 557, caput, do diploma processual civil. NEGADO SEGUIMENTO AO APELO."" (Apelação nº 0387587-96.2011.8.19.0001, Rel. Des. Ferdinaldo do Nascimento, julg. em 10/01/2013, 19ª Câm. Cível.) Pelo exposto, VOTO no sentido de DAR PROVIMENTO ao recurso interposto pelo segundo réu para reformar a sentença e julgar IMPROCEDENTE o pedido de dano moral, mantidos os demais termos. Negado provimento ao recurso da parte autora, que fica condenada nas custas processuais e honorários advocatícios de 10% sobre o valor da causa, observando-se a gratuidade de Justiça ora deferida. É como voto. Rio de Janeiro, 30 de junho de 2015. MARCIA CORREIA HOLLANDA Juíza Relatora PODER JUDICIÁRIO DO ESTADO DO RIO DE JANEIRO CONSELHO RECURSAL IV TURMA RECURSAL CÍVEL. (Grifamos)

Portanto, aplica-se ao caso em tela o Enunciado 14.4.3 dos Juizados Especiais Cíveis que prevê que ""o inadimplemento contratual por si só, não enseja dano moral, salvo se da infração advém circunstância que atenta contra a dignidade da parte"".

Ante o exposto, JULGO IMPROCEDENTES os pedidos elencados na exordial, extinguindo o feito com resolução do mérito, na forma do artigo 487, I CPC.

Sem custas, nem honorários advocatícios, nos termos do artigo 55 da Lei 9099/1995.

Publique-se. Registre-se. Intimem-se.

Rio de Janeiro, 02 de agosto de 2016.
________________________________________
Ana Elisabeth de Paula Santos
Juíza Leiga

Remeto os autos ao MM. Juiz Togado, para posterior homologação.";0004F1D7F96763E55204B6595856146D0BCFC5051D452228;00045339B8C2A1FF3FC5A209EA4C4E4B4C91C505015E2A08;2016.021.028400-0;0.8875863552093506
14;2016.001.143686-8;Vistos etc. HOMOLOGO o PROJETO DE SENTENÇA proferido pelo DD. Juiz Leigo que me foi submetido, para que a mesma produza os seus jurídicos e legais efeitos, nos termos do artigo 4º, inciso III, da Resolução nº 08/2005, do Órgão Especial do TJ/RJ.  Sem custas judiciais, na forma da Lei nº 9.099/95. P.R.I. Certificado o trânsito em julgado, aguarde-se pronunciamento por 30 dias. Na inércia, dê-se baixa e arquive-se.;0004F1D7F96763E55204B6595856146D0BCFC5051D452228;00045339B8C2A1FF3FC5A209EA4C4E4B4C91C505015E2A08;2016.021.028400-0;0.8875863552093506
