;processo;sentenca;similar_file;similar_init;similar_processo;similaridade
6;2016.001.172291-9;"Dispensado o relatório na forma do artigo 38 da Lei 9.099/95, decido.
	Trata-se de ação indenizatória, pelo rito sumaríssimo, por meio da qual a parte autora requer a condenação da parte ré à compensação dos danos morais e materiais a ela causados, uma vez que vem recebendo cobranças desconhecidas em seu cartão de crédito, sob a rubrica ""PAG SEGURO"". Em contestação, a ré afirma que restituiu ao autor os valores cobrados tão logo recebeu a sua reclamação, pelo que requer a improcedência dos pedidos.
Estando presentes as condições da ação e os pressupostos de constituição e desenvolvimento regular do processo, passo a decidir o mérito. 
A relação de direito material havida entre as partes é de consumo, já que presentes os requisitos objetivos (art. 3º, §1º e 2º, da Lei 8.078/90) e subjetivos (arts. 2º e 3º, da Lei 8.078/90) de tal relação. Por essa razão, impõe-se a inteira aplicação do Código de Defesa do Consumidor, o qual positiva um núcleo de regras e princípios protetores dos direitos dos consumidores enquanto tais, prevendo inclusive a possibilidade de inversão do ônus da prova, o que ora se faz, na forma do artigo 6º, VIII, da Lei 8.078/90. 
Nessa esteira de raciocínio, a lei estabelece também que todo aquele que exerce atividade no campo de fornecimento de produtos e serviços tem o dever de responder objetivamente pelos vícios e fatos decorrentes dessa prestação.
Segundo Sérgio Cavalieri Filho, o serviço é considerado defeituoso quando não fornece a segurança que o consumidor dele pode esperar, levando-se em conta as circunstâncias relevantes, tais como o modo de seu fornecimento, o resultado e os riscos que razoavelmente se espera. Como se nota, os defeitos podem ser de concepção, de prestação ou de comercialização, o que inclui a prestação de informações insuficientes ou inadequadas.
Seguindo-se a isso, tem-se que a lei somente afasta essa responsabilidade nos casos de fato exclusivo da vítima, fato de terceiro e caso fortuito ou força maior. No caso em tela, não verifico a existência de qualquer causa capaz de afastar o nexo de causalidade, já que suposta fraude não constituiria fato de terceiro, mas sim descumprimento do dever objetivo de cuidado de sua parte na hora de efetuar a autorizar débito na conta de alguém, pois é sua atribução fornecer a devida segurança para que as contas de seus clientes não seja violada. 
Trata-se de responsabilidade objetiva pelo fato do serviço, fundada na teoria do risco do empreendimento, segundo a qual todo aquele que se dispõe a exercer alguma atividade no campo do fornecimento de bens e serviços tem o dever de responder pelos fatos e vícios resultantes do empreendimento independentemente de culpa. Esta obrigação é imanente ao dever de obediência às normas técnicas e de segurança, decorrendo a responsabilidade do simples fato de dispor-se alguém a realizar atividade de executar determinados serviços. Em suma, os riscos do empreendimento correm por conta do fornecedor de serviços e não do consumidor. 
Nesse contexto, sendo evidente a vulnerabilidade econômica e técnica da parte autora, cabe à ré a produção de prova capaz de ilidir a pretensão deduzida em juízo pela parte autora. Não havendo qualquer prova negativa do alegado na inicial, é de se reconhecer a falha na prestação do serviço. 
Todavia o valor foi restituído antes mesmo do ajuizamento da ação, não tendo o autor desembolsado qualquer valor em virtude da cobrança que não reconhecia, cabendo ainda, ressaltar que ajuizou a ação dois meses depois sem sequer mencionar o estorno realizado pelo réu, trazendo na verdade afirmação que não correspondia com a verdade.
Assim entendo que conduta do réu não foi suficiente para configurar o dano moral. O dano moral, atualmente, muito difundido entre os operadores do direito, deve ser reservado àquelas hipóteses em que há realmente ofensa à dignidade, honra, moral ou imagem da pessoa e, não em toda e qualquer situação em que há mero aborrecimento sem maiores proporções.
O mestre Yussef Said Cahali, em sua obra ""Dano Moral"" presta relevantes ensinamentos sobre o tema reproduzindo as palavras de Dalmartello in Danni morali contrattuali:
""Parece mais razoável, assim, caracterizar o dano moral pelos seus próprios elementos: portanto, ""como a privação ou diminuição daqueles bens que têm um valor precípuo na vida do homem e que são a paz, a tranqüilidade de espírito, a liberdade individual, a integridade individual, a integridade física, a honra e os demais sagrados afetos""; classificando-se, desse modo, em dano que afeta a ""parte social do patrimônio moral"" (honra, reputação etc.) e dano que molesta a ""parte afetiva do patrimônio moral"" (dor, tristeza, saudade etc.); dano moral que provoca direta ou indiretamente dano patrimonial (cicatriz deformante etc.) e dano mora puro (dor, tristeza etc.).
Analisando atentamente as provas constantes dos autos, não vejo caracterizado qualquer das espécies de dano moral acima discriminadas a ensejar a indenização pretendida pelo Autor.
Pelo exposto, JULGO IMPROCEDENTES os pedidos formulados pelo autor.
Sem custas e honorários, na forma do art. 55 da Lei nº. 9.099/95.
Submeto o presente projeto à homologação pela MM. Juíza de Direito.";0004CE18639D1174E13BDD33333B37EBB5A7C505143E055C;00041EE1033CF89EA47D6191E918C7402530C50444545258;2016.063.003296-1;0.7861277461051941
7;2016.001.172291-9;"Dispensado o relatório, na forma do art. 38, da Lei 9.099/95. Decido.   
HOMOLOGO o projeto de sentença elaborado pelo Juiz Leigo, que passa  a valer como fundamentação deste, com fulcro, na Lei Estadual nº 4578/05 e na Resolução nº 08/05 do E. Órgão Especial do TJRJ, e RESOLVE-SE o mérito, com base no art. 487, I, do NCPC. Sem custas e honorários.   
Publique-se. Aguarde-se a data designada para a leitura de sentença. 
Após, certificado o trânsito em julgado e comprovado o depósito, no prazo devido, expeça-se mandado de pagamento, independente de nova conclusão.   
Nada mais havendo, dê-se baixa e arquive-se. 
Ficam as partes cientes de que os prazos perante o JEC continuam sendo contados em dias corridos, nos termos da nota técnica 01/2016 do FONAJE e do entendimento da Corregedora Nacional de Justiça, Ministra Nancy Andrighi.";0004CE18639D1174E13BDD33333B37EBB5A7C505143E055C;00041EE1033CF89EA47D6191E918C7402530C50444545258;2016.063.003296-1;0.7861277461051941
8;2016.001.172291-9;"PODER JUDICIÁRIO DO ESTADO DO RIO DE JANEIRO
I JUIZADO ESPECIAL CÍVEL - DUQUE DE CAXIAS 

PROCESSO Nº: 0054914-87.2016.8.19.0021
AUTOR: ADELMO GALDINO SIQUEIRA 
RÉU: BANCO ITAUCARD S/A

PROJETO DE SENTENÇA

Vistos, etc.
Dispensado relatório nos termos do art. 38, da Lei nº 9.099/95. 
Trata-se de ação ajuizada por ADELMO GALDINO SIQUEIRA em face de BANCO ITAUCARD S/A objetivando o cancelamento do cartão de crédito e compensação por danos morais. Sustenta que houve falha na prestação de serviço da ré por efetuar desconto integral da fatura do cartão de crédito em debito automático na sua conta corrente, gerando saldo devedor.Pontua que buscou resolver administrativamente o problema, sem, no entanto, obter êxito. 
A parte ré foi citada e ofereceu contestação escrita e, no mérito, sustenta que inexiste direito a ser amparado à parte autora. Invocou a ausência de danos a serem reparados. Requereu a improcedência do pedido. 
Requereu a retificação do polo passivo para que dele conste BANCO ITAUCARD S/A.
É o breve relatório. 
A relação estabelecida entre as partes é de consumo, porquanto presentes os requisitos subjetivos (arts. 2º, caput, e 3º, caput, da Lei nº 8.078/90) e objetivo (art. 3º, § 2º, da Lei n.º 8.078/90) que a caracterizam. Aplicável, portanto, o regime jurídico especial da Lei n.º 8.078/90, a qual abriga a responsabilidade do tipo objetiva, em que é necessária, apenas, a prova do dano e do nexo causal, sendo despicienda a culpa da ré, e ainda assegura ao consumidor, como medida protetiva, a inversão do ônus da prova (artigo 6º, VIII, do CDC), haja vista a verossimilhança dos fatos narrados na petição inicial, bem como sua condição de hipossuficiente e vulnerável na relação de consumo. 
No caso presente, a parte ré não demonstrou a legalidade da sua conduta ao realizar o desconto automático do valor integral da fatura do cartão de crédito na conta corrente autoral. 
Na verdade, era dever da parte ré fazer prova dos fatos modificativos, extintivos ou impeditivos do direito autoral, na forma do art. 373, II do NCPC, bem como não demonstrou a ocorrência de uma das excludentes de responsabilidade civil no CDC, já que a responsabilidade objetiva do fornecedor de bens e serviços, através art. 14 daquele diploma legal, somente pode ser afastada se comprovada a culpa exclusiva do consumidor ou de terceiro para a ocorrência do evento danoso, nos termos que lhe impõe o art. 14, § 3º, incisos I e II da Lei nº 8.078/90, o que não foi feito.
Ante a ausência de prova da legitimidade da conduta da ré, se reputa ilegítima a forma pela qual cobrou a fatura do cartão de crédito, sem prévia comunicação ao consumidor. Em decorrência lógica, a invasão às finanças do autor também se reputa indevida, razão pela qual acolho o pedido de cancelamento do cartão de crédito apontado na petição inicial e também do débito.
É nítida a falha na prestação do serviço que não se mostrou seguro ou eficiente, a qual deve ser absorvida pela ré a título de risco do empreendimento, pois não fez prova de qualquer excludente de responsabilidade, devendo, portanto, responder pelos danos causados ao consumidor.
Quanto ao pedido de indenização extrapatrimonial, formulado pela autora, deve o mesmo ser acolhido ante a configuração do dano moral indenizável, evidenciado pelo próprio fato. Conforme lição do Desembargador SÉRGIO CAVALIERI FILHO ""o dano moral existe in re ipsa"", ou seja, ""está ínsito na própria ofensa, decorre da gravidade do ilícito em si"" (Programa de Responsabilidade Civil, 2ª ed., Malheiros, p. 80).
No que tange ao quantum debeatur, deve o mesmo ser fixado de forma proporcional, moderada e razoável, compatível com a reprovabilidade da conduta ilícita, a intensidade e duração do sofrimento experimentado, a capacidade econômica do causador do dano e as condições sociais da vítima, dentre outras circunstâncias relevantes.
Com base em tais critérios, e o decurso de tempo sem qualquer solução por parte do réu, entende esse Juízo que o valor de R$ 2.500,00 (dois mil e quinhentos reais) mostra-se razoável e proporcional.

Ante o exposto, JULGO PROCEDENTES EM PARTE os pedidos autorais, extinguindo o feito com resolução do mérito, nos termos do artigo 487, I do Novo CPC, para: a) condenar a ré a cancelar o cartão de crédito objeto da lide, bem como todo e qualquer debito a ele vinculado, no prazo de 10 dias, abstendo-se de cobrar, sob pena de multa equivalente ao dobro do valor cobrado em desconformidade; b) condenar a ré a pagar a autora a quantia de R$ 2.500,00 (dois mil e quinhentos reais), a título de compensação por danos morais, acrescido de correção monetária a contar da presente sentença, e juros de mora de 1% ao mês, estes a incidir da data da citação.


	A parte ré fica ciente de que deverá depositar as quantias acima fixadas, referentes as condenações de pagar quantia certa, no prazo de 15 (quinze) dias após o trânsito em julgado sob pena de multa de 10%, conforme prevista no artigo 523, I do Novo CPC, e nos termos do Enunciado Jurídico 13.9.1 do Aviso 23/2008.
Publicações, intimações e retificações conforme requerido pelas partes. No caso de retificação de nome, oficie-se ao Distribuidor e anote-se onde couber.
Sem ônus sucumbenciais em razão do art. 55 da Lei n. 9.099/95.
Remeto à apreciação do MM. Juiz Togado, na forma do disposto no art. 40, da lei 9099/95.
Duque de Caxias, 30 de janeiro de 2017.

Adriana do Rosario Soneira
Juíza Leiga";000441666167613D9D41C14B7B91AAD5A471C505542A0722;0004594EEF610F92F76AA1B4AA210AE89FB2C5050D33123B;2016.021.054021-0;0.782730221748352
9;2016.001.172291-9;Vistos etc. HOMOLOGO o PROJETO DE SENTENÇA proferido pelo DD. Juiz Leigo que me foi submetido, para que a mesma produza os seus jurídicos e legais efeitos, nos termos do artigo 4º, inciso III, da Resolução nº 08/2005, do Órgão Especial do TJ/RJ.  Sem custas judiciais, na forma da Lei nº 9.099/95. P.R.I. Certificado o trânsito em julgado, aguarde-se pronunciamento por 30 dias. Na inércia, dê-se baixa e arquive-se.;000441666167613D9D41C14B7B91AAD5A471C505542A0722;0004594EEF610F92F76AA1B4AA210AE89FB2C5050D33123B;2016.021.054021-0;0.782730221748352
10;2016.001.172291-9;"PODER JUDICIÁRIO DO ESTADO DO RIO DE JANEIRO
17º JUIZADO ESPECIAL CÍVEL
PROCESSO: 13746-41.2016.8.19.0204
AUTOR:  WELLINGTON DA COSTA REGO
RÉU: BANCO ITAUCARD 
PROJETO DE SENTENÇA
Dispensado o relatório nos termos do art. 38 da Lei 9099/95, passo a decidir. 
Reclama o  autor que foi negativado pela ré por debito de cartão de credito cujo fatura estava paga; que a ré continua a efetuar cobranças. Requer cancelamento dos débitos e da negativação e indenização por danos morais. 

Em Contestação a ré alega que o pagamento feito pelo autor em 03/03/2016 foi computado 5 dias uteis depois; sendo cobrado encargos por 18 dias de atraso; que não negativou o nome do autor; impugna o pedido indenizatório. 
O documento de fls.14 comprova que o  autor efetuou o pagamento da fatura vencida em 15/02/2016 apenas em 03/03/2016, sendo as cobranças efetuadas pela ré devidas.
Não há nos autos prova de negativação pela ré, sendo o documento de fls.15, apenas comunicado de futura e eventual negativaçao. 
Desta forma, não há que se falar em cobranças ou negativação indevida pela ré, razão pela qual se tem a improcedência dos pedidos.  

Pelo exposto, JULGO IMPROCEDENTES os pedidos, forma do art. 487 NCPC. Sem custas e honorários, nos termos do art. 55 da Lei 9099/95. Submeto o presente projeto de sentença à apreciação do Juiz Togado, para homologação.
Rio de Janeiro, 15 de Julho de 2016.
ANA QUEZIA PEREIRA DE FREITAS
JUIZA LEIGA";000439D4CA64F680CCC0C7A6B3C97A1B47FCC5051819141B;00044C3164248C06E29BA13EE58BBCD833CEC5044552464B;2016.204.013708-0;0.7762407064437866
11;2016.001.172291-9;Dispensado o relatório na forma do art. 38 da Lei 9099/95. HOMOLOGO o projeto de sentença proferido pelo Juiz Leigo, para que produza seus jurídicos e legais efeitos, na forma do art. 40 da Lei 9.099/95.  FICAM AS PARTES CIENTES DE QUE, NOS TERMOS DO AVISO 02/2016 DA COJES (D.O. 31/03/2016) OS PRAZOS PROCESSUAIS EM SEDE DE JEC CONTINUARÃO A SER CONTADOS EM DIAS CORRIDOS, INAPLICÁVEL O ARTIGO 219 DO NCPC.Fica a parte ré ciente de que caso não pague a quantia certa a que foi condenada em 15 dias, contados do trânsito em julgado da sentença, o valor da condenação será acrescido de multa de 10%, por aplicação do artigo 523,§1º do CPC, sendo certo, ainda, que a comprovação do depósito deverá vir aos autos no prazo de 5 dias, após a efetivação. Comprovado o depósito nos autos, e a quitação por parte do credor, expeça-se mandado de pagamento. Após, dê-se baixa e arquive-se. Caso negativo, após o decurso do prazo de trinta dias do trânsito em julgado, dê-se baixa e arquive-se.;000439D4CA64F680CCC0C7A6B3C97A1B47FCC5051819141B;00044C3164248C06E29BA13EE58BBCD833CEC5044552464B;2016.204.013708-0;0.7762407064437866
12;2016.001.172291-9;"ESTADO DO RIO DE JANEIRO
PODER JUDICIÁRIO
VI JUIZADO ESPECIAL CÍVEL
COMARCA DA CAPITAL
Processo nº: 0058352-84.2016.8.19.0001
Parte Autora: MARCELO RZEZINSKI
Parte Ré: MASTERCARD BRASIL SOLUÇÕES DE PAGAMENTO S.A
Parte Ré: BANCO ITAUCARD S.A.
PROJETO DE SENTENÇA
Dispensado o relatório, na forma do art. 38, da Lei nº 9.099/95.
Trata-se de ação de conhecimento na qual a parte autora busca a reparação de danos morais e o cancelamento do cartão decorrentes do bloqueio indevido do cartão durante viagem internacional. Em AIJ, o autor não se opôs à alteração no polo passivo da demanda pugnada pelo Itaú Holding, o qual há de ser, portanto, regularizado com a devida substituição.
O primeiro réu foi citado e apresentou contestação escrita, na qual argui preliminar de ilegitimidade passiva e, no mérito, sustenta a impossibilidade da obrigação de fazer e a inexistência de danos a serem reparados.
O segundo réu foi citado e apresentou contestação escrita, na qual sustenta a negativa de transação por prevenção e segurança, a inexistência de falha na prestação do serviço e de ato ilícito, bem como a inexistência de danos a serem reparados.
Rejeito a preliminar de ilegitimidade passiva, já que, por entender a autora que foi a parte ré quem lhe causou o dano, esta última é parte legítima para responder à presente ação.
Trata-se de relação jurídica disciplinada pelo Código de Defesa do Consumidor, porquanto as partes satisfazem os requisitos objetivos e subjetivos dos artigos 2º e 3º da Lei 8.078/1990.
O autor não narrou nenhum fato relacionado a qualquer conduta praticada pela MasterCard nem poderia, afinal esse réu não possui qualquer ingerência sobre a administração do cartão, sendo mera bandeira do plástico, razão pela qual, em relação a esse réu, os pedidos são improcedentes. No mesmo sentido, o entendimento pacífico no seio da jurisprudência de nosso c. Conselho Recursal:
Juiz(a) Juiz(a) JULIANA ANDRADE BARICHELLO - Julgamento: 15/07/2016 
3ª TURMA RECURSAL. RECURSO Nº. 0033322-19.2015.8.19.0054. Recorrente: MASTERCARD e BANCO ITAÚ. Recorrido: JOSÉ IZAIAS DE AMORIM. VOTO: Recurso interposto em face de sentença que julgou procedentes os pedidos, condenando os réus, solidariamente, à devolução da quantia de R$ 580,00 e ao pagamento de indenização por dano moral no valor de R$ 1.500,00. Recurso da ré Mastercard, arguindo, preliminarmente, sua ilegitimidade passiva, por se tratar de mera bandeira do cartão de crédito. Recurso do Banco Itaú, pugnando pela improcedência dos pedidos. Sentença que merece reforma. Afasto, desde já, a preliminar de ilegitimidade passiva arguida diante da teoria do direito de ação concreto e abstrato, que entende ser suficiente para caracterizar a legitimidade passiva as alegações autorais de suposta lesão a direito. Logo, a discussão acerca da responsabilidade situa-se na esfera meritória. No mérito, verifica-se que nenhuma responsabilidade pode ser imputada à Mastercard, uma vez que não possui nenhuma relação jurídica com o recorrido e não administra o cartão por ele utilizado. Na verdade, a recorrente atua somente como ""bandeira"" do cartão de crédito do autor/recorrido, o que afasta qualquer responsabilidade sobre os fatos articulados nos autos. No que tange ao Banco Itaú, restou comprovada a falha na prestação do serviço, diante da documentação acostada ao feito. No entanto, não se vislumbra, no presente caso, a configuração de maiores dissabores que justifiquem a reparação por danos morais. Mero aborrecimento, mágoa, irritação ou sensibilidade exacerbada que estão fora da órbita de alcance do dano moral, já que fazem parte da normalidade do quotidiano. Nesse sentido é o entendimento uniformizado no Tribunal de Justiça deste Estado através do verbete nº 75 da Súmula da Jurisprudência do TJRJ, in verbis: ""O simples descumprimento de dever legal ou contratual, por caracterizar mero aborrecimento, em princípio, não configura dano moral, salvo se da infração advém circunstância que atenta contra a dignidade da parte"". Pelo exposto, voto no sentido de conhecer e dar provimento a ambos os recursos para reformar a sentença e: a) JULGAR IMPROCEDENTES os pedidos em face da Mastercard; b) JULGAR IMPROCEDENTE o pedido de dano moral em face do ITAÚ. Mantida, no mais, a sentença em face do Banco Itaú tal como lançada. Sem ônus sucumbenciais. Rio de Janeiro, 13 de julho de 2016. JULIANA ANDRADE BARICHELLO JUÍZA RELATORA. (griframos)

O segundo réu, embora tenha alegado a negativa de transação por prevenção e segurança, não conseguiu ilidir as alegações do autor. Note-se que o cartão foi utilizado pela parte autora, a qual avisou ao réu sobre a viagem e solicitou o desbloqueio do referido cartão, motivo pelo qual a alegação do réu não merece prosperar. Ademais, deveria o réu entrar em contato com o consumidor antes de realizar o incontroverso bloqueio do cartão, a fim de evitar a surpresa do cliente e, por conseguinte, os transtornos, os quais, afinal, foram por ele experimentados.
Resta configurado o fato do serviço, por cujos danos dele decorrentes responde objetivamente o fornecedor de serviços, na forma do que dispõe o artigo 14, §1º do CDC.
No que se refere ao pedido de compensação por danos morais, o artigo 375 do CPC autoriza o julgador a julgar de acordo com as regras da experiência. 
O dano moral, consoante lição do Professor e Desembargador Sergio Cavalieri Filho, ""é a lesão de bem integrante da personalidade, tal como a honra, a liberdade, a saúde, a integridade psicológica, causando dor, sofrimento, tristeza, vexame e humilhação à vítima"" (in Programa de Responsabilidade Civil, 1998, p. 74).
É fato notório que, em circunstâncias como as narradas na petição inicial, o consumidor que, de boa fé, comunica ao banco que fará uma viagem internacional e solicita o desbloqueio do cartão para este fim, sendo surpreendido com o bloqueio posterior do plástico durante a viagem, experimenta desesperos, angústias, revoltas, ansiedades e outros transtornos em sua esfera de intimidade que ultrapassam sobremaneira as raias do mero aborrecimento.
Na espécie, o dano moral decorre in re ipsa da conduta sofrida, pois a conduta da parte Ré revelou lesão aos bens que integram a personalidade da parte Autora.
Concluída a existência de dano moral, passo à fixação do valor justo para a sua compensação, observando o que preceitua o artigo 944 do Código Civil, ou seja, a extensão do dano. 
Embora o autor tenha alegado que faria compras para seu nascituro, não juntou aos autos qualquer prova nesse sentido nem especificou de maneira clara o que deixou de comprar e as oportunidades por ele perdias por não ter podido utilizar o cartão, não sendo possível, assim, aplicar à espécie a teoria da perda de uma chance.
Outro fato relevante é que o autor realizou algumas compras, tendo o cartão sido bloqueado no final de sua viagem. Evidente seu constrangimento sofrido junto à recepção do hotel, o qual deve ser levado em conta para a quantificação do dano, mas se deve observar que, apesar da situação desagradável vivida pelo autor, o mesmo conseguiu retornar ao seu país de origem, onde, finalmente, foi debitada a quantia cobrada pelo hotel.
Portanto, nesta demanda, considerando-se as circunstâncias dos autos  reputo o valor de R$3.000,00, razoável, proporcional e suficiente para compensar o consumidor pelos dissabores por ele experimentados, importância a ser corrigida monetariamente desde a data da sentença (verbetes sumulares nº 362 do STJ e 97 do TJRJ) e acrescida de juros de mora de 1% (um por cento) ao mês desde a data da citação, por tratar-se de responsabilidade civil contratual (artigos 405 a 407 do Código Civil e artigo 161, §1º do CTN - Súmula 95 do TJRJ).
Isso posto, JULGO PARCIALMENTE PROCEDENTE O PEDIDO para condenar o segundo réu BANCO ITAUCARD S.A. a pagar à parte autora, a titulo de compensação por danos morais, a quantia de R$3.000,00 (três mil reais), corrigida monetariamente a partir da data da sentença e acrescida de juros de mora de 1% ao mês desde a citação. JULGO IMPROCEDENTES OS PEDIDOS em relação ao primeiro réu, MasterCard Brasil Soluções de Pagamento Ltda.. Nessa parte, dou pela extinção do feito com resolução do mérito, na forma do artigo 487, I, do Código de Processo Civil. 
Julgo extinto o processo sem resolução do mérito, no que se refere ao item ""d"" do pedido, cancelamento do cartão, na forma do artigo 485, VIII, do Código de Processo Civil.
Sem custas e honorários advocatícios, na forma do art. 55, da Lei 9.099/1995.
Transitada em julgado, aguarde-se o decurso do prazo de 15 dias para pagamento espontâneo do valor da condenação previsto no art. 523 do NCPC c/c o entendimento consolidado no enunciado nº 13.9.1 do Aviso nº 23/2008 do TJERJ, aguarde-se por mais 7 dias a manifestação das partes e, em seguida, caso permaneçam em silêncio, proceda-se à baixa e ao arquivamento. 
P.R.I.
Retifique-se o polo passivo da demanda para fazer constar a denominação social do réu BANCO ITAUCARD S.A. em substituição ao do segundo réu ITAÚ UNIBANCO HOLDING  S.A..
Projeto de sentença sujeito à homologação pelo MM. Juiz de Direito, com base no art. 40 da Lei nº 9.099/95.
Rio de Janeiro, 05 de agosto de 2016.
LUIZ EDUARDO FERREIRA DE MORAES
JUIZ LEIGO";00047634F82CB4718541B70AA959015080A5C505022F563E;0004EE4F7FB9DCAA90EDF53A836ECF24BFB9C5050C54415E;2016.001.049050-8;0.7727538347244263
