;processo;sentenca;similar_file;similar_init;similar_processo;similaridade
25;2016.001.143686-8;"Dispensado o relatório, na forma do Art. 38, caput, da Lei 9.099/95.

Trata-se de ação em que pretende a autora a declaração de inexistência de contrato vinculado à ré, bem como a suspensão de descontos realizados sobre a sua conta corrente, além da condenação da demandada ao pagamento de quantia a título de compensação por danos morais e repetição em dobro de indébito. 

Como fundamento de sua pretensão, afirma que é titular de conta corrente administrada pela instituição financeira ré, e que percebeu que esta realizou dois descontos no valor de R$ 860,00 (oitocentos e sessenta reais) cada uma, a título de parcela de um empréstimo consignado. Todavia, alega que os descontos foram indevidos, pois jamais celebrou qualquer contrato de empréstimo com a demandada.

A ré apresentou contestação em que sustenta a inexistência do dever de indenizar. Assim, requer a improcedência do pedido.

FUNDAMENTOS: 

A relação existente entre as partes é de consumo, uma vez que a parte autora se enquadra no conceito de consumidor final (CDC, artigo 2º) e a ré no de fornecedora de serviço (CDC, artigo 3º), sendo objetiva a responsabilidade desta última (CDC, artigo 14).

A responsabilidade civil em análise funda-se na teoria do risco do empreendimento, segundo a qual aquele que exerce alguma atividade relacionada ao fornecimento de bens e serviços tem o dever de responder por eventuais vícios decorrentes de sua atividade, independentemente de culpa.

Assim, ante a responsabilidade civil objetiva do prestador de serviço, o dever de indenizar somente será afastado caso se comprove a ocorrência de uma das excludentes da responsabilidade, quais sejam, que o defeito inexiste ou que decorreu de culpa exclusiva do consumidor ou de terceiro (CDC, artigo 14, § 3º).

Nesta perspectiva, cabia a ré demonstrar a efetiva contratação do empréstimo por parte da autora, a fim de legitimar os descontos realizados sobre a conta corrente.

Em que pese tenha vindo aos autos o contrato de empréstimo contendo assinatura em nome da autora, percebe-se claramente que houve falsificação do documento de identidade da demandante e da assinatura constante do contrato de fls.57.

Nesta perspectiva, diante da ausência de prova da efetiva contratação, deve ser declarada a nulidade do contrato e a ré condenada a restituir à autora o valor que esta pagou indevidamente, e em dobro, haja vista a ausência de engano justificável, nos termos do que dispõe o Art. 42, parágrafo Único, do CDC.

De outro turno, o pedido de danos morais também deve ser acolhido.

A cobrança por empréstimos não contratados pelo cliente é conduta que viola os deveres de lealdade e confiança, que são caríssimos ao princípio da boa-fé objetiva.

Neste sentido:

¿Apelação Cível. Direito do Consumidor. Alegação de empréstimo não contratado. Sentença de procedência. Irresignação do réu. 1. Falha na prestação do serviço do banco comprovada, diante da ausência de provas de que o empréstimo foi regularmente contratado pela recorrida. Teoria do risco do empreendimento. 2. A conduta do apelante em imputar indevidamente à apelada a realização de empréstimo e realizar descontos indevidos, privando-a da sua renda, configura dano moral. Precedente do TJRJ. Quantum indenizatório arbitrado na sentença em observância aos princípios da razoabilidade e da proporcionalidade. Aplicação do Enunciado 116 do Aviso TJ 55/2012. 3. Devolução em dobro das quantias descontadas indevidamente para pagamento do empréstimo não contratado. Incidência do art.42, parágrafo único, do CDC. Precedente do TJRJ. 4. Sentença que se mantém. 5. NEGA-SE SEGUIMENTO AO RECURSO.¿ (grifamos)
(0014516-57.2013.8.19.0004 ¿ APELAÇÃO - SERGIO SEABRA VARELLA - VIGÉSIMA QUARTA CÂMARA CÍVEL CONSUMIDOR - Data de julgamento: 28/09/2015)

A fixação da verba indenizatória por danos morais deve considerar o caráter reparador, punitivo e pedagógico da responsabilidade civil, a gravidade e extensão do dano, a culpabilidade do agente, bem como a condição financeira das partes envolvidas, o valor do negócio e as peculiaridades do caso concreto, sem perder de vista os princípios da razoabilidade e proporcionalidade.

A indenização em tais casos, além de servir como compensação pela angústia e frustração sofridas pelo consumidor, em razão da falha na prestação dos serviços pela ré, deve também ter caráter pedagógico-punitivo de modo a desestimular condutas semelhantes.

Deve, pois, representar compensação razoável pelo sofrimento experimentado, cuja intensidade deve ser considerada para fixação do valor, aliada a outras circunstâncias peculiares de cada conflito de interesses, sem jamais constituir-se em fonte de enriquecimento sem causa para o ofendido, nem, tampouco, em valor ínfimo que o faça perder o caráter pedagógico-punitivo ao ofensor.

Considerando-se as peculiaridades do caso, afigura-se adequado fixar-se o valor indenizatório no patamar de R$ 3.000,00 (três mil reais) pelos danos extrapatrimoniais, quantia que se encontra em consonância com os critérios norteadores que balizam o arbitramento do instituto, como a repercussão do dano e a possibilidade econômica do ofensor e da vítima, sem olvidar da vedação de constituir-se em fonte de lucro.

  DISPOSITIVO:

Pelo exposto, JULGO PROCEDENTES os pedidos para: a) declarar a nulidade do contrato de empréstimo objeto desta ação, determinando que a ré se abstenha de realizar novos descontos sobre a conta corrente da autora, sob pena de multa equivalente ao dobro do que for descontado indevidamente; b) condenar a ré a restituir à autora o valor de R$ 3.440,00 (três mil quatrocentos e quarenta reais), já em dobro, corrigidos monetariamente a partir da data do pagamento indevido, acrescido de juros de mora de 1% ao mês a contar da citação; c) condenar a ré a pagar ao autor a quantia de R$ 3.000,00 (três mil reais) a título de reparação de danos morais, corrigidos monetariamente desde a sentença e com juros de mora de 1% ao mês a contar da citação. Sem custas, nem honorários advocatícios, nos termos do artigo 55, da Lei 9099/95.

Fica a 2ª ré ciente de que, não sendo o pagamento realizado no prazo de 15 (quinze) dias, contados da data do trânsito em julgado da sentença ou do acórdão, independentemente de nova intimação, o valor da condenação será acrescido de 10 % (dez por cento), na forma do Art. 523, §1º, do CPC, conforme estabelecido no item 13.9.1, do Aviso TJ nº 23/2008, alterado pelo Aviso Conjunto TJ/COJES nº 15/2016.

 Publique-se. Registre-se. Intimem-se.

Remeto os autos ao M.M. Juiz de Direito para homologação deste projeto de sentença, na forma do Artigo 40, da Lei 9.099/95. 


Duque de Caxias, 16 de setembro de 2016.";0004E50638D83FF589A4BE39629E1796B324C505312D573A;0004D388AEDF78BC2FECF52890327B847EF8C504631F5807;2016.021.031425-8;0.8812191486358643
26;2016.001.143686-8;"     Tendo em   vista que  houve  acordo entre  as  partes , JULGO  EXTINTO COM  RESOLUÇÃO DO MÉRITO, na forma do artigo  487, III,  alínea  b ,  do CPC.


 Sem custas. Após as formalidades legais, dê-se baixa e arquive-se. P.R.I.";0004E50638D83FF589A4BE39629E1796B324C505312D573A;0004D388AEDF78BC2FECF52890327B847EF8C504631F5807;2016.021.031425-8;0.8812191486358643
27;2016.001.143686-8;"HOMOLOGO, por sentença, para que produza seus efeitos legais, o ACORDO ajustado pelas partes (fls. 66/67) e ratificado em ACIJ (fls. 88) e, em consequência, JULGO EXTINTO O PROCESSO com resolução do mérito, nos termos do art. 487, inciso III, alínea b, do Código de Processo Civil. Sem Custas. Registre-se. Dê-se baixa e arquivem-se os autos.
Defiro desde já, se for o caso, independente de nova conclusão e havendo quitação da parte Autora, a expedição de mandado de pagamento. 
Cientes as partes de que, decorridos 90 dias da data do arquivamento definitivo, os autos processuais (físicos) serão eliminados, nos termos do artigo 1°, do Ato Normativo Conjunto n° 01/2005. PRI.";0004F88A843A9FB58F96FC00828E1F60F572C50524361760;00045F43797D739603869C5B043BCF8CF436C5045219512F;2016.208.011651-8;0.8807986974716187
28;2016.001.143686-8;"Processo nº: 		004657-79.2016.8.19.0208
Parte Autora: 	ANDRÉ RIBEIRO GUERRA
Parte Ré: 		BANCO ITAUCARD S/A

Projeto de Sentença

Trata-se de ação em que a parte Autora pleiteia a exclusão do seu nome dos cadastros restritivos ao crédito, bem como indenização a título de danos morais. Alega que seu cartão de crédito com a ré expiou a validade e ao receber o novo cartão, não desbloqueou o mesmo e não fez nenhuma compra, porém esta negativou o seu nome. 

A parte Ré impugna os pedidos autorais e requer a improcedência dos pedidos. 

É o breve relatório, conforme possibilita o artigo 38 da Lei n. 9099/95. Decido.

Inexiste  preliminar a dirimir, razão pela qual, reconhecendo a existência dos pressupostos processuais e das condições de regular desenvolvimento acionário, passo ao exame do mérito.

Cabe destacar que a relação jurídica entre as partes é de consumo, já que estão presentes os requisitos subjetivos (consumidor e fornecedor ¿ artigos 2o e 3o da Lei 8078/90) e objetivos (produto e serviço ¿ §§ 1o e 2o do artigo 3º da citada lei) de tal relação. 

De acordo com o artigo 14 do CDC, os fornecedores de serviços respondem, de forma objetiva, pela reparação dos danos causados ao consumidor por defeitos na prestação dos serviços, bem como por informações insuficientes e inadequadas sobre sua fruição e riscos. 

No caso vertente, a parte Autora afirma que não possui mais relação comercial com a empresa Ré, porém esta incluiu o seu nome nos cadastros restritivos ao crédito (fls.19) Afirma que tomou conhecimento da negativação, ao tentar fazer o financiamento de um carro e não pôde concretizar tendo em vista a negativação feita pela parte Ré.

Com efeito, diante das alegações da parte Autora de que houve falha na prestação do serviço, caberia a Ré a apresentação de provas de que não houve tal falha. 

Portanto, não há como se acolher as alegações da Ré, pois desacompanhada de qualquer prova que pudesse indicar o que meramente se alegou na contestação. 

Incumbe a parte Ré o ônus de provar o fato modificativo ou extintivo do direito da parte Autora, na forma do art. 333 do Código de Processo Civil e do art. 14 §3º do Código do Consumidor, o que não ocorreu, tendo em vista que a parte Ré, tão-somente, afirma, sem, no entanto, comprovar, a ausência dos danos narrados pela parte Autora.

Observo que a Ré, em momento algum, demonstra a existência de causa que, à luz do contrato firmado ou da lei, legitimasse sua conduta neste caso. 

A parte Ré não juntou contrato   com a assinatura da parte Autora, nem fatura com a descrição das comprars efetuadas,  tornando legítimas, desta forma, as cobranças realizadas.

É cediço que a Ré responde objetivamente, independente da existência ou não de culpa, fundado na teoria do risco do empreendimento.  Como fornecedor, correm por sua conta os riscos do seu empreendimento, cabendo-lhe arcar com os prejuízos decorrentes de seu erro, ou descaso.  

Neste diapasão, atribuo verossimilhança aos fatos, com base nas provas carreadas aos autos, prevalecendo, assim, a narrativa da parte Autora, em sua petição inicial e na Audiência realizada perante este Juízo, diante de sua situação de vulnerabilidade e presunção de boa fé (artigo 4º, I e III, da Lei nº 8.078/90). 

Em assim sendo, tenho como procedentes as razões invocadas ao embasamento da pretensão autoral, devendo a Ré excluir o nome da parte Autora dos cadastros restritivos ao crédito e  cancelar o débito existente.

O pedido de devolução em dobro dos valores cobrados deve ser julgado improcedente, uma vez que não existe nos autos comprovante de seu pagamento.

Por fim, entendo que a situação ora sob exame caracteriza o dano moral que merece reparação. Tal dano fica evidenciado pela circunstância de que o banco Réu incluiu o nome da parte Autora nos cadastros restritivos ao crédito, em razão de uma pendência financeira, que o Autor desconhece (fls. 19). 

O dano moral nas relações de consumo não se configura apenas como lesão de sentimento, mas como forma de ressarcir a falta de cuidado com o consumidor, e prevenir situações semelhantes no futuro. Ressalto que a reparação desse tipo de dano tem tríplice caráter: punitivo, indenizatório e educativo, como forma de desestimular a reiteração do ato danoso.

Portanto, entendo que, diante de tais conclusões, a quantificação do dano a ser indenizado deve ser dotada de razoabilidade e proporcionalidade. A razoabilidade está contemplada, ante as conseqüências do fato e a duração do evento.


A conta do acima exposto, JULGO PROCEDENTE OS PEDIDOS para:

1) Determinar que o Cartório expeça os Ofícios necessários para exclusão do nome da parte Autora dos cadastros restritivos ao credito (SPC e Cartório de Protesto de Títulos e documentos), referente à anotação realizada pela parte Ré. 

2) Condenar a parte Ré a pagar a parte Autora a quantia de R$6.000,00 (seis mil reais), a título de indenização por danos morais, corrigida monetariamente com base nos índices oficiais da CGJ e acrescida de juros na taxa de 1% (um por cento) ao mês, a partir da leitura da presente.

03) Declarar inexiste a dívida existente em nome da parte Autora, no prazo de 15 dias a contar da leitura de sentença, sob pena de multa diária de R$ 50,00 (cinquenta reais), limitada ao montante de R$ 2.000,00 (dois mil reais).

Por fim, julgo improcedente o pedido de devolução em dobro do valor cobrado.

Sem custas e honorários vez que em sede de Juizado Especial Cível, conforme disposto no artigo 55 da lei 9.099/95.

Cientes as partes do disposto no artigo 52, IV, da Lei n° 9.099/95, quanto à necessidade de cumprimento voluntário da sentença, sob pena de penhora, dispensada nova citação. 

Ficam, ainda, as partes intimadas de que em se tratando de sentença condenatória ao pagamento de quantia certa, o prazo previsto no art. 523 do NCPC, para incidência da multa ali prevista (10%), contar-se-á da data do trânsito em julgado. 
 
Certificado o trânsito em julgado e não havendo novas manifestações no prazo de 15 (quinze) dias, dê-se baixa e arquivem-se. Cientes as partes de que decorridos 90 dias da data do arquivamento definitivo os autos processuais serão eliminados, nos termos do artigo 1º do Ato Normativo Conjunto 01/2005, publicado no DORJ de 07/01/05.

Projeto de sentença sujeito à homologação, assim, remeto os autos a MM. Juíza Togada, nos termos do artigo 40 da Lei nº 9.099/95.

Rio de Janeiro, 12 de maio de 2016.

NOELMA RAMOS FARIA
Juíza Leiga";0004F0B0FA9DB1CFD1EB1FF19BB253A71EEAC504621D0F48;000403F7403D740F1A1820DF4A9AB7867934C50459402F0A;2016.208.004604-8;0.8807739615440369
29;2016.001.143686-8;Homologo por sentença na forma do artigo 40 da Lei nº 9.099/95 o Projeto de Sentença elaborado pelo Juiz Leigo. PRI. Certifique-se o trânsito em julgado. Defiro desde já, se for o caso, independente de nova conclusão e havendo quitação da parte Autora, a expedição de mandado de pagamento. Após, dê-se baixa e arquivem-se.;0004F0B0FA9DB1CFD1EB1FF19BB253A71EEAC504621D0F48;000403F7403D740F1A1820DF4A9AB7867934C50459402F0A;2016.208.004604-8;0.8807739615440369
30;2016.001.143686-8;"PROJETO DE SENTENÇA

Ainda que seja dispensado o relatório, na forma do artigo 38 da lei 9.009/95, faz-se um breve resumo. Após, passo a decidir.
Trata-se de ação de obrigação de fazer c/c compensação por danos morais proposta por TANIA REGINA PINHO DE ARAUJO ABREU E PATRICK GIL DOS SANTOS em face de ITAU UNIBANCO S.A., em que alega o o encerramento de sua conta corrente sem aviso prévio.
A ré, em sua contestação, aduz não haver comprovação do alegado.
Presentes os pressupostos processuais e as condições ao regular exercício do direito de ação, passa-se ao mérito.
É inegável tratar-se de relação de consumo, na medida em que estão presentes as figuras do consumidor, do fornecedor e do serviço, na forma dos arts. 2º e 3º do CDC, estando presentes os elementos subjetivos e objetivo da relação de consumo.
Conclui-se, compulsando os autos, pela ocorrência de um fato do serviço, na medida em que há, por parte da ré, o encerramento da conta corrente de sua titularidade, sem justificativa plausível.
A responsabilidade civil dos fornecedores, pelo fato do serviço, serviço é objetiva e baseada na teoria do risco da atividade. Assim, caberá apenas a configuração de conduta, dano e nexo causal.
Assim sendo, na forma do art. 14, §3º do CDC, a inversão do ônus da prova se opera ope legis, na medida em que o fornecedor somente não será responsabilizado quando provar fato exclusivo da vítima ou de terceiro, ou que o defeito inexiste. 
Porém, quanto aos fatos constitutivos de seu direito, não há como se entender que haja tal inversão, notadamente quanto aos prejuízos ocasionados pela conduta da ré, devendo tais fatos serem comprovados pela autora, na forma do art. 373, I do CPC/2015 (art. 333, I do CPC/1973), logrando êxito, posto que traz aos autos os extratos de fls. 27-45, e-mails de fls. 64-67, bem como ofício de fls. 69.
Há caracterização da conduta ilícita, na medida em que a parte ré não traz aos autos qualquer comprovaça da legalidade do encerramento da referida conta corrente, além de não haver qualquer aviso prévio, tendo sido os autores surpreendidos com a atitude unilateral da ré, que cancelou conta corrente e seus cartões de crédito.
De acordo com o posicionamento doutrinário e jurisprudencial amplamente dominante, apenas se terá como lícito o bloqueio de cartão realizado após prévia comunicação ao cliente, e por motivo justificado (tais como suspeita de clonagem ou inadimplemento, por exemplo), ou em hipóteses em que não há saldo, por ter o consumidor ultrapassado seu limite, seguindo-se o princípio da boa-fé, notadamente, na vedação aos comportamentos contraditórios.
Não tendo o réu comprovado o envio de aviso prévio aos autor, o que se tem é falha na prestação de serviços, notadamente em relação ao dever de informação (art. 6º, III do CDC).
Assim sendo, para o inicio da restituição ao status quo ante, deverá a ré restabelecer a conta corrente nº 01565-3 (agência 3820), com os cartões de crédito, tal qual anteriormente ao cancelamento, na medida em que este se deu de forma unilateral e arbitrária, quando ainda era de interesse a manutenção do contrato.
Quanto aos danos morais alegadamente sofridos pelo pelos, como houve violação dos deveres anexos do contrato, não tendo o fornecedor agido com lealdade e nos ditames da boa-fé objetiva que deve regular as relações de consumo, e tendo em vista ter tido sua compra negada por mais de uma vez em estabelecimentos comerciais, além de a primeira autora ficar impossibilitada de receber seu pagamento, é possível concluir pela ocorrência de abalos psíquicos capazes de afetar os direitos da personalidade, tornando os danos morais presumidos (in ré ipsa), não se podendo aplicar a súmula 75 do TJRJ de forma a não se considerar o ocorrido como mero aborrecimento diário que tem reflexos exclusivamente patrimoniais, até mesmo em aplicação á função punitivo-pedagógica da compensação por danos morais.
No tocante ao quantum da indenização fixado, em que pese não haver parâmetros objetivos para o seu estabelecimento, observo que o valor não deve levar ao enriquecimento do credor e tampouco à ruína do devedor.
Nesse sentido, deve mais do que possuir cunho punitivo, ter caráter educativo àquele que agiu indevidamente ao ferir a honra e a imagem de outrem, compensando de forma pecuniária a pessoa lesada no seu íntimo, na forma dos arts. 5º, X da CRFB e 6º, VI do CDC.
Assim, observando-se os parâmetros acima mencionados e considerando-se as informações constantes dos autos, entendo que a indenização por danos morais no valor de R$ 4.000,00 (quatro mil reais) PARA A PRIMEIRA AUTORA e R$ 2.000,00 (dois mil reais) PARA O SEGUNDO AUTOR, é justa, adequada e atende os princípios da proporcionalidade e razoabilidade.
Posto isso, julgo PROCEDENTE EM PARTE A PRETENSÃO, na forma do art. 487, I do CPC/2015 (art. 269, I, do CPC/1973), para: 1) DETERMINAR que a ré restabelecer a conta corrente nº 01565-3 (agência 3820), com os cartões de crédito, no prazo de 30 (trinta) dias corridos, a contar da data da leitura da sentença, sob pena de multa a ser arbitrada em sede de execução; 2) CONDENAR a ré ao pagamento da quantia de R$ 4.000,00 (quatro mil reais) PARA A PRIMEIRA AUTORA e R$ 2.000,00 (dois mil reais) PARA O SEGUNDO AUTOR, a título de compensação pelos danos morais, devendo o valor ser corrigido monetariamente a partir do arbitramento e com juros de 1% ao mês a partir da citação.
Isento dos ônus sucumbências, na forma do art. 55 da lei 9.099/95. Submeto este Projeto de Sentença ao Juiz Togado, na forma do que dispõe o art. 40 da lei 9.099/95.

Rio de Janeiro, 31 de julho de 2016.

Janayme Vieira de Moraes
Juíza Leiga";0004D2A128089A44A4A281519E251022A817C5051660603B;00040AF8E25874059B1810E339A1737D7179C5045A1A1E24;2016.001.131632-2;0.8807357549667358
31;2016.001.143686-8;"Homologo, por sentença, para que surta seus efeitos legais, o projeto de sentença elaborado pelo juiz leigo, na forma do artigo 40 da Lei nº 9.099/95. 

Em caso de depósito judicial referente à condenação, expeça-se mandado de pagamento, independentemente de nova conclusão. 

Caso haja valor remanescente a ser recebido, manifeste-se o credor em 7 dias, sob pena de arquivamento dos autos. Após o trânsito em julgado, tratando-se de sentença de improcedência ou de extinção do feito sem resolução do mérito, dê-se baixa e arquivem-se imediatamente. 

Tratando-se de sentença de procedência, após o trânsito em julgado e o decurso do prazo de 15 dias para pagamento espontâneo do valor da condenação previsto no art. 523 do NCPC c/c o entendimento consolidado no enunciado nº 13.9.1 do Aviso nº 23/2008 do TJERJ, aguarde-se por mais 7 dias a manifestação das partes e, em seguida, caso permaneçam em silêncio, proceda-se a baixa e ao arquivamento. 

FICAM AS PARTES CIENTES DE QUE A NOVA SISTEMÁTICA DE CONTAGEM DE PRAZO ESTABELECIDO NO ART. 219 DO NCPC/2015 NÃO SE APLICA AOS JUIZADOS ESPECIAIS CÍVEIS, CONSOANTE NOTA TÉCNICA 01/2016 DO FONAJE DE 04/03/2016 C/C A PRIMEIRA PARTE DO ENUNCIADO 86 TAMBÉM DO FONAJE, COMPUTANDO-SE OS PRAZOS EM DIAS CORRIDOS, ASSIM PROCEDENDO COM A FINALIDADE PRECÍPUA DE SE ALCANÇAR A BOA GESTÃO CARTORÁRIA COM FUNDAMENTO NO PRINCÍPIO DA CELERIDADE QUE REGE A LEI 9.099/95.";0004D2A128089A44A4A281519E251022A817C5051660603B;00040AF8E25874059B1810E339A1737D7179C5045A1A1E24;2016.001.131632-2;0.8807357549667358
32;2016.001.143686-8;Projeto em Revisão;00047DA763968EBFC1B9039F9FD769B84118EEC50534644F;0004CC3EF4FF4953B14C0DC68D6FF1D376EFC5044C4F0F1C;2016.204.020945-5;0.8801872730255127
33;2016.001.143686-8;Projeto em Revisão;00047DA763968EBFC1B9039F9FD769B84118EEC50534644F;0004CC3EF4FF4953B14C0DC68D6FF1D376EFC5044C4F0F1C;2016.204.020945-5;0.8801872730255127
