;processo;sentenca;similar_file;similar_init;similar_processo;similaridade
0;2016.001.143686-8;"Homologo o acordo celebrado entre as partes para que surta seus jurídicos e legais efeitos, e julgo o feito extinto, com resolução do mérito, nos termos do art. 487, inc. III, b, do novo Código de Processo Civil ( Lei nº 13.105/ 2015). 

Se for o caso, comprovado o depósito, expeça-se mandado de pagamento em favor da parte autora, independentemente de nova conclusão.   Após, nada mais sendo requerido, dê-se baixa e arquivem-se. 


Decorrido o prazo do cumprimento o acordo, aguarde-se por cinco dias a manifestação das partes; não havendo manifestação,  dê-se baixa e arquive-se.";0004AEE49C4653745FD252474ABEAF94915EC5052221410B;0004F11B1EB564794C63AC46C240F07A432AC50507525945;2016.001.163462-9;0.9038727283477783
1;2016.001.143686-8;"Dispensado o relatório nos termos do art. 38, da lei 9.099/95.
Homologo, para que produza seus jurídicos e legais efeitos, o acordo estabelecido pelas partes às fls. 75. Por conseguinte, JULGO EXTINTO o presente processo, com julgamento do mérito, na forma do art. 487, III, ""b"" do NCPC sem custas ou honorários. Aguarde-se a manifestação das partes para o cumprimento do acordo. 
Após, permanecendo inertes, e cumpridas todas as formalidades legais, inclusive certificado o trânsito em julgado, dê-se baixa e arquivem-se. P.R.I.";0004E2D4BDFB8433841A496C1C875E9363BDC50528460F19;0004AD41EF77B925EAB85F3440BD5D634998C50507496128;2016.063.006087-7;0.8992836475372314
2;2016.001.143686-8;"HOMOLOGO, por sentença, o acordo celebrado entre as partes, para que produza seus jurídicos e legais efeitos. Assim sendo, JULGO EXTINTO O PROCESSO, com resolução de mérito, com fundamento no artigo 487, inciso III, alínea b, do CPC. 

Sem custas. 

REGISTRE-SE. 

Após, dê-se baixa e arquive-se.";0004B7CF672228CFA3520F7BE2B45E8DFF89C50509310A48;00041E05F34AF3AABFC154581EBFB47E8264C5045631103A;2016.001.069993-8;0.8942130208015442
3;2016.001.143686-8;"PODER JUDICIÁRIO DO ESTADO DO RIO DE JANEIRO
I JUIZADO ESPECIAL CÍVEL ¿ DUQUE DE CAXIAS 

PROCESSO Nº: 0062912-09.2016.8.19.0021
AUTOR: WAGNER DA SILVA DE SANTANA
RÉU: ITAU UNIBANCO S/A
RÉU: BANCO ITAUCARD S/A

PROJETO DE SENTENÇA

Vistos, etc.
Dispensado relatório nos termos do art. 38, da Lei nº 9.099/95. 
Trata-se de ação judicial ajuizada pela parte autora em face da ré, pleiteando antecipação dos efeitos da tutela para que a ré exclua seu nome dos cadastros de inadimplentes, sob pena de multa diária a ser arbitrada em caso de descumprimento. Requereu a confirmação do provimento antecipado, a restituição do valor de R$ 328,65, bem como seja declarada a inexigibilidade dos débitos vinculados ao cartão de crédito Visa nº. 4440.xxxx.xxxx.4434. Requer, por fim, compensação por danos morais.
A parte autora aduz em síntese que é titular de conta-corrente nº 49198-2, adquirida junto a 1ª ré, agência: 1282 e titular de cartão de crédito Visa nº. 4440.xxxx.xxxx.4434, administrado pela 2ª ré. Menciona que em novembro de 2013 a validade de seu cartão de crédito expirou a validade, não tendo recebido outro em substituição. Afirmou que, como haviam débitos parcelados em seu cartão, efetuava os pagamentos regularmente desses valores, através das faturas que recebia da ré. Alega que não obstante a ré não ter enviado o nova cartão de crédito, a partir da fatura com vencimento em 08/09/2014, passou a descontar o valor de R$ 67,00, referente à anuidade. Que por engano, efetuou o pagamento em duplicidade do parcelamento incluído na fatura com vencimento em dezembro de 2014. Assevera que realizou reclamações administrativas, inclusive via e-mail (fl. 53/58), informando o ocorrido e requerendo o cancelamento do plástico, passando a efetuar o pagamento da fatura apenas com o valor do parcelamento que reconhecia o débito. Destacou que em outubro/2016, tomou conhecimento de que a ré havia incluído o seu nome nos cadastros restritivos de crédito por débitos referente a fatura vencida em 08/09/2016 (fl. 14), embora jamais tenha recebido o cartão, desbloqueado ou utilizado. Esclareceu, ainda, que ao comparecer em sua agência, tomou conhecimento que os valores referentes ao mínimo de seu cartão de crédito foram descontados mensalmente em sua conta corrente até agosto de 2015 (fls. 31/31 e 40/52), quando deixou de ter saldo para o desconto. Que os débitos foram acumulando, gerando posterior gravame de seu nome.
O pedido de antecipação dos efeitos da tutela foi negado, conforme se depreende da decisão de fl. 64.
Em audiência de instrução e julgamento, pela parte autora foram reiterados os termos da inicial, acrescentando que a ré em sua peça de bloqueio reconhece que ele não recebeu o plástico, portanto indevidas as cobranças e posterior negativação de seu nome nos cadastros restritivos de crédito.
Resposta oferecida pelas rés, em peça única, por sua vez, requer a RETIFICAÇÃO DE POLO PASSIVO para que conste apenas a ré: BANCO ITAUCARD S/A, empresa responsável pela administração do produto objeto da lide. No mérito, sustenta que inexiste direito a ser amparado à parte autora. Sustenta que não houve ato ilícito e que não há dano moral. Que a parte autora não buscou as vias administrativas para a solução da lide, havendo ausência de pretensão resistida da ré. Requer a improcedência do pedido. 
Preliminarmente, quanto a alegação da ré de a parte autora não buscou as vias administrativas para a solução da questão, os e-mail enviados (fls. 53/58) demonstram o esforço do autor na solução da lide.
A relação estabelecida entre as partes é de consumo, porquanto presentes os requisitos subjetivos (arts. 2º, caput, e 3º, caput, da Lei nº 8.078/90) e objetivo (art. 3º, § 2º, da Lei n.º 8.078/90) que a caracterizam. Aplicável, portanto, o regime jurídico especial da Lei n.º 8.078/90, a qual abriga a responsabilidade do tipo objetiva, em que é necessária, apenas, a prova do dano e do nexo causal, sendo despicienda a culpa da ré, e ainda assegura ao consumidor, como medida protetiva, a inversão do ônus da prova (artigo 6º, VIII, do CDC), haja vista a verossimilhança dos fatos narrados na petição inicial, bem como sua condição de hipossuficiente e vulnerável na relação de consumo. 
Diante das provas dos autos, verifica-se que a parte autora comprova de forma robusta os fatos aduzidos em sua peça exordial. Contexto fático probatório que permite concluir que há verossimilhança nas alegações da autora.
A Ré, por sua vez, defende-se arguindo que a parte autora não apresentou prova mínima dos fatos alegados, ferindo o art. 373, I do CDC.
Não trouxe aos autos qualquer comprovação de que o cartão objeto da lide tenha sido entregue a autora, ou que possuía autorização para descontar os valores referentes aos débitos do cartão de crédito, diretamente de sua conta-corrente, eis que nenhum contrato foi apresentado.
E, muito embora tenha aduzido em sua peça de bloqueio que: ¿Assim, tomou o Réu todas as providências necessárias para evitar ou minimizar os danos e prejuízos sofridos pelo autor, bem como para recompô-los, o que demonstra que não resistiu à pretensão da parte autora.¿, fato é que também não comprovou nenhuma providência, sequer havendo nos autos a comprovação de que providenciou a baixa de gravame em nome do autor.
Desta forma, desnecessária a comprovação da culpa, uma vez que a responsabilidade da parte ré é objetiva, não conseguindo a parte ré comprovar nenhuma excludente de nexo causalidade. Trata-se do risco do empreendimento, onde a ré lucra com o bônus, mas também deve arcar com o ônus.
Na verdade, era dever da parte ré fazer prova dos fatos modificativos, extintivos ou impeditivos do direito autoral, na forma do art. 373, II do Novo CPC, no sentido de demonstrar a ocorrência de uma das excludentes de responsabilidade civil no CDC, já que a responsabilidade objetiva do fornecedor de bens e serviços, através art. 14 daquele diploma legal, somente pode ser afastada se comprovada a culpa exclusiva do consumidor ou de terceiro para a ocorrência do evento danoso, nos termos que lhe impõe o art. 14, § 3º, incisos I e II da Lei nº 8.078/90 e art. 373, II do CPC, o que não foi feito. 
Diante do apresentado, deve ser acolhido o pleito autoral, devendo a ré proceder a baixa do gravame vinculado ao CPF da parte autora referente ao débito vinculado ao cartão objeto da lide. Deve, ainda, ser declarada a inexigibilidade de todo e qualquer débito em nome da parte autora, referente ao cartão de crédito objeto da lide.
Ante a ausência de prova do cumprimento da obrigação contratual de entrega do cartão de crédito, se reputam ilegítimas as cobranças enviadas ao autor durante todo o período que este não foi prestado, devendo ser canceladas as que não tiverem sido pagas, bem como restituídas as que tiverem sido comprovadamente quitadas.
No entanto, tal restituição deverá ocorrer na forma simples, eis que conforme decidido na Reclamação 4892/PR pelo Superior Tribunal de Justiça, é imprescindível a prova da má-fé na cobrança para a aplicação da devolução em dobro, nos termos do art. 42 do CDC. 
Diante do exposto, deverá a ré restituir ao autor o valor total requerido de R$ 328,65 (trezentos e vinte e oito reais e sessenta e cinco centavos), conforme comprovantes nos autos. 
Quanto ao pedido de indenização extrapatrimonial, formulado pela autora, deve o mesmo ser acolhido ante a configuração do dano moral indenizável, evidenciado pelo próprio fato. Conforme lição do Desembargador SÉRGIO CAVALIERI FILHO ""o dano moral existe in re ipsa"", ou seja, ""está ínsito na própria ofensa, decorre da gravidade do ilícito em si"" (Programa de Responsabilidade Civil, 2ª ed., Malheiros, p. 80).
No que tange ao quantum debeatur, deve o mesmo ser fixado de forma proporcional, moderada e razoável, compatível com a reprovabilidade da conduta ilícita, a intensidade e duração do sofrimento experimentado, a capacidade econômica do causador do dano e as condições sociais da vítima, dentre outras circunstâncias relevantes.
Com base em tais critérios, e o decurso de tempo sem qualquer solução por parte do réu, entende esse Juízo que o valor de R$ 10.000,00 (dez mil reais) mostra-se razoável e proporcional.
Quanto ao pedido de RETIFICAÇÃO DE POLO PASSIVO, indefiro, eis que a parte autora reclama, além das cobranças referentes a anuidade em seu cartão de crédito, cuja administração é feita pelo réu: BANCO ITAUCARD S/A, pelos descontos efetuados diretamente em sua conta-corrente sem sua prévia autorização. Desta forma, deve o réu: ITAU UNIBANCO S/A, permanecer no polo passivo da demanda. Solidariedade entre os Réus que se impõe.
Ante o exposto, JULGO PROCEDENTE EM PARTE os pedidos autorais, extinguindo o feito com resolução do mérito, nos termos do artigo 487, I do Novo CPC, para: 
a) declarar a rescisão do contrato vinculado ao cartão de crédito Visa nº. 4440.xxxx.xxxx.4434, bem como declarar a inexigibilidade de todo e qualquer débito a ele vinculado, devendo a ré abstendo-se de fazer novas cobranças, sob pena de multa equivalente a R$ 200,00 (duzentos reais) por cada cobrança indevida; 
b) condenar a ré a restituir a parte autora a quantia de R$ 328,65 (trezentos e vinte e oito reais e sessenta e cinco centavos), na forma simples, corrigidos monetariamente desde a data do pagamento e juros de mora de 1% ao mês a partir da citação; 
c) condenar a ré a pagar a parte autora a quantia de R$ 10.000,00 (dez mil reais), a título de compensação por danos morais, acrescido de correção monetária a contar da presente sentença (Súm. 362/STJ), e juros de mora de 1% ao mês, estes a incidir da data da citação;  
d) condenar a ré a proceder a exclusão do nome da parte autora dos cadastros de proteção ao crédito da anotação de fl. 14, no prazo de 10 dias sob pena de multa diária de R$ 50,00 (cinquenta reais), inicialmente limitada em R$ 5.000,00 (cinco mil reais);





	A parte ré fica ciente de que deverá depositar as quantias acima fixadas, referentes ás condenações de pagar quantia certa, no prazo de 15 (quinze) dias após o trânsito em julgado sob pena de multa de 10%, conforme prevista no artigo 523, I do Novo CPC, e nos termos do Enunciado Jurídico 13.9.1 do Aviso 23/2008.
Publicações, intimações e retificações conforme requerido pelas partes. No caso de retificação de nome, oficie-se ao Distribuidor e anote-se onde couber. 
Sem ônus sucumbenciais em razão do art. 55 da Lei n. 9.099/95.
Remeto à apreciação do MM. Juiz Togado, na forma do disposto no art. 40, da lei 9099/95.
Duque de Caxias, 23 de março de 2017.
		
Adriana do Rosario Soneira
Juíza Leiga";0004702483AC0902739D735F181565C0FBF6C50562343508;00041173801FCA0EEFCA2BDA252919F2EA18C5052D145B3B;2016.021.061956-2;0.8931504487991333
4;2016.001.143686-8;Vistos etc. HOMOLOGO o PROJETO DE SENTENÇA proferido pelo DD. Juiz Leigo que me foi submetido, para que a mesma produza os seus jurídicos e legais efeitos, nos termos do artigo 4º, inciso III, da Resolução nº 08/2005, do Órgão Especial do TJ/RJ.  Sem custas judiciais, na forma da Lei nº 9.099/95. P.R.I. Certificado o trânsito em julgado, aguarde-se pronunciamento por 30 dias. Na inércia, dê-se baixa e arquive-se.;0004702483AC0902739D735F181565C0FBF6C50562343508;00041173801FCA0EEFCA2BDA252919F2EA18C5052D145B3B;2016.021.061956-2;0.8931504487991333
5;2016.001.143686-8;"PODER JUDICIÁRIO DO ESTADO DO RIO DE JANEIRO
I JUIZADO ESPECIAL CÍVEL - DUQUE DE CAXIAS 

PROCESSO Nº: 0062912-09.2016.8.19.0021
AUTOR: WAGNER DA SILVA DE SANTANA
RÉU: ITAU UNIBANCO S/A
RÉU: BANCO ITAUCARD S/A

PROJETO DE SENTENÇA

Vistos, etc.
Dispensado relatório nos termos do art. 38, da Lei nº 9.099/95. 
Trata-se de ação judicial ajuizada pela parte autora em face da ré, pleiteando antecipação dos efeitos da tutela para que a ré exclua seu nome dos cadastros de inadimplentes, sob pena de multa diária a ser arbitrada em caso de descumprimento. Requereu a confirmação do provimento antecipado, a restituição do valor de R$ 328,65, bem como seja declarada a inexigibilidade dos débitos vinculados ao cartão de crédito Visa nº. 4440.xxxx.xxxx.4434. Requer, por fim, compensação por danos morais.
A parte autora aduz em síntese que é titular de conta-corrente nº 49198-2, adquirida junto a 1ª ré, agência: 1282 e titular de cartão de crédito Visa nº. 4440.xxxx.xxxx.4434, administrado pela 2ª ré. Menciona que em novembro de 2013 a validade de seu cartão de crédito expirou a validade, não tendo recebido outro em substituição. Afirmou que, como haviam débitos parcelados em seu cartão, efetuava os pagamentos regularmente desses valores, através das faturas que recebia da ré. Alega que não obstante a ré não ter enviado o nova cartão de crédito, a partir da fatura com vencimento em 08/09/2014, passou a descontar o valor de R$ 67,00, referente à anuidade. Que por engano, efetuou o pagamento em duplicidade do parcelamento incluído na fatura com vencimento em dezembro de 2014. Assevera que realizou reclamações administrativas, inclusive via e-mail (fl. 53/58), informando o ocorrido e requerendo o cancelamento do plástico, passando a efetuar o pagamento da fatura apenas com o valor do parcelamento que reconhecia o débito. Destacou que em outubro/2016, tomou conhecimento de que a ré havia incluído o seu nome nos cadastros restritivos de crédito por débitos referente a fatura vencida em 08/09/2016 (fl. 14), embora jamais tenha recebido o cartão, desbloqueado ou utilizado. Esclareceu, ainda, que ao comparecer em sua agência, tomou conhecimento que os valores referentes ao mínimo de seu cartão de crédito foram descontados mensalmente em sua conta corrente até agosto de 2015 (fls. 31/31 e 40/52), quando deixou de ter saldo para o desconto. Que os débitos foram acumulando, gerando posterior gravame de seu nome.
O pedido de antecipação dos efeitos da tutela foi negado, conforme se depreende da decisão de fl. 64.
Em audiência de instrução e julgamento, pela parte autora foram reiterados os termos da inicial, acrescentando que a ré em sua peça de bloqueio reconhece que ele não recebeu o plástico, portanto indevidas as cobranças e posterior negativação de seu nome nos cadastros restritivos de crédito.
Resposta oferecida pelas rés, em peça única, por sua vez, requer a RETIFICAÇÃO DE POLO PASSIVO para que conste apenas a ré: BANCO ITAUCARD S/A, empresa responsável pela administração do produto objeto da lide. No mérito, sustenta que inexiste direito a ser amparado à parte autora. Sustenta que não houve ato ilícito e que não há dano moral. Que a parte autora não buscou as vias administrativas para a solução da lide, havendo ausência de pretensão resistida da ré. Requer a improcedência do pedido. 
Preliminarmente, quanto a alegação da ré de a parte autora não buscou as vias administrativas para a solução da questão, os e-mail enviados (fls. 53/58) demonstram o esforço do autor na solução da lide.
A relação estabelecida entre as partes é de consumo, porquanto presentes os requisitos subjetivos (arts. 2º, caput, e 3º, caput, da Lei nº 8.078/90) e objetivo (art. 3º, § 2º, da Lei n.º 8.078/90) que a caracterizam. Aplicável, portanto, o regime jurídico especial da Lei n.º 8.078/90, a qual abriga a responsabilidade do tipo objetiva, em que é necessária, apenas, a prova do dano e do nexo causal, sendo despicienda a culpa da ré, e ainda assegura ao consumidor, como medida protetiva, a inversão do ônus da prova (artigo 6º, VIII, do CDC), haja vista a verossimilhança dos fatos narrados na petição inicial, bem como sua condição de hipossuficiente e vulnerável na relação de consumo. 
Diante das provas dos autos, verifica-se que a parte autora comprova de forma robusta os fatos aduzidos em sua peça exordial. Contexto fático probatório que permite concluir que há verossimilhança nas alegações da autora.
A Ré, por sua vez, defende-se arguindo que a parte autora não apresentou prova mínima dos fatos alegados, ferindo o art. 373, I do CDC.
Não trouxe aos autos qualquer comprovação de que o cartão objeto da lide tenha sido entregue a autora, ou que possuía autorização para descontar os valores referentes aos débitos do cartão de crédito, diretamente de sua conta-corrente, eis que nenhum contrato foi apresentado.
E, muito embora tenha aduzido em sua peça de bloqueio que: ""Assim, tomou o Réu todas as providências necessárias para evitar ou minimizar os danos e prejuízos sofridos pelo autor, bem como para recompô-los, o que demonstra que não resistiu à pretensão da parte autora."", fato é que também não comprovou nenhuma providência, sequer havendo nos autos a comprovação de que providenciou a baixa de gravame em nome do autor.
Desta forma, desnecessária a comprovação da culpa, uma vez que a responsabilidade da parte ré é objetiva, não conseguindo a parte ré comprovar nenhuma excludente de nexo causalidade. Trata-se do risco do empreendimento, onde a ré lucra com o bônus, mas também deve arcar com o ônus.
Na verdade, era dever da parte ré fazer prova dos fatos modificativos, extintivos ou impeditivos do direito autoral, na forma do art. 373, II do Novo CPC, no sentido de demonstrar a ocorrência de uma das excludentes de responsabilidade civil no CDC, já que a responsabilidade objetiva do fornecedor de bens e serviços, através art. 14 daquele diploma legal, somente pode ser afastada se comprovada a culpa exclusiva do consumidor ou de terceiro para a ocorrência do evento danoso, nos termos que lhe impõe o art. 14, § 3º, incisos I e II da Lei nº 8.078/90 e art. 373, II do CPC, o que não foi feito. 
Diante do apresentado, deve ser acolhido o pleito autoral, devendo a ré proceder a baixa do gravame vinculado ao CPF da parte autora referente ao débito vinculado ao cartão objeto da lide. Deve, ainda, ser declarada a inexigibilidade de todo e qualquer débito em nome da parte autora, referente ao cartão de crédito objeto da lide.
Ante a ausência de prova do cumprimento da obrigação contratual de entrega do cartão de crédito, se reputam ilegítimas as cobranças enviadas ao autor durante todo o período que este não foi prestado, devendo ser canceladas as que não tiverem sido pagas, bem como restituídas as que tiverem sido comprovadamente quitadas.
No entanto, tal restituição deverá ocorrer na forma simples, eis que conforme decidido na Reclamação 4892/PR pelo Superior Tribunal de Justiça, é imprescindível a prova da má-fé na cobrança para a aplicação da devolução em dobro, nos termos do art. 42 do CDC. 
Diante do exposto, deverá a ré restituir ao autor o valor total requerido de R$ 328,65 (trezentos e vinte e oito reais e sessenta e cinco centavos), conforme comprovantes nos autos. 
Quanto ao pedido de indenização extrapatrimonial, formulado pela autora, deve o mesmo ser acolhido ante a configuração do dano moral indenizável, evidenciado pelo próprio fato. Conforme lição do Desembargador SÉRGIO CAVALIERI FILHO ""o dano moral existe in re ipsa"", ou seja, ""está ínsito na própria ofensa, decorre da gravidade do ilícito em si"" (Programa de Responsabilidade Civil, 2ª ed., Malheiros, p. 80).
No que tange ao quantum debeatur, deve o mesmo ser fixado de forma proporcional, moderada e razoável, compatível com a reprovabilidade da conduta ilícita, a intensidade e duração do sofrimento experimentado, a capacidade econômica do causador do dano e as condições sociais da vítima, dentre outras circunstâncias relevantes.
Com base em tais critérios, e o decurso de tempo sem qualquer solução por parte do réu, entende esse Juízo que o valor de R$ 10.000,00 (dez mil reais) mostra-se razoável e proporcional.
Quanto ao pedido de RETIFICAÇÃO DE POLO PASSIVO, indefiro, eis que a parte autora reclama, além das cobranças referentes a anuidade em seu cartão de crédito, cuja administração é feita pelo réu: BANCO ITAUCARD S/A, pelos descontos efetuados diretamente em sua conta-corrente sem sua prévia autorização. Desta forma, deve o réu: ITAU UNIBANCO S/A, permanecer no polo passivo da demanda. Solidariedade entre os Réus que se impõe.
Ante o exposto, JULGO PROCEDENTE EM PARTE os pedidos autorais, extinguindo o feito com resolução do mérito, nos termos do artigo 487, I do Novo CPC, para: 
a) declarar a rescisão do contrato vinculado ao cartão de crédito Visa nº. 4440.xxxx.xxxx.4434, bem como declarar a inexigibilidade de todo e qualquer débito a ele vinculado, devendo a ré: BANCO ITAUCARD S/A, abster-se de fazer novas cobranças, sob pena de multa equivalente a R$ 200,00 (duzentos reais) por cada cobrança indevida; 
b) condenar as rés, solidariamente, a restituírem à parte autora a quantia de R$ 328,65 (trezentos e vinte e oito reais e sessenta e cinco centavos), na forma simples, corrigidos monetariamente desde a data do pagamento e juros de mora de 1% ao mês a partir da citação; 
c) condenar as rés, solidariamente, a pagarem, à parte autora a quantia de R$ 10.000,00 (dez mil reais), a título de compensação por danos morais, acrescido de correção monetária a contar da presente sentença (Súm. 362/STJ), e juros de mora de 1% ao mês, estes a incidir da data da citação;  
d) condenar a ré: BANCO ITAUCARD S/A, a proceder a exclusão do nome da parte autora dos cadastros de proteção ao crédito da anotação de fl. 14, no prazo de 10 dias sob pena de multa diária de R$ 50,00 (cinquenta reais), inicialmente limitada em R$ 5.000,00 (cinco mil reais);





	A parte ré fica ciente de que deverá depositar as quantias acima fixadas, referentes ás condenações de pagar quantia certa, no prazo de 15 (quinze) dias após o trânsito em julgado sob pena de multa de 10%, conforme prevista no artigo 523, I do Novo CPC, e nos termos do Enunciado Jurídico 13.9.1 do Aviso 23/2008.
Publicações, intimações e retificações conforme requerido pelas partes. No caso de retificação de nome, oficie-se ao Distribuidor e anote-se onde couber. 
Sem ônus sucumbenciais em razão do art. 55 da Lei n. 9.099/95.
Remeto à apreciação do MM. Juiz Togado, na forma do disposto no art. 40, da lei 9099/95.
Duque de Caxias, 23 de março de 2017.
		
Adriana do Rosario Soneira
Juíza Leiga";0004702483AC0902739D735F181565C0FBF6C50562343508;00041173801FCA0EEFCA2BDA252919F2EA18C5052D145B3B;2016.021.061956-2;0.8931504487991333
6;2016.001.143686-8;"     Tendo em   vista que  houve  acordo entre  as  partes , JULGO  EXTINTO COM  RESOLUÇÃO DO MÉRITO, na forma do artigo  487, III,  alínea  b ,  do CPC.


 Sem custas. Após as formalidades legais, dê-se baixa e arquive-se. P.R.I.";0004702483AC0902739D735F181565C0FBF6C50562343508;00041173801FCA0EEFCA2BDA252919F2EA18C5052D145B3B;2016.021.061956-2;0.8931504487991333
